org_name	org_url
Mohawk Corp.	/org/mohawk-corp
Presbyterian Church In America	/org/presbyterian-church-in-america-8
Ella M Brown Uaw Memorial Fund	/org/ella-m-brown-uaw-memorial-fund
Church Of God	/org/church-of-god-43
Pta Delaware Congress West Seaford Elementary	/org/pta-delaware-congress-west-seaford-elementary
Society Of Pi Kappa Lambda	/org/society-of-pi-kappa-lambda-16
Delaware Dance Cmpany	/org/delaware-dance-cmpany
Wilmington Head Start Inc	/org/wilmington-head-start-inc
Alpha Worship Center Inc	/org/alpha-worship-center-inc
Sussex Community Crisis Housing Services Inc	/org/sussex-community-crisis-housing-services-inc
St Anthonys Housing Management Corp	/org/st-anthonys-housing-management-corp
Laurel District Library Comm. Trust	/org/laurel-district-library-comm-trust
Delaware Technical & Community College Educational Foundation 866	/org/delaware-technical-community-college-educational-foundation-866
Lebanon Wesleyan Church	/org/lebanon-wesleyan-church
Centreville Layton School Inc	/org/centreville-layton-school-inc
Fox Point Babe Ruth League Inc	/org/fox-point-babe-ruth-league-inc
Delaware Theatre Company	/org/delaware-theatre-company
Mid Sussex Medical Center Inc	/org/mid-sussex-medical-center-inc
Irish Culture Club Of Delaware	/org/irish-culture-club-of-delaware
Smyrna Church Of Christ Inc	/org/smyrna-church-of-christ-inc
Georgetown Aid Inc	/org/georgetown-aid-inc
Milton And Hattie Kutz Home Inc	/org/milton-and-hattie-kutz-home-inc
American Lung Association Of Delaware	/org/american-lung-association-of-delaware
Home For Aged Women Inc	/org/home-for-aged-women-inc
Junior Board Of The Kent General Hospital	/org/junior-board-of-the-kent-general-hospital
Newark Day Nursery Assoc Inc	/org/newark-day-nursery-assoc-inc
Leon Williams Revivals Inc	/org/leon-williams-revivals-inc
Prison Outreach Of Delaware Inc	/org/prison-outreach-of-delaware-inc
Peoples Place II Inc	/org/peoples-place-ii-inc
Meadwood Church Of Christ	/org/meadwood-church-of-christ
Bayhealth Medical Center	/org/bayhealth-medical-center
Delaware Safety Council Inc	/org/delaware-safety-council-inc
Bayhealth Medical Center Inc	/org/bayhealth-medical-center-inc
Diocesan Council Inc	/org/diocesan-council-inc
THE MUSIC SCHOOL OF DELAWARE INC	/org/the-music-school-of-delaware-inc
Catholic Youth Organization Inc	/org/catholic-youth-organization-inc
First Baptist Church Holloway Terrace	/org/first-baptist-church-holloway-terrace
Friends Of The University Of Sussex	/org/friends-of-the-university-of-sussex
Laurel District Library Commission	/org/laurel-district-library-commission
Critters Inc	/org/critters-inc
Pta Delaware Congress	/org/pta-delaware-congress-17
Pta Delaware Congress	/org/pta-delaware-congress-19
Pta Delaware Congress	/org/pta-delaware-congress-23
Pta Delaware Congress	/org/pta-delaware-congress_157930
Pta Delaware Congress	/org/pta-delaware-congress-30
Society For Preservation & Encrgmnt Of Barbershop Quartet Singing Amer	/org/society-for-preservation-encrgmnt-of-barbershop-quartet-singing-amer-39
Local Union 313 Ibew Electrical Joint Apprenticeship	/org/local-union-313-ibew-electrical-joint-apprenticeship
Society Of Our Lady Of Mt Carmel Inc	/org/society-of-our-lady-of-mt-carmel-inc
Water Resources Association Of The Delaware River Basin	/org/water-resources-association-of-the-delaware-river-basin
Padamsambhava Buddhist Center Of Delaware	/org/padamsambhava-buddhist-center-of-delaware
Mcc Foundation Inc	/org/mcc-foundation-inc
Spirit Life Ministries International	/org/spirit-life-ministries-international
VALS	/org/vals
New Castle County Head Start Inc	/org/new-castle-county-head-start-inc
East Side Charter School Of Wilmington Inc	/org/east-side-charter-school-of-wilmington-inc
Caesar Rodney High School Cheerleader Booster Club	/org/caesar-rodney-high-school-cheerleader-booster-club
Delaware Technology Park Inc	/org/delaware-technology-park-inc
Christian And Missionary Alliance	/org/christian-and-missionary-alliance_195984
Toastmasters International	/org/toastmasters-international_195986
City Theater Company	/org/city-theater-company
Urban Environmental Center Inc	/org/urban-environmental-center-inc
Delaware Theatre Association For The Performing Arts	/org/delaware-theatre-association-for-the-performing-arts
Thomas And Rachel Garrett Station, Inc.	/org/thomas-and-rachel-garrett-station-inc
Blue White Inc	/org/blue-white-inc
Friends Of Bombay Hook Inc	/org/friends-of-bombay-hook-inc
Spiritual Assembly Of The Bahais Of Kent County	/org/spiritual-assembly-of-the-bahais-of-kent-county
West Center City Adult Center Inc	/org/west-center-city-adult-center-inc
Public Assistance Taskforce	/org/public-assistance-taskforce
Irish Society Of Delmarva Inc	/org/irish-society-of-delmarva-inc
Zenobia A James Company, Inc.	/org/zenobia-a-james-company-inc
Delaware Recreation And Parks Society	/org/delaware-recreation-and-parks-society
Vocational Technical Educational Foundation Of Delaware	/org/vocational-technical-educational-foundation-of-delaware
The Lighthouse Inc	/org/the-lighthouse-inc
Boris Lurie Art Foundation	/org/boris-lurie-art-foundation
Global Health Investment Corporation	/org/global-health-investment-corporation
