org_name	org_url
Jewish Federation of Delaware Inc	/org/jewish-federation-of-delaware-inc
St. Michael's School and Nursery, Inc.	/org/st-michaels-school-and-nursery-inc
National Endowment for Alzheimer's Research	/org/national-endowment-for-alzheimers-research
Hearts of the Sacred Spirit	/org/hearts-of-the-sacred-spirit
Delaware Financial Literacy Institute	/org/delaware-financial-literacy-institute
The Bernard And Ruth Siegel Jewish Community Center Of Delaware Inc	/org/the-bernard-and-ruth-siegel-jewish-community-center-of-delaware-inc
Greenbank Mill Associates, Inc.	/org/greenbank-mill-associates-inc
Compassionate Care Hospice Foundation	/org/compassionate-care-hospice-foundation
Simply Equal Education	/org/simply-equal-education
Clean Energy Research and Education Institute Inc	/org/clean-energy-research-and-education-institute-inc
Neighbors Sharing with Neighbors in Crisis	/org/neighbors-sharing-with-neighbors-in-crisis-3
Pets Enriching Troops Association	/org/pets-enriching-troops-association
Literacy Delaware	/org/literacy-delaware
Changing Fates Equine Rescue of Delware, Inc.	/org/changing-fates-equine-rescue-of-delware-inc
Clothing Our Kids	/org/clothing-our-kids
Faithful Friends Inc	/org/faithful-friends-inc
Connections Community Support Programs Inc	/org/connections-community-support-programs-inc-1
Claymore Senior Center Inc	/org/claymore-senior-center-inc
DEBRA L SIPPLE MEMORIAL INC (Debbie's Fund)	/org/debra-l-sipple-memorial-inc-debbies-fund
Jewish Family Services Of Delaware Inc	/org/jewish-family-services-of-delaware-inc
Christ Servants Mission Institute	/org/christ-servants-mission-institute
Kind to Kids Foundation	/org/kind-to-kids-foundation
Chabad at the University of Delaware	/org/chabad-at-the-university-of-delaware
The Andrew McDonough B+ Foundation	/org/the-andrew-mcdonough-b-foundation
Safe Haven Animal Sanctuary Of Sussex County Inc	/org/safe-haven-animal-sanctuary-of-sussex-county-inc
National League Of American Pen Women Inc	/org/national-league-of-american-pen-women-inc-19
Soldiers Undertaking Disabled Scuba	/org/soldiers-undertaking-disabled-scuba
Urban Bike Project of WilmingtonInc	/org/urban-bike-project-of-wilmingtoninc
K.I.S.H. Home,Inc.	/org/k-i-s-h-home-inc-1
American War Memorials Overseas, Inc.	/org/american-war-memorials-overseas-inc
Brandywine Counseling, Inc.	/org/brandywine-counseling-community-services
Junior League Of Wilmington Inc	/org/junior-league-of-wilmington-inc
TRI-STATE BIRD RESCUE AND RESEARCH INC	/org/tri-state-bird-rescue-and-research-inc
SUSSEX COUNTY STAMP CLUB	/org/sussex-county-stamp-club
Children and Families First Delaware, Inc.	/org/children-and-families-first-delaware-inc
Newark Senior Center Inc	/org/newark-senior-center-inc
First State Animal Center And Spca Inc	/org/first-state-animal-center-and-spca-inc
Partnership For The Delaware Estuary Inc	/org/partnership-for-the-delaware-estuary-inc
Kodys Kids Inc	/org/kodys-kids-inc
A Buddy For Life Inc	/org/a-buddy-for-life-inc
ST ANNES EPISCOPAL SCHOOL	/org/st-annes-episcopal-school
DAST - DELAWARE ALL STATE THEATRE	/org/dast-delaware-all-state-theatre
Billy Cook Foundation	/org/billy-cook-foundation
Manners First Education Initiative Institute	/org/manners-first-education-initiative-institute
Women At The Well Inc	/org/women-at-the-well-inc
Delaware Hospice	/org/delaware-hospice
Southeastern Pa - Delaware House Rabbit Society L L C	/org/southeastern-pa-delaware-house-rabbit-society-l-l-c
Brandywine Baroque Inc	/org/brandywine-baroque-inc
Friends Of Middletown Robotics Organization	/org/friends-of-middletown-robotics-organization
Delaware Adolescent Program Inc	/org/delaware-adolescent-program-inc
Parent Information Center Of Delaware Inc	/org/parent-information-center-of-delaware-inc
Hospital Billing & Collection Service Ltd	/org/hospital-billing-collection-service-ltd
Prison Ministries Of Delaware	/org/prison-ministries-of-delaware
Delaware Housing Coalition Inc	/org/delaware-housing-coalition-inc
Forgotten Cats Inc	/org/forgotten-cats-inc
Community Hope Of Delaware Incorporated	/org/community-hope-of-delaware-incorporated
Nativity Preparatory School	/org/nativity-preparatory-school
BRAIN INJURY ASSOCIATION OF DELAWARE	/org/brain-injury-association-of-delaware
Christian Outreach World Mission Corp.	/org/christian-outreach-world-mission-corp
Canine Guardians For Life	/org/canine-guardians-for-life
Dover Interfaith Mission For Housing Inc	/org/dover-interfaith-mission-for-housing-inc
The Trinity Bible School Of Hempstead	/org/the-trinity-bible-school-of-hempstead
Amc Museum Foundation Inc	/org/amc-museum-foundation-inc
Delaware Wild Lands Inc 350	/org/delaware-wild-lands-inc-350
Home Of The Brave Foundation	/org/home-of-the-brave-foundation-1
Moms House Inc	/org/moms-house-inc
You Are Not Alone Veterans Foundation Inc	/org/you-are-not-alone-veterans-foundation-inc
AMERICAN MUSTANG AND BURRO ASSOCIATION INC	/org/american-mustang-and-burro-association-inc
Mountainside Productions Inc	/org/mountainside-productions-inc
Eastern Shore Afram Festival	/org/eastern-shore-afram-festival
Pencader Hundred Community Center Inc	/org/pencader-hundred-community-center-inc
Delaware Museum Of Natural History Inc	/org/delaware-museum-of-natural-history-inc
Delaware Audubon Society Inc	/org/delaware-audubon-society-inc
Intercultural Open University Foundation	/org/intercultural-open-university-foundation
Opera Delaware Inc	/org/opera-delaware-inc
Zurich International School Foundation Inc	/org/zurich-international-school-foundation-inc
Harvest Years Senior Center Inc	/org/harvest-years-senior-center-inc
Clarence Fraim Senior Center Of Delaware Inc	/org/clarence-fraim-senior-center-of-delaware-inc
Exceptional Care Inc	/org/exceptional-care-inc
Academy Of Dover Charter School	/org/academy-of-dover-charter-school
Goodwill Industries Of Delaware & Delaware County Inc	/org/goodwill-industries-of-delaware-delaware-county-inc
Appoquinimink Development Inc	/org/appoquinimink-development-inc
Practice Without Pressure Inc	/org/practice-without-pressure-inc
Efe International	/org/efe-international
Water Is Life Kenya Inc	/org/water-is-life-kenya-inc
Enduring Faith Ministries Inc	/org/enduring-faith-ministries-inc
Church Of God Chapel	/org/church-of-god-chapel_100072931
Lost And Found Dog Rescue Adoption Center Inc	/org/lost-and-found-dog-rescue-adoption-center-inc
Southern Delaware Botanic Gardens	/org/southern-delaware-botanic-gardens
Sojourners Place Inc	/org/sojourners-place-inc
Silent Warrior Foundation	/org/silent-warrior-foundation
Operation Seas The Day Inc	/org/operation-seas-the-day-inc
Dover High School Band Boosters Inc	/org/dover-high-school-band-boosters-inc
PAWS for People	/org/paws-for-people
Faith First Educational Assistance Corporation	/org/faith-first-educational-assistance-corporation
Business History Conference	/org/business-history-conference
Civil Air Patrol 7006 Dover Cadet Squadron	/org/civil-air-patrol-7006-dover-cadet-squadron
University Of Canterbury Foundation In America Inc	/org/university-of-canterbury-foundation-in-america-inc
American Rose Society	/org/american-rose-society_21820
New Pentecostal United Holy Church	/org/new-pentecostal-united-holy-church
American Friends Of The Monteverdi Choir & Orchestras Inc	/org/american-friends-of-the-monteverdi-choir-orchestras-inc
University Of Bristol Foundation Inc	/org/university-of-bristol-foundation-inc
National Society Of New England Women	/org/national-society-of-new-england-women
In His Ministry	/org/in-his-ministry
Healthnet International U S A Inc	/org/healthnet-international-u-s-a-inc
National Society Of The Sons Of The American Revolution	/org/national-society-of-the-sons-of-the-american-revolution-311
Delaware Manufacturing Alliance Inc	/org/delaware-manufacturing-alliance-inc
Pop Warner Little Scholars, Inc.	/org/pop-warner-little-scholars-inc-46
American Friends Of Trinity College University Of Melbourne Inc	/org/american-friends-of-trinity-college-university-of-melbourne-inc
American Friends Of Dulwich Picture Gallery Inc	/org/american-friends-of-dulwich-picture-gallery-inc
Beau Bogan Foundation	/org/beau-bogan-foundation
Foundation For The 11th International Congress On Catalysis	/org/foundation-for-the-11th-international-congress-on-catalysis
The R Group, Inc.	/org/the-r-group-inc
Delaware State Police Museum Inc	/org/delaware-state-police-museum-inc
Sussex County Aids Council Inc	/org/sussex-county-aids-council-inc
Dima I Inc	/org/dima-i-inc
Maat Temple Of Truth Inc	/org/maat-temple-of-truth-inc
Lenape Indian Tribe Of Delaware Inc	/org/lenape-indian-tribe-of-delaware-inc
Little League Baseball Inc	/org/little-league-baseball-inc-342
Psi Chi The National Honor Society In Psychology	/org/psi-chi-the-national-honor-society-in-psychology-423
Glasgow Lions Service Foundation Inc	/org/glasgow-lions-service-foundation-inc
Holy Spirit Ministries Inc	/org/holy-spirit-ministries-inc
Pta Delaware Congress	/org/pta-delaware-congress
Delaware Fc United, Inc.	/org/delaware-fc-united-inc
National Association Of Scholars	/org/national-association-of-scholars-20
Friends Of The Certosa Di Capri Inc	/org/friends-of-the-certosa-di-capri-inc
Mbacke House Of Hope	/org/mbacke-house-of-hope
Countryside Alliance Usa Inc	/org/countryside-alliance-usa-inc
Friends Of The British Film Institute	/org/friends-of-the-british-film-institute
Everlasting Church	/org/everlasting-church
Christian Family Services Inc	/org/christian-family-services-inc
American Friends Of The Royal Institution Inc	/org/american-friends-of-the-royal-institution-inc
Delaware Mental Health Consumer Coalition Inc	/org/delaware-mental-health-consumer-coalition-inc
Shekinah Glory Fellowship Church Inc	/org/shekinah-glory-fellowship-church-inc
University Of Strathclyde Usa Foundation	/org/university-of-strathclyde-usa-foundation
American Friends Of The Royal College Of Surgeons Of Edinburgh	/org/american-friends-of-the-royal-college-of-surgeons-of-edinburgh
Sustainable Food Alliance Inc	/org/sustainable-food-alliance-inc
The Public Libraries Foundation For New Castle County	/org/the-public-libraries-foundation-for-new-castle-county
Living Waters Ministries Inc	/org/living-waters-ministries-inc
American Friends Of Ulster University Inc	/org/american-friends-of-ulster-university-inc
Whitehall Neck Sportsman Club	/org/whitehall-neck-sportsman-club
American Friends Of Chicken Shed Inc	/org/american-friends-of-chicken-shed-inc
North American Friends Of Napier University Edinburgh	/org/north-american-friends-of-napier-university-edinburgh
Christiana Rotary Club Foundation	/org/christiana-rotary-club-foundation
The Us Project Inc	/org/the-us-project-inc
American Friends Of Royal Museums Greenwich Inc	/org/american-friends-of-royal-museums-greenwich-inc
Main Street Delaware City Inc	/org/main-street-delaware-city-inc
Delaware Pain Initiative Inc	/org/delaware-pain-initiative-inc
University Of Sheffield In America Inc	/org/university-of-sheffield-in-america-inc
Disability Action Inc	/org/disability-action-inc
Friends Of The High School Of Glasgow Inc	/org/friends-of-the-high-school-of-glasgow-inc
Redeemed Christian Church Of God Abundant Life Center Inc	/org/redeemed-christian-church-of-god-abundant-life-center-inc
The Corrigan-Walla Foundation	/org/the-corrigan-walla-foundation
Basket Brigade Of Delaware Inc	/org/basket-brigade-of-delaware-inc
Zsl America Inc	/org/zsl-america-inc
Friends Of The Claymont Stone School Inc	/org/friends-of-the-claymont-stone-school-inc
The Country Chapel Corporation	/org/the-country-chapel-corporation
University Of York In America Inc	/org/university-of-york-in-america-inc
The Purple Community Fund Inc	/org/the-purple-community-fund-inc
Aikikai Foundation Of Delaware	/org/aikikai-foundation-of-delaware
Gonville & Caius College-The Caius Foundation	/org/gonville-caius-college-the-caius-foundation
Cornerstone Church Of The Assembly Of God	/org/cornerstone-church-of-the-assembly-of-god
International Reading Association Inc	/org/international-reading-association-inc-69
Pta Delaware Congress Of Parents And Teachers	/org/pta-delaware-congress-of-parents-and-teachers
American Friends Of The River & Rowing Museum Inc	/org/american-friends-of-the-river-rowing-museum-inc
International School Of Prague Foundation Inc	/org/international-school-of-prague-foundation-inc
American Fund For Emmanuel	/org/american-fund-for-emmanuel
Delaware Astronomical Society	/org/delaware-astronomical-society
National Association Of University Women	/org/national-association-of-university-women-27
Nanticoke Senior Center Inc	/org/nanticoke-senior-center-inc
Fish Of Northern Delaware Inc	/org/fish-of-northern-delaware-inc
Pta Delaware Congress	/org/pta-delaware-congress-20
Pta Woodbridge Jr. & Sr. Hs	/org/pta-woodbridge-jr-sr-hs
Whatcoat Social Service Agency Inc	/org/whatcoat-social-service-agency-inc
Felton Community Fire Company Inc	/org/felton-community-fire-company-inc
Edgell Charitable Trust	/org/edgell-charitable-trust
Epworth Quartet	/org/epworth-quartet
Caravel Academy Athletic Boosters Association	/org/caravel-academy-athletic-boosters-association
Laurel Church Of Christ	/org/laurel-church-of-christ
AMERICAN SOCIETY FOR THE ROYAL BOTANIC GARDENS-KEW	/org/american-society-for-the-royal-botanic-gardens-kew
Sons Of Confederate Veterans, Inc. Gen John Henry Winder Camp 1416	/org/sons-of-confederate-veterans-inc-gen-john-henry-winder-camp-1416
International Reading Association Inc	/org/international-reading-association-inc-116
Civil Air Patrol 7019 Sussex Cadet Squadron	/org/civil-air-patrol-7019-sussex-cadet-squadron
National Society Of The Sons Of The American Revolution	/org/national-society-of-the-sons-of-the-american-revolution_78664
Pop Warner Little Scholars, Inc.	/org/pop-warner-little-scholars-inc-113
North American Folk Music And Dance Alliance Inc	/org/north-american-folk-music-and-dance-alliance-inc-35
Appalachian Ministries	/org/appalachian-ministries
Christian Interaction	/org/christian-interaction
AMAZING GRACE OUTREACH MINISTRIES & U S FOOD RESCUE INC	/org/amazing-grace-outreach-ministries-u-s-food-rescue-inc
Arc Of Delaware Inc	/org/arc-of-delaware-inc-8
Aquinas Academy Inc	/org/aquinas-academy-inc
Dino And Marilyn Costas Ministries Inc	/org/dino-and-marilyn-costas-ministries-inc
Sea Watch Inc	/org/sea-watch-inc
Delaware Council On Economic Education Inc	/org/delaware-council-on-economic-education-inc
The Harrington High School Alumni Association Scholarship Char Trust	/org/the-harrington-high-school-alumni-association-scholarship-char-trust
First Episcopal District Ministrerial Education Fund Inc	/org/first-episcopal-district-ministrerial-education-fund-inc
Lewes Historical Society	/org/lewes-historical-society
Pta Delaware Congress	/org/pta-delaware-congress-49
National Council Of Jewish Women Incorporated	/org/national-council-of-jewish-women-incorporated_83962
Kiwanis Foundation Of Wilmington Delaware Inc	/org/kiwanis-foundation-of-wilmington-delaware-inc
Road Runners Club Of America	/org/road-runners-club-of-america-436
Global Missions Inc	/org/global-missions-inc
First Assembly Of God	/org/first-assembly-of-god-202
Return Peace Corp Volunteers Of Delaware Association	/org/return-peace-corp-volunteers-of-delaware-association
New Knollwood Community Center Inc	/org/new-knollwood-community-center-inc
Silverside Church	/org/silverside-church
Pta Delaware Congress	/org/pta-delaware-congress-15
Mancus Foundation Inc	/org/mancus-foundation-inc
American Chemical Society	/org/american-chemical-society-103
Destiny Community Development Corporation	/org/destiny-community-development-corporation-3
Agape Christian Center Inc	/org/agape-christian-center-inc
Seaford Band Association	/org/seaford-band-association
National Society Of The Sons Of The American Revolution	/org/national-society-of-the-sons-of-the-american-revolution-243
Arc Of Delaware Inc	/org/arc-of-delaware-inc-2
Advance America Foundation	/org/advance-america-foundation
National Spiritual Assembly Of The Bahais Of The Us	/org/national-spiritual-assembly-of-the-bahais-of-the-us-5
Dima Ii Inc	/org/dima-ii-inc
Maranatha Christian Revival Center Inc	/org/maranatha-christian-revival-center-inc
Nanticoke River Watershed Conservan Cy	/org/nanticoke-river-watershed-conservan-cy
Jesus Is Lord Church Of Deliverance Inc	/org/jesus-is-lord-church-of-deliverance-inc
Delaware Volunteer Coordinators Inc	/org/delaware-volunteer-coordinators-inc
Midatlantic Credit Counseling Services Inc	/org/midatlantic-credit-counseling-services-inc
Delaware Trail Spinners Inc	/org/delaware-trail-spinners-inc
Word Of Life Christian Center Inc	/org/word-of-life-christian-center-inc
Volunteers For Adolescent Pregnancy Prevention	/org/volunteers-for-adolescent-pregnancy-prevention
Delaware Center For Wellness, Inc.	/org/delaware-center-for-wellness-inc
Wilmington Toys For Tots Inc	/org/wilmington-toys-for-tots-inc
Brandywine Valley Friends Of Old Time Musci Inc	/org/brandywine-valley-friends-of-old-time-musci-inc
Smyrna-Clayton Heritage Association	/org/smyrna-clayton-heritage-association
Serra International	/org/serra-international_43559
Pta Delaware Congress	/org/pta-delaware-congress-31
Friends Of Winterthur Inc	/org/friends-of-winterthur-inc
American Friends Of Cancer Research Inc	/org/american-friends-of-cancer-research-inc
Pta Delaware Congress Cape Henlopen High School	/org/pta-delaware-congress-cape-henlopen-high-school
Child Evangelism Fellowship, Inc.	/org/child-evangelism-fellowship-inc_43483
National Society Of The Daughters Of The American Revolution	/org/national-society-of-the-daughters-of-the-american-revolution-109
Usa Swimming Inc	/org/usa-swimming-inc-14
Delaware Chapter Of The National Museum Of Women In The Arts Association	/org/delaware-chapter-of-the-national-museum-of-women-in-the-arts-association
United States Power Squadrons	/org/united-states-power-squadrons-221
University Of Kent In America Inc	/org/university-of-kent-in-america-inc
Old Wulfrunians In America Inc	/org/old-wulfrunians-in-america-inc
Hoosier Traction Meet Inc	/org/hoosier-traction-meet-inc
United Cerebral Palsy Of Delaware Inc	/org/united-cerebral-palsy-of-delaware-inc
Crooked Tree Girl Scout Council Tr Fund	/org/crooked-tree-girl-scout-council-tr-fund
Center For Christian Nonviolence	/org/center-for-christian-nonviolence
American Friends Of Sherborne Inc	/org/american-friends-of-sherborne-inc
Minquas Fire Co 1	/org/minquas-fire-co-1
Newark Center For Creative Learning Inc	/org/newark-center-for-creative-learning-inc
H Fletcher Brown Trust Uw Fbo Ymca Of Wilmington Delaware	/org/h-fletcher-brown-trust-uw-fbo-ymca-of-wilmington-delaware
Wilmington University Inc	/org/wilmington-university-inc
Bethel Baptist Church	/org/bethel-baptist-church-14
Delmar Public Library	/org/delmar-public-library
World Revivals Inc	/org/world-revivals-inc
American Friends Of Hantam Community Education Inc	/org/american-friends-of-hantam-community-education-inc
Us Friends Of Gladstones Library Inc	/org/us-friends-of-gladstones-library-inc
Babcock Charitable Trust	/org/babcock-charitable-trust
Our Redeemer Lutheran Church	/org/our-redeemer-lutheran-church-56
Immanuel Baptist Church	/org/immanuel-baptist-church-20
Beacon Mission	/org/beacon-mission
Mental Health Association Of Delaware	/org/mental-health-association-of-delaware
Boys And Girls Club Of Delaware Inc	/org/boys-and-girls-club-of-delaware-inc
Senior Care Group Inc	/org/senior-care-group-inc
Friends Of The University Of Warwick Inc	/org/friends-of-the-university-of-warwick-inc
Ymca Of Delaware	/org/ymca-of-delaware
Layton Home For Aged Persons	/org/layton-home-for-aged-persons
Interfaith Mission Of Sussex County Inc	/org/interfaith-mission-of-sussex-county-inc
Pike Creek Valley Baptist	/org/pike-creek-valley-baptist
Society Of Winterhur Graduates Inc	/org/society-of-winterhur-graduates-inc
Milford Memorial Hospital Insurance Trust	/org/milford-memorial-hospital-insurance-trust
Brooke Usa Inc	/org/brooke-usa-inc
Barry & Martin America Inc	/org/barry-martin-america-inc
M E Herring Day Care Center And Pre-School Inc	/org/m-e-herring-day-care-center-and-pre-school-inc
Milford Ame Housing Corporation	/org/milford-ame-housing-corporation
Delaware Society For The Prevention Of Cruelty To Animals	/org/delaware-society-for-the-prevention-of-cruelty-to-animals
Kingswood Community Center Inc	/org/kingswood-community-center-inc
Neighborhood House Inc	/org/neighborhood-house-inc
American Philosophical Association	/org/american-philosophical-association
Actis Inc	/org/actis-inc
International Reading Association Inc	/org/international-reading-association-inc-958
National Association Of Miniature Enthusiasts	/org/national-association-of-miniature-enthusiasts_97712
Pta Welch-Arnold Elementary	/org/pta-welch-arnold-elementary
Walter S Carpenter Jr Trust Fbo Delaware Academy Of Medicine	/org/walter-s-carpenter-jr-trust-fbo-delaware-academy-of-medicine
United Campus Ministry At The University Of Delaware Inc	/org/united-campus-ministry-at-the-university-of-delaware-inc
Milton Historical Society	/org/milton-historical-society-4
Pta Delaware Congress	/org/pta-delaware-congress-14
Pta Delaware Congress	/org/pta-delaware-congress-27
DELAWARE FOUNDATION FOR THE VISUAL ARTS	/org/delaware-foundation-for-the-visual-arts
Faith Lutheran Church	/org/faith-lutheran-church_102713
Kent County Theatre Guild Foundation Inc	/org/kent-county-theatre-guild-foundation-inc
Delaware Innovation Fund	/org/delaware-innovation-fund
University Of Delaware Bartol Research Institute	/org/university-of-delaware-bartol-research-institute
Pta Delaware Congress	/org/pta-delaware-congress-13
Amateur Riders Club Of America Inc	/org/amateur-riders-club-of-america-inc
American Council On Alcoholism And Drug Addiction, Inc.	/org/american-council-on-alcoholism-and-drug-addiction-inc
Kiwanis Foundation Of Rehoboth Beach Inc	/org/kiwanis-foundation-of-rehoboth-beach-inc
Police Athletic League Of Delaware Inc	/org/police-athletic-league-of-delaware-inc
Service Corps Of Retired Executives Association	/org/service-corps-of-retired-executives-association_106446
Parents Without Partners, Inc.	/org/parents-without-partners-inc_118944
Lillie B Gould Perpetual Charitable Tr	/org/lillie-b-gould-perpetual-charitable-tr
National Society Of The Daughters Of The American Revolution	/org/national-society-of-the-daughters-of-the-american-revolution-2999
Thresholds Of The State Of Delaware Incorporated	/org/thresholds-of-the-state-of-delaware-incorporated
Southern Delaware Therapeutic And Recreational Horseback Riding Inc	/org/southern-delaware-therapeutic-and-recreational-horseback-riding-inc
Peninsula Community Church	/org/peninsula-community-church
John J Murray Foundation Inc	/org/john-j-murray-foundation-inc
Little Italy Merchant Association	/org/little-italy-merchant-association
Christiana Care Health System Inc	/org/christiana-care-health-system-inc
Vine-Branch Ministries Inc	/org/vine-branch-ministries-inc
Millsboro Art League Inc	/org/millsboro-art-league-inc
Charter School Inc	/org/charter-school-inc
First Baptist Church Of New Castle Delaware	/org/first-baptist-church-of-new-castle-delaware
Youth For Christ Usa, Inc.	/org/youth-for-christ-usa-inc_140012
Trust Uw Of Bayard Murray For Medical Scholarships	/org/trust-uw-of-bayard-murray-for-medical-scholarships
Unidel Foundation Inc	/org/unidel-foundation-inc
Studio Group Incorporated	/org/studio-group-incorporated
Coordinating Council For Children With Disabilities Inc	/org/coordinating-council-for-children-with-disabilities-inc
Elizabeth Virginia White Trust U/W For University Of Delaware	/org/elizabeth-virginia-white-trust-u-w-for-university-of-delaware
Toastmasters International	/org/toastmasters-international-5408
Downtown Milford Inc	/org/downtown-milford-inc
Crozier Foundation	/org/crozier-foundation
Cornerstone Child Care And Youth Center Inc	/org/cornerstone-child-care-and-youth-center-inc
Coasters Inc	/org/coasters-inc
Adults And Families Learning Together, Inc.	/org/adults-and-families-learning-together-inc
Delaware Progressive Committee Of Women Inc	/org/delaware-progressive-committee-of-women-inc
Institute For Applied Composites Technology	/org/institute-for-applied-composites-technology
West Side New Beginnings Inc	/org/west-side-new-beginnings-inc
Lewes Public Library Inc	/org/lewes-public-library-inc
Canaan Full Gospel Christian Church Inc	/org/canaan-full-gospel-christian-church-inc
Delta Outreach And Education Center Incorporated	/org/delta-outreach-and-education-center-incorporated
Ejb Inc	/org/ejb-inc
Little League Baseball Inc	/org/little-league-baseball-inc-1056
Dima V Inc	/org/dima-v-inc
Delaware Greenways Inc	/org/delaware-greenways-inc
American Volkssport Association	/org/american-volkssport-association_140057
Mountain Brook Academy Inc	/org/mountain-brook-academy-inc
1992 Delaware Columbus Commission	/org/1992-delaware-columbus-commission
Association Of Friends Of Aurora Center	/org/association-of-friends-of-aurora-center
The Renewal Center	/org/the-renewal-center
Nanticoke Alternative Care Inc	/org/nanticoke-alternative-care-inc
Delaware Senior Olympics Inc	/org/delaware-senior-olympics-inc
Pta Delaware Congress	/org/pta-delaware-congress_140066
Pyle Child Development Center Inc	/org/pyle-child-development-center-inc
Crossroads Presbyterian Church	/org/crossroads-presbyterian-church
Delaware Council On The Teaching Of Foreign Languages	/org/delaware-council-on-the-teaching-of-foreign-languages
Human Services Council Inc	/org/human-services-council-inc
Christiana Care Health Initiatives Inc	/org/christiana-care-health-initiatives-inc
Vsa Delaware Inc	/org/vsa-delaware-inc
Delaware Chamber Music Festival Incorporated	/org/delaware-chamber-music-festival-incorporated
Serenity Place Inc	/org/serenity-place-inc
Delaware Genealogical Society	/org/delaware-genealogical-society
Wilmington Housing Partnership Corp	/org/wilmington-housing-partnership-corp
Pop Warner Little Scholars, Inc.	/org/pop-warner-little-scholars-inc-169
