org_name	org_url
United Jewish Charities Of N E Louisiana Inc	/org/united-jewish-charities-of-n-e-louisiana-inc
American Chemical Society	/org/american-chemical-society-184
National Society Of The Daughters Of The American Revolution	/org/national-society-of-the-daughters-of-the-american-revolution-271
Sonrise Communications Inc	/org/sonrise-communications-inc
Inner-City Revitalization Corporation	/org/inner-city-revitalization-corporation
Housing Corporation Of Acadiana Inc	/org/housing-corporation-of-acadiana-inc
Family Values Resource Institute Inc	/org/family-values-resource-institute-inc
Vernon Historical And Genealogical Society	/org/vernon-historical-and-genealogical-society
U S Naval Sea Cadet Corps Baton Rouge Inc	/org/u-s-naval-sea-cadet-corps-baton-rouge-inc
Fellowship Ministries Inc	/org/fellowship-ministries-inc
Camp Fire, Inc. Sowela Council	/org/camp-fire-inc-sowela-council
New Orleans Metro Fast Pitch Softball Association Inc	/org/new-orleans-metro-fast-pitch-softball-association-inc
Maison Desprit Of Lafayette Inc	/org/maison-desprit-of-lafayette-inc
Bpcc Foundation Inc	/org/bpcc-foundation-inc
West Monroe Soccer Club	/org/west-monroe-soccer-club
Truth Ministries, Inc.	/org/truth-ministries-inc_71631
Louisiana Steam Train Association	/org/louisiana-steam-train-association
Masjid-Al-Jihad	/org/masjid-al-jihad
Louisiana Transportation Research Center Foundation Inc	/org/louisiana-transportation-research-center-foundation-inc
Louisiana Hayride Foundation Inc	/org/louisiana-hayride-foundation-inc
Urban Housing Of America Inc Louisiana	/org/urban-housing-of-america-inc-louisiana
Lucys Daycare & Learning Center Inc	/org/lucys-daycare-learning-center-inc
Toughlove International	/org/toughlove-international_71680
Meals On Wheels-New Orleans Fund Inc	/org/meals-on-wheels-new-orleans-fund-inc
Catholic Church Of The Americas	/org/catholic-church-of-the-americas
Upward Community Services Inc	/org/upward-community-services-inc
Birth Rite Education Center	/org/birth-rite-education-center
Gateway Foundation	/org/gateway-foundation
LITTLE LEAGUE BASEBALL INC	/org/little-league-baseball-inc-597
Absolute Care Enterprise Inc	/org/absolute-care-enterprise-inc
Literacy Works Inc	/org/literacy-works-inc
The Centennial Culture Center Inc	/org/the-centennial-culture-center-inc
Jefferson Coalition For Alternative Schools	/org/jefferson-coalition-for-alternative-schools
Voa Nicollet Towers Affordable Housing Corp.	/org/voa-nicollet-towers-affordable-housing-corp
Southern Mutual Housing Development Corporation	/org/southern-mutual-housing-development-corporation
Missions Inc	/org/missions-inc_71704
Marian Central Catholic Middle School	/org/marian-central-catholic-middle-school
Angels Learning Academy Inc	/org/angels-learning-academy-inc
High Voltage Girls Fastpitch Softba Ll Organization	/org/high-voltage-girls-fastpitch-softba-ll-organization
Caddo Ward Ii Industrial Development Corporation	/org/caddo-ward-ii-industrial-development-corporation
Church Of Scientology	/org/church-of-scientology_71714
Friends Of The Algiers Courthouse	/org/friends-of-the-algiers-courthouse
Friends Of The Chennault Aviation & Military Museum Of Louisiana Inc	/org/friends-of-the-chennault-aviation-military-museum-of-louisiana-inc
Success Counseling Services-North	/org/success-counseling-services-north
Gods House Of Prayer And Deliverance	/org/gods-house-of-prayer-and-deliverance
