org_name	org_url
David Holmes Chapter National Society Daughters Of American	/org/david-holmes-chapter-national-society-daughters-of-american
National Society Of The Daughters Of The American Revolution	/org/national-society-of-the-daughters-of-the-american-revolution-281
Mississippi Library Association Inc	/org/mississippi-library-association-inc
Society Of Manufacturing Engineers	/org/society-of-manufacturing-engineers-109
Phi Theta Kappa Fraternity	/org/phi-theta-kappa-fraternity-1110
National Society Of The Daughters Of The American Revolution	/org/national-society-of-the-daughters-of-the-american-revolution-282
Lamar School Foundation	/org/lamar-school-foundation
Christians United Of Leland Ms	/org/christians-united-of-leland-ms
St Andrews Mission	/org/st-andrews-mission
Mississippi Association Of The Deaf Incorporated	/org/mississippi-association-of-the-deaf-incorporated_73663
Central Mississippi Sickle Cell Foundation	/org/central-mississippi-sickle-cell-foundation
Taylors Daycare & Learning Center Inc	/org/taylors-daycare-learning-center-inc
Clydesdale Christmas Store Inc	/org/clydesdale-christmas-store-inc
Pearl River Central School Health Program	/org/pearl-river-central-school-health-program
T O U C H Inc	/org/t-o-u-c-h-inc
Ministerial Institute & College	/org/ministerial-institute-college
Habitat For Humanity International Inc	/org/habitat-for-humanity-international-inc-1314
Mississippi Homemaker Volunteers Inc	/org/mississippi-homemaker-volunteers-inc-25
Pta Mississippi Of Congress	/org/pta-mississippi-of-congress
The Council	/org/the-council
Mississippi Homemaker Volunteers Inc	/org/mississippi-homemaker-volunteers-inc-32
Favre 4 Hope Inc	/org/favre-4-hope-inc
Isola Christian Community Action Group	/org/isola-christian-community-action-group
Round Table Foundation	/org/round-table-foundation
East Mississippi Childrens Shelter	/org/east-mississippi-childrens-shelter
Phi Theta Kappa Fraternity	/org/phi-theta-kappa-fraternity-1051
Phi Theta Kappa Fraternity	/org/phi-theta-kappa-fraternity-1054
River City Rescue Mission Inc	/org/river-city-rescue-mission-inc
Mississippi Homemaker Volunteers Inc	/org/mississippi-homemaker-volunteers-inc-12
Mississippi Homemaker Volunteers Inc	/org/mississippi-homemaker-volunteers-inc-15
Phi Theta Kappa Fraternity	/org/phi-theta-kappa-fraternity-1021
Life Line Aviation, Inc.	/org/life-line-aviation-inc
Pearl Educational Foundation For Excellence Inc	/org/pearl-educational-foundation-for-excellence-inc
Developmental Learning Center	/org/developmental-learning-center
Phi Theta Kappa Fraternity	/org/phi-theta-kappa-fraternity-1025
Phi Theta Kappa Fraternity	/org/phi-theta-kappa-fraternity-1031
Main Street Greenwood Incorporated	/org/main-street-greenwood-incorporated
Education Services Foundation	/org/education-services-foundation
Dusti Bonge Art Foundation Inc	/org/dusti-bonge-art-foundation-inc
American Inns Of Court Foundation	/org/american-inns-of-court-foundation-283
Kevin M Williams Ministries Inc	/org/kevin-m-williams-ministries-inc
George Greene Habitat For Humanity Inc	/org/george-greene-habitat-for-humanity-inc
Mississippi Association Of Partners In Education Inc	/org/mississippi-association-of-partners-in-education-inc
Pearl River County Spca Inc	/org/pearl-river-county-spca-inc
Greenwood Community Band Inc	/org/greenwood-community-band-inc
New Dimensions Development Foundation Inc	/org/new-dimensions-development-foundation-inc
Pta Mississippi Congress	/org/pta-mississippi-congress-28
Pta Mississippi Congress	/org/pta-mississippi-congress-29
The Mississippi Mass Choir Ministries Inc	/org/the-mississippi-mass-choir-ministries-inc
Tennis Foundation Of Mississippi	/org/tennis-foundation-of-mississippi
Pta Mississippi Congress	/org/pta-mississippi-congress-30
Pta Mississippi Congress	/org/pta-mississippi-congress-31
V-Burg, Inc.	/org/v-burg-inc
Habitat For Humanity International Inc	/org/habitat-for-humanity-international-inc-1302
Rush Medical Group Of Newton Pa	/org/rush-medical-group-of-newton-pa
CULKIN VOLUNTEER FIRE DEPARTMENT	/org/culkin-volunteer-fire-department
Housing Education And Economic Development Inc	/org/housing-education-and-economic-development-inc
Women Work The National Network For Women's Employment, Inc.	/org/women-work-the-national-network-for-womens-employment-inc_73787
Mississippi Homemaker Volunteers Inc	/org/mississippi-homemaker-volunteers-inc-9
First John The Baptist Church	/org/first-john-the-baptist-church
Pta Mississippi Congress	/org/pta-mississippi-congress-32
Civil Air Patrol 22095 Group I	/org/civil-air-patrol-22095-group-i
New Horizons Ministries	/org/new-horizons-ministries
Pta Mississippi Congress	/org/pta-mississippi-congress-33
Pta Mississippi Congress	/org/pta-mississippi-congress-35
Sally Kate Winters Family Services	/org/sally-kate-winters-family-services
Pta Mississippi Congress	/org/pta-mississippi-congress-36
People Against Litter	/org/people-against-litter
Sons Of Confederate Veterans, Inc. Addison Harvey Camp 267	/org/sons-of-confederate-veterans-inc-addison-harvey-camp-267
Sons Of Confederate Veterans Inc	/org/sons-of-confederate-veterans-inc-53
Tishomingo Health Services Inc	/org/tishomingo-health-services-inc
Mississippi Recreation & Park Association Inc	/org/mississippi-recreation-park-association-inc
The Kosciusko Athletic Booster Club Inc	/org/the-kosciusko-athletic-booster-club-inc
Helping Hands Ministries Of Attala County Inc	/org/helping-hands-ministries-of-attala-county-inc
Phi Theta Kappa Fraternity	/org/phi-theta-kappa-fraternity-577
United Methodist Senior Services Of Tupelo Area Inc	/org/united-methodist-senior-services-of-tupelo-area-inc
Pta Mississippi Congress	/org/pta-mississippi-congress-38
Apostolic Assemblies In Jesus Christ Inc	/org/apostolic-assemblies-in-jesus-christ-inc
