org_name	org_url
Spay Panamas Animals Yes USA	/org/spay-panamas-animals-yes-usa
Diabetes Foundation of Mississippi, Inc.	/org/diabetes-foundation-of-mississippi-inc
Show Mercy International	/org/show-mercy-international
Wingard Home Ministry	/org/wingard-home-ministry
Coastal Women for Change	/org/coastal-women-for-change
Community Animal Rescue & Adoption	/org/community-animal-rescue-adoption
Warrior Bonfire Program	/org/warrior-bonfire-program
Institute of Southern Jewish Life	/org/institute-of-southern-jewish-life
Network of International Christian Schools Oasis International Schools, Inc.	/org/network-of-international-christian-schools-oasis-international-schools-inc
The Baddour Center	/org/the-baddour-center
Shaw Pit Bull Rescue	/org/shaw-pit-bull-rescue
Memorial Hospital At Gulfportfoundation Inc	/org/memorial-hospital-at-gulfportfoundation-inc
American Family Association Inc	/org/american-family-association-inc-1
Animal Rescue Fund Of Mississippi	/org/animal-rescue-fund-of-mississippi
Mission at the Cross	/org/mission-at-the-cross
Boys & Girls Clubs of the Mississippi Delta	/org/boys-girls-clubs-of-the-mississippi-delta
Madison Ark	/org/madison-ark
The Animal Rescue League	/org/the-animal-rescue-league
G E L I Inc	/org/g-e-l-i-inc
Make A Wish Foundation Of Mississippi Chartered	/org/make-a-wish-foundation-of-mississippi-chartered
Tunica Humane Society	/org/tunica-humane-society
E J & W Foundation Inc	/org/e-j-w-foundation-inc
Save Our Strays	/org/save-our-strays-2
Southern Pines Animal Shelter	/org/southern-pines-animal-shelter
The Gift of Life Counseling and Mentoring Center	/org/the-gift-of-life-counseling-and-mentoring-center
PHI THETA KAPPA FOUNDATION	/org/phi-theta-kappa-foundation
MidSouth Ballet Theatre	/org/midsouth-ballet-theatre
Animal Relief And Rescue Fellowship	/org/animal-relief-and-rescue-fellowship
Seth Harris Childhood Cancer Foundation Inc	/org/seth-harris-childhood-cancer-foundation-inc
One Way International Ministries	/org/one-way-international-ministries
French Camp Academy	/org/french-camp-academy
East Mississippi Animal Rescue Inc	/org/east-mississippi-animal-rescue-inc
Extra Table Inc	/org/extra-table-inc
The Exchange Club Ctr For The Prevention Of Child Abuse Of N Ms	/org/the-exchange-club-ctr-for-the-prevention-of-child-abuse-of-n-ms
Land Tr For The Ms Coastal Plain	/org/land-tr-for-the-ms-coastal-plain
Rhyme-N-Reason Foundation	/org/rhyme-n-reason-foundation
New Zion Utilities Inc	/org/new-zion-utilities-inc
Good Samaritan Center Inc	/org/good-samaritan-center-inc
Preservation Yazoo	/org/preservation-yazoo
Hope Ministries Inc	/org/hope-ministries-inc-8
Greenville Renaissance Scholars	/org/greenville-renaissance-scholars
Focus On Natural Health Education & Community Development Inc	/org/focus-on-natural-health-education-community-development-inc
Southern Jewel Dog Rescue	/org/southern-jewel-dog-rescue
Zoe Rose Memorial Foundation	/org/zoe-rose-memorial-foundation-1
The Gift Of Life Counseling Center	/org/the-gift-of-life-counseling-center
Phi Theta Kappa Fraternity	/org/phi-theta-kappa-fraternity-159
Nathas Ministries Inc	/org/nathas-ministries-inc
Split Rock Research Foundation	/org/split-rock-research-foundation
The Reaching Educating For Community Hope Foundation	/org/the-reaching-educating-for-community-hope-foundation
Foundation For Innovation Education & Research In Otorhinolaryngology	/org/foundation-for-innovation-education-research-in-otorhinolaryngology
Legacy Education and Community Empowerment Foundation Inc.	/org/legacy-education-and-community-empowerment-foundation-inc
Voices For Mississippis Children Inc	/org/voices-for-mississippis-children-inc
GULF COAST WOMENS CENTER FOR NONVIOLENCE	/org/gulf-coast-womens-center-for-nonviolence
Digital Opportunity Trust Usa Inc	/org/digital-opportunity-trust-usa-inc
Bicycle Advocacy Group Of Mississippi	/org/bicycle-advocacy-group-of-mississippi
Southaven Chamber Of Commerce	/org/southaven-chamber-of-commerce
DESOTO ANIMAL RESCUE SOCIETY	/org/desoto-animal-rescue-society
Toastmasters International	/org/toastmasters-international_100264520
Covenant House Outreach Ministries	/org/covenant-house-outreach-ministries
VINEYARD NEW OUTREACH MINISTRY	/org/vineyard-new-outreach-ministry
Citizens Reinvesting In Shaw Corporation	/org/citizens-reinvesting-in-shaw-corporation
People Making A Difference, Inc.	/org/people-making-a-difference-inc
Marshall County Educational Foundation Inc	/org/marshall-county-educational-foundation-inc
Open Season Sportsman Club	/org/open-season-sportsman-club
Boy Scouts Of America	/org/boy-scouts-of-america-9
Msgc Youth For Christ Thrift Mart	/org/msgc-youth-for-christ-thrift-mart
VOX Press Inc	/org/vox-press-inc
Sacred Heart League	/org/sacred-heart-league
Project Hope Outreach	/org/project-hope-outreach
Standing Tall Ministries Inc	/org/standing-tall-ministries-inc
Pass Christian Delisle Community Center	/org/pass-christian-delisle-community-center
Granthi Buddhist Association Inc	/org/granthi-buddhist-association-inc
Joe Graham Post 119 American Legion	/org/joe-graham-post-119-american-legion
3 Angels Behavioral Health Centers Inc	/org/3-angels-behavioral-health-centers-inc
UNITED WAY OF SOUTH MISSISSIPPI INC	/org/united-way-of-south-mississippi-inc
A Natural Way	/org/a-natural-way
Compass Points Educational Foundati On	/org/compass-points-educational-foundati-on
Edgar Dewitt Johnson Md Memorial Scholarship	/org/edgar-dewitt-johnson-md-memorial-scholarship
Okeefe Educational Media	/org/okeefe-educational-media
Coast Chorale Inc	/org/coast-chorale-inc
National Leighs Disease Foundation	/org/national-leighs-disease-foundation
Heartland Church	/org/heartland-church-2
Gap Ministries Outreach	/org/gap-ministries-outreach
World Impact Network	/org/world-impact-network_100872253
Community Foundation Of Greater Jackson Inc	/org/community-foundation-of-greater-jackson-inc
Mississippi Industrial Heritage Museum Inc	/org/mississippi-industrial-heritage-museum-inc
Casa-Prc Incorporated	/org/casa-prc-incorporated
Jasmines And Jaylahs Youth Learning Center	/org/jasmines-and-jaylahs-youth-learning-center
Columbus Lowndes Humane Society	/org/columbus-lowndes-humane-society
Cedarhill Animal Sanctuary Inc	/org/cedarhill-animal-sanctuary-inc
Foundation On The Rock Ministries	/org/foundation-on-the-rock-ministries
Copiah County Animal Shelter Inc	/org/copiah-county-animal-shelter-inc
Friends Of The Animal Shelter In Hancock County	/org/friends-of-the-animal-shelter-in-hancock-county
Greater New Prospect Missionary Baptist Church Inc	/org/greater-new-prospect-missionary-baptist-church-inc
Pure Gold Booster Club	/org/pure-gold-booster-club
Life Support Cares	/org/life-support-cares
Delta Animal League	/org/delta-animal-league
Sunflower County Freedom Project	/org/sunflower-county-freedom-project
Children's World Learning Center	/org/childrens-world-learning-center
Friends Of Mississippi Libraries Inc	/org/friends-of-mississippi-libraries-inc-53
Greenwood Cemetery Restoration Association	/org/greenwood-cemetery-restoration-association
Aldersgate Personal Care Inc	/org/aldersgate-personal-care-inc
Lowndes Community Investment Corp	/org/lowndes-community-investment-corp
National Society Of The Sons Of The American Revolution	/org/national-society-of-the-sons-of-the-american-revolution_17054
Friends Of Mississippi Libraries Inc	/org/friends-of-mississippi-libraries-inc_17108
Preserve Sight Mississippi	/org/preserve-sight-mississippi
Natchez Little Theatre Inc	/org/natchez-little-theatre-inc
Pta Mississippi Congress	/org/pta-mississippi-congress-9
Phi Theta Kappa Fraternity	/org/phi-theta-kappa-fraternity-1035
Phi Theta Kappa Fraternity	/org/phi-theta-kappa-fraternity-1030
Pta Mississippi Congress	/org/pta-mississippi-congress-13
Pta Mississippi Congress	/org/pta-mississippi-congress-15
Lighthouse Assembly Of God	/org/lighthouse-assembly-of-god-45
Pta Mississippi Congress	/org/pta-mississippi-congress-16
Gospel Singers Of America Inc	/org/gospel-singers-of-america-inc
Westminster Development Foundation	/org/westminster-development-foundation
Greater Columbus Learning Center Inc	/org/greater-columbus-learning-center-inc
Armed Forces Museum Foundation	/org/armed-forces-museum-foundation
Women's Aglow Fellowship	/org/womens-aglow-fellowship_5306
Pta Mississippi Congress	/org/pta-mississippi-congress-5
Phi Theta Kappa Fraternity	/org/phi-theta-kappa-fraternity-1026
Mississippi Drug Testing Consortium Inc	/org/mississippi-drug-testing-consortium-inc
Phi Theta Kappa Fraternity	/org/phi-theta-kappa-fraternity-1055
Phi Upsilon Omicron Inc	/org/phi-upsilon-omicron-inc
West Bolivar Christian Association	/org/west-bolivar-christian-association
Habitat For Humanity International Inc	/org/habitat-for-humanity-international-inc-1303
Friends Of Mississippi Libraries Inc	/org/friends-of-mississippi-libraries-inc-65
Rush Medical Group Of Sumter Pc	/org/rush-medical-group-of-sumter-pc
Pta Mississippi Congress	/org/pta-mississippi-congress-4
National Society Of The Daughters Of The American Revolution	/org/national-society-of-the-daughters-of-the-american-revolution-69
National Society Daughters Of The American Colonists	/org/national-society-daughters-of-the-american-colonists_13976
The Larry Payne Foundation	/org/the-larry-payne-foundation
National Society Colonial Dames Xvii	/org/national-society-colonial-dames-xvii-1
Rome Community Development Organization	/org/rome-community-development-organization
Friends Of Mississippi Libraries Inc	/org/friends-of-mississippi-libraries-inc-39
Phi Theta Kappa Fraternity	/org/phi-theta-kappa-fraternity-1046
Phi Theta Kappa Fraternity	/org/phi-theta-kappa-fraternity-1125
North Mississippi Emmaus Community Inc	/org/north-mississippi-emmaus-community-inc
Pta Mississippi Congress	/org/pta-mississippi-congress-2
North Gulfport Community Scholar Ship Fund Inc	/org/north-gulfport-community-scholar-ship-fund-inc
Center For Pregnancy Choices Of South Central Mississippi	/org/center-for-pregnancy-choices-of-south-central-mississippi
Phi Theta Kappa Fraternity	/org/phi-theta-kappa-fraternity-1124
Toastmasters International	/org/toastmasters-international_3827
Phi Theta Kappa Fraternity	/org/phi-theta-kappa-fraternity
Full Gospel Missionary Church	/org/full-gospel-missionary-church
Hope Thru Truth Ministries	/org/hope-thru-truth-ministries
Helm Incorporated	/org/helm-incorporated
Greenbrook Elementary Pto	/org/greenbrook-elementary-pto
Friends Of Mississippi Libraries Inc	/org/friends-of-mississippi-libraries-inc-1
White Horse Christian Retreat Camp Inc	/org/white-horse-christian-retreat-camp-inc
Love Ministries Inc	/org/love-ministries-inc-2
Morton Medical Center Inc	/org/morton-medical-center-inc
Brices Crossroads National Battlefield Commission Inc	/org/brices-crossroads-national-battlefield-commission-inc
Holmes Assembly Of God	/org/holmes-assembly-of-god
Glendora Economic And Community Development Inc	/org/glendora-economic-and-community-development-inc
Ballet Mississippi Foundation	/org/ballet-mississippi-foundation
Compassionate Friends, Inc.	/org/compassionate-friends-inc_17263
Southern Baptist Bivocational Ministers Association Inc	/org/southern-baptist-bivocational-ministers-association-inc
Covenant Presbyterian Church 307 Ivy Ave	/org/covenant-presbyterian-church-307-ivy-ave
The Mississippi Academy Of Ancient Music Inc	/org/the-mississippi-academy-of-ancient-music-inc
Tutwiler Clinic Inc	/org/tutwiler-clinic-inc
Jus Jesus Ministries Inc	/org/jus-jesus-ministries-inc
Dream Of Hattiesburg Inc	/org/dream-of-hattiesburg-inc
The Shafer Center For Crisis Intervention	/org/the-shafer-center-for-crisis-intervention
Uspc Newco Inc	/org/uspc-newco-inc_17273
Copiah-Lincoln Junior College Foundation Inc	/org/copiah-lincoln-junior-college-foundation-inc
St Vincent De Paul Society	/org/st-vincent-de-paul-society_17275
Pta Mississippi Congress	/org/pta-mississippi-congress-20
Mississippi Cultural Crossroads Inc	/org/mississippi-cultural-crossroads-inc
Gary Bowlin Evangelistic Association Inc	/org/gary-bowlin-evangelistic-association-inc
Winona Community Improvement Club	/org/winona-community-improvement-club
Mantachie Rural Health Care Inc	/org/mantachie-rural-health-care-inc
First Assembly Of God	/org/first-assembly-of-god-570
Shepherds Staff Ministries Inc	/org/shepherds-staff-ministries-inc
Friends Of The Grenada County Hospital Committee Charitable Tr	/org/friends-of-the-grenada-county-hospital-committee-charitable-tr
National Society Colonial Dames Xvii Century	/org/national-society-colonial-dames-xvii-century-236
East Mississippi Junior College Development Foundation	/org/east-mississippi-junior-college-development-foundation
Haven House Family Shelter	/org/haven-house-family-shelter
Grace Church Of Cleveland	/org/grace-church-of-cleveland
William Carey College Development Foundation Inc	/org/william-carey-college-development-foundation-inc
Sons Of The American Revolution	/org/sons-of-the-american-revolution_17291
Soil And Water Conservation Society	/org/soil-and-water-conservation-society_17292
Church After School Association Inc	/org/church-after-school-association-inc
Gulf Coast Symphony Orchestra Inc	/org/gulf-coast-symphony-orchestra-inc
Mississippi Engineering Society Mes State Scholarship Fund	/org/mississippi-engineering-society-mes-state-scholarship-fund
Parents Without Partners	/org/parents-without-partners_17298
Mississippi Rural Water Association Inc	/org/mississippi-rural-water-association-inc
Bible Ministry Association	/org/bible-ministry-association
Northeast Ms Community Svcs Inc	/org/northeast-ms-community-svcs-inc
National Society Colonial Dames Xvii Century	/org/national-society-colonial-dames-xvii-century-235
National Football Foundation And College Hall Of Fame Inc	/org/national-football-foundation-and-college-hall-of-fame-inc-65
Mississippi Institute For Small Towns, Inc.	/org/mississippi-institute-for-small-towns-inc
Harvard Club Of Mississippi Inc Term	/org/harvard-club-of-mississippi-inc-term
Amite County Medical Services Inc	/org/amite-county-medical-services-inc
Centreville Academy Inc	/org/centreville-academy-inc
Mississippi Arts Commission	/org/mississippi-arts-commission
H C Watkins Memorial Hospital Inc	/org/h-c-watkins-memorial-hospital-inc
Tupelo Service Finance Inc	/org/tupelo-service-finance-inc
College Hill Presbyterian Church	/org/college-hill-presbyterian-church
Five County Child Development Program Inc	/org/five-county-child-development-program-inc
Washington County Opportunities Inc	/org/washington-county-opportunities-inc
Institute Of Community Services Incorporated	/org/institute-of-community-services-incorporated
Region 1-Mental Health Commission	/org/region-1-mental-health-commission
Delta Health Center Inc	/org/delta-health-center-inc
Helping Hands Of Columbus Inc	/org/helping-hands-of-columbus-inc
Millsaps College	/org/millsaps-college
Methodist Hospital Of Hattiesburg Inc	/org/methodist-hospital-of-hattiesburg-inc
Main Street Presbyterian Church	/org/main-street-presbyterian-church
Phi Theta Kappa Fraternity	/org/phi-theta-kappa-fraternity-934
Phi Theta Kappa Fraternity	/org/phi-theta-kappa-fraternity-914
Phi Theta Kappa Society	/org/phi-theta-kappa-society_18076
Tennessee Branch Of The International Dyslexia Association	/org/tennessee-branch-of-the-international-dyslexia-association
Faith Temple Pentecostal Church	/org/faith-temple-pentecostal-church
Compassionate Friends, Inc.	/org/compassionate-friends-inc_18496
Yazoo City Church Of Christ	/org/yazoo-city-church-of-christ
Biloxi Tricentennial Commission Inc	/org/biloxi-tricentennial-commission-inc
Housing Development Corporation Of Humphreys County Inc	/org/housing-development-corporation-of-humphreys-county-inc
Demolay International	/org/demolay-international-1269
Quail Unlimited Inc	/org/quail-unlimited-inc_20840
Phi Theta Kappa Society	/org/phi-theta-kappa-society-12
Phi Theta Kappa Chapter	/org/phi-theta-kappa-chapter
Phi Theta Kappa Society	/org/phi-theta-kappa-society-1
Phi Theta Kappa Society	/org/phi-theta-kappa-society_21047
Phi Theta Kappa Fraternity	/org/phi-theta-kappa-fraternity-854
Wilkinson County Industrial Development Authority	/org/wilkinson-county-industrial-development-authority
Phi Theta Kappa Fraternity	/org/phi-theta-kappa-fraternity-1173
Wfca Radio Inc	/org/wfca-radio-inc
North Mississippi Medical Center Inc	/org/north-mississippi-medical-center-inc
Lawrence County Business & Professional Votech Scholarship	/org/lawrence-county-business-professional-votech-scholarship
Lawrence County Hospital	/org/lawrence-county-hospital
Phi Theta Kappa Fraternity	/org/phi-theta-kappa-fraternity-247
Adat Inc	/org/adat-inc
Pontotoc Community Hospital	/org/pontotoc-community-hospital
Phi Theta Kappa Fraternity	/org/phi-theta-kappa-fraternity-1128
The Tate County Mississippi Genealogical Society Inc	/org/the-tate-county-mississippi-genealogical-society-inc
Mississippi Homemaker Volunteers Inc	/org/mississippi-homemaker-volunteers-inc-8
South Sunflower Habitat For Humanity	/org/south-sunflower-habitat-for-humanity
Mother Goose Incorporated	/org/mother-goose-incorporated
New Hope M B Church	/org/new-hope-m-b-church
Spca Of Diamondhead Inc	/org/spca-of-diamondhead-inc
Petal Childrens Task Force Inc	/org/petal-childrens-task-force-inc
Grace Reformed Baptist Church	/org/grace-reformed-baptist-church
Fisher Ferry Volunteer Fire Department	/org/fisher-ferry-volunteer-fire-department
Habitat For Humanity International Inc	/org/habitat-for-humanity-international-inc-1308
Lupus Foundation Of America Mississippi Chapter	/org/lupus-foundation-of-america-mississippi-chapter
Pta Mississippi Congress	/org/pta-mississippi-congress-19
International Reading Association Inc	/org/international-reading-association-inc-32
Ebony Pearls Foundation Inc	/org/ebony-pearls-foundation-inc
National Council Of Negro Women Inc	/org/national-council-of-negro-women-inc_5952
The National Juneteenth Observance Foundation Inc	/org/the-national-juneteenth-observance-foundation-inc
Mississippi Association Of The Deaf Incorporated	/org/mississippi-association-of-the-deaf-incorporated
Edwards Street Fellowship Center Inc	/org/edwards-street-fellowship-center-inc
Wonderful World Of Learning, Inc.	/org/wonderful-world-of-learning-inc
Bibles For Communist Lands Inc	/org/bibles-for-communist-lands-inc
Mhg Development Foundation Inc	/org/mhg-development-foundation-inc
Friends Of Terry	/org/friends-of-terry
Dominican Sisters Advocacy For The Poor	/org/dominican-sisters-advocacy-for-the-poor
Mississippi Vision Foundation	/org/mississippi-vision-foundation
Pine Woods Chapter Of The National Audubon Society	/org/pine-woods-chapter-of-the-national-audubon-society
Sons Of Confederate Veterans Inc	/org/sons-of-confederate-veterans-inc-5
Phi Theta Kappa Fraternity	/org/phi-theta-kappa-fraternity-528
Shiloh Missionary Baptist Church Of Moss Point	/org/shiloh-missionary-baptist-church-of-moss-point
Phi Theta Kappa Fraternity	/org/phi-theta-kappa-fraternity-521
Phi Theta Kappa Fraternity	/org/phi-theta-kappa-fraternity-507
Church Of The Way Of Meridian Incorporated	/org/church-of-the-way-of-meridian-incorporated
Dayspring Ministries Inc	/org/dayspring-ministries-inc
Phi Theta Kappa Fraternity	/org/phi-theta-kappa-fraternity-1061
Operation Save Lives	/org/operation-save-lives
Mississippi State Medical Association Foundation Inc	/org/mississippi-state-medical-association-foundation-inc
Laurel Community Concert Association	/org/laurel-community-concert-association
Brain Injury Association Of Mississippi	/org/brain-injury-association-of-mississippi
Phi Theta Kappa Fraternity	/org/phi-theta-kappa-fraternity-487
Phi Theta Kappa Fraternity	/org/phi-theta-kappa-fraternity-483
American Inns Of Court Foundation	/org/american-inns-of-court-foundation-255
Psi Chi The National Honor Society In Psychology	/org/psi-chi-the-national-honor-society-in-psychology-767
Phi Theta Kappa Fraternity	/org/phi-theta-kappa-fraternity-458
Phi Theta Kappa Fraternity	/org/phi-theta-kappa-fraternity_27925
American Institute Of Industrial Engineers Inc	/org/american-institute-of-industrial-engineers-inc-15
Phi Theta Kappa Fraternity	/org/phi-theta-kappa-fraternity-413
Phi Theta Kappa Fraternity	/org/phi-theta-kappa-fraternity-395
Phi Theta Kappa Fraternity	/org/phi-theta-kappa-fraternity-376
Women's Aglow Fellowship Of Philadelphia Mississippi	/org/womens-aglow-fellowship-of-philadelphia-mississippi
Harvest Of Faith Church	/org/harvest-of-faith-church
Rising Sun Missionary Baptist Church	/org/rising-sun-missionary-baptist-church
Youngheart Ministries Inc	/org/youngheart-ministries-inc
Sigma Theta Tau Inc	/org/sigma-theta-tau-inc-170
International Lutheran Laymens League	/org/international-lutheran-laymens-league_43608
Southern Atlantic Corporation	/org/southern-atlantic-corporation
Grenada Junior Auxiliary Inc	/org/grenada-junior-auxiliary-inc
Phi Theta Kappa Fraternity	/org/phi-theta-kappa-fraternity-267
Phi Theta Kappa Fraternity	/org/phi-theta-kappa-fraternity-274
Old Spanish Trail Heritage Foundation Inc	/org/old-spanish-trail-heritage-foundation-inc
Mississippi State Rescue Workers Inc	/org/mississippi-state-rescue-workers-inc
Phi Theta Kappa Fraternity	/org/phi-theta-kappa-fraternity-239
Juvenile Diabetes Foundation International	/org/juvenile-diabetes-foundation-international_84240
Phit Theta Kappa Fraternity	/org/phit-theta-kappa-fraternity
Indianola Rotary Club Educational Trust	/org/indianola-rotary-club-educational-trust
Toastmistress Clubs International Delphi	/org/toastmistress-clubs-international-delphi
Phi Theta Kappa Fraternity	/org/phi-theta-kappa-fraternity-234
St Dominic Jackson Memorial Hospital Auxiliary	/org/st-dominic-jackson-memorial-hospital-auxiliary
Phi Theta Kappa Fraternity	/org/phi-theta-kappa-fraternity-217
Phi Theta Kappa Fraternity	/org/phi-theta-kappa-fraternity-223
Phi Theta Kappa Fraternity	/org/phi-theta-kappa-fraternity-229
Iuka Gospel Assembly Church	/org/iuka-gospel-assembly-church
Phi Theta Kappa Fraternity	/org/phi-theta-kappa-fraternity-201
Phi Theta Kappa Fraternity	/org/phi-theta-kappa-fraternity-209
Phi Theta Kappa Fraternity	/org/phi-theta-kappa-fraternity-186
Phi Theta Kappa Fraternity	/org/phi-theta-kappa-fraternity-171
Phi Theta Kappa Fraternity	/org/phi-theta-kappa-fraternity-130
Phi Theta Kappa Fraternity	/org/phi-theta-kappa-fraternity-147
Phi Theta Kappa Fratetnity	/org/phi-theta-kappa-fratetnity
Phi Theta Kappa Fraternity	/org/phi-theta-kappa-fraternity-109
Phi Theta Kappa Fraternity	/org/phi-theta-kappa-fraternity-124
Association For The Severly Handicapped	/org/association-for-the-severly-handicapped_60141
Friends Of Mississippi Libraries Inc	/org/friends-of-mississippi-libraries-inc-83
Friends Of Mississippi Libraries Inc	/org/friends-of-mississippi-libraries-inc-86
Friends Of Mississippi Libraries Inc	/org/friends-of-mississippi-libraries-inc-82
Revivals Of Deliverance Inc	/org/revivals-of-deliverance-inc
Bereaved Parents Of The Usa	/org/bereaved-parents-of-the-usa_62618
National Council Of Negro Women Nc Lee County Sect	/org/national-council-of-negro-women-nc-lee-county-sect
Phi Theta Kappa	/org/phi-theta-kappa_62667
Civil Air Patrol	/org/civil-air-patrol_62781
Phi Theta Kappa Fraternity	/org/phi-theta-kappa-fraternity-1159
Phi Theta Kappa Fraternity	/org/phi-theta-kappa-fraternity-1165
Phi Theta Kappa	/org/phi-theta-kappa-211
Phi Theta Kappa Fraternity	/org/phi-theta-kappa-fraternity-1153
Phi Theta Kappa Fraternity	/org/phi-theta-kappa-fraternity-1146
God Cares Ministries	/org/god-cares-ministries-3
Berean International Ministries	/org/berean-international-ministries
Faith Baptist Church	/org/faith-baptist-church-99
Walthall County Mississippi Tr For Preservation Of Hist Culture & Art	/org/walthall-county-mississippi-tr-for-preservation-of-hist-culture-art
Armed Services Ymca Of The Usa	/org/armed-services-ymca-of-the-usa_71632
Hope Foundation Ulj	/org/hope-foundation-ulj
Boys & Girls Club Of Covington County Inc	/org/boys-girls-club-of-covington-county-inc
New Covenant Presbyterian Church	/org/new-covenant-presbyterian-church
Christ Community Church Of Hernando	/org/christ-community-church-of-hernando
Jefferson County Coalition For Honest Government	/org/jefferson-county-coalition-for-honest-government
Institute For Development Of Human Performance	/org/institute-for-development-of-human-performance
Phi Theta Kappa Fraternity	/org/phi-theta-kappa-fraternity-1126
Phi Theta Kappa Fraternity	/org/phi-theta-kappa-fraternity-1121
Distributive Education Clubs Of America	/org/distributive-education-clubs-of-america-44
Mississippi Bar Foundation Inc	/org/mississippi-bar-foundation-inc
National Society Of The Daughters Of The American Revolution	/org/national-society-of-the-daughters-of-the-american-revolution-278
United Daughters Of The Confederacy	/org/united-daughters-of-the-confederacy-76
United Daughters Of The Confederacy	/org/united-daughters-of-the-confederacy-77
Phi Theta Kappa Fraternity	/org/phi-theta-kappa-fraternity-1113
Phi Theta Kappa Fraternity	/org/phi-theta-kappa-fraternity-1115
Tchula Presbyterian Church	/org/tchula-presbyterian-church
Robert G Kennington Trust Uw Fbo Reformed Theological Seminary	/org/robert-g-kennington-trust-uw-fbo-reformed-theological-seminary
Richard S Thomson Sr Trinity Episcopal Church Trust	/org/richard-s-thomson-sr-trinity-episcopal-church-trust
Junior Auxiliary Of Vicksburg Ms Inc	/org/junior-auxiliary-of-vicksburg-ms-inc
4-H Club Foundation Of Mississippi Inc	/org/4-h-club-foundation-of-mississippi-inc
Mississippi Womens Bowling Association	/org/mississippi-womens-bowling-association
Saint Phillips Episcopal Church Jackson Mississippi	/org/saint-phillips-episcopal-church-jackson-mississippi
Alumni Association Of The University Of Mississippi	/org/alumni-association-of-the-university-of-mississippi
National Society Of The Daughters Of The American Revolution	/org/national-society-of-the-daughters-of-the-american-revolution-279
