org_name	org_url
Homes for Veterans A Nj Non Profit Corporation	/org/homes-for-veterans-a-nj-non-profit-corporation
Rutgers University Foundation	/org/rutgers-university-foundation
TOMORROWS CHILDRENS FUND INC	/org/tomorrows-childrens-fund-inc
JEWISH FAMILY & CHILDRENS SERVICE OF GREATER MERCER CO	/org/jewish-family-childrens-service-of-greater-mercer-co
EPOCH	/org/epoch
Autism New Jersey Inc	/org/autism-new-jersey-inc
Women Helping Women	/org/women-helping-women-1
Police Activity League Of Jersey City Inc	/org/police-activity-league-of-jersey-city-inc
Habitat For Humanity International Inc	/org/habitat-for-humanity-international-inc-722
BIKUR CHOLIM OF LAKEWOOD INC	/org/bikur-cholim-of-lakewood-inc
PEI Kids	/org/pei-kids
New Jersey Search and Rescue, Inc.	/org/new-jersey-search-and-rescue-inc
YWCA of Princeton NJ	/org/ywca-of-princeton-nj
Collinsville Child Care Center Inc	/org/collinsville-child-care-center-inc
Hemophilia Association Of New Jersey	/org/hemophilia-association-of-new-jersey
International Alliance for Child Literacy	/org/international-alliance-for-child-literacy-3
Samaritan Healthcare & Hospice Inc	/org/samaritan-healthcare-hospice-inc
Eve's Children	/org/eves-children
Ridgeway Volunteer Fire Company	/org/ridgeway-volunteer-fire-company
Mary's Meals USA	/org/marys-meals-usa
Ridge And Valley Conservancy Inc	/org/ridge-and-valley-conservancy-inc
Perth Amboy Happy Home Shelter Incorporated	/org/perth-amboy-happy-home-shelter-incorporated
Shri Yoga Vedanta Ashram Inc	/org/shri-yoga-vedanta-ashram-inc
Juvenile Diabetes Foundation International	/org/juvenile-diabetes-foundation-international_477740
Trenton Education Dance Institute Inc	/org/trenton-education-dance-institute-inc
YWCA of Trenton	/org/ywca-of-trenton
CHILDREN'S SPECIALIZED HOSPITAL FOUNDATION INC	/org/childrens-specialized-hospital-foundation-inc
Barnyard Sanctuary A Nj Nonprofit Corporation	/org/barnyard-sanctuary-a-nj-nonprofit-corporation
New Jersey State Organization Of Cystic Fibrosis	/org/new-jersey-state-organization-of-cystic-fibrosis
Ship Bottom Volunteer Fire Co 1 Inc	/org/ship-bottom-volunteer-fire-co-1-inc
YOUTH ORCHESTRAS OF ESSEX COUNTY	/org/youth-orchestras-of-essex-county
Pet Adoption League Inc	/org/pet-adoption-league-inc-1
Special Needs K9 Inc	/org/special-needs-k9-inc
Baps Charities	/org/baps-charities
4cs Of Passaic County Inc	/org/4cs-of-passaic-county-inc
Christs Ambassadors Of Reconciliation And Evangelism	/org/christs-ambassadors-of-reconciliation-and-evangelism
Watchung Hills Warriors Touchdown Club Inc	/org/watchung-hills-warriors-touchdown-club-inc
Radburn Association	/org/radburn-association
Academy Parent Partnership Org A New Jersey Nonprofit Corporation	/org/academy-parent-partnership-org-a-new-jersey-nonprofit-corporation
AAUW	/org/aauw
MILFORD BOROUGH HISTORICAL SOCIETY	/org/milford-borough-historical-society
Hindu Swayamsevak Sangh U S A Inc	/org/hindu-swayamsevak-sangh-u-s-a-inc
International Association Of Lions Clubs	/org/international-association-of-lions-clubs-1372
Ocean County YMCA, Inc.	/org/ocean-county-ymca-inc
Martin Luther King Youth Center Inc	/org/martin-luther-king-youth-center-inc
Aslan Youth Ministries	/org/aslan-youth-ministries
Young Womens Christian Association	/org/young-womens-christian-association-4
Celebrate New Jersey	/org/celebrate-new-jersey
The Arnold Gold Foundation	/org/the-arnold-gold-foundation
Harding Land Trust Inc	/org/harding-land-trust-inc
Animal Rescue Force Inc	/org/animal-rescue-force-inc
The Promise Outreach Inc	/org/the-promise-outreach-inc
Destination Imagination Inc	/org/destination-imagination-inc-6
The Underground Railroad To Success, Inc.	/org/the-underground-railroad-to-success-inc
National Registry Of Organ Donors	/org/national-registry-of-organ-donors
New City Kids Inc	/org/new-city-kids-inc
Unexpected Wildlife Refuge	/org/unexpected-wildlife-refuge
National Life Center Inc	/org/national-life-center-inc
Bernards Lacrosse Club Association Inc	/org/bernards-lacrosse-club-association-inc
Akhil Autism Foundation	/org/akhil-autism-foundation
Bayonne Jewish Community Center	/org/bayonne-jewish-community-center
Echo Inc	/org/echo-inc-2
Healthcare Communication & Marketing Association	/org/healthcare-communication-marketing-association
MINORT, Inc	/org/minort-inc
Opportunity Project Inc	/org/opportunity-project-inc
Trenton Community Music School Inc	/org/trenton-community-music-school-inc
Robbinsville Education Foundation Inc	/org/robbinsville-education-foundation-inc
Hunterdon Land Trust	/org/hunterdon-land-trust
Humane Society Of Atlantic County	/org/humane-society-of-atlantic-county
The Baroque Orchestra Of New Jersey Inc	/org/the-baroque-orchestra-of-new-jersey-inc
Health Care Ministry Of Princeton	/org/health-care-ministry-of-princeton
New Jersey State Museum Foundation	/org/new-jersey-state-museum-foundation
Tri-State Weimaraner Rescue Inc	/org/tri-state-weimaraner-rescue-inc
Windmill Alliance Inc	/org/windmill-alliance-inc
United Way Of Central Jersey Inc	/org/united-way-of-central-jersey-inc
United Community Corporation	/org/united-community-corporation
Big Brothers Big Sisters of Monmouth & Middlesex Counties	/org/big-brothers-big-sisters-of-monmouth-middlesex-counties
United Percussion And Arts Inc	/org/united-percussion-and-arts-inc
Town Clock Community Development Corporation Inc.	/org/town-clock-community-development-corporation-inc
New Jersey Chapter Of The American Artists Professional League Inc	/org/new-jersey-chapter-of-the-american-artists-professional-league-inc
PHD PROJECT ASSOCIATION	/org/phd-project-association
Foundation For Peace	/org/foundation-for-peace
Education Network Of Christian Home Schoolers Of New Jersey Inc	/org/education-network-of-christian-home-schoolers-of-new-jersey-inc
Our Lady Of Lourdes Health Foundation	/org/our-lady-of-lourdes-health-foundation
D & R Greenway Land Trust Inc	/org/d-r-greenway-land-trust-inc
Lunch Break	/org/lunch-break
Pass It Along Inc	/org/pass-it-along-inc
PERC - PALISADES EMERGENCY RESIDENCE CORP	/org/perc-palisades-emergency-residence-corp
Hanover Consort Alternate Name Hanover Wind Symphony	/org/hanover-consort-alternate-name-hanover-wind-symphony
Yvonne Mccalla Scholarship Foundation Incorporated	/org/yvonne-mccalla-scholarship-foundation-incorporated
Clean Ocean Action Inc	/org/clean-ocean-action-inc
CTC Academy, Inc - Fair Lawn and Oakland Campuses	/org/ctc-academy-inc-fair-lawn-and-oakland-campuses
Musconetcong Watershed Association	/org/musconetcong-watershed-association
Gospel Services Benevolent Society Inc	/org/gospel-services-benevolent-society-inc
Eva's Village, Inc	/org/evas-village-inc
Sigma Community Enrichment Initiative Inc	/org/sigma-community-enrichment-initiative-inc
Csa Institute	/org/csa-institute
Everas Community Services Inc	/org/everas-community-services-inc
VOLUNTEER CENTER OF SOUTH JERSEY	/org/volunteer-center-of-south-jersey
Loving Grace Ministries Inc	/org/loving-grace-ministries-inc
Orphan Sponsorship International	/org/orphan-sponsorship-international
Landmark Property Management Inc	/org/landmark-property-management-inc
Lyme Disease Association Inc	/org/lyme-disease-association-inc
Alice Paul Institute, Inc.	/org/alice-paul-institute-inc
Institute Of Electrical And Electronics Engineers Inc	/org/institute-of-electrical-and-electronics-engineers-inc
Association Of New Jersey Environmental Commissions	/org/association-of-new-jersey-environmental-commissions
North American Butterfly Association Inc	/org/north-american-butterfly-association-inc
Family Promise, Inc.	/org/family-promise-inc
Baptist Home Of South Jersey	/org/baptist-home-of-south-jersey
