name	url	telephone	tax_num	street	locality	region	postcode	country	Causes	Mission	Results	Target demographics	Direct beneficiaries per year	Geographic areas served	Programs	The China Care Program		Half the Skys Nurture and Education Programs	The Youth Empowerment Program
Sensations Charitable Foundation Inc	http://www.empoweringabilities.org	(860) 460-0144	EIN 27-0861497	12 Pinehurst Ln	Moodus	CT	06469	USA		Create, conduct, and support effective programs and services for families affected with disabilities and health conditions.		families generalize the skills be learned in therapy in fun unique programs.	over 300 families engage in typical activities without the stress that typically comes with some of the behaviors their children can exhibit in novel situations	Southeastern and Central Connecticut and South County Rhode Island	Social Species from the Sea To Me Synergy Socials Sensational Synergy for the Summer SOS - Success On Skateboards Sensory Friendly Movies Free Night at Mystic Aquarium for Families with Autism and Sensory Challenges				
New Dimension Project	http://		EIN 20-2222116	75 Fresh Meadow Rd	West Haven	CT	06516	USA	Protestant, Religion										
Connecticut Association for the Gifted Inc	http://www.ctgifted.org	203-291-6586	EIN 22-2682441	PO Box 2598	Westport	CT	06880	USA	Education, Special Education	To support and advocate for Connecticut's gifted, talented, and high-potential children of diverse cultural and socio-economic backgrounds so they are identified and provided access and opportunities to an appropriate education by personnel trained and qualified to meet their cognitive, social, and emotional special needs.		children's educational opportunities		Connecticut	Minds in Motion to help students identify their passion and find their true potential to maximize their personal, academic, and professional achievement.				
New Haven Symphony Orchestra	http://www.NewHavenSymphony.org	203-865-0831	EIN 06-6000592	545 Long Wharf Drive, Sixth Floor	New Haven	CT	06511	USA	Arts & Culture, Symphony Orchestras	Through its live performances of classical music and education programs, the New Haven Symphony Orchestra aspires to exceed expectations, unite communities, challenge, delight, and inspire. We change lives, for the better.			80,000 concert-goers and 30,000 students	Greater New Haven and throughout Connecticut	exciting Classics, Pops, and Family Concerts, as well as enriching Education programs				
Vintage Radio And Communications Museum Of Connecticut Inc	http://	(860) 683-2905	EIN 06-1356178	115 Pierson Ln	Windsor	CT	06095	USA		Radio/communications museum					Contributions from outside sources used to supplement cost of operating museum.   investment income used to supplement cost of operating museum.   fees charged by museum which are used to operate museum.				
Prison Family Outreach Ministry Inc	http://		EIN 06-1335012	19 Margo Ct	Cromwell	CT	06416	USA	Christianity, Religion										
Cove Center for Grieving Children Inc	http://www.covect.org	203 634-0500	EIN 06-1546563	Coordinating Office 250 Pomeroy Ave., Suite 107	Meriden	CT	06450	USA	Children & Youth, Children & Youth Services, Human Services	The mission of The Cove Center for Grieving Children is "to provide hope and healing for grieving children and teens."	Over 32,000 children in CT are grieving the death of a loved one, and the need for supportive services continues to grow statewide. The Cove has provided services to hundreds of families in CT during the past 17 years. The Cove added a new site last year in Stonington CT, and due to increased demand is hoping to open a new site in the Greater Hartford region in the future.	The Cove provides services to children throughout the state of CT at our 5 Cove Family Sites in West Hartford, New Haven, Guilford, Meriden and Stonington, CT.  We also provide professional development, Cove in Schools and Community Outreach throughout the state.	1,200	State of Connecticut	The Cove Family Program, "Good Grief" Schools Program, Community Outreach, and Professional Development Traiing.				
Beech Brook Farm	http://www.beechbrookfarm.homestead.com/	860-705-8456	EIN 30-0530213	77 Ocean View Avenue	Mystic	CT	06355	USA	Animal Protection & Welfare, Animals	Our 501c3 nonprofit rescue is a small volunteer based rescue that specializes in gaited breeds (Tennessee Walking horse, Rocky Mountain horse, Missouri Fox Trotter, Paso etc.). We also rescue "long ears" (donkeys, mules). There are many auctions that supply the foreign-owned slaughter houses that kill horses for human consumption abroad.   We assist horses through owner surrenders, neglect cases, local auctions outbidding kill-buyers, buying sick or injured horses and purchasing directly out of kill pens. Our goal is to save as many lives as possible.  Our Purpose:   Save Equines from neglect and abusive situations and provide them with loving homes for life. To educate the public about horse welfare and care. To enlist public support and funding to rescue horses from abuse, slaughter and neglect alone, or in cooperation with local, state or federal agencies or with other nonprofit organizations.  Re-home/train rescues animals with the intent of placing for adoption.	We have saved over 130 horses and placed over 115 in loving homes				Rescue, maintenance & adoptive services provided to horses which have been subjected to negligent care or potential slaughter.				
YPI, Inc.	http://www.ypicamp.org	888-657-2986	EIN 06-1298954	143 Sandy Point Rd	Old Saybrook	CT	06475	USA	Children & Youth, Youth Development	YPI is a co-educational residential summer camp offering one and two-week workshops for young people in grades 6 through 12 who are interested in the creative arts. YPI is housed at the beautiful Suffield Academy in Suffield, Connecticut. At YPI, master teachers work in small group settings with students of all levels of accomplishment, pointing them in undreamed-of directions. At YPI, there are no can'ts and no won'ts. Young people flourish in an atmosphere that is motivating, encouraging, and supportive. Days and nights hum with the spontaneous energy of workshops, recreation activities, town meetings, performances, and exhibitions.				Campers come to us from across the U.S.	The institute provides education and enrichment for students in the visual and performing arts.				
Give2thetroops Inc	http://www.GIVE2THETROOPS.org		EIN 37-1493066	P O Box 445	Canton	CT	06019	USA	Human Service Organizations	GIVE2THETROOPS supports the physical, moral, and spiritual health of America's armed forces in combat zones around the world through the letters and packages prepared and shipped by caring volunteers.Our Motto is: "GIVE BACK TO THOSE WHO GIVE ALL" (TM)									
March for Education Foundation	http://www.marchforeducation.com		EIN 80-0250434	1753 Barnum Ave	Stratford	CT	06614	USA	Children & Youth, Youth Development Programs			At risk communities		Fairfield County					
SOUTHERN CONNECTICUT STORM SPECIALHOCKEY INC	http://www.ctstormhockey.org	203-554-2752	EIN 26-0585647	757 Oenoke Rdg	New Canaan	CT	06840	USA	Sports, Winter Sports	The purpose of Southern Connecticut Storm Special Hockey is to provide children from the age five through young adult with a developmental disability who are physically able the opportunity to play ice hockey. The program teaches skating and hockey skills, as well as gives the player the opportunity to play in a team sport. Through hockey, the program emphasizes the development of individual life skills such as self reliance, dependability, focus and confidence.  "Life skills through ice hockey".	Seven years strong and part of a nationwide program.  Our athletes are gaining the confidence to try many new things, becoming independent, and real progress is being made to make their lives, and the lives of their families more successful.	developmentally disabled athletes age 5 and up in Southern Connecticut		Southern Connecticut and beyond	Therapeutic program for children and young adults with a developmental disability such as Autism or Down syndrome, teaching life skills  and independence both on and off the ice through hockey.  Now SEVEN years Strong!				
Center for Hospice Care Southeast Connecticut	http://www.hospicesect.org	860-848-5699	EIN 22-2667260	227 Dunham Street	Norwich	CT	06360	USA	Hospices, Human Services	Center for Hospice Care Southeast Connecticut's mission is to provide quality care for people with life-limiting illnesses and support for their loved ones before and after death.  Hospice Southeastern Connecticut's vision is to be the premier Hospice organization providing care in our community.  Hospice Southeastern Connecticut values:   compassionate care that respects the uniqueness of our patients and their families and enhances the quality of their life.   an interdisciplinary team of experts that offers medical care, pain management, spiritual and psychosocial support for a patients daily needs and advocacy.   a team of volunteers trained in the philosophy of Hospice care.   care at home and across all settings.   bereavement support for all members of our community.   support for the dignity of everyone involved in our care.   responsible management of finite resources to provide for the future ability to fulfill our mission.   a strong local community presence.				New London County (From Colchester to Old Lyme to Stonington to Lisbon and everywhere in between)	End of life care services in the home and often in skilled nursing facilities including nursing care, complementary therapies, hospice aide care, counseling services, volunteer support and pet therapy.  Community bereavement center providing support groups and other bereavement services FREE of charge to anyone in New London County.				
Safe Futures Inc	http://	(860) 447-0366	EIN 06-0950718	16 Jay St	New London	CT	06320	USA	Domestic Violence, Family Violence Shelters, Homeless & Housing	To save lives, restore hope, and change the future for those impacted by domestic violence and sexual assault in southeastern connecticut.					Transitioned approximately 36 women and children, who were homeless and survivors of domestic violence, to independent living, free from domestic violence within 24 months, by providing safe, afordable housing and supportive services that develop self-esteem and self-reliance.   provided approximately 5,969 victims/survivors of domestic violence and sexual assault emergency assistance and support, including two (2) 24-hour hotlines, crisis intervention services, general advocacy, safety planning, court-based advocacy, support groups, information and referrals, and supportive services.   provided approximately 131 women, children and men, fleeing a domestic violence situation, with safe, confidential, emergency shelter; food, clothing, and personal care items; crisis intervention services; case management; advocacy; and supportive services.   provided approximately 21,274 units of school-based violence prevention education to approximately 3,503 students in approximately 21 elementary/middle/high schools and 1 church. In addition, we provided other training, community awareness, and educational programs and activities to another approximately 3,867 individuals from the community in order to increase their understanding of issues related to the dynamics of domestic violence and sexual assault, services available for victims and survivors and their families/friends, and strategies for prevention.				
Pta Connecticut Congress	http://		EIN 06-1348008	490 Highland Ave	Cheshire	CT	06410	USA	Education, Parent & Teacher Groups										
Artreach, Inc.	http://www.artreachheals.org	860-887-0014	EIN 22-2921497	401 W. Thames St. Unit 702	Norwich	CT	06360	USA		Artreach, Inc. is a nonprofit mental health organization employing the arts, recreation and wellness activities to aid in the recovery and community integration of low-income adults with chronic mental illnesses. Our goals are to:      * Through artistic, cultural, recreational and wellness activities, encourage members to acquire and actively implement into their lives socialization and stress reduction skills necessary to build self confidence and increase the chance of sustaining recovery.     * Challenge the myths and misconceptions that stigmatize people with mental illnesses so that members can successfully integrate into the community.     * Expand the community based recreational opportunities available to people who have persistent mental illnesses to reduce their sense of isolation.		Adults 18 - 98 who have been diagnosed with psychiatric disorders, their families and friends.  Through performances, we also reach people nationwide to increase positive perceptions about people who have mental illnesses.			The Second Step Players, Stand Up For Mental Health CT, Artreach Holistic Wellness Program, Artreach Recreation for Recovery, Artreach Artistic Development				
Strays & Others Inc	http://www.straysandothers.petfinder.com	203-966-6556	EIN 06-1205549	PO Box 473	New Canaan	CT	06840	USA	Animal Protection & Welfare, Animals	Strays & Others, Inc. is a volunteer-run, 501(c)3, Fairfield County based, nonprofit organization dedicated to the rescue and responsible placement of homeless and unwanted animals.  Founded in 1985, the organization provides both refuge and sanctuary for nearly 50 animals at any given time; offers medical care, spaying and neutering, good nutrition in nurturing environments; and has placed over 4,450 animals into loving, permanent homes.  The main focus is on dogs and cats, although the group has been known to help a wide variety of animals in need including: domestic birds, waterfowl, assorted wildlife, and three horses in need!    Strays & Others is also known for its unusually high success rate in matching each animal with the best suitable home - 96% stay in their adoptive homes forever!  The group is currently seeking foster homes, volunteers, direct animal care, fundraising, marketing and creative input!		homeless and abandoned animals	more than 200 animals including cats, dogs, wildlife and one horse!	the Fairfield County area of Connecticut and bordering Westchester County, NY	Adoptions, Low Cost Spay/Neutering, Senior Support, Humane Education, Emergency Rescue and a Sanctuary Program.				
Lebanon Bible Church	http://		EIN 06-1317672	Po Box 148	Lebanon	CT	06249	USA											
MOURNING PARENTS ACT, INC. -- !MPACT	http://www.mourningparentsact.org/	860-742-8933	EIN 20-0645138	PO Box 599	Coventry	CT	06238	USA	Disaster Aid, Safety Education	Mourning Parents ACT, Inc., also known as !MPACT, is a nonprofit organization whose mission is to eliminate tragedies caused by inexperienced drivers through awareness, education and legislation.									
All Our Kin	http://www.allourkin.org	203-772-2294	EIN 06-1539280	PO Box 8477	New Haven	CT	06530	USA	Education, Vocational & Technical Schools	All Our Kin, Inc., is a nationally-recognized, New Haven-based nonprofit organization that trains, supports, and sustains community child care providers in order to ensure that children and families have the foundation they need to succeed in school and in life. Our vision: all children, regardless of where they live, their racial or ethnic background, or how much money their parents earn, will begin their lives with all the advantages, all the tools, and all the experiences that we, as a society, are capable of giving them.And All Our Kin works to achieve that vision on many different levels at the same time. We make it possible for children to receive the excellent foundational early learning experiences they need and deserve. We furnish working parents with the resources to find and keep high-quality child care. We equip caregivers with the skills and resources to move out of poverty and open child care businesses in their communities. And we invest in neighborhoods, by building the capacity, quality, and viability of local child care businesses.				Connecticut	Family, friend and neighbor caregivers provide much of the daily child care to families in low-income neighborhoods. Through the Toolkit project, All Our Kin provides materials, mentorship and support to help these unlicensed caregivers meet health and safety standards, fulfill state licensing requirements, and become part of a professional community of child care providers. In this incentive-based project, caregivers receive boxes of useful resources and goodies, which gradually increase in value, as they move through the licensing process. Each box contains the necessary paperwork for each step towards licensure, as well as health and safety supplies; educational supplies such as quality childrens books, blocks, and art materials; and vouchers for training.				
Liz Baldino Memorial Fund	http://		EIN 06-1325304	504 Carrington Rd	Bethany	CT	06524	USA											
Thirty Thirty Park Inc	http://		EIN 06-6107772	3030 Park Ave	Bridgeport	CT	06604	USA	Homeless & Housing, Housing & Shelter										
Our Companions Domestic Animal Sanctuary Inc	http://www.ourcompanions.org	(860) 242-9999	EIN 41-2047734	Po Box 956	Manchester	CT	06045	USA	Animal Protection & Welfare, Animals	Our companions is an animal rescue organization that is committed to doing the right thing for animals, regardless of the cost or challenge. Our companions offers programs to help animals in need today, while working to prevent animals from becoming homeless tomorrow. Our companions provides its services through its valerie friedman program center in manchester, ct and a 43 acres animal sanctuary in ashford, ct.					Our companions operates an animal sanctuary in ashford, ct where animals are cared for and rehabilitated in a cage-free, home-like environment while they await new homes. Our companions also operates its valerie friedman program center in manchester, ct which provides dog training and other canine behavioral programs, programs that facilitate the sterilization and care for feral cats, volunteer programs, educational programs and monthly meet and greet events featuring adoptable animals and community partners.				
John L Starks Foundation Inc	http://www.johnstarks.com	(203) 322-7788	EIN 73-1438056	1127 High Ridge Road No 331	Stamford	CT	06905	USA	Amateur Sports, Sports	The foundation provides monetary grants to new york, connecticut, new jersey and tulsa area high school students who demonstrate academic achievement and a commitment to community service but lack the financial means to pursue a college education. In addition, from time to time, the foundation will provide financial assistance to other non-profits and community organizations whose primary focus is to further the educational, recreational and social development of children and families.					Provide scholarships for high school seniors' secondary education based on financial need and academic performance. Donations were made to various non profits whose mission and goals are compatible with the john l. Starks foundation.				
Compassionate Friends, Inc.	http://		EIN 36-3725400	55 Sherwood Dr	Torrington	CT	06790	USA											
Save the Children Federation, Inc.	http://www.savethechildren.org/	1-800-728-3843	EIN 06-0726487	501 Kings Highway East Suite 400	Fairfield	CT	06825	USA	Disaster Aid, Disaster Preparedness & Relief Services, International, International Relief, Refugees, Zika Virus	Save the Children invests in childhood  every day, in times of crisis and for our future. In the United States and around the world, we are dedicated to ensuring every child has the best chance for success. Our pioneering programs give children a healthy start, the opportunity to learn and protection from harm. Our advocacy efforts provide a voice for children who cannot speak for themselves. As the leading expert on children, we inspire and achieve lasting impact for millions of the worlds most vulnerable girls and boys. By transforming childrens lives now, we change the course of their future and ours.		children	143 million children in 120 countries, through the Save the Children global movement	the U.S. and around the world	education, nutrition, health, child protection and disaster relief - in the United States and around the world.				
Harc, Inc.	http://www.harc-ct.org	(860) 218-6000	EIN 06-0710289	900  Asylum Ave Ms#1002	Hartford	CT	06105	USA	Developmentally Disabled Centers, Disabilities, Human Service Organizations, Job Training, Vocational Rehabilitation	HARC was founded in 1951 by parents and friends of children with intellectual disability.  At that time few community programs were available and children were almost always referred to an institution.  Throughout the years HARC maintains a family focus in both its array of programs and governance structure.  Raising children is among life?s greatest joys and privileges.  Creating new family visions and meeting their unanticipated challenges associated with developmental disabilities are achieved with HARC?s help.  Our mission is to help people with intellectual and related disabilities and their families enjoy lives of quality, inclusion and dignity by providing support, education, and advocacy.		those with Intellectual and related disabilities	2,500	Hartford CT	arts, life enrichment, supported employment, Camp Bulova, Birth to Three program				
Multiple Myeloma Research Foundation, Inc.	http://www.themmrf.org	203-229-0464	EIN 06-1504413	383 Main Avenue 5th Floor	Norwalk	CT	06851	USA	Cancer, Cancer Research, Health, Nerve, Muscle & Bone Diseases	The Multiple Myeloma Research Foundation, Inc. is the world''s largest private funder of myeloma research. It''s mission: To accelerate the search for a cure for multiple myeloma. To achieve this purpose, four goals are pursued: Funding research in the field of multiple myeloma, building collaborations among researchers and industry, providing disease and treatment related information to patients and family members while advocating for optimal patient care, and raising awareness of multiple myeloma.  The MMRF was started by Karen Andrews after her twin sister Kathy Giusti was diagnosed with MM at age 37. Both sisters were shocked by the lack of awareness and research funding for this incurable cancer and were determined to help find a cure.	By working closely with researchers, clinicians and our partners in the biotech and pharmaceutical industry, we helped bring multiple myeloma patients six new treatments in one decade that are extending lives around the globe. We are now at a turning point where we have the knowledge, the team and the tools to build upon this success and advance the next generation of treatments.   We are reaching incredible milestones in advancing our innovative research portfolio of basic science, validation, and clinical trials programs to ensure that better, more effective treatments are brought to patients as soon as possible.				The mission of the MMRF is to relentlessly pursue innovative means that accelerate the development of next-generation multiple myeloma treatments to extend the lives of patients and lead to a cure. As the world's number-one private funder of multiple myeloma research, the MMRF has raised over $225 million since its inception and directs 90% of total budget to research and related programming.				
'r kids Family Center	http://www.rkidsct.org	(203) 865-5437	EIN 06-1453694	45 Dixwell Ave	New Haven	CT	06511	USA	Adoption, Children & Youth	The 'r kids Family Center mission is to provide specialized, quality services to children and families in transition. Our objective is to promote permanency, safety and stability for children by providing nurturing services to biological, foster, adoptive and relative care families.					Working with Department of Children and Families referred clients, 'r kids works with families who have been separated from their children. The goal is to provide intensive support services to allow for permanency either within the birth home, the relative care or adoptive home. Staff provide initially center based supervised visitation and individualized parenting support .Additionally assessment and treatment planning services are provided. The provision of unsupervised and in-home visits occurs for those families who have a plan of reunification. If reunification is not the goal, staff prepairs the families and children for a permanent out-of - home placement. Staff provide children with programming to meet specific individual needs, including referrals and transitional planning and support. Our services are on-going and multi-faceted, singularly geared toward the timely implementation and support of effective permanency plans.				
