Connecticut Alliance For Victims Of Violence And Their Families	http://		EIN 03-0466336	49 Lancaster Rd	West Hartford	CT	06119	USA	Victims Services										
Cornwall Conservation Trust Inc	http://www.cornwallconservationtrust.org	(860) 672-6263	EIN 06-1203660	Po Box 74	West Cornwall	CT	06796	USA		Acquisition or control and conservation of land in litchfield county and the town of cornwall, connecticut. To promote scientific study and educational endeavors. To use all the properties held or controlled for the benefit of the general public.					Stewardship expenditures: o cornwall conservation trust engaged a land manager who worked on mapping, staking, laying out trails and other stewardship activities relating to the trust's properties. O insurance on the trust's properties; o mapping; o communication with members and townspeople, including enhancements to newsletter and invitations to townspeople to enjoy newly created trails.   the trust awarded four scholarships to students who had graduated from housatonic regional high school and who were enrolled or were entering college to assist them in studies relating to conservation.				
OPIN	http://www.opinpets.org	(203) 326-0216	EIN 30-0386610	OPIN, Inc, Office only:  1747 Summer Street, Suite 1	Stamford	CT	06905	USA	Animal Protection & Welfare, Animals	Outreach to Pets In Need (OPIN) is an all volunteer nonprofit organization, and our mission is to decrease the population of homeless pets in Connecticut through medical treatment, training, public education, surrender prevention, spay/neuter, and placement programs.	Since 2007 OPIN has worked to put and end to pet homelessness within the community.   We have no brick and mortar building but rather rely on foster homes for pets we rescue from Connecticut kill shelters, those abandoned at vet offices or, those we accept from community members who are in crisis.    From 2007-2014, OPIN has supported the Stamford Animal Care & Control facility, financially providing: medical care, medicine, training, evaluations, microchipping, supplies, food, web services, networking, advertising, in-home dog training for adopted dogs and much more.    OPIN worked along side Ms. Laurie Hollywood (former Director of Stamford Animal Control) to help with the adoption of over 3,000 pets (cats, dogs, birds, little furries, reptiles, etc.).  Thanks to OPIN's funding, no pet of the Stamford Animal Shelter, suffering a treatable illness, was euthanized.   Medical care was given no matter the cost, age or breed.  Timeline:   March 2007 - OPIN received 501c3 nonprofit status  2008 - Microchipping of the shelter animals and SNIP (Spay Neuter Incentive for Pits), a subsidy program is offered to low income Stamford families.  2009 - OPIN offers FREE dog training to the public, currently held at the Stamford Bartlett Arboretum on Wednesday nights.  2010 - Two foster programs are developed:  the SafePet program provides foster care for pets owned by victims of Domestic Violence.  It provides temporary housing for a pet during the owners time of transition.  The second is for pets that come into OPIN's foster network. Foster homes provide a nurturing environment for pets from a shelter or otherwise, preparing them for a forever home.  2012 - Project Chip'n is launched.  FREE microchip clinics are held each quarter at different locations within the City.  This program aims at making pets safer and ensure a quicker reunion back home should the pet get lost and be picked up by Animal Control, a resident or a veterinarian.  Our goal?  To chip every pet!  2015 - OPIN leases a small office near the Stamford downtown to hold volunteer and board meetings, meet and greets with dogs and prospective adopters, event planning and small gatherings.  2016 - OPIN to unveil plans to build a privately owned, safe house/adoption and education center.  None of what we have been able to do has been possible without the kind financial support of our donors with the local and surrounding communities and our incredible volunteers.    Our first successful seven years deserves a special acknowledgement to Ms. Laurie Hollywood (former Stamford Animal Control Director).  Her leadership, dedication, compassion and knowledge is unmatched!	homeless pets at local Animal Shelters and  within the community	over 500 homeless shelter, cats, dogs, birds, rabbits & reptiles and a number of pets owned by low income individuals who could not afford medical care for their animals.	Stamford, Connecticut	Medical care, education, dog training & evaluations, low-cost spay/neutering, microchipping, volunteerism, fostering of homeless pets and fostering of animals owned by victims of domestic violence.				
CONNECTICUT WOMENS EDUCATIONAL AND LEGAL FUND INC	http://www.cwealf.org	860-247-6090	EIN 06-0913214	75 Charteroak Ave, Suite 1-300	Hartford	CT	06106	USA	Civil Rights, Women, Womens Rights	The Connecticut Women''s Education and Legal Fund is a statewide nonprofit dedicated to empowering women, girls and the families to achieve equal opportunities in the personal and professional lives.				Connecticut, statewide					
Vincent J Maiocco Scholarship Fund Inc	http://		EIN 06-1357908	6 Brookline Dr	Hartford	CT	06107	USA	Education, Student Sororities & Fraternities										
Connecticut Draft Horse Rescue, Inc	http://www.ctdraftrescue.com	(860) 305-1377	EIN 35-2401003	15 Rock Landing Rd	Haddam Neck	CT	06424	USA		Connecticut Draft Horse Rescue, Inc. is an all volunteer 501(c)3 non-profit organization dedicated to saving the lives of draft horses that were bound for slaughter in addition to draft horses that are victims of starvation, neglect or abuse or whose owners are unable to provide for their needs.		horses, especially draft horses,	dozens of horses and horse owners in our region.	Connecticut and throughout the Northeast	rescue, rehabilitation, retraining, and rehoming. In addition, we provide services such as low-cost equine castration clinics, educational seminars including emergency and disaster preparations, and assistance to horse owners in need.				
Mercy Learning Center of Bridgeport, Inc.	http://www.mercylearningcenter.org	(203) 334-6699	EIN 22-2859879	637 Park Ave	Bridgeport	CT	06604	USA	Adult Education, Education	Mercy Learning Center of Bridgeport, Inc. (MLC) provides basic literacy and life skills training to low-income women using a holistic approach within a compassionate, supportive environment. All women are welcome without regard for race, religion, color, creed, sexual orientation or national origin.    MLC was founded in 1987 on the premise that one of the best ways to help entire families overcome poverty and succeed is to educate women and mothers. Rooted in this multigenerational approach, the motto of Mercy Learning Center is Educate a woman Educate a family. Since its founding, MLC has educated and empowered over 10,000 women.  MLC provides a range of flexible learning opportunities for women, including part time tutoring, full-time classroom instruction, technology education, employment and life skills training, family literacy programs and enrichment. Holistic support servicesincluding social services, counseling, childcare, and food assistanceare available to all program participants. All programs and services are free.	Progress is defined in many ways among the diverse group of women Mercy Learning Center serves.  For women who come to MLC with little or no English language proficiency, progress comes when they are able to explain their symptoms to an emergency room doctor or count change at the grocery store. For students who struggle to make ends meet by working in a minimum wage position, success is celebrated when they receive a job promotion with an increase in wages. And, for the women who work towards completing their high school education, success is realized when they earn their diplomas.  As a cohesive community, however, Mercy Learning Center students have a high rate of success.  According the Connecticut State Department of Education, academically "Mercy Learning Center's adult education program consistently reflects high performance outcomes for its learners and has performed in the top 5% of the approximately 70 programs statewide."  MLC basic and secondary-level students advance at rates that are double the federal and state guidelines, and our ESL students advance at rates nearly 50% higher than federal and state guidelines.   Since the GED preparation program began in 2003 and the NEDP began in 2008, 229 women have graduated from MLC.  The majority of our graduates have attended college, served in the armed forces, focused on raising their young children, or sustained living wage employment. During the 2014-15 program year, 65 MLC alumnae were enrolled in college or job certification programs.  One graduate earned a masters degree, 1 graduate earned a bachelors degree, 2 graduates earned associates degrees, 3 graduates earned college certificates, and 11 students and graduates completed career certifications.  In addition, 85 students reported finding new jobs and 17 students, with help from MLC tutors, prepared for and passed the U.S. citizenship exam.   Each of these achievements strengthens the overall Greater Bridgeport community by bringing about an increase in educated and skilled workers more engaged parents who actively advocate for their childrens education and increased economic stability and independence among families.	low-income, undereducated women and their families	881 women and 169 children	Bridgeport, CT	litearcy and life skills education, high school diploma programs, citizenship education, computer skills, family literacy and more.				
Artists For World Peace Inc	http://		EIN 57-1184659	377 Ridge Rd	Middletown	CT	06457	USA	Arts & Culture	To create opportunities for artistic expression that fosters world peace and raise funds to benefit humanitarian causes					Art performances to benefit the organization  grants disbursed and non-cash contributions distributed to children and organizations where needed				
Trout Unlimited	http://		EIN 06-1496855	Po Box 3795	Danbury	CT	06813	USA	Environment, Natural Resources Conservation & Protection, Pollution Abatement & Control, Water, Water Resources, Wetlands Conservation & Management										
WALLINGFORD CHORUS	http://www.wallingfordchorus.org	203 269-6218	EIN 22-3163820	PO Box 4451	Wallingford	CT	06492	USA	Arts & Culture, Singing & Choral Groups	The mission of Wallingford Chorus is to provide the appreciation and enjoyment of choral singing in Central Connecticut.	Founded in 1970, Wallingford Chorus has been able to sustain itself financially through dues, fundraising activities, and community sponsors.  We are proud to say that we continue to grow and collaborate with other community art organizations adding to the cultural vibrancy of our community.	provide the appreciation and enjoyment of choral singing	the arts and culture communities of Wallingford and the greater Wallingford area	the Wallingford, CT arts community	high energy, appealing concerts that appeal to a wide range of audience members				
Growth Resources And Counseling Enrichment Inc	http://		EIN 06-1310292	705 N Mountain Rd	Newington	CT	06111	USA											
Canavan Research Foundation, Inc.	http://www.canavan.org		EIN 06-1579083	88 Route 37	New Fairfield	CT	06812	USA	Birth Defects & Genetic Diseases Research, Brain Disorders Research, Health, Pediatrics Research, Voluntary Health Associations & Medical Disciplines	Because Canavan Disease is considered an "orphan disease," research to find a cure receives little public funding. Research is extremely dependent on our fundraising efforts. This means that the children born with devastating disease will not be cured unless we and similar organizations initiate, identify, and fund the necessary research.	The first treatment, gene therapy, made history when it created the growth of myelin in the children's brains. Every single child who was treated with the gene therapy has experienced a better quality of life, the end of degeneration in the brain, and greater awareness of the world.								
Preston J Dunn Tr Uw Fbo Yale Univ 1928 Alumni Fund	http://	(203) 789-2779	EIN 06-6366024	1st Niagara Bank 195 Church Street	New Haven	CT	06510	USA											
Bridgeport Area Youth Ministry Inc	http://www.baym.org	(203) 336-9333	EIN 06-1447769	Po Box 1134	Bridgeport	CT	06601	USA	Children & Youth, Youth Development	Industrial youth center					Bridgeport area youth ministry, inc. (baym) operates a youth center and community technology center providing developmental training and technology services for inner-city youth and their families. During 2014, baym provided technology services to approximately 2500 individuals and other organizations in the community.				
Ledyard C.H.A.I.N. Inc	http://ledyardchain.org	860-287-3504	EIN 46-2202268	2 Village Dr	Ledyard, CT	CT	06339	USA	Animals	Ledyard C.H.A.I.N. is a community based group whose purpose is to offer support to the Ledyard Animal Control, to offer education that will enrich the lives of pets and their owners, and to support efforts and initiatives that will benefit the welfare and safety of companion animals in the Ledyard and Gales Ferry area.	Food Distribution:  Between the Ledyard Animal Control, Meals on Wheels, Ledyard Food Pantry, and Free Store Connecticut we have distributed over 1600lbs. of dry food and over 1700 Canned Foods to pets in need. Since 2014, we provided 177 pets  a meal for Thanksgiving and Christmas by working with Social Services.  Spays/Neuters: We have covered the costs of 61 spays and neuters for pets at the Ledyard Animal Control since 2014. Medical Costs:  Since 2013, we have covered the surgery and medical care for 5 pets who would not have been able to have been treated had we not stepped in to help as their medical bills where beyond what the shelter could afford. To date we contributed over $5000 toward the medical needs of the shelter pets.  Lost and Found:  We have formed a Ledyard C.H.A.I.N. Lost Pet Squad and have had a hand in helping 5 pets in our community get reunited with their owners.	pets in need at the Ledyard Animal Control and in our Ledyard and Gales Ferry.	In 2015, we helped the Ledyard Animal Control and our community by supplying over 500lbs of dry food and over 700 canned foods. We also covered the costs of the medical cost of surgery of 1 pet. We also covered the costs for spays and neuters for 28 pets.	Ledyard and Gales Ferry	1. The Oliver Project: A stray and feral cat assistance fund which covers the cost of spays and neuters for cats trapped by the Ledyard Animal Control. Additionally, we purchase humane traps and needed supplies to make the project a success.  2. Fixed 4 Life Fund: This fund covers the cost of spays and neuters for any pet that may find their way to the Ledyard Animal Control. By getting the pet spayed before it leaves the kennel it can  increase their chances of being adopted and will end the change of any unwanted litters being born.				
Association Of Wish Granting Organizations Inc	http://		EIN 62-1642147	Po Box 391	Oakville	CT	06779	USA	Children & Youth, Children & Youth Services, Human Service Organizations, Human Services	The Association of Wish Granting Organizations was formed in 1995.  Its members make wishes and dreams come true for children and adults throughout the United States, Canada and Europe who are battling life-threatening and terminal illnesses.  Members abide by strict codes of ethics and the highest level of financial accountability.  The members of the organziation do not raise funds through telemarketing; in order to qualify as a member of AWGO, at least 75% of dollars raised must go directly to program expenses.  Donations to this organization will be distributed evenly among member organizations to make dreams and wishes come true for sick children and adults.									
Spiritual Life Center Inc	http://www.spiritlifectr.org	860-243-2374	EIN 06-1606685	303 Tunxis Rd	West Hartford	CT	06107	USA	Religion, Religion-Related	SPIRITUAL DIRECTION & TRAINING. THE SPIRITUAL LIFE CENTER IS A COMMUNITY BORN OF FAITH, GATHERED IN LOVE AND LED BY THE SPIRIT TO SEEK ONENESS WITH THE MYSTERY THAT IS GOD. WE ARE CALLED TO TEND THE HOLY IN THE SOULS OF INDIVIDUALS, GROUPS, AND THE WORLD BY COPPERATING WITH GOD TO INVITE AND NURTURE, EQUIP AND SUSTAIN, HEAL AND TRANSFORM, THROUGH THE MINISTRY OF SPIRITUAL DIRECTION.									
National Organization for Rare Disorders, Inc.	http://www.rarediseases.org	(617) 249-7300	EIN 13-3223946	55 Kenosia Avenue P O Box 1968	Danbury	CT	06813	USA	Health, Specifically Named Diseases, Voluntary Health Associations & Medical Disciplines	NORD represents 1 in 10 Americans who have rare diseases with programs of advocacy, education, research and patients services.  It serves as the voice of the rare disease community on important issues of public policy.  It also provides information on rare diseases in understandable language for patients and their families, with referrals to support groups and other helpful resources.  It encourages research on new diagnostics and treatments and administers patients assistance programs. NORD mentors rare disease support groups so that they can more effectively help their members.  It serves as the point of connection between the patient community and key government agencies, such as the National Institutes of Health (NIH) and Food and Drug Administration (FDA). Nearly 150 patient organizations are members of NORD and look to NORD for guidance, mentoring and leadership.					Patient services provides patient assistance programs including free drug, premium and co-pay assistance, travel and lodging assistance for clinical trials, and expanded emergency and ancillary access programs.   membership and education provides training and mentoring to assist rare disease patient organizations in achieving the highest possible level of service to their members while adopting best practices and adhering to accepted non-profit standards. Also, patient and family education, health professional education, and public awareness programs are offered through extensive online, electronic, in-person, and in-print educational resources and programs.   research and medical and scientific affairs administers a program of grants and fellowships to support research on rare diseases funded by contributions from the public, patients and their families, and patient organizations.   advocacy serves as the liason between the rare disease community and national institutions that have a direct impact on the health of the thirty million americans living with rare diseases, including the u. S. Congress, food and drug administrations, and national institutes of health.				
The Open Door Shelter, Inc.	http://www.opendoorshelter.org/	(203)-866-1057	EIN 22-2536909	4 Merritt Street	Norwalk	CT	06854	USA	Financial Counseling, Homeless & Housing, Homeless Shelters, Human Services, Job Training, Sheltered Employment	The mission of the open door shelter, inc. Is to effectively address the causes and complexities of the homeless and working poor by providing shelter, food, clothing, case management services, treatment services, transitional planning for short and long term goals, subsidized housing, education, employment, and a path towards independence and success.		effectively address the causes and complexities of the homeless and working poor by providing shelter, food, clothing, case management services, treatment services, transitional planning for short and long term goals, subsidized housing, education, employment, and a path towards independence and success.		the Open Door Shelter in Norwalk CT	a shelter with over 95 beds as well as the Manna House kitchen and pantry where we serve meals three times a day (20,000 per month) and provide boxed and canned goods to the working poor to help make ends meet. Between the kitchen and the pantry, we provide approximately 60,000 meals per month to individuals and families in our community. In addition, we operate a number of private residences, providing supportive housing to those who are working and earning an income, but unable to afford housing in the area.				
China Care Foundation Inc	http://www.chinacare.org	(203) 227-3655	EIN 31-1732062	PO Box 607	Westport	CT	06881	USA	Children & Youth, Children & Youth Services, Foster Care, International, International Relief, Philanthropy, Public Foundations	The mission of the China Care Foundation is to give special needs Chinese orphans the opportunity for a better life and to empower youth through direct humanitarian service. By providing extensive medical, social and educational programs devoted to children, China Care makes a lasting contribution to our shared future.						at Half the Sky provides medical treatment and nurturing after-care for medically fragile orphaned infants. Whether receiving 24-hour loving attention in the Beijing Special Care Nursery or its adjacent Medical Family Care Unit or in the hospital watched over by a doting, trained nanny, tiny children fighting for their lives are never again alone in the world.		provide loving environments as well as individualized developmental guidance to children growing up without a family of their own.These programs include, The Baby Sisters Infant Nurture Program, The Little Sisters Preschool Program, The Big Sisters Program and The Family Village Program.	at China Care offers young people the opportunity to give of themselves and experience first-hand their own ability to touch the lives of children in need.Through the China Care Clubs and its Volunteer Program, students across the globe are making a difference in the world.
Starfish Connection Inc	http://		EIN 26-2410124	1127 High Ridge Rd 255	Stamford	CT	06905	USA	Education										
Danbury Animal Welfare Society, Inc.	http://www.daws.org	(203) 744-3297	EIN 06-0945388	147 Grassy Plain Street	Bethel	CT	06801	USA	Animal Protection & Welfare, Animals	Danbury animal welfare society, inc. Is a non-profit, volunteer-run organization dedicated to improving the lives of animals in our community and beyond. We promote responsible pet guardianship and the humane treatment of animals, and work toward ending animal overpopulation through education and a variety of programs. We take pride in the work we do- working to keep homeless pets safe, happy and sheltered.					Animal shelter providing spaying, neutering, veterinarian services and placement of abandoned and stray animals in new homes.				
Saint Marys Health System Inc	http://www.stmh.org	(203) 709-6000	EIN 22-2528399	56 Franklin Street	Waterbury	CT	06706	USA	Community Health Systems, Health	Saint mary's health systems, inc. 's primary purposes is the overall management of hospital systems.					Saint mary's health system manages and oversees the operations of saint mary's hospital, inc. And affiliates. Please see schedule o for a description of saint mary's hospital's program service accomplishments.				
Rondo Music Society Inc	http://		EIN 22-2495855	3 Farm Creek Rd	Norwalk	CT	06853	USA											
Turning Point Christian Center Inc	http://www.turningpointcc.org	(860) 314-1101	EIN 06-1418609	Po Box 1913	Bristol	CT	06011	USA	Philanthropy, Private Grantmaking Foundations	Turning point is a cutting edge, 15 month, faith-based residential program for men and women which provides healing from life-controlling addictions. Our vision is to see every person with an alcohol or substance abuse addiction freed, restored and prepared to make a valuable contribution to society.					Turning point is a cutting edge, 15 month, faith-based residential program for men and women which provides healing from life-controlling addictions. Our vision is to see every person with an alcohol or substance abuse addiction freed, restored and prepared to make a valuable contribution to society.   men's and women's homes				
Noroton Heights Depot Inc	http://dariendepot.org	(203) 655-0812	EIN 06-1269671	Po Box 2381	Darien	CT	06820	USA	Children & Youth, Youth Centers & Clubs	The noroton heights depot is a teen center which provides a safe, supervised, drug-free and alcohol-free environment in which high school age youth can gather and socialize. Through its own student governance and recreational inter- face with other youth organizations and the high school. The depot offers opportunities for leadership experiences and positive youth development.					The noroton heights depot is a teen center which provides a safe, supervised, drug-free and alcohol-free environment in which high school age youth can gather and socialize. Through its own student goverment and recreational interface with other youth organizations and the high school. The depot offers opportunities for leadership experiences and positve youth development  the noroton heights depot is a teen center which provides a safe, supervised, drug-free and alcohol-free environment in which high school age youth can gather and socialize. Through its own student governance and recreational interface with other youth organizations and the high school. The depot offers opportunities for leadership experiences and positive youth development.				
Boys And Girls Village Inc	http://www.bgvillage.org	(203) 877-0300	EIN 22-2562827	528 Wheelers Farms Rd	Milford	CT	06461	USA	Group Homes, Human Services	Boys and girls village serves children and families in at-risk situations by strengthening their ability to succeed in life					Therapeutic foster care - see attached  special education - see attached  safe haven- psb- see attached				
