Firm Foundation Leadership Coalition, Inc.	http://www.firmfoundationcoalition.org	860-748-2906	EIN 06-1594331		Manchester	CT	06040	USA	Family Services	Providing Latino community leadership development and economic independence	Firm Foundation Leadership Coalition, Inc., provides services to our Latino communities based on their self-identified needs to enhance their leadership skills and develop self-advocacy.  We are distinguished, outstanding and nationally recognized for our leadership commitment to human development and community service in the Latino community.  Serving our Latino community is what validates Firm Foundation Leadership Coalition, Inc., existence. We strive to ensure that our constituents are satisfied, accomplished and successful in living and leading healthy extraordinary lives.  Latinos coaching and mentoring Latino business leaders, creating Latino business models, developing Latino best practices.	Non-profit, Community and Faith-based organizations		CT, RI, MA	Leadership Development, Organizational Capacity, Program Development, Community Engagement				
Friends Of The Salem Free Public Library Inc	http://		EIN 06-1331652	264 Hartford Rd	Salem	CT	06420	USA											
Annual Bishops Appeal Of The Diocese Of Norwich Inc	http://		EIN 06-1507733	201 Broadway	Norwich	CT	06360	USA											
Domestic Violence Crisis Center	http://www.dvccct.org	(203) 588-9100	EIN 06-1057356	777 Summer St Ste 400	Stamford	CT	06901	USA	Crime & Law, Domestic Violence, Family Violence Shelters, Homeless & Housing, Hot Lines & Crisis Intervention, Mental Health, Protection Against Abuse	The domestic violence crisis center is committed to promoting the fundamental right of all individuals to be safe in their relationships. Dvcc offers confidential services at no charge, including civil representation and criminal advocacy, group and individual counseling, temporary shelter, housing services, children's services, medical advocacy, professional adult trainings, multilingual services, peaceworks prevention education and a 24-hour hotline.					Stamford and norwalk safehouses - crisis shelters for victims of domestic violence and their children who would otherwise be homeless are provided immediate safety and access to specialized resources. Dvcc remains the leader in provision of shelter to ipv victims in ct; indeed, the number of individuals residing in dvcc safehouses each year has quintupled since 2005, from 62 in 2007 to an average of 425 per year over the past four years. Our position as the largest provider of shelter is attributed to the depth and breadth of the services offered via the continuum of care.   court and legal project - ensures that victims of ipv are informed about their rights and remedies within the courts and supported in their interactions with law enforcement. Dvcc attorneys and advocates also advocate within the system for a victim-centered response by all providers. Results of our efforts include a 36% reduction (to 12%) of the dual arrest rate (both victim and offender arrested) since 2010. Dvcc family violence victim advocates meet with a multidisciplinary team that reviews between 80-100 domestic violence cases weekly in both the norwalk and stamford courts. Our civil legal clinics continue at both dvcc office sites, providing education sessions led by local attorneys on civil legal matters related to the abuse. Within the lethality assessment program, four local police departments performed 171 danger screens on domestic violence calls between june and october 2014 56% screened in at high danger, 34 connected directly to dvcc, and 29 accessed further services.   counseling project - trauma-informed individual and group counseling for adults and the youth services program, specialized interventions for children exposed to ipv. Counseling directs esperanzact, our spanish-language website and on line resource, one of few comprehensive programs of its kind in the u. S. , connecting the growing latino communities within our service area to all dvcc services and information in a culturally and linguistically specific manner.				
Greater Middletown Chorale Inc	http://www.gmchorale.org	(860) 349-3631	EIN 06-1038816	PO Box 527	Middletown	CT	06457	USA	Arts & Culture, Singing & Choral Groups	Perform community choral concerts					A chorus of approx 60 singers performs two annual concerts. Dues and grants plus ticket sales cover expenses of conductor and other hired musicians.				
Applied Scholastics International	http://		EIN 06-1355664	70 Meriline Ave	Waterbury	CT	06705	USA	Education, Educational Services										
Cornelia de Lange Syndrome Foundation, Inc.	http://www.CdLSusa.org	800.753.2357	EIN 06-1057497	302 West Main Street #100	Avon	CT	06001	USA	Health, Health (General & Financing)	Reaching Out, Providing Help and Giving Hope.				United States	Publications, family service support phone lines, national family conferences, Foundation sponsored family gatherings across the country				
Empowerment Through Arts Inc	http://		EIN 80-0572220	98 Courtland Cir Unit 3	Stamford	CT	06902	USA	Arts & Culture, Arts Education										
Miracle Temple Church Of God In Christ Of Norwalk Inc	http://		EIN 06-6162636	2 Trinity Pl	Norwalk	CT	06854	USA											
FUTURE 5 INC	http://		EIN 46-2986201	135 Atlantic St	Stamford	CT	06901	USA	Children & Youth, Youth Development Programs										
Foodshare	http://www.foodshare.org	860-286-9999	EIN 	450 Woodland Ave.	Bloomfield	CT	06002	USA	Emergency Assistance, Food, Food Banks & Pantries	Founded in 1982, Foodshare works with the food industry and nearly 350 local nonprofit partners. We distribute 15 tons of food every day. Foodshare not only distributes food but also acts to end hunger by promoting self-sufficiency and engaging the community in effective long-term solutions.				greater Hartford					
New Haven International Festival Of Arts & Ideas Inc	http://www.artidea.org	(203) 498-1212	EIN 06-1444222	195 Church St 12th Flr	New Haven	CT	06510	USA	Arts & Culture	The organization was incorporated for the purpose of organizing, conducting and supporting a festival for the performing, visual and literary arts.					The 19th annual festival was held on june 14-28, 2014 in new haven, ct. Artists and cultural visionaries from around the world participated in the festival which was attended by an audience of approx. 116,300.				
Warren Land Trust Inc	http://www.warrenlandtrust.org		EIN 22-3018018	50 Cemetery Rd	Warren	CT	06754	USA	Environment, Land Resources Conservation	The warren land trust is an organization dedicated to the preservation of the rural character of warren. Its mission is to preserve farmland, open space and natural and endangered resources such as wetlands, forests and wildlife habitats.					Land conservation and preservation activities in the town of warren ct with 654 acres currently under protection				
Region One Cooperating Library Service Unit, Inc.	http://		EIN 06-0983685	530 Middlebury Rd.	Middlebury	CT	06762	USA	Education										
South Central Ct Substance Abuse Council Inc	http://www.mawsac.org	(203) 294-3591	EIN 06-1348152	5 Brookside Dr	Wallingford	CT	06492	USA	Community Service Clubs	Addiction prevention					Assist in identification of community substance abuse needs and sevice gaps in the areas of prevention, inter- vention and treatment.				
Bobcat Pit Crew	http://bhsbandandguard.com	(203) 775-8085	EIN 06-1343100	Po Box 207	Brookfield	CT	06804	USA	Education, Parent & Teacher Groups	Support high school band & color guard					Fund marching band and color guard for all high school home football games and competition with other schools. Help with purchase of uniforms props, music, equipment, etc. 46 members in band and color guard members  annual banquet and awards to recognize all members  provide four $1,000 scholarships to graduating seniors committee of 4-6 parents make determination based upon various criteria that have been established.   0				
Young Mariners Foundation Inc	http://www.youngmarinersfoundation.org	(203) 348-9000	EIN 06-1427077	1281 Cove Rd	Stamford	CT	06902	USA	Children & Youth, Youth Development Programs	Young mariners foundation is dedicated to increasing academic and life skills achievement of low income and at-risk students through after-school enrichment and summer sailing programs.					Blue water bound is an experiential, hands-on education and summer sailing camp designed to positively influence social and learning skills, especially for children who are at-risk and/or from economically deprived households in the stamford area.   greenwich young mariners is an experiential, hands-on learning program, in sail boats on the water, designed to positively influence social and learning skills, especially for children from economically deprived households in the greenwich area.   young mariners afterschool enrichment program is a stem-based experiential education intervention that teaches swimming, first aid and basic waterfront skills to under-served and at-risk children in the stamford and greenwich area.   the fall sailing program is offered to blue water bound students who wish to extend their sailing experience and skills. It is offered on designated weekends for a fee in september/october and staffed by the blue water bound instructors and interns. Normally about 20 participants register for this program which takes place in the boccuzzi park at southfield location. The young mariners foundation added community sailing and kayak and paddleboard programs in 2012 to its roster of program services. These programs offer the community access to the limited waterfront resources in the stamford area. The community sailing program is offered during the spring and fall months and the kayak and paddleboard program is offered during the summer months.				
East Lyme Viking Band Inc	http://		EIN 22-3298536	Po Box 183	East Lyme	CT	06333	USA											
The New Haven Reads Community Book Bank, Inc.	http://www.newhavenreads.org	203-752-1923	EIN 76-0807330	45 Bristol St	New Haven	CT	06511	USA	Education	The overall goal of New Haven Reads is to provide an environment where children and adults have access to free books and tutoring to increase their literacy skills and academic performance.	We tutor more than 400 children a week (and have over 100 children on the wait list) with a corps of over 300 dedicated volunteers. Eighty-one percent of our families live in New Haven.			New Haven	Three adult ESL classes; a pre-school literacy program; a kindergarten reading program; four weekly homework tables; two writing clubs; and our large after-school tutoring program				
Kent Kats Inc	http://		EIN 06-1620457	Po Box 916	Kent	CT	06757	USA	Animal Protection & Welfare, Animals										
Connecticut Association Of Latin Americans In Higher Education Inc	http://	(860) 906-5234	EIN 22-2562167	950 Main St	Hartford	CT	06103	USA		To foster education awareness to the latino community					Golf tournament for the purpose of raising funds for the scholarship fund and other program services to foster education awareness to the latino community  scholarship  allocated program expenses				
Kids Our Future Trust Fund	http://		EIN 06-1340808	733 Summer St	Stamford	CT	06901	USA		ANNUAL GRANTS GENERALLY RANGING FROM $50 TO $500 GIVEN TO TEACHERS IN THE STAMFORD PUBLIC SCHOOL SYSTEM AS WELL AS PROGRAMS TO PROMOTE STAMFORD PUBLIC EDUCATION.									
New London Irish Parade Inc	http://		EIN 27-2374302	281 Elm St	New London	CT	06320	USA	Arts & Culture, Cultural & Ethnic Awareness										
The Caring Community Of Connecticut Inc	http://caringcommunityct.org	(860) 267-4463	EIN 22-2583035	84 Waterhole Rd	Colchester	CT	06415	USA		To provide a full range of community based services for developmentally disabled persons, most especially those who have behavioral and social deficits which are not easily accommodated by the general community. It is the agency's goal to afford people we serve a setting and the mechanisms to diminish those mal adaptive traits which have been obstacles to full participation in community living. We fully subscribe to the proposition that all developmentally disabled persons shall live quality lives which are full, fruitful and within a framework of fellowship with others.					Residential programs consist of 15 group homes providing services to 66 adults with severe/profound developmental disabilities. Also, supported living arrangements for 6 people and an intermediate care facility for 4 people  vocational programs serving 61 developmentally disabled adults.				
El-Shammah Apostolic Church Inc	http://		EIN 22-2506211	Po Box 2671	Stamford	CT	06906	USA											
National Shooting Sports Foundation Inc	http://www.nssf.org	(203) 426-1320	EIN 06-0860132	11 Mile Hill Rd	Newtown	CT	06470	USA		Nssf's purpose is to promote, protect and preserve hunting and the shooting sports.					Shot show - nssf held its annual trade show during the year. This event allows members of the shooting, hunting and outdoor trade to showcase their products and services and share information about the latest developments in the industry.   government relations - nssf protects the firearms industry through coordination with political, regulatory, and membership organizations. Not only does nssf protect the industry's best interests in washington, d. C. , but it also aggressively guards against attacks in state capitals throughout the country.   voter education - nssf provides the public with resources to register to vote and to educate voters on the candidates' positions on issues.   safety & education - nssf published and distributed various newsletters, pamphlets and publications to its members and the general public to educate them on the safe use of sporting firearms, various sport shooting events, and to promote wildlife conservation programs related to the shooting sports. Nssf also promotes gun safety by distributing gun locks and other gun safety materials.				
Intense Intestines Foundation Inc	http://intenseintestines.org	(203) 274-8711	EIN 27-1750958	Po Box 8097	Stamford	CT	06905	USA	Digestive Diseases & Disorders, Health	To help and connect those with inflammatory bowel disease through unique social media and events. We will combine the thrill of activities such as hiking, climbing, skiing, kayaking and other activities and events with charitable efforts to advance awareness for crohns disease and ulcerative colitis.					Intense intestines scholarship - scholarship is designed to help those with moderate to severe crohns disease or ulcerative colitis achieve the higher education they desire.   intense intestines social- i. I. S. Is a social and support network similiar to facebook where a member can create a profile, become friends with others that have ibd, share blogs, pictures, & videos as well as become members in subgroups to interact more about a particular topic.				
Connecticut Hospice Inc	http://www.hospice.com/cthospice	(203) 315-7500	EIN 06-0878822	100 Double Beach Rd	Branford	CT	06405	USA	Hospices	Provide adult and pediatric care to irreversibly ill patients and their families at home and at hospital-hospice.					Physician directed pain and symptom management provided statewide to palliative hospital and hospice care adult and pediatric patients and their families  physician directed home medical and hospice care services to adults and pediatric patients on a statewide basis				
Perspectives Center for Care, Inc.	http://www.pcc4me.com	8602763000	EIN 46-3321685	341 West Street Suite B1	Plantsville	CT	06479	USA	Mental Health, Mental Health Associations, Mental Health Disorders, Mental Health Treatment, Substance Abuse Dependency, Prevention & Treatment	The mission of the organization is to provide the most effective forms of therapy through research and state-of-the-art programs. PCC believes in proactively maintaining mental health to help strengthen positive connection so that people and communities unite and flourish. To accomplish its goals, PCC has created various programs to provide the most effective forms of therapy.	PCC has already proven that it can successfully implement programs for the mental well-being of the community by serving over 700 clients in the year 2016. The Center has available resources and has effective collaboration with other organizations and the Government. PCC has an existing contract with the CT Government for providing court ordered parenting education program. The Center gets referrals from DCF, area hospitals and doctors offices.  PCC has many bilingual counselors who offer services to the immigrant population in the area. PCC also has few alcohol & drug certified counselors who are qualified to administer Naloxone in opioid overdose cases. The Center is opening a private freestanding mental health facility to provide psychiatric outpatient services. In addition the Center is opening a primary health care center that will act as a medical home for the low income, minority and immigrant population in the area.	low income/minority/immigrant population to resolve mental health and substance abuse issues.	700	Southington, Waterbury, Meriden, Newtown	Mental health treatment, Substance abuse treatment, Substance use management Education				
A HAND FOR A PAW INC	http://		EIN 26-1882087	114 Lakeside Dr	Bridgeport	CT	06606	USA	Animal Protection & Welfare, Animals										
Farmington Valley Trails Council	http://		EIN 06-1350200	Po Box 576	Tariffville	CT	06081	USA											
Service for Peace Inc	http://www.serviceforpeace.org	(203) 339-0064	EIN 03-0388426	2838 Fairfield Avenue	Bridgeport	CT	06605	USA	Children & Youth, Human Services, Salvation Army, Youth Community Service Clubs, Youth Development Programs	We involve volunteers in ongoing community development programs throughout the world. Our programs are designed to further the growth and development of individuals and communities through the shared experience of voluntary service.		High School students, college students, young professionals, etc.		Throughout the US: Selma AL; Fairfield County CT; Washington DC; Miami FL; Chicago IL; Louisville KY; Cincinnati OH; Seattle WA.  Student Clubs: Campus Corps - Miami Dade College - IAC Bridgeport Miami Dade West Miami - FIU  Internationally: Austria, Belarus, Brazil, Bulgaria, Cambodia, Dominican Republic, Ghana, Guatemala, Honduras, Israel, Italy & San Marino, Ivory Coast, Japan, Luxembourg, Moldova, Mongolia, Nepal, New Zealand, Nicaragua, Palestine, Philippines, Russia, Sierra Leone, South Korea, Taiwan Province of China, Thailand, Ukraine.	Martin Luther King Jr. Day of Service  Global PeaceMakers				
Brooklyn Pto	http://		EIN 06-1325280	119 Gorman Rd	Brooklun	CT	06234	USA	Education, Parent & Teacher Groups										
TAILS	http://www.tailsct.org		EIN 06-1616864	Po Box 2277	Westport	CT	06880	USA	Animal Protection & Welfare, Animals	To serve the community as a charitable organization that promotes spay/ neutering of animals and provides financial support to humane organizations and individuals in pursuit of this goal. We are dedicated to vigorously promoting and educating the community about the importance of spay/ neuter to reduce, and eventually eliminate, the killing of unwanted dogs, cats, and other animals.									
Hole in the Wall Gang Fund, Inc.	http://www.holeinthewallgang.org	203-772-0522	EIN 06-1157655	555 Long Wharf Dr	New Haven	CT	06511	USA	AIDS, Cancer, Health, Patient & Family Support, Sports	Founded in 1988 by Paul Newman, The Hole in the Wall Gang Camp is a community dedicated to providing a different kind of healing to seriously ill children and their families through a variety of year-round programs. The Camp delivers fun, friendship and a healthy dose of mischief through its signature summer program and weekend sessions at the Camp facility in Ashford, Conn. as well as outreach to hospitals, clinics and communities across the Northeast. All services are free of charge.	We served 25,000 seriously ill children and their family members in 2013 and expect to increase that number to 30,000 in the coming years.	seriously ill children with cancer, sickle cell disease, HIV/AIDS, hemophilia and other blood disorders, metabolic disease and mitochondrial disease	25,000 children and family members	northeastern United States and some groups from overseas	We offer year-round programs for seriously ill children and their families, including our signature summer camp program, weekend programs for campers, families, parents and caregivers.				
Cambodia's Children Education Fund, Inc.	http://www.ccedfund.org	7175862104	EIN 61-1545069	12 Thistle Lane	Greenwich	CT	06831	USA	Education, Educational Services, Human Service Organizations, International, International Human Rights, Scholarships, Scholarships & Student Financial Aid	After thirty years of war and a genocide at the hands of the Khmer Rouge, Cambodia remains an impoverished country that offers almost no educational opportunities to impoverished students. These students cannot afford to attend public school, but  those who can afford school are in overcrowded classrooms for approximately 2 hours per day. CCEdFund expands educational opportunity to impoverished students by providing scholarships for them to attend exceptional schools within Cambodia. While recent economic growth in Cambodia and the creation of a democratic system of government has expanded opportunities for some, many Cambodians have little to no access to public education due to poverty. Further, there are exceptional schools in Cambodia that provide progressive, child-centered educational experiences to students whose families can afford the schools. CCEdFund provides similar educational opportunities to Cambodian students who have exhibited dedication to their studies by providing scholarships to these exceptional schools. In doing so, CCEdFund is promoting peaceful economic, social, and political development in Cambodia where there is a paucity of education professionals (due to the Khmer Rouge genocide). After completing their education, our students commit to working in the public interest in Cambodia for a minimum of two years.	CCEdFund is providing 22 impoverished or orphaned Cambodian students with scholarships to exceptional schools for the 2010-2011 school year.	Impoverished and orphaned Cambodian students in Cambodia; any age.	22 Students	Cambodia					
GRANBY LAND TRUST INC	http://www.granbylandtrust.org	(860) 653-7441	EIN 23-7243316	PO Box 23	Granby	CT	06035	USA	Environment, Land Resources Conservation	To acquire and maintain land for preservation purposes					Stewardship of land trust properties:1. Substantially completed project to develop and adopt baseline data reports for all of our 25 conservation easements. 2. Completed monitoring reports on all conservation easements and fee-owned properties3. Began and partially completed a project to develop property management reports on all fee-owned properties4. Continued the development and oversight of the overall stewardship program of the glt  property acquisition:acquired three properties for the glt. Two acquired by donation and one by purchase. 1. Nukols preserve, 19. 4 acres donated. Valued at $208,800. Acquisition expense of $8,189 covered some of the donor's direct expenses related to the donation. 2. Godard preserve addition. 5 acres donated. Valued at $82,100. Expense of $492 for legal fees. 3. Duhaime property. 57. 1 acres purchased for $120,000 plus $1,249 closing costs. Land acquired by donation or by purchase: neither costs nor revenue were included as program expenses or revenue since they are capital expenditures and served to increase glt's permantly restricted net assets  art activitiesglt annually ponsors an artist's paint-out day on land trust property followed by a juried art show that features the art created at the paint-out and elsewhere by artists from the local area depicting the local natural environments. This program serves as an educational tool, is a community involvement and public relations tool and is a fundraiser for the granby land trust. Revenue of $13,200 less expenses of $8,440 are reported on line 8c as $4,760				
VICKI SOTO MEMORIAL FUND	http://www.vickisotomemorial.com		EIN 46-1619352	Stratford Post Office P.O. Box 411 411 Barnum Avenue	Stratford	CT	06615	USA	Education, Primary & Elementary Schools, Scholarships, Scholarships & Student Financial Aid, Secondary & High Schools	The mission of The Vicki Soto Memorial Fund, Inc. is to promote a love of education by honoring Vickis passion for life and commitment to teaching. In carrying on with her legacy, all donations and money raised goes to the fund and is used to support many important and vital educational initiatives. To date, the fund has awarded thousands of dollars in annual scholarships, donated hundreds of childrens books to local libraries and schools, and has partnered with many different non-profit organizations to build playgrounds, promote kindness, and support future education. The Vicki Soto Memorial Fund, Inc. is an official 501c(3) public charity organization. Thank you so much for your continued support and generous donations - See more at: http://vickisotomemorial.com/#sthash.dwe8KXaC.dpuf		Children and high school students pursuing Education as a major		Stratford Ct	The Vicki Soto memorial Scholarship at Stratford and Bunnell High, The Miss Soto's Literacy Legacy Project, The Vicki Soto 5K				
