Love146	http://www.love146.org	203.772.4420	EIN 20-1168284	PO Box 8266	New Haven	CT	06530	USA	Child Abuse Prevention, Civil Rights, Crime & Law, Domestic Violence, Human Service Organizations, Human Services, Victims Services	Love146 is an international human rights organization working to end child trafficking and exploitation through survivor care and prevention. The trafficking and exploitation of children is one of the darkest stories and most severe human rights abuses imaginable. But for us, the hope of ending it is a reality. Love146 is helping grow the movement to end child trafficking while providing effective, thoughtful solutions. We believe in the power of love and its ability to effect sustainable change. Love is the foundation of our motivation.  Founded in 2002 (as Justice for Children Intl.), Love146 is a registered public charity. Love146 is a 501c3 non-profit organization.	OUR HOLISTIC CARE In The Philippines: Our Round Home in the Philippines is uniquely built and designed to facilitate the restoration and holistic health of every girl entering its doors. A tree house is regularly the venue for therapy sessions. A volleyball court is available to play on. Theres even a punching bag for children to work out their aggression. The physical structure of the Round Home is intended to promote reflectiveness, a sense of peace, freedom, dignity, and self-esteem, as well as playfulness so that children can simply be children again. After years of providing direct care to dozens of girls, the Love146 White Home opened in 2014, caring for exploited boys, providing them with holistic care, including medical attention, nutrition, therapy, formal and informal education, and vocational training, all to help them walk toward recovery and prevent future exploitation.  In the United States Over the years, we have heard stories about exploitation and trafficking of children in the United States. Before launching our US Survivor Care program, we talked with survivors of child sex trafficking in the US, asking them what sort of care they would have liked to have. We listened to government officials, asking them what was actually needed. After much research, we realized that while many services for children exist in the US, service providers are generally not familiar with human trafficking, and few survivors have a trauma-informed advocate who understands human trafficking and can help them gain access to the services they need. Youth who have been trafficked are at higher risk for further exploitation; thus, one of the first things we tell a youth is, We go where you go. If you move placements, or foster homes, or run away and come back, we will always be there. By journeying with the youth, Love146 helps ensure that youth receive victim-centered services and the support they need to become self-sufficient and flourishing adults, which includes freedom from revictimization.  Our Prevention Education in the United States We are driven by the belief that child trafficking and exploitation is not inevitable, and working to reach youth before traffickers do.  Our child trafficking and exploitation prevention education curriculum, Not a #Number, is designed to teach at-risk youth how to recognize recruitment tactics, understand vulnerabilities, and develop skills to safely navigate potential and existing exploitative situations. Youth identify healthy support systems and learn how to access community resources when situations occur that increase their vulnerability or if exploitation is already underway. We also provide resources to educate parents, caregivers, and professionals about the issue and actions they can take to help safeguard children. Not a #Number has been embraced by schools, child welfare and juvenile justice agencies, and other youth-serving organizations.	Children who have experienced being trafficked or exploited.	161 children who have experienced being trafficked or exploited; 3,922 youth received prevention education, 592 professionals and community members received training, and 41 professionals were certified to facilitate Not a #Number, our prevention education curriculum.	United States, The Philippines, The United Kingdom	We serve children from our offices in Asia, the United Kingdom, and the United States. Love146 is working to end child trafficking and exploitation through survivor care and prevention.  We began in 2002, building and expanding safe homes in Asia and training grassroots aftercare workers with knowledge in best practices and equipping them with practical tools to be even more effective. In 2008, we opened our Round Home for girls in the Philippines, and since then have added three more additional survivor care locations, serving both boys and girls in the Philippines, the U.S. and the U.K. However, we could only provide survivor care for so long before asking ourselves, What can we do to actually prevent exploitation from occurring in the first place? Our Prevention Education program has been developed to better answer just that question. Prevention Education reaches children before traffickers do. Weve reached thousands of U.S. children in classroom and community settings, equipping them to recognize vulnerabilities and protect themselves and their peers from exploitation. In 2015, we completed & began implementing a youth curriculum, called Not A #Number, which incorporates what weve learned about effective prevention. The trafficking and exploitation of children is one of the darkest stories and most severe human rights abuses imaginable. But for us, the hope of ending it is a reality. Love146 is helping grow the movement to end child trafficking while providing effective, thoughtful solutions. We believe in the power of love and its ability to effect sustainable change. Love is the foundation of our motivation.				
Dravet Syndrome Foundation, Inc.	http://www.dravetfoundation.org	203-392-1950	EIN 27-0924627	PO Box 16536	West Haven	CT	06516	USA	Epilepsy, Health, Philanthropy, Public Foundations	The mission of Dravet Syndrome Foundation (DSF) is to aggressively raise research funds for Dravet syndrome and related epilepsies; to increase awareness of these catastrophic conditions; and to provide support to affected individuals and families.	To date, DSF has awarded over $2M in Dravet-specific research grants, more than any other nonprofit organization, and over $80K in patient assistance grants. Even though research might not move as quickly as we as parents would like to see, we don't want lack of funding to be slowing down the process.	We collaborate globally with researchers, geneticists, clinicians, and other professionals with an interest in Dravet syndrome and related epilepies, as well as serving patients and familes across the globe.			Research Grant Program  This program offers grants for research directly related to Dravet syndrome and associated epilepsies.  Our research grants fund initial research hypotheses that have not been fully explored.  The results extracted from this type of research will help bring untested research to the point that it can qualify for larger governmental funding. Research applications will be judged principally on novelty of the hypotheses, innovative approaches with a direct relevance and application to Dravet syndrome and related epilepsies, scientific quality, strength of approach, and likelihood of success.    International Ion Channel Epilepsy Patient Registry (IICEPR) This registry (co-funded by the DSF & ICE Alliance) is owned by University of Michigan and Miami Childrens Hospital, but will be available to all interested researchers.  It will collect basic information and genetic test results of individuals with Dravet syndrome and related epilepsies worldwide.  The establishment of this registry will expedite future clinical trials and will serve to improve communication of ideas amongst interested researchers, as well as assure rapid distribution of any new information that may benefit patients and their families.  DSF Annual Research Roundtable  This annual meeting allows researchers, geneticists, neurologists and other professionals with a strong interest in Dravet syndrome and related epilepsies establish a research roadmap.   By allowing this consortium of specialists to establish a plan, the DSF can facilitate the development and implementation of better treatments by funding research projects that address the critical challenges of this syndrome and which will offer the most promising breakthroughs at the fastest pace possible.    International Patient Assistance Grant (PAG) Program - This program offers grants to patients with Dravet syndrome and associated epilepsies for necessary medical expenses associated with these conditions that are not covered through private insurance or other assistance programs.  Three percent of donations, after expenses, are allocated to this program.				
Petit Family Foundation	http://www.petitfamilyfoundation.org	(860) 479-1436	EIN 26-0627813	Po Box 391	Farmington	CT	06034	USA	Community Foundations, Philanthropy	The primary activity is to raise funds to foster the education of young people, especially those in the sciences; to improve the lives of those affected by chronic illnesses and affected by violence. In keeping with its missions, the foundation makes scholarships to needy individuals and makes contributions to charitable and educational institutions.					Contributions are provided to charitable & educational institutions to foster the education of young people, especially women in the sciences; to improve the lives of those affected by chronic illnesses; and to support efforts to protect and help those affected by violence.   scholarships are provided to children and young adults in need to assist with their education.				
Society For Neuroscience	http://		EIN 51-0145788	75 N Eagleville Rd	Storrs	CT	06269	USA											
Paper For All	http://www.paper4all.org		EIN 				06011	USA		Help children learn in better conditions in one of the most illiterate countries in the world Burkina Faso, Africa.  The organization provides academic resources to improve the learning conditions of children (6-14 years old) in four elementary schools (2,000 children) in Ouagadougou, Burkina Faso and is registered as a 501 (c) (3) in the US (#109090026), in the UK (#1116888), France (#20020080003) and Burkina Faso (#2007366).	The quarterly distribution programme currently targets a select number of schools in Ouagadougou, Burkina Faso, or about 2,000 children:  Cit de lAvenir (670 pupils)  Trame dAccueil A (880 pupils)  Trame dAccueil B (500 pupils)  Yaaka (150 pupils) Overall, in two years of operations, more than 8,000 notebooks and 5,000 pens have been distributed to the children.  In addition, Paper for All launched a tutoring programme for 150 children, to assist them for the academic fees, track their performance and distribute supplies such as mosquito nets and lamps, with the same focus, enabling better learning conditions to enable them to have a greater impact on the development on their country,	Children 6-14 in elementary schools	2400 children	US, UK, France, Burkina Faso					
Guilford A Better Chance Inc	http://	(203) 453-3994	EIN 23-7417687	Po Box 140	Guilford	CT	06437	USA	Human Services, Thrift Shops	Guilford abc is a life-changing program that offers academically gifted girls of color the opportunity to attend guilford high school, live in a caring community surrounded by a strong professional support team, and realize their individual potential. These young women, chosen from many applicants to the national abc program, come from under-represented communities where they lack access to quality educational experiences. Our program's primary mission is to provide these scholars with a better chance to excel in high school, attend a quality college or university, and lead a fulfilling personal and professional life. Guilford abc, which opened its doors in 1974, was one of the very first community-based abc programs in the nation. Since its inception, guilford abc has sent more than 55 young women on to colleges and universities in the country, many of them on full academic scholarships. Given their achievements, many of these guilford abc graduates have become real-life role models.					To provide housing, food, supervision, academic counseling for inner city students attending guilford high school.				
West Hartford Community Tv Inc	http://		EIN 06-0999684	50 South Main Street Suite 326	West Hartford	CT	06107	USA		Offer public access tv to the west hartford,ct community					Community tv  other				
Newmans Own Foundation	http://	(860) 284-4200	EIN 06-1606588	One Morningside Drive North	Westport	CT	06880	USA	Philanthropy, Private Grantmaking Foundations										
Bethel Recovery Center Inc	http://		EIN 06-1337292	1037 Sylvan Avenue	Bridgeport	CT	06606	USA	Health, Rehabilitative Care	The mission of bethel recovery center inc is to provide a safe sober and structured environment for women desiring continua					The organization provided a safe and structured environment and training for more than 52 women recovering from substance abuse				
Holy Family Home and Shelter, Inc.	http://www.holyfamilywillimantic.org	860 423-7719	EIN 06-1329333	P.O. Box 844 88 Jackson St.	Willimantic	CT	06226	USA	Homeless & Housing, Homeless Shelters	Holy Family Home And Shelter was founded in 1989 by Sisters of Charity, Our Lady Mother of the Church to temporarily house homeless families, at no cost to them, regardless of race, religious preference, or family status.	For 25 years Holy Family Home and Shelter, Inc. has been ending homelessness in Connecticut one family at a time. Many families have gone to college, gotten married, bought homes, children have done well in school. Some of our children have received awards at school and have made the honor roll. Through the education program children have received tickets to Jorgensen at UCONN for performances. Some of the children's artwork has been displayed in several venues.	Homeless families--female head of household	125 families with 220 children. We served 16,448 meals.	Willimantic, CT	On-site tutoring for school age children, activities for toddlers, case management for moms, workshops in parenting, health, budgeting, education opportunities,  etc. Three meals a day--emphasis on nutrition, snacks. Holiday assistance, on-site laundry,				
The Circle Of Hands Foundation Inc	http://		EIN 13-0449923	7 Mansfield Ave	West Hartford	CT	06117	USA	International, International Relief										
191914 Ministries Incorporated	http://	860-770-9721	EIN 26-1675759	44 Green St P.O. Box 771	Middletown	CT	06457	USA	Health, Rehabilitative Care	Our mission is to bring faith and creativity together in programs that support community wellness and enhance individual and family crisis recovery efforts by: Drawing diverse populations together to effect positive change; Building innovative bridges to individual and family crisis-recovery; Nurturing the raw creative talents of all ages Revitalizing health, commerce, and arts in our communities; Engendering economic development and enhanced employment opportunities; Promoting faith in God as a contributor to health and wellness in human life.	We spent a lot of time this year fundraising to secure new facilities to increase capacity for service delivery	Low-to-moderate income individuals and families recovering from crisis	Our programs directly benefited 970 individuals last year	State Of Connecticut	*Red Truck Services --provides job training and specialized sanitation, safety, organizing, and relocation services to low-income, at-risk families with barriers to traditional sanitation and organizing solutions *Writers Out Loud! --monthly community open-mic presenting richly diverse sharing of cross-cultural story *Walkabout Outreach --weekly community outreach to interact with neighbors and businesses, building rapport, learning about needs and strengths, sharing about available resources *Speakers Bureau --pool of individual speakers, peer and professional, providing information and education about about psychosocial crises experiences and resources *191914.COM --interactive web site providing public information and eduction resources *YouthARTS Studios --- recreational art groups for at-risk youth (ages 6-17) *Emerging Artist Development Series -- interdisciplinary art groups for at-risk adults. *Dream Capture Groups --10-week seminars for streamlining the pathway to individual life goals *Bridges to Recovery: Books & Gifts --books, art, and gift shop featuring unique writings, artwork, crafts created by 191914 artists. *Ready for the World Teens(RTWF) --interactive teen workshops providing enhanced self-image and life skills education to at-risk teens (age 13-17) *Better Parenting --facilitated parenting groups to help psycho-socially challenged parents-at-risk build better parenting and coping skills *Food-4-Love/Food-4-Life --TBA				
The Battered Women's Safe Territory an Opportunity to Progress, Inc.	http://www.bwstop.org		EIN 56-2455549	94 Bentwood Dr	Waterbury	CT	06705	USA	Domestic Violence, Family Violence Shelters, Homeless & Housing	BW STOP provides our clients - the victims of domestic violence and their families - counseling, family/group therapy, medical referrals, babysitting services, educational and vocational training, and temporary residential housing.  BW STOP offers these services to assist in developing self-reliance and independence for our clients									
Mary's Place, Inc.	http://www.marysplacect.org	(860) 688-9621	EIN 06-1462376	6 Poquonock Ave.	Windsor	CT	06095	USA	Counseling, Family Services, Mental Health, Named Trusts, Philanthropy	Our mission is to provide an atmosphere of trust in which children and families who are grieving a death share their experiences, receive support and find comfort. We are able to do this through peer support groups, education and training.					Mary's Place offers peer grief support groups for children ages 3-18. Our Little Kids Group is for children ages 3-7, Big Kids Groupages 8-12 and Teens Group ages 13-18. The peer support groups are offered to children whoare grieving the death ofa parent, sibling or in the case of teens, a close friend. We alsohavea Young Widows and Widowers Group. All groups are offered at no charge to families. Besides our in house support groups we have a resource center and library, offer support and guidance to schools and the community and offer a 6 week course for our parents on Understanding Children's Grief.				
Cardinal Kung Foundation Inc	http://		EIN 06-1334853	185 Echo Hill Dr	Stamford	CT	06903	USA	Gift Distribution, Human Services	To promote the Roman Catholic Church in China, now under persecution, through increased prayers, financial support and other appropriate projects.									
Friends Of The Morris Library Inc	http://		EIN 37-1569786	4 North Street	Morris	CT	06763	USA	Education										
Serious Fun Children's Network	http://www.seriousfunnetwork.org	203-562-1203	EIN 31-1794455	228 Saugatuck Avenue	Westport	CT	06880	USA	Cancer, Diseases of Specific Organs, Health, Mental Health, Mental Health & Crisis Intervention, Pediatrics	The mission is to create opportunities for children with serious illnesses and their families to reach beyond illness and discover joy, confidence and a new world of possibilities, always free of charge.	- 30 camps and programs worldwide and growing; - 75,000 children and families served in 2013; - 518,000 children and families from more than 50 countries served since 1988; - 20,000 volunteers served children and families in 2013;  A 2012-2013 evaluation of SeriousFun parents and children by the Yale School of Medicine found that children with serious illnesses who attend camp showed improved confidence, higher self-esteem, a greater sense of independence and increased interest in social activities. The study also revealed that childrens stress related to their illness decreased as a result of the camp experience.	for children with serious illnesses and their families.	75,000  children and families	International	Each SeriousFun camp is an independent, not-for-profit organization dependent upon private funding to serve children free of charge. SeriousFun programming and facilities are skillfully adapted to fit the different cultures and medical conditions of campers. Every attempt is made to be inclusive and accessible. Through its Global Partnership Program, SeriousFun also collaborates with international organizations to deliver the camp experience to children with illnesses in resouce-limited locations.  The medical expertise at camps enable more than 50 different types of conditions to be supported, including cancer, HIV, blood disorders, heart diseases and severe asthma. Through intentional programming delivered through camp and outreach programs, children are empowered to reach beyond the barriers of their conditions to build connections and foster resilience.				
Holcomb Farm Inc	http://www.holcombfarm.com	(860) 844-8616	EIN 06-1384197	113 Simsbury Rd	West Granby	CT	06090	USA	Environment	To preserve, promote, and utilize an historic new england farm for food production, education, and responsible community use.					Holcomb farm's community supported agriculture program encourages healthy living to the public through the practice and promotion of the sustainable production of fresh produce for families in the greater hartford area, educating the public through the use of an historic new england farm. Every year the fresh access program provides over five tons of fresh produce to over 1300 people with limited access and dietary needs.   holcomb farm's property preservation program raises funding for capital improvements to the property in support of the mission and the ongoing programs.				
The Noroton Fire Department Incorporated	http://	(203) 655-0653	EIN 22-2667419	1873 Post Rd	Darien	CT	06820	USA		The corporation is a 100% volunteer fire department providing 24 hour protection to the town of darien in the state of connecticut and to neighboring towns.					The corporation is a 100% volunteer fire department providing 24 hour protection to the town of darien in the state of connecticut and to neighboring towns.				
Prospect Bible Chapel	http://		EIN 22-2627063	576 Prospect Ave	Hartford	CT	06105	USA											
Hartford Dispensary	http://	(860) 643-3200	EIN 06-0646665	335 Broad Street 3rd Floor	Manchester	CT	06040	USA		Provides highly specialized health & rehabilitative services exclusively geared towards treatment of chronic opiate addiction (primarily heroin) through methadone treatment. Services include medical, pharmacy, psychiatric nursing health education, counseling (individual, family and group) and aids related activities.					Provides treatment and counseling services to narcotic addicts: the hartford dispensary provides highly specialized health & rehabilitative services exclusively geared towards treatment of chronic opiate addiction (primarily heroin) through methadone treatment. Services include medical, pharmacy, psychiatric nursing health education, counseling (individual, family and group) and aides related activities.				
Save the Kid Fund Inc	http://www.savethekid.org/		EIN 06-1158140	33 Stanton Lane	Preston	CT	06365	USA	Philanthropy, Philanthropy, Charity & Voluntarism Promotion										
Cenconn Healthcare Inc	http://		EIN 22-2836007	100 Grand St	New Britain	CT	06052	USA	Community Health Systems, Health										
Voice For Joanie Inc	http://www.voiceforjoanie.org		EIN 06-1388161	5 Glenwood Rd	New Milford	CT	06776	USA	Health, International, Nerve, Muscle & Bone Diseases, Unknown	Provide computer aided communications devices for people with als					Provide computer aided communications devices for people with als				
STRATFORD ANIMAL RESCUE SOCIETY (STARS)	http://www.stratfordanimalrescue.com/	(203) 494-4881	EIN 06-1596291	PO Box 1371	Stratford	CT	06615	USA	Animal-Related, Animals	Service the homeless animals of the Stratford community by providing the medical care and necessities needed for their survival as well as educating the community on humane treatment of all living things in the goal of abolishing future animal cruelty.	We started our humane education for children the earlier part of 2012 and with each session see an increase in attendees.  This shows the parents of the community are eager to teach their children how to prevent and extinguish animal cruelty.   Fundraising endeavors we have hosted have seen slow increases.  We hold an annual Fall Festival (http://starsfest.com) which last year had over 90 vendors and continues to grow.				Volunteering  Humane Education for Children *Future Programs:       Jr. Volunteer Program (Ages 13-17)       Summer Camp Program				
Essex Land Trust Inc	http://www.essexlandtrust.org	(860) 767-0410	EIN 06-6104076	Po Box 373	Essex	CT	06426	USA	Environment, Land Resources Conservation	Land conservation and management					The organization's primary exempt purpose is land conservation and management through research, environmental education, improvement, and the acquisition of undeveloped land for open space in essex, ct. The total value of the land it holds title to and maintains is over $5 million. Land under elt is open for passive recreation to the general public at no charge.				
