Howard Brown Health Center	http://www.howardbrown.org	(773) 388-1600	EIN 36-2894128	1025 W Sunnyside Ave200	Chicago	IL	60640	USA	Community Health Systems, Health	To promote the well-being of gay, lesbian, bisexual and transgender persons through the provision of health care and wellness programs, including clinical, educational, social service, and research activities. (continued in schedule o)				Medical: howard brown health center provides comprehensive, compassionate, nonjudgmental, and holistic primary medical care services including general check-ups, gynecological services, child wellness, hiv/aids treatment, and geriatric care. We receive funding from the health resources and services administration, illinois department of public health, chicago department of public health, aids foundation of chicago, private foundations, and other sources to provide care to 12,509 patients for 20,914 total visits, regardless of a patient''s ability to pay.   prevention: howard brown health center provides public education and awareness about hiv/aids and sti's via many channels, traditional and non-traditional. Our prevention team provides direct service delivery of hiv counseling and testing, partner and referral services, health information and public awareness campaigns. Currently we receive funding from many sources including state and local governments, corporations, and foundations. In fiscal year 2014, 5,629 patients accessed hiv/sti testing in the walk-in clinic.   youth services: howard brown health center provides an array of youth-specific services at the broadway youth center location. These services include resource advocacy, clothing vouchers, ongoing workshops, medical care, std/hiv testing, counseling, and support groups. We receive funding from federal, state and local governments as well as corporations and foundations to carry out these activities. In fiscal year 2014, the broadway youth center provided services to 1,817 unduplicated clients for 25,433 visits.					
Future CEO Business Academy	http://www.fceoba.org	708-842-2144	EIN 27-0990381	1200 Ring Road Unit 2548	Calumet City	IL	60409	USA		Our mission is to bridge the gap between business and education for high school students in Chicago and the surrounding suburbs.									
Feeding America	http://www.feedingamerica.org	(312) 263-2303	EIN 36-3673599	35 E Wacker Dr Ste 200	Chicago	IL	60601	USA	Disaster Aid, Disaster Preparedness & Relief Services, Food, Food Banks & Pantries, Food Programs	Feeding america's mission is to feed america's hungry through a nationwide network of food banks and engage our country in the fight to end hunger.				Food procurement - see schedule o  member services - see schedule o  research & analysis - see schedule o					
For Better Youth Inc	http://FORBETTERYOUTH.COM	(312)7752389	EIN 42-1546511	70 West Madison St.	Chicago	IL	60616	USA	Children & Youth, Youth Development Programs	Promoting Education Among Youth and their communities while building life -learning skills. leadership development and individual growth through health and prevention programs.		The Communities, Schools and Youths	Chicago/ West Africa	Peer Leadership & Violence Prevention Training, Youth Sports / A.T.O.D.A , Job Training , HIV/AIDS Education and Stress Management					
Midwest Young Artists Conservatory	http://www.mya.org	847-926-9898	EIN 23-7179740	878 Lyster Rd	Highwood	IL	60040	USA	Arts & Culture, Music, Symphony Orchestras	"To Build a Home with the Power of Music to Enrich the Lives of our Students and Community"	MYA has gone from a single orchestra with 50 members and rented spaces in 1993, to an organization that now serves over 1,000 young people annually with a permanent rehearsal space in Highwood, Illinois that houses 9 orchestras, 65+ chamber ensembles, dozens of Jazz ensembles including combos and Big Bands, a wind symphony, choral ensembles, early childhood education classes, music theory & history classes, festivals, summer camps, and national concerto & chamber competitions.	children and young adults learn life skills through performance in music ensembles	78 Communities in Illinois, Wisconsin and Indiana	Orchestra, Jazz Combos & Ensembles, Big Band, Chamber Ensembles, Early Childhood Music & Movement, Choral Ensembles and  Music Theory classes.	almost 1,000 students				
Camp of Dreams	http://www.campofdreams.org	312-649-5551	EIN 20-1384908	1235-A N. Clybourn Suite 362	Chicago	IL	60610	USA	Camps, Children & Youth, Health, Patient & Family Support, Sports, Youth Centers & Clubs, Youth Development Programs	Camp of Dreams is committed to providing ongoing and free enrichment programs during the hours in which youth are typically unengaged and needing meaningful interaction. What began as a summer camp for low-income Chicago youth quickly became a year-round endeavor as we realized that our participants would best benefit from a consistent, dynamic community. The year-round program ensures that our participants, who we call Dreamers, remain engaged, challenged and supported in a program that insists on accountability, respect and creative learning.	Each year, over 150 Chicago youth participate in Camp of Dreams programs, expand their horizons, learn substantive academic and artistic skills, and gain confidence in themselves as community leaders and great citizens. Ultimately, each of our participants, who we call "Dreamers" learns how to define a dream and how to accomplish it.		Chicago	Multi-week residential camp program and an ongoing school-year program	170 low-income children from underserved communities, and growing				
Metropolitan Family Services	http://www.metrofamily.org	312-986-4000	EIN 36-2167940	One North Dearborn	Chicago	IL	60602	USA	Children & Youth, Children & Youth Services, Family Services, Senior Centers, Seniors	Metropolitan Family Services empowers families to learn, to earn, to heal, to thrive. Part mentor, part motivator, part advocate, since 1857 Metropolitan Family Services has been the engine of change that empowers families to reach their greatest potential and positively impact their communities. Metropolitan is Illinois first comprehensive human services agency and reaches more than 68,000 families and individuals annually through seven community centers in Chicago, Evanston/Skokie, the southwest suburbs and DuPage County. Metropolitans services promote education, economic stability, emotional wellness and empowerment.		Individuals and families as diverse as the communities in which they live, with 81% being part of the working poor or lower-middle class.	Chicago, Evanston/Skokie, the Southwest suburbs and DuPage County	Four key service area in economic stability, education, emotional wellness and empowerment	68,435 Individuals				
Silent Stars Foundation	http://www.silentstars.org	847-644-6591	EIN 27-1726932	711 Indian Rd	Glenview	IL	60025	USA	Ear & Throat Diseases Research, Health	Bring awareness to Childhood Apraxia of Speech.  Raise funds for research and help provide much needed AAC devices to children who cannot afford one.		We are able to help Apraxic children US wide, but do concentrate in the Chicagoland area.							
The Humanitarian Service Project	http://www.humanitarianservice.org		EIN 36-3187979	465 Randy Rd	Carol Stream	IL	60188	USA	Human Service Organizations	The mission of the Humanitarian Service Project is to alleviate the pain and suffering poverty brings to children, elderly, and families living in DuPage and Kane Counties, IL.	In 2010, we served 6400 needy children, 556 low-income families and 120 impoverished senior citizens in our community.  Distributed over 273,000 lbs. of food and gifts.	Low-income children between the ages of 3-12 and families of these children;  needy senior citizens		Senior Citizen Project serves 120 impoverished seniors; Children's Birthday Project serves 750 needy children; Christmas Offering Project serves 456 families and 1200 children; Feed the Kids Project serves 100 low-income families; School Supplies Project serves 5200 needy children					
Pro Musica Youth Chorus	http://www.promusicayouthchorus.org		EIN 36-3738199	220 N. Euclid Avenue	Oak Park	IL	60302	USA		Make Life Sing!  Through Song, we learn, achieve, grow, and experience joy!		youth in kindergarten through high school grow through music	the near west suburbs of Chicago	exceptional music education, vocal technique and unique performance opportunities.	over 200 youths				
Stuart I Raskas Friendship Circle Of Illnois Nfp	http://www.thefriendshipcircle.net	(847) 943-9770	EIN 20-4884060	3068 Antelope Springs Rd	Northbrook	IL	60062	USA	Arts & Culture, Children & Youth, Cultural & Ethnic Awareness, Developmentally Disabled Centers, Disabilities, Youth Community Service Clubs	To provide peer companionship to developmentally disabled children and teenagers.				The organization's program's for pairing disabled children and teenagers with peers has expanded and is very successful. Many of the volunteers continue to see their "buddies" throughout the year and on their own time. Both the volunteers and their charges feel a strong bond and sense of accomplishment.					
Paws Chicago	http://www.pawschicago.org	(773) 935-7297	EIN 36-4219778	1997 N Clybourn Ave	Chicago	IL	60614	USA	Animal Protection & Welfare, Animal Services, Animals	Paws chicago's mission is to build no kill communities, starting with a no kill chicago; to end pet overpopulation; and to transform animal welfare by setting higher standards. Since its founding, the number of pets killed each year in chicago has been reduced by 77 percent. Paws chicago's lifesaving success is rooted in the no kill model, which can be replicated and scaled in any community. The foundation of all lifesaving is community engagement. By raising awareness about pet homelessness and engaging people in lifesaving efforts, we can make lasting change for animals. Paws chicago's mission-critical programs - our no kill pillars of prevention, adoption, animal health & behavior, and volunteers -- sit atop this foundation. These are the robust programs that are essential to building no kill communities.				Animal health & behavior:committing to the life of each treatable pet and providing all medical treatment and behavioral enrichment needed to optimize health and wellbeing is one of the most critical elements of no kill. Because of our expert veterinary and behavior teams, we are one of the few shelters in the country that can treat and rehabilitate a large volume of sick, injured and behaviorally challenged animals. In 2014, we had a 97. 37 percent save rate, even while taking in a vulnerable population of animals. Shelter medicine: the medical center-the first stop for homeless animals when they arrive at paws-treats the most serious cases onsite. We also utilize a robust foster network for pets receiving more simple treatment. In 2014, thousands of animals were treated at our medical center-2,191 pets had upper respiratory infections alone-and 3,467 pets went into foster care. More than 41,000 vaccinations, microchips and blood tests were provided in 2014. Training & behavior enrichment: in 2014, we celebrated the opening of our training & foster care center. This 3,000 square-foot space is now home to our innovative dog training and enrichment programming and a hub to expand our geographic reach to new foster families. Through this center, our team of behavior professionals and trained volunteers provide our homeless dogs with one-on-one and group training, agility and enrichment. And it's making an impact. In 2014, 122 behaviorally challenged dogs found new loving homes. Expanding the medical center: with the progress we are seeing in chicago, healthy animals are being saved in record numbers at the city pound, which means we are seeing a sicker population of animals in need of rescue, requiring enhanced medical resources to treat. To save more lives, paws chicago is launching a major expansion of our medical center and shelter medicine program to triple our capacity to take in, isolate and treat sick and injured animals.   prevention & spay/neuter:spay/neuter services: with the paws chicago lurie clinic located in little village and the gusmobile spay/neuter van, which brings life-saving solutions directly to neighborhoods most in need, we performed 18,290 spay/neuter surgeries in 2014. Seventy-two percent of client surgeries were provided free of charge. Preventing unwanted pets from being born is key to building a no kill chicago. The majority of stray, feral and unwanted pets originate in low income, under resourced communities. Important pet resources like free spay/neuter surgeries, information on pet care and training and affordable medical care are all necessary ingredients to reducing pet homelessness and building a humane community. Trap-neuter-return program: paws chicago's feral cat trap-neuter-return (tnr) program is critical aspect of our targeted spay/neuter approach. It is aimed at proactively sterilizing and managing the free roaming cat population, the source of thousands of unwanted kittens born each year. Tnr reduces the number of animals entering the sheltering system each year while also saving kittens and finding them adoptive homes. In 2014, paws performed 4,763 spay/neuter surgeries on feral cats. Outreach efforts: expanding our reach and meeting people who would never knew about paws chicago's support and resources is the key objective of our outreach efforts. In late 2014, we launched two paws for life outreach programs to connect families in need with resources and information to help them better care for their pets. Our first neighborhood of focus was englewood, where more than 49 percent of the population lives below the poverty line. The team achieved spay/neuter conversion rate of 89 percent of all unaltered pets they met. We also began counseling and offering resources to individuals coming to the city pound (animal care & control, or acc) to give up their pets, preventing animals from entering the sheltering system.   adoption:rescuing homeless pets and uniting them with their new families is at the forefront of what we do. Through paws chicago's adoption centers, offsite events and innovative programming, 5,952 animals found loving homes in 2014. While saving pets from the local community is paws chicago's primary mission, because of the progress we have made in chicago, we are able to rescue at risk animals from other states. Our dog spay/neuter efforts have been so successful that in chicago all the puppies at the city pound are being rescued, and there are more families wanting puppies than the chicago rescue community can provide. To meet adoption demand, we have developed relationships with groups in tennessee, oklahoma and mississippi to save puppies who would otherwise be killed. Pippen fasseas adoption center: the pippen fasseas adoption center in lincoln park, which opened in 2007, redefined animal sheltering as the first cageless, state-of-the-art, no kill shelter in the midwest. Innovative on-site adoption events like our spring and holiday 36-hour adopt-a-thons raise awareness and bring in the community, resulting in more lives saved. Glenn l. Felner adoption center: paws chicago's first satellite adoption facility-the glenn l. Felner adoption center- opened in december 2014 in highland park. The opening of the north shore center represents an important step in paws chicago's mission to expand lifesaving and build no kill communities. Located inside the highland park petco, the center was responsible for 76 adoptions in its first month of operation. In 2015, we are working to find new families 500 additional homeless pets. Offsite adoption events: through our angels with tails off-site adoption events in chicago and various suburban locations, we bring adoptable animals to high-traffic shopping centers and retail stores where people will stop, play with the animals and think about adopting. Paws chicago also hosted additional offsite adoption events almost every weekend during 2014.					
Frank Lloyd Wright Trust	http://www.flwright.org	312-994-4000	EIN 23-7414937	209 S. LaSalle, Suite 118	Chicago	IL	60604	USA		The mission of the Trust is to engage, educate and inspire the public through interpretation of Frank Lloyd Wrights design legacy and preservation of his original sites for future generations.		Engaging a broad and diverse local, regional, national, and international audience through a dynamic cultural tourism program, a comprehensive and interactive website, and consistent marketing and communications initiatives.	Inspiring our audience through powerful aesthetic experiences of authentic Wright sites, preserved to Wrights original design vision.	Affirming the contemporary relevance of Wrights design legacy by educating K-12 students through innovative design programs that nurture individual vision; by presenting quality adult enrichment programs, national/international travel programs; and by producing electronic/print publications.					
Midwest Pesticide Action Center	http://www.midwestpesticideaction.org	(773) 878-7378	EIN 36-4361525	4611 N. Ravenswood Suite 107	Chicago	IL	60640	USA	Environment, Health, Public Health	Midwest Pesticide Action Center is dedicated to reducing the health risks and environmental impacts of pesticide use by promoting safer alternatives.		human health and the environment		Since our inception in 1994, MPAC (formerly SPCP) has been working on reducing pesticide exposures to children. We do this by promoting Integrated Pest Management (IPM) as a best practice. MPAC advocated for one of the nation's first laws to require IPM in Schools and Childcares. Since that time, we have collaborated on training teachers, administrators, engineers, childcare workers and others on IPM. We won a EPA Environmental Justice Award in 2008 for our childcare program. In 2009, we helped write and lobby for new and improved legislation that requires stricter protections for chemical lawn care applications on the grounds of schools and childcares. This program provides training and education on IPM to a critical audience and serves as a model for other states.   In 2010, MPAC was awarded a three-year EPA grant to reduce pollution in the Great Lakes by promoting natural lawn care and sustainable landscapes in the region - to cities, landscapers, and homeowners.					
Childrens Home & Aid Society of Illinois	http://www.childrenshomeandaid.org	312-424-0200	EIN 36-2167743	125 S Wacker Drive Suite 1400	Chicago	IL	60606	USA	Children & Youth, Children & Youth Services, Family Services, Human Service Organizations, Human Services	Children''s Home + Aid's mission is to give children help, hope and opportunity. The agency''s vision is to build a better life for children, youth and families.	FY11 Outcomes:  Family Centered Services--Protecting children from abuse, strengthening families and providing safe, permanent and loving homes. (1) Foster Care: 1006 abused and neglected children were kept safe in foster homes. (2) Adoption Services: 80 children were united with loving, adoptive parents. (3) Intact Family Services: 945 children and 418 parents and caregivers benefitted from services to stabilize families that have suffered abuse, neglect or extreme hardship.  Early Childhood Services--Building a strong foundation for a lifetime of learning (1) 919 children at risk of academic failure received vital early care and education to promote school readiness and healthy development at our five Child + Family Centers. (2) 22,750 parents and children were helped to access affordable, high-quality early childhood care and education.  Clinical and Community Services--Advancing the success of children, youth and families (1) Child and Family Counseling: 1,858 fragile children were strengthened through counseling. (2) Parent Support: 2,634 parents were helped to build their parenting skills and learn about their childs development, benefitting 1,371 children. (3) Residential Services: 67 emotionally troubled children were helped to heal from abuse, neglect and other trauma through intensive 24/7 therapeutic residential care. (4) Youth Services: 2,802 at risk youth received help to ensure their success at home, in school and in their community.	Low-income, at-risk children and families throughout the state of Illinois.	The entire state of Illinois with administrative offices in Chicago, Rockford, Bloomington and Granite City, Illinois.	Founded in 1883, Childrens Home + Aid is a leading child and family service agency in Illinois. Each year, it protects, educates and counsels more than 40,000 children, youth and families. For over 125 years, Childrens Home + Aid has been recognized for establishing best practices and achieving outstanding results through its programs and services that focus on child abuse prevention, healthy child development and strengthening families. Childrens Home + Aids mission is to give children help, hope and opportunity. Its vision is to build a better life for children, youth and families. Childrens Home + Aid programs are organized under three practice areas: Early Childhood Care and Education, Clinical and Community Services and Family-Centered Services.   Early Childhood Care and Education is one of Childrens Home + Aids largest programs, serving over 1,200 low-income children each year. The agency operates five Early Childhood Centers located in Chicago, Palatine, Carpentersville, Schaumburg, and Bloomington. Each location provides priority enrollment to children considered at-risk, including children of adolescent parents, victims of child abuse and/or neglect, and children from very low-income households.  Clinical and Community Services encompass youth services, residential services, parent support and child and family counseling. The agencys Community Schools Initiative serves 1,500 K-8th grade children across ten schools through mental health and after school enrichment programs. In many cases, children served at the agencys early childhood centers transition into the neighborhood schools where the agency is a partner. After-school programming emphasizes academic support, visual and performing arts, recreation, and leadership development. Childrens Home + Aid also provides community-based clinical counseling services to children and families. The agency addresses the mental health needs of youth in medically under-served communities where mental health and social-emotional problems frequently go undiagnosed and untreated.   Family-Centered Services incorporate foster care, adoption and intact family services. Intact family services and adoption preservation keep families together through child protective services, family preservation and reunification and extended family support. Foster care serves children whose families are unable to care for them due to a crisis. The children are placed in a temporary safe haven until they may be returned to their biological families or until a permanent, loving home can be found. Children's Home + Aid provides foster care services to over 1,200 children each year.	40,000+ children, youth and families				
Operation Support our Troops America	http://www.osotamerica.org/	(630) 971-1150	EIN 20-4275756	1807 S Washington St Ste 110	Naperville	IL	60565	USA	Military & Veterans Organizations, Veterans	To support the morale and well-being of american forces by providing comfort, resources, and education to them and their families both while they are deployed in harm's way and after their return.				Sent care packages of items that are not readily available to our troops in deployed locations, along with letters, cards, and notes of support from the community at large. Nearly 5,300 care packages were sent to our troops during 2014 and approximately 55,000 to date. Over 11,900 volunteer hours were donated to the organization for this program during 2014.   support other organizations with the similar purpose of supporting our troops in harms way and supporting returning veterans.   "leap of faith" is a three day seminar and healing experience based on the idea that those families of fallen service members could live life fully and in a way that honors the life of their service member, despite their terrible loss. The seminar teaches new ideas about the grieving process, coping skills to keep moving forward, healthy living and encourages participants to strive to make a difference in the country for which their loved one had sacrificed his/her life.					
Lungevity Foundation	http://www.lungevity.org	312-464-0716	EIN 36-4433410	228 South Wabash Avenue  Suite 700	Chicago	IL	60604	USA		LUNGevity Foundation is firmly committed to making an immediate impact on increasing quality of life and survivorship of people with lung cancer by accelerating research into early detection and more effective treatments, as well as providing community, support, and education for all those affected by the disease.	Since 2002, LUNGevity has funded 115 scientific research projects at 58 institutions in 23 states.  Whether we are supporting early-career scientists or established researchers, we work with top lung cancer experts to identify and fund promising and innovative research into the early detection and targeted treatment of lung cancer.	anyone impacted by lung cancer	lung cancer research, education, information, survivorship, support, events	Research funding, education thru our comprehensive website, lung cancer 101, webinars and expert videos, Lung Cancer Support Community Message Boards, LifeLine Support Program, , online Survivor Resource Center and Caregiver Resource Center, Voices of Hope Videos, National and Regional Hope Summit survivorship conferences and a national grassroots events program.	people impacted by lung cancer				
