Teen Living Programs, Inc.	http://www.teenliving.org	312-568-5700	EIN 36-2867274	162 W. Hubbard St. Suite 400	Chicago	IL	60640	USA	Children & Youth, Children & Youth Services, Homeless & Housing, Homeless Shelters, Youth Development Programs	Teen Living Programs mission is to create hope and opportunity for youth who are homeless by assisting them to permanently leave the streets, secure stable housing, and build self-sufficient, satisfying lives.	For the past five years: about 60% of youth in our stable housing program have obtained and maintained stable housing for six months after program exit; about 60% enrolled in or had completed formal educational programs by program exit; and about 75% had gained employment, with about 25% maintaining it for at least six months after program exit.		Chicago	Residential programs - the bronzeville youth shelter is an emergency shelter for minor-aged youth ages 14-17 that provides a safe, healing environment with a goal to reunite these youth with their families or guardians if safe and appropriate, or to secure alternative living arrangements. Belfort house, a transitional living program for youth ages 17-23, where residents stay for up to 18 months and create individual action plans to help them achieve their goals. Cassa is tlp's independent living program for youth ages 18-24 where young adults live in their own apartments for up to two years while still maintaining access to case management and supportive services.   outreach, prevention and aftercare - these programs meet the immediate basic needs of youth and provide crisis intervention, as well as connecting youth with community resources, including the full complement of tlp programs. Clients range in age from 12-24 and can access crisis counseling, case management, referrals and access to a range of support services via a 24/7 hotline, street and community outreach, drop-in center and aftercare services.   supportive services - youth in residential programming have access to primary care at the on-site clinic, while all clients receive whole health counseling, education and referrals for primary and preventative care, mental health, substance abuse counseling, and more. Education and assessment are provided on-site, and youth receive individualized attention, advocacy, encouragement, study skills tips, tutoring, and referrals to alternative and/or traditional schools and programs. Employment supports youth with limited job skills and history through an intensive program to develop job readiness. Youth with more significant work experience are offered guidance in job searches, placement, and retention. Tlp also offers recreation activities to help young people identify healthy, positive outlets, develop interpersonal skills, self-esteem, and purpose as they transition into independent adults.	More than 500 youth per year				
Myanmar Hope Christian Mission, Inc.	http://www.myanmarhope.org	217-415-9187	EIN 26-0324244	624 Garvey Ln	Chatham	IL	62629	USA	Economic Development, International, International Agricultural Development, International Economic Development, International Relief, Microfinance	We are working to restore hope to the people of Myanmar by working to eliminate poverty, suffering, disease, and illiteracy.				Education: hope boarding school/tamu preschool - provided a much improved educational experience for children from poor families  special projects - disaster relief/church rebuilding - church rebuilding in tingkaya, fire house rebuilding, purchase church properties in homalin and nomihan  pastor support program - provided regular support to local churches whose members are too poor to support their own pastors and elders  provide food, disaster relief, medical need and native language bibles, leadership training and equipment language bibles, leadership training and equipment					
Karam Foundation NFP	http://www.karamfoundation.org	(312) 404-8444	EIN 37-1548241	230 Northgate Street, #742	Lake Forest	IL	60045	USA	Philanthropy, Refugees	Karam Foundation is a non-profit organization dedicated to help people help themselves. We seek to restore the dignity and quality of life for people affected by conflict by eliminating barriers to success through innovative education, entrepreneurial development, and community-driven aid. Guided by the aspirations of the people we serve, we pursue this mission with compassion, transparency, and generosity.		Syrians in need.	the United States	innovative education, smart aid, and sustainable businesses for Syrian children, youth, and families.	thousands of Syrians inside Syria and in neighboring countries. We provided food baskets, medical supplies, soccer balls for refugees, milk for infants, and support for hundreds of families displaced by the violence.				
Barrel of Monkeys Production	http://www.barrelofmonkeys.org	(773) 506-7140	EIN 36-4283300	2936 N. Southport Ave.	Chicago	IL	60657	USA	Arts & Culture, Arts, Culture & Humanities, Performing Arts	Barrel of Monkeys (BOM) is an ensemble of actors-educators that creates an alternative learning environment in which children share their personal voices and celebrate the power of their imaginations. BOM accomplishes this through creative writing workshops and in-school performances of children''s stories. BOM also engages the broader community in the visions of children though public performances of their work.BOM achieves this mission by:* Teaching fundamental creative writing skills* Providing a safe and supportive learning environment* Building self esteem and confidence in children*Adapting stories written by children for the stage by professional actors* Presenting a smart, funny theatre experience.* Building a community that respects the value of each child''s personal and artistic contribution, and the diversity of his or her perspective.BOM strives to build a community that champions the vision of every child as a way to develop young people who believe in themselves.		Students in under-served Chicago public elementary schools.	Chicago IL	Barrel of Monkeys goes into select Chicago Public School classrooms once a week for six week to lead creative writing workshops. At the end of each workshop, the BOM performers adapt some of the children's stories for an original stage performance.	950				
Rockford Rescue Mission Ministries	http://www.rockfordrescuemission.org		EIN 36-6132381	715 W State St	Rockford	IL	61102	USA	Education, Educational Services, Homeless & Housing, Homeless Shelters, Human Services, Thrift Shops	Rockford Rescue Mission shares hope and help in Jesus'' name to move people from homelessness and despair toward personal and spiritual wholeness.				Rockford Rescue Mission provides free services of food, shelter, clothing, education and case management to the homeless and working population of Northern Illinois and Southern Wisconsin.					
B E D S Inc	http://www.bedsonline.org		EIN 36-3741040	Po Box 2035	La Grange	IL	60525	USA	Homeless & Housing, Homeless Centers, Homeless Shelters, Unknown	BEDS emergency overnight shelter has three strategic goals: 1) Maintain quality service to the homeless 2) inform the public regarding issues of homelessness, and 3) help people regain self-sufficiency.  Eight local churches provide sites for our shelter and about 800 volunteers assist 250-300 people annually.									
American Porphyria Foundation	http://	(708) 246-9406	EIN 36-4401266	Po Box 326	Western Sprgs	IL	60558	USA	Education, Educational Services	Porphyria education and research.				Porphyria education and research - dissemination of information to thousands of individuals affected by porphyria and grants to physicians for research					
Its A Pittie Rescue	http://		EIN 45-1563172	Po Box 383	Peotone	IL	60468	USA	Animal Protection & Welfare, Animals	Rescue animals from abusive situations; provide medical care, training and boarding for animals awaiting adoption				Rescue animals and provide boarding training and medical care to animals awaiting adoption					
Thaakat Foundation	http://www.thaakat.org	18479463549	EIN 33-1212566	118 Fairfield Dr Attn: Thaakat Foundation	Romeoville	IL	60446	USA	Economic Development, Human Services, International, International Economic Development, International Relief, Microfinance, Philanthropy, Voluntarism Promotion	Our mission is to promote charitable giving among students and young professionals in the global community; to drive a movement of creative altruism, unparalleled giving and preservation of diversity and culture; to bring hands on volunteerism to our local communities and hope to our global society; and to create and maintain a diverse community that learns through multiple perspectives.	For a list of our projects and their results, please visit http://www.thaakat.org/our-divisions/		Local, National, Global		3-500				
Rescu Foundation Inc	http://www.RESCUfoundation.org	800-374-9215	EIN 31-1606346	Renaissance Entertainers Services Crafters United 2206 N. Main St   #223	Wheaton	IL	60187	USA	Emergency Assistance, Health, Health Support	The RESCU Foundation is a non-profit organization established to promote and maintain the health and medical well-being of the participants of Renaissance Faires, historical performances and other artistic events through financial assistance, advocacy, education and preventative programs.			nationwide	Assisted with medical expenses of eligible participants.   assisted with advocating lump sum payments to lower medical expenses of eligible participants.   provided health education programs and services for eligible participants.					
Saving Tiny Hearts Society	http://www.savingtinyhearts.org	(847) 607-0177	EIN 20-5505536	1000 W Irving Park Rd Ste 200	Itasca	IL	60143	USA	Philanthropy, Public Foundations	Saving tiny hearts was established to raise seed money for grossly under-funded, lifesaving grassroots research of congenital heart defects. The money raised is used to award lifesaving research grants to help prolong, improve, and save the lives of children born with congenital heart defects.				Provide funds for research of congenital heart defects in newborn babies.					
Prevention Force Family Center	http://www.pffc.blogspot.com	773 826-5543	EIN 36-4117158	3333 W. Arthington, Ste 150I	Chicago	IL	60624	USA	Children & Youth, Family Services, Job Training, Youth Community Service Clubs, Youth Development - Business	Prevention Force Family Center (PFFC) is a not-for-profit community based organization established in 1996. PFFCs mission is to provide educational, youth, entrepreneurial, and job readiness training programs and services that help low-income individuals, youth,  and families become self-sufficient, responsible, and productive residents of the community.PFFC has four objectives: 1) To develop and implement programs and resource/referral services to community residents who live in underserved communities;2) To develop entrepreneurial training programs for youth and individuals who live in low income communities.3) To collaborate with schools, youth organizations, churches, community groups and businesses on providing comprehensive programs and social services to low income families who live in underserved communities; and4) To conduct business workshops and seminars and to provide technical assistance services that will assist the entrepreneurs, businesses and grassroots organizations with the necessary tools to make their businesses successful.			Austin, North Lawndale, East and West Garfield communities in Chicago IL						
Family Network, Inc.	http://		EIN 36-3219968	330 Laurel Avenue	Highland Park	IL	60035	USA	Family Services, Human Services										
Clearbrook	http://www.clearbrook.org	(847) 870-7711	EIN 36-2420176	1835 W Central Rd	Arlington Hts	IL	60005	USA	Children & Youth, Children & Youth Services, Developmentally Disabled Centers, Disabilities, Human Services, Residential Care & Adult Day Programs	Clearbrook provides residential and other services to individuals with developmental disabiliities.				Four intermediate care facilities providing 24 hour care for 140 developmentally and physically disabled adults, including nursing, dietary, medical and recreational activities.   group homes serving 201 adults with developmental and physical disabilities, providing residential services in cila, sla and home settings with direct service support up to 24 hours per day.   day programs for developmentally disabled adults, serving 47 plus clients including sheltered workshop, developmental training, employment services training, and transportation services.   childrens (0-3) services, family community rescource center, respite care for 100 plus developmentally disabled children as well as clinical and therapeutic services. Also provides assessments and case coordination services as well as state required staff training.					
Hadley School for the Blind	http://www.hadley.edu	(847) 446-8111	EIN 36-2183809	700 Elm St	Winnetka	IL	60093	USA	Adult Education, Education, Special Education	The mission of The Hadley School for the Blind is to promote independent living through lifelong, distance education programs for people who are blind or visually impaired, their families and blindness service providers.									
The Night Ministry	http://www.thenightministry.org	(773) 784-9000	EIN 36-3145764	4711 North Ravenswood Avenue	Chicago	IL	60640	USA	Children & Youth, Children & Youth Services, Citizen Participation, Homeless & Housing, Homeless Shelters	The Night Ministry is a Chicago-based organization that works to provide housing, health care and human connection to members of our community struggling with poverty or homelessness. With an open heart and an open mind, we accept people as they are and work to address their immediate physical, emotional and social needs while affirming their sense of humanity.  Through The Night Ministry's Health Outreach Bus, Youth Outreach Van and Youth Shelter Network, we work on the ground in Chicago neighborhoods to reach adults, teens, pregnant and new moms who have nowhere else to go.	The Night Ministrys programs served over 5,000 individuals: our Outreach and Health Ministry Program provided vital health care and support services to 4,610 individuals of all ages, and our four Youth Shelter Programs provide shelter and support services to 450  youth and 44 of their children.	homeless, precariously housed and vulnerable youth and adults.	Chicago	Three housing programs in two youth shelters, where young people without a home can also bring their children.  A specially outfitted Health Outreach Bus that makes scheduled stops to six Chicago neighborhoods, rain or shine.  A Youth Outreach Team that visits two neighborhoods, providing food, hygiene kits, and referrals.	more than 5,000 unduplicated over the past year.				
The Aparecio Foundation	http://www.apareciofoundation.org	312-957-6094	EIN 	P.O. Box a3938	Chicago	IL	60690	USA		The Aparecio Foundation is a registered, non-profit, 501(c)(3) charity.  Every dollar donated goes toward our mission to fund mentoring, academic assistance, and scholarship programs for high-potential, low-income women in Chicago Public High Schools.		Low-income, high potential women in Chicago Public High Schools.	Chicago						
Artreach Chicago	http://www.artreachchicago.org	773-907-0841	EIN 36-3639885	4401 N Ravenswood	Chicago	IL	60640	USA	Education	ArtReach empowers and connects people through the practice of visual arts.			Chicagoland area	ceramic, mosaic, mixed media art programming	over 2000 participants gain access to high quality arts programming				
Moore Place	http://		EIN 83-0494419	P.O. Box 09737	Chicago	IL	60609	USA	Domestic Violence, Family Violence Shelters, Homeless & Housing										
Niagara Foundation	http://		EIN 26-4443012	205 N Michigan Ave	Chicago	IL	60601	USA	Arts & Culture, Cultural & Ethnic Awareness										
Chicago Public Library Foundation	http://www.cplfoundation.org	(312) 201-9830	EIN 36-3480353	20 N Michigan Ave Ste 520	Chicago	IL	60602	USA	Arts & Culture, Education, Single Organization Support	The Chicago Public Library Foundation supports collection development, programs and technology initiatives that connect library users to their community and to the world and ensure that all Chicagoans have the freedom to read, to learn and to discover at the Chicago Public Library.				Help children build academic success and a love of reading through summer learning challenge, teen learning, early literacy, great kids read, science connections and teachers in the library.   provide funding for public access to information resources and technology, including cybernavigators, as well as initiatives to keep the chicago public library relevant to the lives of all chicagoans.   expand library collections and create opportunities to discuss books and ideas through programs such as one book, one chicago.					
Chicago French Bulldog Rescue Inc Nfp	http://www.frenchieporvous.org		EIN 26-1885995	201 W Lake St Ste 118	Chicago	IL	60606	USA	Animal Protection & Welfare, Animals	Provided public education to raise awareness of responsible dog ownership by attendance and participation in public events includign chicago english bulldog rescues bully bash, international kennel club's dog show and chicago french bulldog meetup events.				Provided public education to raise awareness of responsible dog ownership  provided public education to raise awareness of responsible dog ownership by attendance and participation in public events includign chicago english bulldog rescues bully bash, international kennel club's dog show and chicago french bulldog meetup events.					
Evanston Environmental Association	http://www.evanstonenvironmental.org	(847) 448-8256	EIN 36-2885867	2024 McCormick Blvd	Evanston	IL	60201	USA	Environment, Environmental Education	Environmental interpretation and stewardship				The association strives to expand the community's enjoyment and understanding of nature and to bring about wise use of natural resources through environmental education for people of all ages.   the association strives to expand the community's enjoyment and understanding of nature and to bring about wise use of natural resources through environmental education for prople of all ages.					
Oak Park River Forest Food Pantry	http://		EIN 27-2018997	848 Lake St	Oak Park	IL	60301	USA	Food, Food Banks & Pantries										
Variety the Children's Charity of Illinois	http://www.varietyofillinois.org	312 822-0660	EIN 36-1908475	1001 W. 75th Strett # 153	Woodridge	IL	60517	USA	Children & Youth, Developmentally Disabled Centers, Disabilities, Human Services	Improve the quality of life for children and young adults (up to 21 years of age) with disabilities by providing the equipment and experiences needed to reach their highest potential.	"Kids on the Go" has impacted hundreds of children and their families.  The best results are described by the following examples:  Jackson who at the age of 8 suffered a stroke and spent his recovery at the Rehabilitation Institute of Chicago. His ability to walk again required a walk aide (not covered by medical insurance) that was granted by Variety of Illinois. During his stay he developed a friendship with Senator Kirk and together they have participated in Battle Buddies as an effort to share stories of victory for IL residents with disabilities. OR this letter from Nicholass mom, who wrote:  We cant thank you enough or find the words to express how EXCITED Nicholas was to be able to pick out a bike for himself. Finally! He wanted a bike of his own his WHOLE LIFE. While Nicholas was trying the bike, he had a look on his face like he finally had a little bit of freedom! He was so happy and it warmed our hearts! The "Live to Achieve" was established in 2012.  Since its inception, the program has supported the attendance of over 100 children at the Adaptive Sports Camps run in cooperation with the Chicago Park District. 25 athletes have been granted up to $1,000 in support of attendance at wheelchair basketball camps and tournaments, wheelchair track and field training programs and tournaments; goal ball camp and sled hockey camp. We have provided grants to 5 elite and Paralympic hopeful athletes to enable them to pursue their dreams. One of our first Live to Achieve recipients, Hailey Daniscewicz has qualified for the debut of the Paratriathalon at the Paralympics in Rio de Janiero in 2016.	Disabled children and young adults up to the age of 21	Illinois	"Kids on the Go" that provides funding for mobility and other enabling equipment that improves a child's well-being , quality of life, community involvement and confidence. Examples of funded equipment include adaptive bicycles, wheelchairs, strollers, walkers, standers, gait trainers and posturing devices. As adaptive bicycles comprise 60% of our requests, we are currently running a campaign called "Build A Bike" that enables individuals to donate one or more  pieces of the specialized equipment needed to customize a bike. "Live to Achieve" a groundbreaking grant program, established in 2012, that enables children and young adults between the ages of 8 and 21 with physical disabilities to pursue their dreams of participation in sports activities at both recreational and elite levels. The program provides grants of up to $1,000 to eligible applicants.  Program support includes participation at Variety of Illinois Adaptive Sports Camps in cooperation with the Chicago Park District Adaptive Sports Camps, trying out a new sport by attending wheelchair basketball camp or travel and training for elite level competition on World and National stages, including the Paralympics.  "Kids at Play" enable children to experience programs and events that enable personal growth, development and enjoyment.  Examples include: support of the 6 specialized camps run in August of each year for special needs children in cooperation with the Chicago Park District; Special Movie Screenings of newly released childrens movies; support for children and their families to attend National Lekotek to aid in their development and family interaction skills; Everyone at Play days at the Kohl Childrens Museum; dedicated hours for the enjoyment of carnival rides for special needs children and their families; an adapted Knight Training program at Medieval Times;	over 500 families in Illinois				
