Adat Yeshua Synagogue	http://	(504) 701-4848	EIN 72-1365396	1501 Hickory Ave.	Harahan	LA	70123	USA	Judaism, Religion	Adat Yeshua New Orleans welcomes Jewish and Non-Jewish people to find a spiritual home in Messianic Judaism.	Greater New Orleans Area, as well as Southern Louisiana		Jewish, Non-Jewish, Non-Jewish with Jewish ancestry		We now have Friday evening Erev Shabbat Service (7pm) and Shabbat Shacharit Service (10am Saturday morning). Children's Shabbat School is offered  for all ages to help children grow in their understanding of Torah, Judaism, and Messiah.. We also sponsor  the Mashal Learning Institute, which is for Messianic Jewish and Jewish Studies- one does not have to attend services to attend classes, and classes are open to all.	
Celebration Worship Ctr Assembly Of God	http://		EIN 72-1376976	3231 Highway 27 S	Sulphur	LA	70665	USA								
Amateur Athletic Union Of The United States Inc	http://		EIN 80-0290203	818 Tabernacle St	Denham Spgs	LA	70726	USA								
New Life Assembly Of God	http://		EIN 52-1682244	Po Box 1455	Olla	LA	71465	USA								
Melrose East Interfaith Corporation	http://		EIN 72-1411968	9340 Florida Blvd	Baton Rouge	LA	70815	USA	Children & Youth, Youth Development - Religious Leadership							
ROMANS WINGS OF HOPE	http://www.romanswingsofhope.com	337-739-5597	EIN 47-1367663	PO Box 380	Youngsville	LA	70592	USA	Emergency Assistance	Our mission is to provide HOPE when HOPE seems lost, assisting families after the loss of a child	Louisiana	HOPE bears free of charge to those facing stillbirth and infant loss by giving them something tangible to hold, placing Cuddle Cots into hospitals (a cuddle cot is a medical cooling unit disguised within a mosses bassinet that preserves a stillborn child up to 72 hours allowing parents time to say hello and time to say goodbye) providing financial assistance for grief counseling, providing hospitals with memory boxes, angel gowns and hats and blankets for stillborns	assist families after the loss of a child	1025 HOPE bears into empty arms, 3 cuddle cots, 150 memory boxes, 70 angel gowns, 483 blankets and hats	Ten Cuddle Cots are now in the State of Louisiana, over 3500 HOPE bears have gone into empty aching arms, over 500 blankets have been donated to hospitals, 250 miscarriage packages have gone out. We are your National Presidential Point of Light Winners, Acadiana Hero-May 2015, Star Legacy Foundation Nominee	
Volunteer Svcs Council Of The La School For Visually Impaired Inc	http://		EIN 72-0977412	Po Box 64825	Baton Rouge	LA	70896	USA		To provide services, materials, equipment, projects and programs to augment the education and independent functioning of visually impaired and blind students who attend or are associated with the Louisiana School for the Visually Impaired which cannot be provided by state appropriations or regulations. The state school had in excess of 130 studendts participating in the various activities and functions during the year 2007.						
Christian Challenge Inc	http://		EIN 72-0942780	300 Pearce Rd	Pineville	LA	71360	USA								
Spay-Mart Inc	http://		EIN 72-1418016	C/o 732 Roseland Pkwy	Harahan	LA	70123	USA	Animal Protection & Welfare, Animals							
Camerons Shoes Foundation Inc	http://		EIN 45-2839744	8559 Foxfield Dr	Baton Rouge	LA	70809	USA	International, International Relief							
The Civil War Round Table Of New Orleans Inc	http://		EIN 72-1011936	1230 Washington Ave	New Orleans	LA	70130	USA								
New Covenant Fellowship Of Slidell, Inc.	http://		EIN 72-1130952	509 Driftwood Cir	Slidell	LA	70458	USA								
Pta Louisiana Congress	http://www.lapta.org/		EIN 51-0193164	Allemands Elementary PTA 1471 Wpa Rd	Des Allemands	LA	70030	USA	Education, Parent & Teacher Groups	The mission of the Lousiana PTA is to support and speak on behalf of children and youth in the schools, in the community, and before governmental agencies and other organizations that make decisions affecting children; to assist parents in developing the skills they need to raise and protect their children; to encourage parent and public involvement in the public schools of this nation.						
Lafayette Education Foundation Inc	http://www.lefoundation.org	(337) 234-3229	EIN 58-1849198	Po Box 53649	Lafayette	LA	70505	USA		To promote excellence in education		Mini-grants and teacher awards given to teachers which benefitted local students.				
Lafayette Animal Aid	http://www.lafayetteanimalaid.org		EIN 23-7414331	Po Box 298	Carencro	LA	70520	USA	Animal Protection & Welfare, Animals	Lafayette animal aid was incorporated and filed for exempt status 501(c)(3) in 1976 with sole purpose of helping to manage and care for the animal population in the lafayette parish area of louisiana.		Lafayette animal aid is a 501(c)(3) non-profit organization whose mission is to provide, care, shelter and provide medical attention to stray, abandoned and unwanted animals, as well as place homeless animals in good, lovings homes through adoption events. The organization also encourages and educates the public to spay/neuter their pets through a reduced cost neutering program to prevent future pet over-population.				
Shreveport Opera	http://www.shreveportopera.org	(318) 227-9503	EIN 72-6021455	212 Texas St Ste 101	Shreveport	LA	71101	USA	Arts & Culture, Opera, Performing Arts	The mission of shreveport opera is to produce professional opera and musical productions of the highest artistic quality and to provide educational programming and outreach to children, youth and adults in the ark-la-tex region.		The shreveport opera produces professional opera and musical productions of the highest artistic quality and to provides educational programming and outreach to children, youth and adults in the ark-la-tex region.				
Higher Dimensions Evangelistic Center	http://		EIN 72-1229028	Po Box 47	Natchitoches	LA	71458	USA								
New Orleans Metro Fast Pitch Softball Association Inc	http://	(504) 737-7416	EIN 72-1391111	128 Celeste Ave	River Ridge	LA	70123	USA	Baseball & Softball, Sports	Entity's purpose is to create an environment in order for children to maximize their athletic abilitiy and to pursue leadership qualities while participting in high level athletic events.		Entity's purpose is to create an environment in order for children to maximize their athletic abilitiy and to pursue leadership qualities while participting in high level athletic events.				
Chimp Haven	http://www.chimphaven.org	318-925-9575	EIN 74-2766663	13600 Chimpanzee Place	Keithville	LA	71047	USA	Animal Protection & Welfare, Animals, Protection of Endangered Species, Wildlife Preservation & Protection	Our mission is to provide and promote the best care of sanctuary chimpanzees and inspire action for the species worldwide.	a national scope	Chimp Haven is The National Chimpanzee Sanctuary and offers a permanent home for retired chimpanzees to live their lives in the company of other chimpanzees.  We provide expert veterinary care, nutritious diet, and daily enrichment activities.	retired chimpanzees	Chimp Haven is home to more than 200 chimpanzees, the vast majority of whom were retired from research.	Chimp Haven is The National Chimpanzee Sanctuary and is currently home to 212 residents.  We were founded in 1995 by an alliance of professionals from research, animal welfare, and the pharmaceutical industry who saw the need for humane, cost-effective social housing for unwanted chimpanzees.  Chimp Haven opened its doors to its first two residents in 2005.  Since then, more than 300 chimpanzees have called Chimp Haven home.   In June 2014, the migration of 110 chimpanzees from the New Iberia Research Center to Chimp Haven was completed - nearly doubling our population over the previous year.  With over 200 chimpanzees to feed, we go through nearly 4,000 pounds of produce in just one week.  Multiply that by 52 weeks in a year and you can see why your support is so critical to us!	
NO/AIDS Task Force	http://www.noaidstaskforce.org	504-821-2601	EIN 72-1059635	2601 Tulane Ave Ste 500	New Orleans	LA	70119	USA	AIDS, Education, Health, Human Service Organizations	The mission of NO/AIDS Task Force is to reduce the spread of HIV infection, advocate empowerment, safeguard the rights and dignity of HIV-affected individuals, and provide for an enlightened public.	Southeast Louisiana	Medication: the task force contracts with a local pharmacy to provide medication to hiv-infected individuals. The task force also assists with insurance (and medical) copayments for qualified individuals. Staff assists eligible clients in enrolling in pharmaceutical medication assistance programs for access to free or low cost medications. The task force is a covered entity in the u. S. Department of health and human services, health resources and services administration, office of pharmacy affairs and participates in the 340b drug pricing program whereby medications are purchased by a qualified third party pharmacy company for task force clients at a discounted price, resulting in revenue for the task force based on these savings. The intent of the 340b program is to permit the covered entity to stretch scarce federal resources as far as possible, reaching more eligible patients and providing more comprehensive services.   primary medical care: the task force operates two full service primary care clinics which provide comprehensive medical care to over 1,600 hiv-infected or exposed individuals and over 120 clients from the community at large. In the clinic, the task force employs five full-time physicians, three full-time nurse practitioners, six full-time registered nurses, one full-time medical assistant, one licensed practical nurse, and one phlebotomist. The clinics are open five and a half days per week and provide care to all individuals in need.   case management: the task force provides case managers who serve as liaisons between clients and the network of community resources to ensure that the infected live comfortably and with dignity. Case managers work with those living with hiv and aids to develop a plan of care that addresses their medical, financial, emoitional and social needs.				
West Monroe Soccer Club	http://		EIN 72-1377635	PO Box 1317	West Monroe	LA	71294	USA	Children & Youth, Youth Development Programs							
Caddo Ward Ii Industrial Development Corporation	http://	(318) 929-4518	EIN 72-1302659	Po Box 1043	Vivian	LA	71082	USA	Community Service Clubs	To attract businesses to ward ii of caddo parish, louisiana.		Receives legislatively allocated share of gaming boat boarding fees that are used to improve the infrastructure of ward ii of caddo parish, louisiana in order to attract businesses to the region.				
High Voltage Girls Fastpitch Softba Ll Organization	http://		EIN 72-1331735	72711 Highway 1077	Covington	LA	70433	USA	Baseball & Softball, Sports							
Louisiana SPCA	http://www.la-spca.org	(504) 368-5191	EIN 72-0471368	1700 Mardi Gras Blvd	New Orleans	LA	70114	USA	Animal Protection & Welfare, Animal Services, Animals, Veterinary Services	The Louisiana SPCA is a private nonprofit dedicated to the elimination of animal suffering through innovative services and programs.	Louisiana	feral cat program, pet adoptions, volunteer opportunities, foster care, humane education, spay/neuter, wellness appointments, sheltering of homeless and unwanted animals				
Louisiana Elks Fund	http://www.laelks.com	(504) 909-1654	EIN 72-0914640	Po Box 409	Hahnville	LA	70057	USA		Drug awareness,hoop shoot,scholorships, veteran home,va hospital, & americanism		Louisiana elks association - youth activities				
Cmms Deshae Lott Ministries Inc	http://		EIN 20-8381986	Po Box 9232	Bossier City	LA	71113	USA	Protestant, Religion							
SHARED HOUSING OF NEW ORLEANS INC	http://	(504) 896-2575	EIN 72-1132780	PO Box 15316	New Orleans	LA	70175	USA	Health, Health (General & Financing), Homeless & Housing, Housing Search Assistance, Human Service Organizations, Human Services	Provide assistance to the homeless		Shared housing helps elderly and/or disabled adults remain in thier homes by matching them with homeless persons.				
Women Outreaching Women Wow	http://www.womenowomen.com		EIN 43-1957621	PO Box 904	Watson	LA	70786	USA	Domestic Violence, Family Violence Shelters, Homeless & Housing, Housing Support, Victims Services	The mission of Women Outreaching Women is to empower battered women, empower children and to create community awareness about family violence.						
Shreveport Chamber Of Commerce Inc	http://www.shreveport.chamber.org	(318) 677-2527	EIN 72-0315700	400 Edwards Street	Shreveport	LA	71101	USA		Shreveport chamber of commerce provides various projects throughout the year for chamber members.		Shreveport chamber of commerce provides various projects throughout the year for chamber members.				
Foundation Industries Inc	http://	(225) 654-6283	EIN 72-0947928	9995 Main St	Zachary	LA	70791	USA	Job Training, Sheltered Employment	Foundation industries, inc is a non-profit private agency striving to meet the vocational needs of individuals with developmental disabilities.		10the organization trains and rehabilitates the mentally handicapped individuals(sheltered workshop). The organization usually has in excess of 125 clients.				
Word Of Liberty Christian Fellowship Inc	http://		EIN 91-1899984	Po Box 48	Luling	LA	70070	USA	Christianity, Religion							
Society For Preservation & Encrgmnt Of Barbershop Quartet Singing Amer	http://		EIN 72-1290756	4145 N Maiden Dr	Baton Rouge	LA	70809	USA								
Baton Rouge Green Association Inc	http://www.batonrougegreen.com	(225) 381-0037	EIN 72-1124182	439 N 11th St	Baton Rouge	LA	70802	USA		To make baton rouge greener by educating, leading, and inspiring our community to conserve, plant, and sustain trees.		As part of the national neighborwoods program, baton rouge green selects one environmentally-underserved neighborhoods each year throughout the city of baton rouge for tree plantings, held during tree planting season - october through march. Partnering with neighborhood organizations, residents, and volunteers, baton rouge green shares information and technical assistance about planting and maintaining trees, empowering local citizens to implement tree planting and maintenance programs in their neighborhoods.   baton rouge green has planted thousands of trees at medians and intersections along baton rouge's highly traveled roadways. With help from our generous sponsors, the green team, we still provide regular maintenance for nearly 5,000 of these trees in roadside green spaces around baton rouge.				
Louisiana Lawyers For Life	http://		EIN 58-1966764	Po Box 24106	New Orleans	LA	70184	USA	Crime & Law, Legal Services							
Baton Rouge Model Railroad Club Inc	http://		EIN 31-1619989	7172 Sheffield Ave	Baton Rouge	LA	70806	USA	Recreational Clubs, Sports							
New Bethany Home For Girls	http://		EIN 72-0740672	PO Box 764	Arcadia	LA	71001	USA	Camps, Sports							
United Jewish Charities Of N E Louisiana Inc	http://		EIN 72-6022343	Po Box 6058	Monroe	LA	71211	USA	Federated Giving Programs, Philanthropy							
North Monroe Baptist Church Of Monroe Inc	http://		EIN 72-0651467	210 Finks Hideaway Rd	Monroe	LA	71203	USA								
Toastmistress International Clubs, Inc. Shreveport Chapter	http://		EIN 72-6033887	236 East Fairview	Shreveport	LA	71104	USA								
Camellia Club Of New Orleans Inc	http://		EIN 72-1102008	13 Glacier St	Kenner	LA	70065	USA								
Haven Of Hope Church	http://		EIN 72-1233756	Po Box 1421	West Monroe	LA	71294	USA								
Peoples Institute For Survival & Be Yond	http://		EIN 72-1160700	601 N Carrollton	New Orleans	LA	70119	USA	Civil Rights, Intergroup & Race Relations, Race							
Lakeview Shepherd Center Inc	http://		EIN 72-0819404	316 38th St	New Orleans	LA	70124	USA	Human Services, Senior Centers, Seniors							
Gods House Of Prayer And Deliverance	http://		EIN 72-1311947	57610 Eli Craig Rd	Plaquemine	LA	70764	USA	Christianity, Religion							
American Red Cross Southeast Louisiana Chapter	http://		EIN 72-0408907	2640 Canal St	New Orleans	LA	70119	USA								
Learning Land Inc	http://	(870) 260-2886	EIN 72-1289352	7096 White Oak Ln	Natchitoches	LA	71457	USA	Child Day Care, Children & Youth	Abeka based education programs for pre-school children. Serving 70 children on a full time on going basis and another 20 to 30 after school.		Daycare center				
James Burton Foundation	http://	(318) 222-7403	EIN 54-2156197	714 Elvis Presley Ave	Shreveport	LA	71101	USA	Arts & Culture, Music, Performing Arts Centers	To increase music education, specifically guitar, in schools by providing guitars and other equipment to the schools.		The foundation was created to promote music education, specifically guitar, in middle and high schools in louisiana. The program has expanded in 2008 to include music programs in childrens hospitals in louisiana and tennessee and veterans homes and hospitals. Since the inception of the program over 4000 guitars have been purchased and distributed by the foundation.				
Salvation Army	http://www.salvationarmysouth.org	(225) 355-4483	EIN 58-0660607	7361 Airline Highway	Baton Rouge	LA	70805	USA		The salvation army, an international movement, is an evangelical part of the universal christian church. Our message is based on the bible, our ministry is motivated by the love of god, and our mission is to preach the gospel of jesus christ and to meet human needs in his name without discrimination.		Corps - provides programs to both adults and children. These programs consist of education, character building, recreation, and etc. The salvation army not only wants to meet the physical and emotional needs of the people but also their spiritual needs as well.   social services - to serve each client's emergency needs through cas management and financial support. Services are rendered to help stabilize families and individuals in times of crisis and to assist them with maintaining their standard of living.   to provide short-term lodging for men who are transient or situationally homeless. The program provides the men with food, lodging, and laundry facilities. The program also provides counseling, social service assistance and substance abuse treatment that will assist them with combating homelessness.				
Louisiana Volunteers For Family & Community Inc	http://		EIN 72-0961092	610 Holiday Dr	Houma	LA	70364	USA				Awarded 1800 in scholarships and grants in amounts of 100 and 300				
Absolute Care Enterprise Inc	http://		EIN 72-1316771	2024 Bayou Rd	New Orleans	LA	70116	USA	Health, Home Health Care							
Friends Of Hilltop Arboretum Inc	http://hilltop.lsu.edu	(225) 767-6916	EIN 58-1799472	Po Box 82608	Baton Rouge	LA	70884	USA	Environment	Preserve the arboretum as an educational and national resource for the community and to provide help and support to louisiana state university.		Provided a sanctuary and educational opportunities where students and visitors can learn about natural systems, plants, and landscape design.				
Greater Baton Rouge Youth Sports Association	http://		EIN 72-1269072	3151 Seracedar St	Baton Rouge	LA	70816	USA	Amateur Sports, Sports	To operate a program to introduce children to sports		The organization operates four year-round sports programs designed to foster confidence and positive self-image in children. Each program serves about 200 children				
Sci-Port: Louisiana's Science Center	http://www.sciport.org	(318) 424-3466	EIN 72-1136273	820 Clyde Fant Pkwy	Shreveport	LA	71101	USA	Arts & Culture, Education, General Science, Science & Technology Museums, Technology	Sci-Port: Louisiana's Science Center provides a fun, educational environment for people of all ages to explore and actively engage in the world of mathematics, science and technology.  Sci-Port serves to spark curiosity about the world around us, provides hands-on tools for using scientific discovery in everyday life, and encourages a passion for life-long learning.		Exhibits and programs: sci - port discovery center organizes activities to promote the sciences with traveling exhibits and provides permanent "hands on" museum displays. The center features over 290 science, math and space exhibits, daily changing programs, and a space dome planetarium.   gift shop: supports sci-port's mission through the sale of educational science-themed items.   cafe: eating facility for staff and visitors to support sci-port's mission.				
Baton Rouge Christian Education Foundation Inc	http://	(225) 767-7097	EIN 72-0921878	11111 Roy Emerson Dr	Baton Rouge	LA	70810	USA		Education		The organization provided education services to 755 students in grades pre-kindergarten through 12th, including our academic center.				
American Statistical Association	http://		EIN 52-1665936	161 Ag Admin Bldg	Baton Rouge	LA	70803	USA								
Junior Auxiliary Of East St Mary La Inc	http://		EIN 72-1258107	Po Box 3492	Morgan City	LA	70381	USA	Community Service Clubs							
VOLUNTEERS FOR YOUTH JUSTICE	http://		EIN 72-1057695	900 Jordan St Ste 301	Shreveport	LA	71101	USA	Children & Youth, Crime & Law, Youth Violence Prevention							
Louisiana Human Resources Development Institute	http://		EIN 72-1124184	1991 Wooddale Blvd	Baton Rouge	LA	70806	USA								
Nazareth Ii	http://		EIN 72-0993840	1000 Howard Ave Ste 100	New Orleans	LA	70113	USA	Homeless & Housing, Senior Citizens Housing & Retirement Communities, Seniors							
AUTISM SOCIETY OF AMERICA - Greater New Orleans Chapter	http://www.autism-society.org/chapter168	504-464-5733	EIN 72-0942376	P.O. Box 26057	New Orleans	LA	70186	USA		Our Mission is to provide information and referrals, advocacy and support for individuals with Autism Spectrum Disorder (ASD) and their families: to help families identify qualified professionals in their communities; to assist families in securing benefits and services provided by law; and to promote lifelong opportunities for persons with Autism Spectrum Disorder in order to be fully included members of their communities.  Our Vision is for all individuals affected by ASD will enjoy better quality lifestyles.	Serving Jefferson, Orleans, Plaquemines, St. Bernard, and St. Tammany Parishes in Louisiana.		Children and adults with Autism Spectrum Disorders and their families.			
Trinity Full Gospel	http://		EIN 72-0949476	PO Box 1585	Deridder	LA	70634	USA								
Heritage Ranch	http://www.hrbr.org	(225) 658-1800	EIN 41-2118848	20090 Tucker Rd	Zachary	LA	70791	USA	Children & Youth, Youth Development Programs	Heritage ranch is a christian children's home that serves boys and girls in the midst of personal or family crisis from which they require respite. Our staff provides a safe and nurturing environment where these valuable young people are empowered to regain personal stability and, whenever possible, achieve healthy family reunification. Ultimately youth are equipped to become productive members of society who will pass on the inheritance of hope and healing they have received to subsequent generations.		Our staff will provide a safe and nuturing environment where valuable young people, ages 8-18, are empowered to regain personal stability and whenever possible, achieve family reunification. Our ultimate goal is that youth are equipped to become productive members of society who will pass on the inheritance of hope and healing they have received to subsequent generations.   a week long summer camp for the kids in the community that is focused on promoting educational achievement and good habits.				
Pride And Hope Ministry & Activity Center	http://	(985) 986-2808	EIN 72-1481855	25502 Highway 21	Angie	LA	70426	USA	Children & Youth, Youth Development Programs	The mission of pride and hope inc is to provide services to at-risk individuals and families with special needs. We believe that systems such as vocational, educational, and recreational will help prevent and break the cycle of institutionalization of disadvantaged children and adults.		Through pride and hope efforts for 2014 over 150 single parents were given part - time and temporary jobs. Youth camps were used as tools to present activities to youth that would both build self esteem and encourage them to excell in education. Phm through its progams endeavored to remove any obstacles that might prevent the youths realizing their displayed or stated purpose in life. A daycare building was renovated. Daycare services are helping more single parent household use a safer enviroment for children that are under school age. The daycare gives parents an opportunity to seek employment. The daycare also gives an enviorment that prepares the children who participate for the upper levels of education.				
