For the Love of Rats Rescue	https://www.facebook.com/ForTheLoveOfRatsRescue	225-305-0214	EIN 61-1705022		Walker	LA	70785	USA	Animal Protection & Welfare, Animals	Our mission is to educate the public about the proper care of pet rats and other exotic animals, help abused, neglected and homeless rats/exotic pets find loving forever homes, socialize them and give them proper veterinarian care.	Walker, Louisiana and surrounding areas		We believe in educating the public about the proper care and treatments of pet rats and other exotic animals.	Over 100 pets rats, guinea pigs, rabbits and other small/exotic pets	We have successfully re-homed approximately 300 pets rats and other exotic pets since January of 2013.	
Southern Hills Christian Church	http://		EIN 72-6050280	900 Francais Dr	Shreveport	LA	71118	USA								
Reaching Very Special People Inc	http://		EIN 58-1805810	Po Box 5313	Slidell	LA	70469	USA	Human Services, Transportation Assistance							
Cat Haven Inc	http://cathaven.org	(225) 636-2680	EIN 72-1454718	11130 N Harrells Ferry Rd	Baton Rouge	LA	70816	USA	Animal Protection & Welfare, Animals	To improve the life of the people and cats in our community by rescuing and providing care, shelter, and adoption to homeless cats and kittens. To advocate routine sterilization of cats and kittens for population control. To foster understanding of responsible cat and kitten care. To provide help and guidance to the people of our community in matters of animal health and welfare.		Prevention of cruelty to animals by rescuing, sheltering, and placing into adoptive homes cats that are abandoned.   prevention of cruelty to animals by providing assistance to qualified low income owners to spay and/or neuter cats.				
Young Mens Christian Association Of Lafayette Louisiana Inc	http://www.ymca.net	(337) 781-3872	EIN 58-1640136	800 E Farrel Rd	Lafayette	LA	70508	USA	Human Services, Physical Fitness & Community Recreational Facilities, Sports, Young Mens or Womens Associations	The ymca of lafayette strives		After school care program provides all children in our area with a safe, educational, and fun environment to finish their homework while waiting for their parents to get off of work. This program comprises about 74. 0% of program revenues and expeditures.   summer day camp program provides all children in our area with a safe, educational, and fun environment to finish their homework while waiting for their parents to get off of work. This program comprises about 24. 0% of program revenues and expeditures.   holiday camp program provides all children in our area with a safe, educational, and fun environment to finish their homework while waiting for their parents to get off of work. This program comprises about 2. 0% of program revenues and expeditures.				
Body Of Christ Inc	http://		EIN 72-0921540	425 Lynbrook Blvd	Shrevport	LA	71106	USA								
Swamp Dawg Youth Organization	http://		EIN 27-0388268	Po Box 62	Cotton Valley	LA	71018	USA	Football, Sports							
Adopt Older Kids A Ok Inc	http://		EIN 72-1125744	10 Steamboat Bnd Blvd	New Iberia	LA	70563	USA	Adoption, Children & Youth							
Keep Bossier Beautiful	http://		EIN 72-1058153	Po Box 5644	Bossier City	LA	71171	USA	Environment, Environmental Beautification							
New Heart Ministries	http://		EIN 75-1986240	Po Box 184	Saline	LA	71070	USA								
Capital Area Family Violence Battered Womens Pro	http://www.stopdv.org	(225) 389-3001	EIN 72-0986008	3730 Saint Gerard Ave	Baton Rouge	LA	70805	USA	Civil Rights, Domestic Violence, Family Violence Shelters, Homeless & Housing, Homeless Shelters, Victims Services, Women, Womens Rights	To end domestic violence in the capital area through serving victims of domestic violence, educating the public about domestic violence, and working to eliminate economic, social, and cultural conditions and attitudes that contribute to domestic violence.		Direct services program offers temporary emergency housing to battered women and their children who have no safe place to stay. Room and board are provided at no cost for a limited time.   legal services program assists battered women with legal needs such as protection orders, pressing charges, court appearances, and access to legal representation.   outreach services program provides telephone, face-to-face counseling and support groups to battered women. They also provide information and referral to other community resources, assist battered women in accessing our shelter services, provide advocacy on behalf of the battered woman and her children, and provide court advocacy and support services.   the education and training program aims to double the number of support groups at the louisiana correctional institute for women, work with local businesses to raise awarenewss of domestic violence, expand coordination with organizations and faith-based groups, develop an active social media presence, call attention to the issue of domestic violence-related stalking and improving stalking respone times, and highlighting the tragedy of domestic violence homicide by co-sponsoring the stop the slaughter rally.				
Christian Outreach Center Of Baton Rouge Inc	http://	(225) 262-2396	EIN 30-0123976	6586 Jones Creek Rd	Baton Rouge	LA	70817	USA	Christianity, Mental Health, Religion, Substance Abuse Dependency, Prevention & Treatment, Substance Abuse Treatment, Thrift Shops	To extend and coordinate the social/charitable ministries of member churches. The ministry operates an outreach center that provides structure and guidelines for active involvement of volunteers from member congregations to serve the community's poor, so that lives can be transformed to realize the fullness of their being a child of god.		Aid to the needy and underprivileged through the provision of food and other human essentials. Providing training and education of life skills and discipleship.				
Alpha Lambda Delta	http://		EIN 91-1900452	Grambling State University	Grambling	LA	71245	USA								
The Food Bank Of Central Louisiana Inc	http://www.fbcenla.org	(318) 445-2773	EIN 72-1154072	3223 Baldwin Ave	Alexandria	LA	71301	USA	Food, Food Banks & Pantries, Food Programs	To alleviate hunger in central louisiana		Gather, store and redistribute food to individuals and charitable organizations that serve the needy				
Auxillary Of St Patricks Hospital	http://		EIN 72-0909648	524 S Ryan St	Lake Charles	LA	70601	USA	Health							
Cornerstone Assistance Foundation Inc	http://		EIN 72-1288368	71 Colony Bnd	Shreveport	LA	71115	USA	Homeless & Housing, Senior Citizens Housing & Retirement Communities, Seniors	The mission of cornerstone assistance foundation, inc. , is to provide affordable housing for the elderly, families, and for persons with physical challenges.		The mission of cornerstone assistance foundation, inc. , is to provide affordable housing for the elderly, families, and for persons with physical challenges. The foundation also provides special assistance in hardship cases and helps establish operations in small and beginning churches. The foundation also secures funds to develop affordable housing from foundations, state and local governments, and for profit corporations.				
Living Hope Lutheran Church	http://		EIN 72-1375500	PO Box 8994	Mandeville	LA	70470	USA								
Jesus Word Ministries Inc	http://		EIN 72-1345488	Po Box 526	Keithville	LA	71047	USA	Christianity, Religion							
Community Christian Concern Of Slidell	http://ccc.slidell.org	(985) 649-6233	EIN 72-1050312	Po Box 3125	Slidell	LA	70459	USA	Public & Societal Benefit	To serve the truly needy in the slidell and pearl river community areas.		Ccc assistance to individuals; no one received more than $5,000  miramon center  janet's korner				
Frances Special Services	http://	(985) 474-4115	EIN 34-1987838	Po Box 1430	Amite	LA	70422	USA	Homeless & Housing, Housing Development, Construction & Management	To provide low cost housing. To provide safe and decent housing to low-moderate income families.		Renting low cost housing to tenant's that qualify.				
Eden House	http://www.edenhousenola.org	(504) 407-0943	EIN 45-3303791	PO Box 750386	New Orleans	LA	70175-0386	USA		-	New Orleans	physical and mental healthcare, financial guidance and savings matching, access to education and job training, yoga, and anything else our residents need at no cost to them.	victims of sex trafficking and prostitution rebuild their lives			
Capital Region Builders Foundation Inc	http://	(225) 769-7696	EIN 74-3031988	10518 Kentshire Ct	Baton Rouge	LA	70810	USA	Community Improvement & Capacity Building	The corporation is organized for eductional and charitable purposes within the meaning of a 501(c)(3) of the internal revenue code as more fully stated in the articles of incorporation. Distributions are made only to organizations that qualify as exempt organizations under 501(c)(3), most specifically to organizations that benefit children. The corporation raises funds to provide assistance to needy children and families.		The foundation was formed to raise funds to provide assistance to needy children and families.				
Louisiana Pulmonary Disease Campinc	http://		EIN 72-0897336	Po Box 10235	New Orleans	LA	70181	USA								
Beauregard Community Action Association Inc	http://		EIN 72-6031055	Po Box 573	Deridder	LA	70634	USA	Human Service Organizations, Human Services	Provide assistance to low income familie		To provide assistance to low income families through various state and federal grants				
Northwest Louisiana Food Bank	http://www.foodbanknla.org	(318) 675-2400	EIN 72-1328890	2307 Texas Ave	Shreveport	LA	71103	USA	Food, Food Banks & Pantries	Our mission is to serve as the central resource for fighting hunger in Northwest Louisiana.Our vision is to ultimately end hunger in Northwest Louisiana by ensuring a consolidated network of effective food collection and distribution which will provide universal access to free food for the needy in our communities.		Food bank - distribution of food and other essential items to 501(c)(3) organizations who serve the needy. Food is also distributed to low-income seniors, half-way houses, and to individuals by emergency referral on a one-time walk-in basis.				
Lower Nine Org	http://www.lowernine.org	(504) 278-1240	EIN 11-3821601	6018 El Dorado Sreet	New Orleans	LA	70117	USA	Disaster Aid, Disaster Preparedness & Relief Services	Lowernine. Org is dedicated to training residents and volunteers in the lower ninth ward of new orleans, la in the numerous skills necessary to bring this century-old neighborhood back to life in the wake of hurricanes katrina and rita.		Reconstruction of housing destroyed by hurricane katrina to help resurrect the lower ninth ward neighborhood.				
Learn To Live	http://		EIN 45-4415554	1700 S Rampart St	New Orleans	LA	70113	USA	Health, Public Health							
Louisiana Porcelain Art School	http://		EIN 72-1137240	PO Box 6504	Alexandria	LA	71307	USA	Art Museums, Arts & Culture							
First Presbyterian Church	http://		EIN 72-0989784	204 N Lewis St	New Iberia	LA	70563	USA								
Shepherds Farm Child Development And Learning Center	http://		EIN 27-2366283	405 Hearne Ave	Shreveport	LA	71103	USA	Human Service Organizations							
Extreme Missionary Adventures	http://www.xmaonline.com	318-728-6346	EIN 72-1347807	16 Pierce Rd	Rayville	LA	71269	USA	Christianity, International, International Development, Neighborhood Centers, Protestant, Religion	At our core, XMA is about experiential missions  about helping American Christians obey Gods desire for us to take the Gospel to all nations.  As Jesus tells us in John 15:16, You did not choose Me, but I chose you.  I appointed you that you should go out and produce fruit  You have heard Gods call and we can help you answer that call.  Our volunteers share the love of Jesus with overlooked people in remote locations around our world and help with human needs such as medical, dental, clean water, construction, educational and other basic needs.  Our lives have been changed for the better by what Christ did for us.  We now want to help others with their physical needs but more importantly to show them how they can have lasting peace in their lives.   God has put within each of us a desire for excitement, a need to rise above the mere everyday existence, a passion for adventure.  We might suppress the burning urgency of this passion so that all that is left is a small glowing ember.  Or we may try to satisfy this need with vicarious, second hand adventure such as Facebook and YouTube.  But that God-given desire is still there.  It is still part of our basic make up.  Its part of our DNA.  God has also given each of us a purpose.   We are here for more than to just get all we can get.  Each of us have God-given talents and skills  evangelism, medical, teaching, prayer, listening and caring.  Our purpose and true satisfaction is found in using our unique gifts to help others, especially those who are not able to help themselves, those trapped in systems of spiritual darkness, poverty, and injustice..  XMAs calling is to combine these two often suppressed life needs into an Adventure with a Purpose.  On an extreme missionary adventure youll get all of the adventure you want but its not just adventure for adventures sake. Its an adventure with a purpose.  It could be preaching or showing an evangelistic film to the unreached, showing love to abandoned children in a small village orphanage in Honduras, a medical/dental team working in villages along an Amazon tributary in the Peruvian jungle, giving educational assistance to a pastor or teacher in a remote village in the mountains of Asia, or maybe helping rural Central Americans improve their standard of living with farm assistance projects.  Most importantly, through all of these and other activities, showing others how Jesus can give purpose, peace and meaning to their lives.	Worldwide					
H O P E Ministry Of Pointe Coupee	http://		EIN 72-1350536	Po Box 45	New Roads	LA	70760	USA	Domestic Violence, Emergency Assistance, Family Violence Shelters, Homeless & Housing, Human Service Organizations, Human Services	HOPE Ministry originated in 1995, when a group of local church pastors asked community leaders to join them in forming an organization that would provide coordinated assistance to the people who came to them for help. HOPE's programs are designed to meet immediate needs and to work on solving the underlying problems that create the needs. HOPE's mission is defined as meeting the needs of the community as they are expressed by its members at their initial point of need.  HOPE Ministry takes a holistic approach to problem-solving, including the physical, emotional and spiritual dimensions.						
Children and Arthritis	http://www.ChildrennAndArthritis.org	(318) 635-5682	EIN 72-1170530	2751 Albert Bicknell Drive Ste 2E	Shreveport	LA	71103	USA	Arthritis, Health	Children and Arthritis provides information and support to families with children who suffer from arthritis and other autoimmune diseases. Through our opportunities for education, encouragement and enjoyment, families discover ways to alleviate the frustrations of chronic illness.	the Southern United States	Jambalaya Jubilee, our annual camp.	children with arthritis and their families	over 300 children with arthritis, their siblings, and parents		
Hope Extreme Inc	http://		EIN 20-5871523	Po Box 936	Bourg	LA	70343	USA	Children & Youth, Youth Development Programs							
Agnes Hageman Trust 27074-3	http://		EIN 74-6044100	Po Box 61540	New Orleans	LA	70161	USA								
Louisiana Hayride Foundation Inc	http://		EIN 72-1355639	333 Texas Ave Suite 899	Shreveport	LA	71101	USA	Arts & Culture, Cultural & Ethnic Awareness							
GULF SOUTH LEADERSHIP INSTITUTE	http://www.legacy.gs-li.org		EIN 80-0297940	1290 Seventh Street Suite 5	Slidell	LA	70458	USA	Adult Education, Christianity, Economic Development, Education, Protestant, Religion, Urban & Community Economic Development		Greater New Orleans	Youth Career Mentoring, and Youth Workforce Readiness - specific to junior high and high school students.	youth and young adults	98 junior high and high school students and 69 households		
United States Power Squadrons	http://		EIN 72-6033347	333 Rossitter St	Shreveport	LA	71105	USA								
SHINE YOUR LIGHT INC	http://	(504) 309-6725	EIN 56-2672232	8311 Oak St Jill Donaldson and Margaret Bruzdzinski	New Orleans	LA	70118	USA	Education, Scholarships, Scholarships & Student Financial Aid	To provide christmas presents, clothes and meals for children of families in need.	South Louisiana	We adopt families for Christmas.  We ask local principals to recommend families to us where the parents are down on their luck for one reason or another but the parents are involved in their children's lives in a positive role.   We surprise these children by giving them an amazing Christmas complete with toys and clothes.  Sometimes we even get furniture for the families.	Families that are down on their luck	We helped over 50 children in the New Orleans, Slidell and Mandeville area celebrate a special Christmas.		
Alzheimer's Services of the Capital Area, Inc.	http://www.alzbr.org	225-334-7494	EIN 72-1082047	3772 North Blvd	Baton Rouge	LA	70806	USA	Alzheimers Disease, Health	The mission of Alzheimer''s Services of the Capital Area is to make a significant difference in the lives of those coping with Alzheimer''s disease in the community.	Baton Rouge, Louisiana	Alzheimer's Services of the Capital Area offers the following services: information and referral assistance, caregiver support groups,lending library, free educational materials, caregiver respite, monthly caregiver education, quarterly newsletter, family & caregiver consultation, education & support for individuals diagnosed with dementia, social opportunities for caregivers & patients, Safe Return registration, and ongoing training and annual conference for health care professionals.	teach, care for, and connect with those in our community affected by Alzheimers disease and other memory-related impairments.			
Wounded War Heroes of America	http://woundedwarheroes.org	(985) 960-1471	EIN 27-0794499	12360 Mill House Dr	Gonzales	LA	70734	USA		To provide benefits and activities for wounded war veterans.		To provide events and activities for wounded war heroes.				
River City Repertory Theatre	http://www.rivercityrep.org	(318) 868-5888	EIN 20-2784416	2829 Youree Dr Ste 4	Shreveport	LA	71104	USA	Arts & Culture, Theater	Operation of a professional theatre to contribute to the local growing culture economy by staging equity theatrical productions sanctioned by actors' equity, with the aim to provide opportunities for professional development of local actors, designers, and technicians.		The organization staged four theatrical productions, attendance for all four productions totaled 831 people				
Junior Achievement of North Louisiana	http://	318-861-5998	EIN 	3825 Gilbert Drive	Shreveport	LA	71104	USA		Junior Achievement (JA) inspires and prepares young people to succeed in a global economy. JA programs, facilitated by JA-trained volunteers, incorporate hands-on learning about financial literacy, work readiness and entrepreneurship while encouraging students to stay in school and to reach their boundless potential.	North Louisiana					
Love Thy Neighbor Ministries Of Springhill Inc	http://		EIN 58-1984680	105 1st St Se	Springhill	LA	71075	USA	Emergency Assistance, Human Services							
Toughlove International	http://		EIN 72-1335479	PO Box 24	Eunice	LA	70535	USA								
Southern United States Trade Association Susta	http://www.susta.org	(504) 568-5986	EIN 72-0767213	701 Poydras St Ste 3845	New Orleans	LA	70139	USA		Development of cooperative programs designed to increase the export of high value food and agricultural products.		Market access program(map) brand program- the map brand was designed for small businesses that desire financial support to launch a new branded export effort. For accepted participants susta reimburses up to 50% of certain international marketing and and promotion expenses, including eligible trade shows, in-store displays, and required label changes. For the fiscal year ended september 30, 2014 susta worked with 108 companies. These companies generated $218,518,752 in export sales through the brand program.   generic program- 38 events were held with 421 companies participating utilizing $2,793,312 of generic program funds generating $37,084,831 of export sales.   education outreach measures- 36 outreach seminars and events were conducted reaching out to 1,108 companies. New success stories totalled 80.				
Gulf Restoration Network	http://www.healthygulf.org	(504) 525-1528	EIN 72-1447742	PO  Box 2245	New Orleans	LA	70176	USA	Environment	Gulf Restoration Network (GRN) is a 16 year old environmental advocacy organization that works to unite and empower people to protect and restore the natural resources of the Gulf of Mexico region.   With an exclusive focus on the ecological health of the Gulf Coast, GRN quickly mobilized resources to respond to the 2005 hurricanes and 2010 BP oil drilling disaster.    GRN continues to fight for clean flowing waters, healthy coastal areas, and vibrant offshore ecosystems that are essential to resilient communities and healthy wildlife in the region.	Gulf of Mexico region	Gulf future campaign: the organization independently monitors and assesses the bp/federal government clean up, containment and restoration efforts in the face of the bp drilling disaster through boat excursions and seaplane flights; coordinates a collaborative "gulf future" campaign focused on ensuring ecosystem and coastal community restoration, and works to establish a robust public participation process to make the industry safer and more transparent and accountable to impacted communities.   water resources: the organization works to improve water quality by identifying pollution issues and providing technical assistance, training, and mentoring to numerous communities faced with pollution, as well to improve the development and implementation of watershed and coastal wetlands restoration plans and to prevent damaging projects that destroy wetlands and/or inpact water quality. The organization also works closely with citizen activists, providing frequent updates and action alerts, b  coastal rebuilding: the organization works to build an active and engaged national constituency to support natural storm protection and restoration efforts for the gulf coast region and is an advocate for the establishment of multiple coastal lines of defense to build resiliency and protect communities placed at risk due to the continuing loss of coastal wetlands and increasing sea levels.				
PILOT CLUB OF DENHAM SPRINGS LOUISIANA FOUNDATION	http://www.pilotclubds.org	225-304-6225	EIN 38-3739326	30999 Barnett Ln	Denham Spgs	LA	70726	USA	Community Service Clubs, Mental Health	To serve by furthering Pilot International's humanitarian efforts through charitable, educational, and research programs in communities throughout the world.	Livingston Parish	Pilots service focus involves promoting awareness of brain-related disorders, and helping those affected through volunteer activities, education, and financial support. Pilot works closely with national and international organizations that support this focus, including the National Organization on Disability, American Heart Association, Dana Alliance for Brain Initiatives, Alzheimers Association, Project Lifesaver and The Brain Injury Association.	the youth and elderly		- Completion of Kidz Korner Playland - Planning on Challengers' Ball Field	
Radio Bible Courses Ltd	http://	(225) 205-4473	EIN 58-1716780	12205 Lake Sherwood Ave S	Baton Rouge	LA	70816	USA		Present a program of bible study to the general public through radio media and in a live class setting.		Broadcast daily bible teaching on two radio stations  conduct weekly bible lectures on lsu campus  support of world missions				
ONE TRUE VINE OUTREACH MINISTRIES INCORPORATED	http://	225-778-5069	EIN 72-1248114	4343 Denham Street, Community Service Room Post Office Box 73295	Baton Rouge	LA	70805	USA	Protestant, Religion	To reach out to those who are lost and do not know Jesus Christ, Lord and Savior in a personal relationship.  It is our purpose to bring them to Christ.  Our motto is:  R U SAVED?	Infinite	Youth Leadership, Women's Outreach, International Mission Outreach & Education, Couples Ministry	Low income families around the world; children with sickle cell anemia or cancer, ages 0 - 17. international families that are in a disaster area.	100	Because of my illness, we did not spent a great deal of time on dundraising; however we have  501(c)(3) status and any donation, large or small is tax deductible.	
