name	url	telephone	tax_num	street	locality	region	postcode	country	Causes	Mission	Geographic areas served	Programs	Target demographics	Direct beneficiaries per year	Results	DomesticViolence Emergency Shelter
Victory And Power Ministries Inc	http://		EIN 72-1139148	6940 Harry Dr	Baton Rouge	LA	70806	USA								
Pool of Siloam Medical Ministry, Inc.	http://www.poolofsiloam.org		EIN 20-0171332	4140 Greenwood Rd	Shreveport	LA	71109	USA	Ambulatory & Primary Health Care, Community Health Systems, Health	We share the love of Jesus by reaching out to the medically underserved.  Everyone, regardless of income or situation, is entitled to adequate health care.  We believe that health is defined as physical, emotional, mental and spiritual well-being.  By building Christ-centered relationships, fostering trust and providing necessary tools of awareness, education, excellent medical care and assistance with mediations, we can empower persons to take responsibility for their own well-being.  Our success can be measured in the life-changing words, "Lord, I believe."		We provide basic medical care to adults with no insurance, Medicaid or Medicare.  Our services include our medical clinic, dental clinic, women's health clinic, diabetic eye clinic, and counseling.  In 2007, there were 997 appointments for patients in our clinic.  Additionally, we provided approximately 1,000 other services, including the Patient Assistance Program as well as information and referrals.				
Animal Rights For Life	http://		EIN 58-1618372	10 Dauterive Ct	Kenner	LA	70065	USA								
Southern Mutual Housing Development Corporation	http://	(337) 367-3277	EIN 72-1322831	3602 Old Jeanerette Rd	New Iberia	LA	70563	USA	Homeless & Housing, Housing Support	To build healthy and prosperous rural communities in louisiana						
North Central Louisiana Substance Abuse Center Inc	http://		EIN 72-0952068	Po Box 505	Ruston	LA	71273	USA								
Ladies Auxiliary Of The Deutsches Haus	http://		EIN 72-0813473	4536 Meadowdale St	Metairie	LA	70006	USA								
Foundation Health Services Inc	http://		EIN 72-1248744	PO Box 40018	Baton Rouge	LA	70835	USA	Human Services, Seniors, Supportive Housing for Older Adults							
Lafayette Parish Bar Foundation	http://	(337) 237-4700	EIN 58-1875564	Po Box 2194	Lafayette	LA	70502	USA	Crime & Law	Provide legal information to the community through a legal library maintained for the community; providing information on law and legal services available for low income residents of the community.		Provide legal information to the community through a legal library maintained for the community; providing information on law and legal services available for low income residents of the community.				
Goodwill Industries of North Louisiana, Inc.	http://www.goodwillnla.org	318 868 4701	EIN 72-0460816	800 W 70th St	Shreveport	LA	71106	USA	Goodwill Industries, Human Service Organizations, Human Services, Job Training	Founded in 1902 by Rev. Edgar Helms, Goodwill Industries'' primary mission is to place people in productive and competitive jobs.	26 Parishes North Louisiana	Goodwill Industries of North Louisiana, Inc. provides job training and job placement services to persons with disabilities and other barriers to employment.  We teach people to work and help people find jobs.	Low income adults as well as youth in the North Louisiana area Between the ages of 12 and up.	over 2500 families served each year	2009 Statistics   Served Total 2469 Some of which includes:  At Risk Youth           709  Persons with Disabilities 1033  Ex-Offenders  976	
NEXT GENERATION MINISTRIES	http://nextgenclubs.com/	504-885-0980	EIN 72-1314271	5000 W Esplanade Suite 112	Metairie	LA	70006	USA	Big Brothers & Big Sisters, Boys & Girls Clubs, Children & Youth	Providing moral and character education clubs to middle and high school campuses across the Southern Region of the United States, beginning in New Orleans and spreading out as we go.	Greater New Orleans area	Character and Moral Education	Middle schools and High schools	Over 4,000 students per week for 30 weeks.	Presently hold our weekly clubs in 47 schools speaking to over 4200 students.  Our 10 staff members and 65 volunteers from the community serve as mentors to these students as they connect with us through our lessons. Our motto is "change the campus, change the culture"!  We are doing this	
Infinity Initiative	http://		EIN 27-2874887	11416 Manorwood Dr	Baton Rouge	LA	70815	USA	Education, Literacy, Remedial Reading & Encouragement							
Eunice Care Center, Inc.	http://		EIN 72-1108968	300 South Street	Eunice	LA	70535	USA	Child Day Care, Children & Youth							
Shir Chadash Conservative Congregation	http://www.shirchadash.org	504-889-1144	EIN 72-1448252	3737 W Esplanade Ave N	Metairie	LA	70002	USA	Judaism, Religion	Shir Chadash Conservative Congregation is a family-oriented, egalitarian conservative congregation that is committed to strengthening, celebrating and enriching Jewish life through a diverse program of Torah (study), Avodah (worship) and Gmilut Hasadim (deeds of loving kindness) in order to address the needs of congregants and to enhance the life of the larger community.						
Common Ground Relief, Inc.	http://		EIN 06-1816720		New Orleans	LA	70117	USA	Civil Rights, Disaster Preparedness & Relief Services, Economic Development, Housing Development, Construction & Management							
NEW ORLEANS SPEECH & HEARING CENTER	http://www.noshc.org	(504) 897-2606	EIN 72-0443103	1636 Toledano St	New Orleans	LA	70115	USA	Health, Rehabilitative Care	To improve the communication of children and adults who are affected by speech-language and hearing disorders, in order to improve their quality of life and help them connect with others.		Autism Summer Camp, Language to Literacy, Listening for Success, Stuttering Support Group, Bilingual Group				
Paws of NE Louisiana Inc	http://		EIN 68-0557163	351 Murray Cir	West Monroe	LA	71292	USA	Animal Protection & Welfare, Animals							
The Jewell Parkerson Lowe Foundation Inc	http://	(337) 232-4357	EIN 58-1857420	Po Box 3668	Lafayette	LA	70502	USA								
Save Our Cemeteries, Inc.	http://www.SaveOurCemeteries.org	504-525-3377	EIN 51-0138358	1539 Jackson Avenue Suite 415	New Orleans	LA	70130-5896	USA	Arts & Culture, Cultural & Ethnic Awareness, Historical Organizations, History Museums	Founded in 1974, Our mission is to preserve, protect, and promote the historic cemeteries of New Orleans through restoration, education, and advocacy.   In 1974, the Archdiocese of New Orleans announced a plan to destroy the wall vaults surrounding St. Louis Cemetery No. 2 and replace them with a chain-link fence. The preservation community was incensed.  Save Our Cemeteries was created in response to this threat, but the organization quickly realized the problem of cemetery neglect was not limited to just one cemetery.	The greater New Orleans metro area.	Education: tours and lectures(open to the public) are held throughout the year with topics ranging from jazz funerals to voodoo to yellow fever epidemic. Our guided cemetery tour allows the visitor a glimpse into the hisorical past of new orleans. Each year save our cemeteries holds a seminar covering a wide range of topics to educate tour guides with historically accurate knowledge.   restoration: save our cemeteries conducts cemetery restoration work each year as part of its mission. Grants, donations,tours and fundraisers support these endeavors. Projects include the restoring of abandoned tombs, landscaping, and making capital improvements. Also, proper restoration techniques for historic tombs are provided to tomb owners and cemetery operators.			To date, Save Our Cemeteries (SOC) has performed millions of dollars worth of capital improvements in New Orleans' cemeteries. Educated tens of thousands of visitors/tourists on the history, culture, significance and impact of New Orleans' historic cemeteries through educational cemetery tours and lectures.	
Louisiana Wildlife Agents Association Inc	http://www.lwaa.org		EIN 72-1130460	281 Lansdown Dr	Houma	LA	70360	USA	Animals	To foster, protect and promote the welfare and interest of all classified commissioned wildlife enforcement agents, active or retired; to encourage and promote the constant improvement of public service rendered by the office of enforcement of la dept. Of wildlife & fisheries; and to engage in any other lawful activity permitted by internal revenue code of 1986 section 501(c)(3).		Publication and distribution of the louisiana game warden magazine: three issues of the magazine were published and distributed to the organization's members, retirees, elected state district court judges, district attorneys, state senators, state representatives, sheriffs, and the state governor free of charge. Businesses that purchased ad space in the magazine also receive a copy. The magazine provides members a forum to share experiences encountered as a wildlife agent, experiences as lwaa members, and current issues that affect the louisiana wildlife agent profession. The magazine also serves as a tool to keep the public and public officials aware of the services that wildlife agents provide each day to the general public and general hunting and boat safety issues that are beneficial for all individuals to be aware of.   hosting the annual louisiana wildlife agents association convention: approximately 114 members of the louisiana wildlife agent's association attended the annual conference which takes place over a weekend. The conference is the only event held by the organization at which a large portion of the members are present simultaneously. The organization takes this opportunity to inform and educate the members regarding issues that are important to them as louisiana wildlife agents. Speakers at the conference include public officials and staff from the louisiana department of wildlife and fisheries headquarters. A pistol match and a golf tournament are held to provide networking and team-building. Statistics of the ldwf enforcement division are shared. Various awards are given to show appreciation and provide encouragement, including the "agent of the year" awards.   children's t-shirt program: wildlife agents handed out approximately 3,100 free t-shirts to children wearing life jackets that were encountered during random boat safety inspections on the water. The t-shirts are inscribed with the slogan "i got caught wearing my life jacket. " the goals of the program include encouraging parents and children to practice safe boating habits and to showcase the agents' duties in a positive manner to the public.				
Tater Tot Big Dog Rescue Inc	http://		EIN 27-2879125	Po Box 704	Independence	LA	70443	USA	Baseball & Softball, Sports							
Church Of Scientology	http://		EIN 72-1304939	102 Huggins Rd	Lafayette	LA	70506	USA								
Joy House Ministries	http://		EIN 58-2010773	5993 Toria Dr	Alexandria	LA	71303	USA								
Friends Of The Algiers Courthouse	http://	(504) 391-0667	EIN 72-1306631	Po Box 741056	New Orleans	LA	70174	USA	Human Service Organizations, Human Services	Preservation and restoration		Preservation, restoration, and maintenance of the algiers courthouse.				
Youth Outreach Services	http://		EIN 04-3717195	7903 Arcadian Shores Dr	Shreveport	LA	71129	USA	Human Service Organizations							
Women's Aglow Fellowship	http://www.aglow.org/		EIN 51-0238704	320 Barataria St	Lockport	LA	70374	USA	Christianity, Religion	Aglow International is an intercultural transdenominational organization of Christian women with more than 3,500 fellowships in more than 151 nations. Our mission is to lead women to Jesus Christ and provide opportunity for Christian women to grow in their faith and minister to others. Aglow's vision to impact the lives of women worldwide is expressed in the strategic focuses of: Prayer, Evangelism, Relationship, and Reconciliation.						
Truth Ministries, Inc.	http://		EIN 72-1379039	47433 Singing Hill Rd	Hammond	LA	70401	USA	Protestant, Religion							
Temple Enrichment Center Inc Non-Profit	http://		EIN 20-1100132	2836 Exposition  Ave	Shreveport	LA	71109	USA	Children & Youth, Community Foundations, Education, Educational Services, Philanthropy, Youth Community Service Clubs	Our Mission statement is to foster economic social development by providing: Computer Literacy Training, Youth & Adult financial education, After-School tutorials/GED classes, Teaching Employment and job service skills, Teaching Entrepreneurial skills, and we serve as an USDA Food Distribute Pantry.						
LAFAYETTE COMMUNITY HEALTH CARE CLINIC	http://lchcc.net/		EIN 72-1221982	1317 Jefferson St	Lafayette	LA	70501	USA	Health, Public Health		Lafayette	out-patient medical services, GYN clinics, dental clinics, and pharmaceutical services, all at no cost to our patients.	provide health care to the working uninsured			
Cultural Crossroads Of Minden Inc	http://artsinminden.com	(318) 377-9200	EIN 72-1287064	Po Box 1393	Minden	LA	71058	USA	Arts & Culture	Promote arts & culture in the community		Minden spring arts festival - 3 day outdoor festival festival offers free instructional art programs for area elementary children by professional artists. Total individuals benefit > 2,500				
ST.MARK INSTITUTE OF HEALTH SCIENCES ltd	http://www.stmarkinstitute.org	+256783452511	EIN 	kyengera masanda wakiso	Kampala		71474	Uganda		Enhancing the life of orphans and PH As through parental care, guidance and education.	10 kilometers		Children from 6months-18 years old	1000	bought land  1 acre,so far we are helping 100 children in education, carrying out fund raising, we have built 3 class room block	
New Orleans Faith Health Alliance	http://www.nofha.org	504-486-8585	EIN 26-2665118	3401 Canal Street Suite 200 NE	New Orleans	LA	70119	USA	Community Clinics, Health, Hospitals	To provide quality, affordable primary care to working uninsured and their families.	Greater New Orleans Area	Provide affordable healthcare services to working uninsured individuals and families in greater new orleans. In addition to providing primary care services, the organization provides health coaching/nutrition education to all patients. However, those who are diabetic or hypertensive are strongly encouraged and recommended to work with the health coach/nutrition educator to develop an individual health plan. We logged over 1,000 visits in 2012 and continued to provide individual support to all patients making lifestyle changes for improved health. 100% of the hypertensive patients that worked with the health coach/nutrition educator improved their blood pressure over the year. The organization also provides blood pressure screenings, flu vaccines and health education in the community at health fairs, schools and in the workplace.				
Thibodaux Area Christmas Toy Dr	http://		EIN 72-1344564	Po Box 1014	Thibodaux	LA	70302	USA	Gift Distribution, Human Services							
Bpcc Foundation Inc	http://www.bpcc.edu/foundation	(318) 746-9851	EIN 72-1393535	6220 E Texas St	Bossier City	LA	71111	USA	Philanthropy, Public Foundations	The purpose and mission of the bpcc foundation is to host fundraising events and activities to raise monies that will assist the bossier parish community college in the following manner: to provide additional student scholarships, to sponsor faculty and staff professional development workshops, and to support the athletic programs. Organized in 1997, the bpcc foundation, inc. Was designed for the purpose and mission of engaging in educational, scientific, literal, benevolent, and charitable works exclusively for bossier parish community college. The fundamental purpose of the foundation is to promote the educational and cultural welfare of bossier parish community college, to improve the college's facilities so as to provide broader and educational advantages and opportunities, to encourage educational advancement, and to increase the college's usefulness to the citizens of louisiana.		Bossier parish community college scholarships for students selected by the college  bossier parish community college faculty and staff development  bossier parish community college chancellor's fund expense				
Relief Fund Of The Louisiana Dental Association	http://		EIN 72-6031859	7833 Office Park Blvd	Baton Rouge	LA	70809	USA								
Glad Tidings Church Ministries	http://		EIN 72-1297848	1886 Missile Base Rd	Stonewall	LA	71078	USA	Protestant, Religion							
Shreveport-Bossier Rescue Mission	http://www.sbrescuemission.com	(318) 227-2868	EIN 23-7050551	901 Mcneil St	Shreveport	LA	71101	USA	Homeless & Housing, Homeless Shelters, Housing Development, Construction & Management, Mental Health, Substance Abuse Treatment	The shreveport-bossier rescue mission, inc. Exists to pursue the passion of jesus christ to lift up the hungry, homeless, abused, and addicted.		The shreveport-bossier rescue mission has four facilities: the housing facility; a warehouse facilty where residents learn job skills like welding, furniture refinishing, and automotive skills; the thrift store which supports the rescue mission's work; and a work program housing facility. The shelter has free medical and dental clinics for the homeless residents which is staffed by volunteer health care professionals. Other services include: chapel services, discipleship training, work assistance, homeless intervention services, and women and family services.   thrift store and enterprise operations: supports the rescue mission's work and provides training for individuals.				
St Martin Humane Society	http://www.stmartinhumane.org	(318) 680-1267	EIN 72-1443714	Po Box 64	Breaux Bridge	LA	70517	USA	Animal Protection & Welfare, Animals	Assist in numerous rescues of animals by getting them medical attention and fostering them until adopted.		Assist in numerous rescues of animals by getting them medical attention and fostering them until adopted.				
Camp Fire, Inc. Sowela Council	http://www.campfireusa.org/		EIN 72-6001355	2126 Oak Park Blvd Sowela Council	Lake Charles	LA	70601	USA	Boys & Girls Clubs, Camp Fire, Children & Youth	Camp Fire USA's mission is to build caring, confident youth and future leaders.						
Unity In The Community Uitc	http://		EIN 72-1288679	3763 Lorraine St	Baton Rouge	LA	70805	USA	Protestant, Religion							
Inner-City Revitalization Corporation	http://www.innercityrevitalization.org		EIN 72-1402559	1902 Main St	Alexandria	LA	71302	USA	Homeless & Housing, Housing Search Assistance	Providing clean, healthful, safe and affordable housing for low income families.		Olive house - transitional housing and other low income rental housing  building of single family residences for sale to low income individuals and families.				
Shreveport Medical Education And Research Fund	http://		EIN 72-6030744	736 W Lakeshore Dr	Benton	LA	71006	USA								
Bbb Consumer Education Foundation A Non-Profit Corporation	http://	(225) 346-1162	EIN 58-1716864	748 Main St	Baton Rouge	LA	70802	USA		Consumer education		Distribute consumer education materials (more than 15,000) to businesses and two trade shows, 20 speaking engagements, and better business bureau members. Issued 35 scam alerts to the public via printed media and 52 interviews on local radio and television broadcasts on consumer tips. Awarded $1,000 scholarship to a local high school senior. Consumer id theft protection event shredded 13 tons of personal documents for the public free of charge.				
Plaquemines Animal Welfare Society	http://	(504) 392-1601	EIN 46-0519776	Po Box 83	Belle Chasse	LA	70037	USA	Animal Protection & Welfare, Animals	Rescue shelter for adoption of cats and dogs.		Rescue shelter for adoption of cats and dogs.				
Awesome Ladies Of Distinction	http://		EIN 72-1495894	3848 Irwin Kuntz Dr	Harvey	LA	70058	USA	Children & Youth, Youth Development							
Spiritual Assembly Of The Bahais Of East Baton Rouge Parish	http://		EIN 72-1162884	Po Box 84864	Baton Rouge	LA	70884	USA								
Junior League Of Alexandria Inc	http://		EIN 72-6027983	Po Box 13086	Alexandria	LA	71315	USA	Women, Womens Service Clubs	USED CLOTHING SALES-DONATED CLOTHING IS SOLD TO LOW INCOME AND ECONOMICALLY DISADVANTAGED INDIVIDUALS AT BELOW MARKET PRICES VARIOUS EDUCATIONAL COMMUNITY RELATED EXPENSES DESIGNED TO INFORM AND EDUCATE THE PUBLIC AND BUILD LEADERSHIP SKILLS AND PROMOTE VOLUNTEERISM						
Vermilion Parish Council On Aging	http://	(337) 893-2563	EIN 72-0742247	Po Box 543	Abbeville	LA	70511	USA	Human Services, Senior Centers, Seniors	To deliver services to the elderly of vermillion parish. We are the designated agency (in affiliation with regional & state agencies) for meal services,senior center, homemaker, transportation and similar services to the aging.		All programs are designed to deliver services to the elderly of vermilion parish. We are the designated agency centers, homemaker and transportation services to the elderly. Allcosts are either direct or indirect.				
Chorale Acadienne Inc	http://www.choraleacadienne.com		EIN 72-0898404	Po Box 53868	Lafayette	LA	70505	USA	Arts & Culture, Singing & Choral Groups			The Fall Concert, Spring Concert and Christmas at the Cathedral are the three concerts making up the Chorale Acadienne annual season. The musical soirees are evenings of music in the homes of our supporters. The Children's Chorus is a group of young people that performs at their own concerts, as well as come of the Chorale Acadienne programs.				
Oakdale Apostolic Church Inc	http://		EIN 72-1122840	503 W Santa Fe St	Oakdale	LA	71463	USA								
Iberville Foundation For Academic Excellence Inc	http://	(225) 687-4494	EIN 72-1224000	Po Box 672	Plaquemine	LA	70765	USA	Education, Parent & Teacher Groups	To invest directly in the work of individual teachers and schools through grants for innovative ideas and programs for the public schools of iberville parish		Provision for grants to teachers, schools, and other educational institutions in iberville parish				
Baromedical Research Institute Ltd	http://		EIN 72-0940152	17 Carriage Ln	New Orleans	LA	70114	USA		MEDICAL RESEARCH TO LEARN MORE ABOUT THE EFFECTS OF HYPERBARIC OXYGEN THERAPY ON TRAUMATIC BRAIN INJURY AND POST TRAUMATIC STRESS DISORDER.						
Restoration Pregnancy Resource Center Inc	http://www.resthse.org	(985) 542-0492	EIN 58-1753800	101 S Spruce St	Hammond	LA	70403	USA		Protecting life and restoring hope through education to expectant mothers and their families		Young women are provided education in assisting them with unwanted or				
Employment Development Services Inc	http://www.edsla.com	(225) 927-1610	EIN 72-1104540	Po Box 15447	Baton Rouge	LA	70895	USA	Job Training, Vocational Rehabilitation	To serve as the state of louisiana's central agency for the acquisition and execution of work contracts to facilitate employment of persons with disabilities.		Arrange contracts for employment of the handicapped through the louisiana state use program. There were approximately 1,400 individuals with severe disabilities that were served. Eds served 75 community rehabilitation programs during the fiscal year ending june 30, 2015.				
Manners of the Heart	http://www.mannersoftheheart.org	225.383.3235	EIN 68-0531760	763 North Boulevard	Baton Rouge	LA	70802	USA	Education, Parent & Teacher Groups, Primary & Elementary Schools	Our mission is to help children see beyond themselves so they can become all they are meant to be.	schools across the country	Manners of the Heart Elementary Character Curriculum PreK-5 Manners at the Table Elementary Etiquette Curriculum K-5  Leaders by Example High School Character Curriculum  Teacher In-service Training  PreK-12  Raising Respectful Children in a Disrespectful World Parenting book  Raising Unselfish Children in a Self-Absorbed World Parenting book  Parent/Grandparent Workshops & Conferences  Keynote and Conference Speaking National Media Contributors	children see beyond themselves to become all they are meant to be	4000+ students, locally. Countless, nationally.	MOH Impact from our founding:  95,000+ copies of our 3 parenting books distributed; 79,500 elementary children - Manners of the Heart curriculum;  18,600+ parents attended a parenting seminar;    6,000+ teachers - Teachers by Example, in-service training;    5,265+ high school students - Leaders by Example;   4,655+ business professionals - The Business of Manners;   1,876 Manners of the Heart curriculum kits distributed;   1,500 pages of material in 8 teaching manuals;         50 states and 5 countries have used our programs	
Cerebral Palsy Association Of Greater Baton Rouge Inc	http://www.mcmainscdc.org	(225) 923-3420	EIN 72-0459036	1805 College Dr	Baton Rouge	LA	70808	USA	Developmentally Disabled Centers, Disabilities, Down Syndrome, Health, Rehabilitative Care	The mission is to identify and treat children with cerebral palsy developmental delays and learning disabilities to enable them to reach their potential and to function as independently as possible.		The organization provides therapeutic services to children with cerebral palsy, developmental delays, and learning disabilities.	We serve children birth-18 years old who have cerebral palsy, developmental delays, and learning disabilities, and syndromes such as Retts and Down syndrome in the greater Baton Rouge area.			
