Vivre Musicale	http://www.vivremusicale.org	561-846-2514	EIN 27-1293459		Baltimore	MD	21218	USA		Vivre Musicale is a non-profit chamber music society that seeks to provide young up and coming musicians a strong foot hold in the classical music world through the diversification of concerts, genres, and the melding together of various art forms that further enhance the concert going experience. It is a collection of select young classically trained artists and guest artists whose goal it is to push the limits of classical music leading the world into a future of living art, where classical music no longer place holds as an aural museum of the past but rather a vibrant, living expression of past impetus informed by contemporary knowledge and performance practice. Through the collaboration of visual and other performance artists as well as different musical genres, Vivre Musicale hopes to diversify the would-be classical music audience, not limiting or pigeon-holing itself in a narrow frame of works but continually seeking to make connections between works of various styles. In total, Vivre is life, the living music. It is the music that inspires, propels, and gives voice to those who otherwise would be silenced in a world where classical music is pronounced dead. It is the chamber group of the past, the present, and the future.	We have produced 5 successful concerts in these cities: Arlington, VA; Baltimore, MD; Boca Raton, FL; Cincinatti, OH. www.vivremusicale.org/concerts			2010/2011 "Something OLD, Something NEW, Something BORROWED, Something BLUE: A Marriage of Mediums" www.vivremusicale.org/concerts for more info!	Young Artists from all over the country!
SUGARLOAF CITIZENS ASSOCIATION INC	http://www.sugarloafcitizens.org/	301-349-4889	EIN 23-7362604	20900 Martinsburg Rd	Dickerson	MD	20842	USA	Neighborhood & Block Associations	Protection of farmland and ecology			Montgomery County, MD	See schedule o  other program services	
Run Your Race Ministries	http://runyourrace.org		EIN 26-3720277	6108 Westland Dr	Hyattsville	MD	20782	USA	Human Service Organizations						
The Travelin' Rat	http://thetravelinrat.org		EIN 45-4332337	8016 Bellonia Rd  Unit 672	Riderwood	MD	21139	USA	Animals	To help animal rescues, especially those that take in rats, wherever we can, in whatever way we can.		11 rescues	globally	our Rescue of the Month and Emergency Vet Fund for Rescues	animal rescues, especially those that take in rats
Baltimore Science Fiction Society Incorporated	http://www.bsfs.org	(410) 799-7438	EIN 52-1098281	6142 Waterloo Rd	Columbia	MD	21045	USA		To educate and promote interest in science fiction/fantasy reading, writing, art and media through activities which lead to exposure and involvement with science fiction/fantasy, especially in the area of reading and writing of the same.				The annual "balticon" convention provides members with panels, speakers and special exhibits as well as movies, videos, book sellers, associated gaming, associated art and other related items.   print monthly newsletters for members which is exchanged with several other similar groups.   support and promote basic literacy in general and science fiction/fantasy in particular through the annual compton crook award for the best first novel in science fiction during the preceding year, the annual young writers contest, the annual poetry contest and support of local libraries through participation in local book and art festivals.   maintain a library of science fiction and fantasy books and videotapes for members and the public's use. The organziation regulary holds business meetings, social meetings and science fiction book discussion groups for members and the public.	
Adventures In Health Educational And Agricultural Development Inc	http://aheadinc.org	(301) 530-3697	EIN 52-1487952	6324 Windermere Cir	Rockville	MD	20852	USA	Children & Youth, Counseling, Health, International, International Development, Mental Health, Public Health, Youth Community Service Clubs	Provide direct assistance to people in gambia, tanzania and in the usa in the areas of health and education				The organization service accomplishments for each of its three largest	
Friends of Jordan	http://friendsofjordan.org/		EIN 47-0947474	3703 37th Place	Cottage City	MD	20722	USA	International	To facilitate networking and knowledge exchange among persons with a common interest in the country of Jordan, promote a better understanding of Jordanian people and culture, and support projects and activities of the U.S. Peace Corps and charitable private organizations in Jordan.			Jordan	grassroots community development, cultural exchange, environmental beautification, learning opportunities, or provide services for Jordanian communities in need.	educate youth and adults
Cystic Fibrosis Foundation Headquarters	http://www.cff.org	(301) 951-4422	EIN 13-1930701	6931 Arlington Rd Suite 200	Bethesda	MD	20814	USA	Birth Defects & Genetic Diseases, Health, Lung Diseases, Specifically Named Diseases, Specifically Named Diseases Research	The CF Foundation is dedicated to improving the quality of life for people with CF by funding the research necessary to develop new treatments and one day, a cure. CF is a complex, genetic disease that affects about 30,000 children and adults in the United States.  Today, the median age of survival for an individual with CF extends into the early 30s.  CF is caused by a defective gene that causes the body to produce an abnormally thick, sticky mucus, which clogs the airways, leading to chronic lung infections.				The CF Foundation currently funds more than two dozen clinical trials for CF to address the lung complications and dysfunction in people with CF and to correct the basic defect in the cells. The CF Foundation also supports educational programs and tools for care-givers of people with CF and accredits more than 115 specialized CF care centers around the country.	
Docs in Progress, Inc.	http://www.docsinprogress.org	301-789-2797	EIN 20-2784718	8700 First Ave	Silver Spring	MD	20910	USA	Arts & Culture, Film & Video, Management & Technical Assistance	Docs In Progress gives individuals the tools to tell stories through documentary film to educate, inspire, and transform the way people view their world.				Workshops and screenings helped aspiring filmakers by teaching basic skills and critiquing works in progress	
Creating Communities Corporation	http://www.creatingcommunities.net	(410) 279-3809	EIN 26-0631265	139 Jefferson St.	Annapolis	MD	21403	USA	Arts & Culture, Arts Education	Our Vision: To create communities where the arts are an integral component of our social fabric; where the power of creativity connects, enriches and transforms lives.  Our Mission: To harness the power of the arts to build life skills and self-esteem, and foster connections across cultures. We seek to partner with communities and provide underserved populations with direct access to the arts through innovative programs and mentorships.	Creating Communities Quick Facts  	Key partners: Anne Arundel County Public Schools, Arts Council of Anne Arundel County, Whole Foods of Annapolis, Baldwin Family Foundation, Carol M. Jacobsohn Foundation, Graham Landscape Architecture, Maryland Hall for the Creative Arts, Maryland State Arts Council, Maximus Properties, Parole Rotary  	Approximately 20% of the families served by the youth programs have an income of $26,000 or less; one-third of these families describe their economic condition as barely making ends meet.  	The Arts Mentorship Academy (AMA) has served nearly 300 children age 8-17 since 2008 and has grown over 270% since that time.  	93% of parents believe that the lessons learned through the artistic and creative activities of the AMA benefit their child academically  	95% of the students shared what they learned with their parent or guardian, demonstrating that the arts bring families together   	100% of parents/guardians stated that they thought the AMA taught their child positive life skills and 73% noticed talents in their child of which they were not aware  	100% of parents/guardians were very satisfied with the AMA.  	91% of the participants, in a recent Life Skills Through Arts session felt they would apply the lessons learned outside of the program and 89% would continue to use the lessons learned after leaving the shelter.			Programs That Change Lives The Arts Mentorship Academy (AMA) program is one example of Creating Communities at work. AMA is an Arts-based alternative education opportunity for young people ages 8 to 17 providing Arts instruction, mentoring, and experiential learning. The program also focuses on teaching academic competencies based on Maryland State Voluntary Curriculum standards. The program teaches artistic skills while it fosters community service. It also teaches life skills such as leadership development and teamwork, which in turn build self-confidence and self-reliance.   The Arts Mentorship Academy serves 100 students and runs for one week in the summer, with occasional weekend intensives and after school sessions. A typical day at the Academy begins with the teachers/mentors leading students in an interactive session. Students then break out into smaller groups to work closely with master artists, followed by collaborative art projects such as creating murals, participating in a drumming circle, or choreographing a group dance.    Another program, The Youth Arts Fellowship (YAF), is an innovative arts-based alternative education opportunity that provides instruction, mentoring, and experiential learning for twenty Annapolis and Anne Arundel County 10th to 12th graders.  YAF is designed for students who are particularly challenged by traditional curricula and who need additional support to assist them in reaching personal and academic goals. Students meet one Saturday per month for ten months for an all-day retreat. The teacher-to-student ratio is 1:4 enabling personal mentoring and special attention to the needs of each student. Field trips to the Kennedy Center, Baltimore Museum of Art, and Maryland Hall for the Creative Arts broaden and enrich the students experience. The group also takes part in three, arts-based community service projects, giving back to the wider community while strengthening the social fabric.  Not only youth but also adults are benefited from Creating Communities programs. For example the Life Skills Through The Arts track includes an eight-week program for parents residing at Sarahs House. Located in Anne Arundel County, Sarahs House is a supportive housing program offering emergency shelter rooms and transitional apartments for families that are homeless. The typical family consists of a mother and two children.  More than 55 percent of the residents served annually are children. In FY2010-2011, over 325 children lived at Sarahs House. Poetry, music, drawing, and storytelling, are just a few of the means used to develop life skills and encourage learning.	
National Aquarium Inc	http://www.aqua.org	(410) 576-3800	EIN 52-1121163	501 East Pratt	Baltimore	MD	21202	USA	Animal Services, Animals, Environment, Natural Resources Conservation & Protection, Water, Water Resources, Wetlands Conservation & Management, Zoos & Aquariums	To inspire conservation of the world's aquatic treasures.				Biological programsthe national aquarium's living collection includes more than 17,000 animals from more than 750 species of fish, birds, amphibians, reptiles, and marine mammals that live in award-winning, re-created habitats. The biological programs department provides the best possible care for all animals in the collection and works to promote the conservation of wild populations and their habitats. In addition, biological programs staff conducts scientific research and field work to support species and habitat conservation, with a strong emphasis on the chesapeake bay.   conservation educationthe national aquarium's education programs help students and teachers gain leadership skills and improve science learning, especially at a time when school districts struggle to provide hands-on environmental education opportunities. Conservation programs, both on-site and in the field, guide participants toward more personal and sustainable relationships with the natural world, inspiring students to enjoy, respect and protect the aquatic world. Each year, more than 113,000 students and chaperones visit the national aquarium, with approximately 11,000 coming from baltimore city, which has many struggling schools. The free admission program, available to maryland schools, introduces students to environmental conservation and marine science. Programs for teachers and school-aged youth include curriculum support; teacher orientations, workshops, and other trainings; school group tours; and grade-appropriate classroom programs that meet national and state curriculum standards.   guest operationsas an institution accredited by the association of zoos and aquariums (aza), the national aquarium is a leader in its field and embraces the highest quality facilities, programs, and staff available. Since opening in 1981, more than 47 million guests have learned about the rich diversity of life through the aquarium's exhibits and by participating in its guest programs. Programming for guests includes animal encounters, feeding and diving demonstrations, guided tours, classroom programs, auditorium presentations, hands-on discovery cart interactions, and other enrichment activities and special events.	
REACH GHANA	http://		EIN 27-1678738	731 Fallsgrove Drive Suite 7132	Rockville	MD	20850	USA	Human Service Organizations	REACH is committed to improving the health-care system in Ghana and promoting equal access to quality health-care for all by:  supplementing health-care resources engaging and empowering members of the community, and advocating for, and helping to develop sustainable approaches to health-care delivery.					
Community Bridges, Inc.	http://communitybridges-md.org	301-585-7155	EIN 52-2043059	8757 Georgia Ave Suite 540	Silver Spring	MD	20910	USA	Children & Youth, Community Health Systems, Health, Youth Development	Community Bridges believes that all girls are infinitely capable of succeeding in life as strong and confident young women. We empower girls to discover their unique identity, voice and potential through leadership development, academic support and enrichment, and exposure to opportunities that challenge them to become advocates for themselves, their families and their community.		200 girls and 220 families.	Montgomery County, Maryland	CB GIRLS: providing after school and out of school time opportunities and development for girls in grades 4-12 to break their cycle of poverty. CB FAMILIES: providing workshops and resource opportunities for the parents of our girls. CB MENTORING: providing high school mentors to middle school and elementary school girls (Big Sister, Little Sister) and providing women mentors to our high school students.	immigrant and minority girls become exceptional students, positive leaders and healthy young women.
Apples For Children	http://www.applesforchildren.org	(301) 733-0000	EIN 52-2358494	1825 Howell Rd Ste 3	Hagerstown	MD	21740	USA	Children & Youth, Children & Youth Services	The organization is operated for the following purposes: 1. To provide training to whole groups of providers, parents and employees. 2. To provide individualized technical assistance to individual child care providers, parents and employees.				Provide training to whole groups of child care providers, parents and employees.   provide individualized training and technical assistance to individual child care providers, parents and employees.	
Reece's Rainbow Down Syndrome Adoption Grant Foundation	http://www.reecesrainbow.org	(240) 780-2120	EIN 20-5466141	PO Box 277	Monrovia	MD	21770	USA	Adoption, Children & Youth, Civil Rights, Disabilities, Disabled Persons Rights, Down Syndrome, Health, Right to Life	1)  Promote the dignity of life of children with Down syndrome & other special needs around the world. 2)  Raise awareness for the plight of orphans with Down syndrome living in foreign orphanages and mental institutions.   3)  Locate and identify as many orphans with Down syndrome as possible, in every country of the world, so that each may have a voice and hope for a "forever family". 4)  Seek US and Canadian families to adopt these children. 5)  Raise money as adoption grants so families can afford the high cost of doing so.	Begun June 2006 More than 2000+ orphans have found families More than $12 million in grants have been disbursed State certified & registered in Maryland and Georgia Independent financial audit & review conducted annually Function on under 10% operationally each year.	270 orphans w/ special needs come home to "forever families"	globally	Waiting Child Grant Funds--for children still needing adoptive families Family Sponsorship Program--for committed adopting families Voice of Hope --operational expenses Child of the Month--one featured child to rally & give for each month 5/5/5--monthly crowdfund with $5 for 5 families on the 5th of each month Prayer Warriors Christmas Warriors Christmas Angel Tree	fund the adoptions of children with Down syndrome and other special needs internationally.
Community Services For Autistic Adults And Children	http://www.csaac.org	(240) 912-2240	EIN 52-1263443	8615 E Village Ave	Montgomry Vlg	MD	20886	USA	Autism, Disabilities, Health	To enable individuals with autism to achieve their highest potential and contribute as confident individuals to their community.				Residential- the residential services currently supports 52 homes in the community for individuals with autism. Csaac strives to assist in the achievement of each individual's goals and outcomes.   supported employment services- csaac provides a wide range of vocational services to individuals with autism. Csaac assists individuals to obtain their choice of meaningful "real work" employment in the community.   community school of maryland- the school offers several different services to meet the individual eucational goals of children and adolescents with autism between the ages of 7 and 21 by offering an age appropriate integrated environment to the student.	
CREATE Arts Center	http://www.createartscenter.org	(301) 588-2787	EIN 52-1489164	816 Thayer Ave	Silver Spring	MD	20910	USA	Arts & Culture, Arts Education, Arts Services	The mission of CREATE Arts Center is to foster creativity, skill development, self expression and enjoyment in the arts.  We believe art promotes growth, learning, and healing, as well as confidence and self esteem.  An important part of our mission is to improve the lives of underserved, at-risk populations in the community through arts opportunities.			Washington DC metropolitan area, downtown Silver Spring, MD	Summer & Winter Arts Camp, Classes for children and adults, Workshops, Birthday Parties, Studio Downstairs Art Therapy Program	
A Bigger Picture, Inc.	http://www.abiggerpicture.org	301-541-3605	EIN 45-4423111	PO Box 2213	Bowie	MD	20718	USA	Children & Youth, Youth Development Programs	A Bigger Picture is a 501(c)(3) non-profit organization dedicated to making a lasting difference in the lives of girls in grades 7-10 through mentorship, exposure, community service and travel opportunities.	-Partnered with the Forestville Boys and Girls Club and El Haynes Public Charter School  -Received our first grant from Dosomething.org -Over the summer of 2011 the girls volunteered over 90 hours of community service through our program -In September 2012, A Bigger Picture, Inc. became a 501(c)(3) organization - We received a book grant from First Book DC that provided college prep materials for the girls in the program		Washington, DC and Maryland	A Bigger Picture partners with schools and community centers to provide girls in the Washington, DC and Maryland area with: Educational and comprehensive workshops  Exposure to new experiences through our enrichment activities An opportunity to give back through our community service projects Traveling opportunities   In turn our girls are provided with:  Leadership, confidence and forward-thinking skills A safe place to learn and grow outside of a traditional classroom setting  Opportunities to develop positive relationships with other students and mentors A positive attitude towards school and academics	Girls in grades 7-10
Maryland Womens Heritage Center And Museum Inc	http://www.marylandwomensheritagecenter.org	(301) 490-7212	EIN 20-1166317	C/o Rj Tomlinson 8630m Guilford Rd	Columbia	MD	21046	USA	Arts & Culture, History Museums	Establishing a maryland women's heritage center and museum.				The mwhc&m has started a small museum in donated space. We are securing funding for the purpose of establishing a permanent museum in maryland that honors, recognizes and educates all people re: the achievements of women through md's history.	
Bladder Cancer Advocacy Network Inc	http://www.bcan.org	(301) 215-9099	EIN 20-2897110	4915 St Elmo Ave	Bethesda	MD	20814	USA	Cancer, Health	To increase public awareness about bladder cancer; to advocate bladder cancer research; and to provide educational and support services for the bladder cancer community.				Research - bcan works to advance bladder cancer research. Recognizing the overwhelming need for research funding, bcan has also engaged a new generation of researchers with the young investigator research awards (3 - $100,000 grants payable over 2 years). With an ongoing investment, bcan plans to expand this innovative research program which provides hope for future treatments. In 2014, bcan established the bladder cancer research innovation award, a $300,000 grant awarded over two-years, for a seasoned researcher to bring a new perspective to bladder cancer research. The new award helped the organization reach the $1 million mark for research investment.   education and information - bcan hosts a variety of educational programs and publishes printed materials to educate those coping with a bladder cancer diagnosis. Now in its second printing, bcan's comprehensive patient handbook, "bladder cancer basics for the newly diagnosed," has been provided to thousands of survivors, caregivers, urology practices, and cancer centers across the united states. The patient insight webinar series is an interactive web program that addresses a variety of issues from clinical trials to living with urinary diversion. The webinars feature top experts in their field and address patient concerns in an easy format. In 2014, bcan expanded support programs by engaging community volunteers to staff the bcan connection information and referral line. The program provides practical resources for those coping with a bladder cancer diagnosis. The survivor 2 survivor program connects newly diagnosed patients with survivors with a similar diagnosis.   think tank - the bladder cancer think tank (think tank) is the only medical symposium dedicated solely to bladder cancer. Through collaboration urologists, oncologists, scientists, and researchers are pioneering new treatment protocols, investigating genetic expressions, and improving access to quality care for those living with the disease. The john quale travel fellowship program provides financial support to help select researchers pay travel expenses related to their attendance at the annual bladder cancer think tank where they have the opportunity to present their research, network with leading bladder cancer researchers and gain insights from the think tank. Each year, four $1,700 travel fellowships are awarded to early career physicians and scientists. The 2014 think tank was the largest to date engaging nearly 170 participants.	
Operation Second Chance Inc	http://www.operationsecondchance.org	888-OSC4VETs	EIN 20-2624345	20251 Century Blvd Suite 130	Germantown	MD	20874	USA	Military & Veterans Organizations, Veterans	We are patriotic citizens committed to serving our wounded, injured and ill combat veterans. We support Veterans and their families by building relationships and identifying and supporting immediate needs and interests. We are dedicated to promoting public awareness of the many sacrifices made by our Armed Forces.			the United States of America	Morale, welfare, and recreation expenses to improve the morale of wounded soldiers. Activities include meals, cookouts, and trips to the movies for the soldiers.   assistance for individual wounded soldier's expenses including clothing, airline tickets, mortgage payments, and car repairs.	wounded, injured, and ill veterans and their families
