The Roberto Clemente Health Clinic	http://www.nicaclinic.org	410-369-0512	EIN 71-0926873	105 West Monument Street	Baltimore	MD	21201	USA	Ambulatory & Primary Health Care, Health	The Roberto Clemente Health Clinic provides affordable access to high-quality health care and wellness programs in the Tola coastal communities of Nicaragua.	Launched in 2004, the Clinic is the creation of generous donations from private individuals, the volunteer efforts of the Rotary Club of Pittsburgh, The Oxford Club, and the Granados Family who donated the land.  This 2,750 square foot facility is staffed by a team of medical professionals who are all accredited by the Nicaraguan Ministry of Health.volunteers  The Roberto Clemente Health Clinic serves over 12,000 patients per year through general and emergency care, minor surgery, dentistry, lab work and a fully stocked pharmacy.  The opening of our clinic means an expectant mother who lives in Limn and the 27 surrounding communities can easily access necessary prenatal care. It means an injured worker can quickly get safe, efficient medical treatment and prescriptions. It means the residents of Limn can have a neighborhood doctor who can treat emergencies like allergic reactions, lacerations and asthma attacks, or even perform routine medical exams and testing.	over 10,000 deserving Nicaraguans	Nicaragua	Healthy Eating Initiative, Clean Water Initiative, Padrino Program, and Volunteers Program	children, young people, women, elders, anyone in need...
Ignatian Volunteer Corps	http://www.ivcusa.org	(410) 752-4686	EIN 52-1885486	112 E. Madison St., Suite 300	Baltimore	MD	21202	USA	Centers to Support the Independence of Specific Populations, Family Services, Human Service Organizations, Human Services, Religion, Religion-Related	The Ignatian Volunteer Corps (IVC) provides men and women age 50 and over the opportunity to serve the needs of people who are poor, to work for a more just society, and to grow deeper in Christian faith by reflecting and praying in the Ignatian tradition.					
The Wellness Community - Greater Washington, DC	http://wellnesscommunitydc.org	301-493-5002	EIN 	5430 Grosvenor Lane Suite 100	Bethesda	MD	20814	USA		To help people affected by cancer enhance their health and well-being through participation in a professional program of emotional support, education and hope.			Washington, DC, suburban Maryland, northern Virginia		
Landscape And Nature Discoveries Inc	http://www.landandnature.org		EIN 86-1161543	21014 Big Woods Rd	Dickerson	MD	20842	USA	Children & Youth, Environment, Environmental Education, Garden Clubs, Youth Community Service Clubs, Youth Development Programs	Landscape and Nature Discoveries, Inc. provides outdoor educational experiences for children encouraging them to appreciate, conserve, and respect their natural environment while cultivating connections with the community.					
Artstream Inc	http://www.art-stream.org	301-565-4567	EIN 37-1516235	620 Pershing Dr.	Silver Spring	MD	20910	USA	Arts & Culture, Arts Education, Performing Arts, Theater	ArtStream's mission is to bring to individuals with disabilities creative and performance opportunities that help them gain the confidence to engage with the world.	We bring the arts to many different communities.     To date we have 7 Inclusive Theatre Companies in Maryland, Virginia and North Carolina, plus inclusive theatre classes through the Mason LIFE Program at George Mason University in Fairfax, Community Services for Autistic Adults (CSAAC) in Montgomery Village, The ARC of Montgomery County, The Forbush School in Gaithersburg and Kids Enjoy Exercise Now (KEEN) in Rockville.    In addition, we hold social skills classes and workshops for adults with disabilities. In these sessions, participants practice real-world situations using acting skills.   We also bring interactive programs to adults and children in hospitals. ArtStream artists lead art sessions for wounded servicemembers and their families and caregivers at Walter Reed National Military Medical Center (WRNMMC) that help them heal and connect in a difficult time. Children at Duke University Hospital also enjoy empowering, interactive stories that bring magic and fun to a challenging setting.		Greater Washington DC	Inclusive Theatre Companies featuring adults with IDD,	Individuals with intellectual and developmental disabilities-including autism-and other social and behavioral needs
Worcester County Commission On Aging Incorporated	http://www.worcoa.org	(410) 632-1277	EIN 52-1127958	Po Box 159	Snow Hill	MD	21863	USA	Human Services, Senior Centers, Seniors	To enhance the quality of life of all older worcester county citizens by managing community based senior programs that are comprehensive, coordinated, accessible, and to advocate the needs of older citizens.				Programs to provide assistance to the elderly through meals, transportation, daycare, and senior centers.	
Nehemiah House Inc	http://www.nehemiahformen.com	(410) 882-2217	EIN 52-1723583	1607 Cromwell Bridge Rd	Baltimore	MD	21234	USA	Crime & Law, Food, Food Programs, Half-Way Houses for Offenders & Ex-Offenders, Homeless & Housing, Homeless Centers, Homeless Shelters	Nehemiah house is a non-profit corporation established for the purpose of providing emotional, physical and all-encompassing restoration of men out of jail, suffering with substance abuse or the ill-effects of society in general. The organization operates a homeless shelter located in baltimore, maryland and has been in operation since january 1991. Nehemiah house attempts to identify and address the problem that caused homelessness in the resident. To avoid being a "revolving door" type program, the help provided is aimed at giving the willing men the tools necessary to bring an end to their situation. Upon completion of the program, assistance is given to the resident as he is getting established back in society.				Operating a shelter and providing services such as g. E. D. Classes, career counseling, substance and abuse counseling, etc.	
Ulman Cancer Fund For Young Adults	http://ulmancancerfund.org	410 964 0202	EIN 52-2057636	921 E Fort Ave Ste 325	Baltimore	MD	21230	USA	Cancer	THE ULMAN CANCER FUND FOR YOUNG ADULTS CHANGES LIVES BY CREATING A COMMUNITY OF SUPPORT FOR YOUNG ADULTS, AND THEIR LOVED ONES, AS THEY FIGHT CANCER AND EMBRACE SURVIVORSHIP.	Since our inception in 1997, UCF has raised over $7 Million to support the young adult cancer fight.  We take great pride in putting these donations to use as effectively and efficiently as possible to further our mission and programmatic activities.     Some accomplishments we're proud of over the years include:  Awarding over $250,000 in college scholarships to young adults impacted by cancer all across the country      Distributing over 15,000 Guidebooks to individuals and cancer centers in all 50 US States  Responsibly allocating over 80% of all our spending towards mission related programs  Helping over 200 recently diagnosed young adult patients navigate their cancer experience every year  Effectively reducing our fundraising spending to less than 10% of our total expenditures by investing in programs like Team Fight and partnerships like 24 Hours of Booty, Rev3 Triathlon, 4K for Cancer, Maryland Half Marathon and more!  To see a financial breakdown please go to: http://www.ulmanfund.org/About-Us/Where-our-money-goes.aspx		USA	Cancer to 5K (free 12 week training program for cancer survivors to empower them physically to complete a 5K),  Helping Other Fight (a group of volunteers who help families facing cancer with day to day chores & more), 4K for Cancer (Cross country bike trips and runs to activate young adults in the fight against cancer), Team Fight (sports endurance team raising awareness & funds in the cancer fight)	Young adults between the ages of 15-39 who have been diagnosed with cancer or been affected by a cancer diagnosis of a family member, friend or loved one.
World Arts Focus	http://www.joesmovement.org	301-699-1819	EIN 52-1804860	3309 Bunker Hill Road	Mount Rainier	MD	20712	USA	Arts & Culture, Arts, Culture & Humanities, Dance, Performing Arts Centers	Open 350 days a year for classes, rehearsals, performances, and arts education programs, Joe's Movement Emporium is a hub of cultural and community activity. The largest independent performing arts center in Prince Georges County, Joes keeps at-risk kids learning, moving, and creating. A safe after-school haven for youth ages 5-13, Club Joes offers arts activities that nurture self-confidence and self-esteem. Performing Arts Summer Camp for children 3-13 (the day runs from 7am to 6pm) focuses on in-depth study of cultures and their art forms. For teens, the Theater Tech Program teaches the basics of working backstage along with academic and employment skills training, and a year of follow-up support. Joes also matches school teachers with local artists who enliven classroom lessons by infusing arts into the curriculum. And year-round, anyone can swing by Joes for classes in yoga, hip hop, ballet, jazz, and tap, or a dance concert in the intimate 150-seat theatre. There's great synergy between artists and residents at Joe's: together they build community and arts and kids  for everyone's greater good.	-70,000 served individuals served annually with programs both in our facility and throughout the greater community  - 3,500 children and youth served through after school programs, summer arts camp and workforce development  -$185,000 in scholarships and tuition assistance awarded to low-income youth  -25 local artists provided with affordable rehearsal and performance space  -19 years of exceptional educational and artistic experiences!	70,000 individuals with programming in our facility as well as throughout the community.	the Greater Washingon, DC area	affordable adult and youth classes, arts after-school care, summer arts camp, affordable rehearsal space for artists, a black box theater for events and performances, plus various free community-oriented events throughout the year.	bring the arts, especially movement, to the community
Adopt A Block Inc	http://www.rockcitychurch.com	(410) 882-2217	EIN 52-1758039	1607 Cromwell Bridge Rd	Baltimore	MD	21234	USA	Children & Youth, Community Coalitions, Human Services, Youth Development - Religious Leadership	Adopt a block, inc. Is a coalition of community groups working together to bring restoration to the inner city of baltimore, block by block. Their mission is to minister and serve the whole man - body, soul and spirit. The organization operates out of its facilities in baltimore, maryland.				Adopt a block parties bring resources and christ-centered entertainment to baltimore's city blocks to help begin the process of change. Bags of groceries, clothing, hot dogs and drinks are handed out from booths. People are linked to organizations providing employment, education, medical information, child services and local community contacts. Can can make a difference is the largest food distribution center in maryland that distributes its food for free. Can can feeds the hungry by the thousands. Compassion commission program is an intense time of outreach and ministry for youth. We bring in hundreds of teenagers, equip them with god's word, and then send them out into the city. They rebuild a house for a family in need, and they also rebuild the lives of broken people in the community.	
International Dravet syndrome Epilepsy Action League	http://www.idea-league.org	443-510-2734	EIN 20-4760085	PO BOX 797	Deale	MD	20751	USA	Epilepsy, Health	The IDEA League promotes awareness of and research for Dravet syndrome and related forms of epilepsy and provides resources and support to improve the quality of life for affected individuals and families. We strive to be the most up-to-date and accurate information source for Dravet syndrome and related conditions for both families and professionals.			International	Patient Medication Assistance Fund Funds of Hope - Research Grants International Family Medical Conferences Dravet Clinical Research and Care Network Family and Professional Educational Materials	Patients, caregivers and professionals around the world coping with the daily challenges of living with Dravet syndrome and closely related disorders.
White Marsh Volunteer Fire Company	http://www.wmvfc.org	410-335-5112	EIN 52-6050771	5419 Ebenezer Road PO Box 309	White Marsh	MD	21162	USA	Disaster Aid, Fire Prevention, Public Safety, Disaster Preparedness & Relief	The White Marsh Volunteer Fire Company provides fire, rescue, and emergency medical services to the citizens of White Marsh, Perry Hall, Nottingham, and other communities within Baltimore and Harford Counties. These services are provided with professionally trained volunteers from the community. The White Marsh Volunteer Fire Company and it's members maintain a commitment to public safety education and outreach to the community to create a safer environment.	Over 3000 calls for emergency service per year.	Over 3000	White Marsh, Maryland, USA	Fire, Rescue, Emergency Medical Services,  Rehab Services, and Public Fire and Life Safety Education	Residents, workers, students, shoppers, travelers and visitors
Susila Dharma Usa Inc	http://www.susiladharmausa.org	(469) 877-3045	EIN 04-2726186	4216 Howard Rd	Beltsville	MD	20705	USA	International, International Relief	Encourages, empowers and supports invidual and organizational charitable activities across the globe.				Cipanas yum village activities are focused on family based services, the providing of assistance for children though families. The cyv aims to provide assistance and support to the wider cipanas community, offering opportunities for families, mothers and youths to develop and strengthen their skills enabling them to later provide for their families. Yums ultimate goal is to support and develop families so that they will be able to care for their own children, instead of placing them in institutions.   susila dharma international association is a global, member based network made up of 23 national susila dharma organisations and 47 development projects.   mithra foundation bangalore city, india provides services in slums that include preschools,education for older children and women, job training,and healthcare. Mithra also addresses child labor and domestic violence, and promotes human rights programs.   q fund is a 501 c3 nonprofit organization whose mission is to collaborate with communities in turmoil and build school centered, self sustaining environments that nurture, educate and empower vulnerable children by honoring diversity, cultivating creativity, and fostering respect for the earth.   international child development programmes in south america, central america, india, europe, russia, israel, and africa: working with unicef, icdp provides training to parents and caregivers to help keep children healthy and alive, particularly amidst poverty, migration, war and disease as well as natural disasters.   badger camp greater fresno area, ca provides music, art, drama, crafts, writing, and puppetry to low income children to foster self esteem through artistic expression, creativity and self awareness  clear path international central vietnam, cambodia, and thailand supplies direct medical and social services to landmine survivors and their families as well as equipment to hospitals. The u. S. State department matches up to 60,000 in contributions.   pueblo people united for a better life in oakland urban youth harvest is a multi-ethnic, multi-issue community membership organization that uses organizing, direct action, policy research and analysis, leadership development, popular education, and coalition building to confront the issues that affect the lives of its membership. Its mission is to advocate for the needs of low income residents of oakland, most of them people of color, through grassroots organizing and leadership potential training. At risk youth and low income seniors are the primary beneficiaries of the pueblo programs, and many other community members benefit from the project and its activities.   quest center this portland, or program offers holistic care and education to people with critical illnesses, including hivaids and cancer. The emphasis is on healthy meals, alternative therapies, community building, and nutrition education.   bina cita utama school the vision of the bcu school is to develop a high quality learning environment and address the need in central kalimantan for education.   centre for culture and development. Modern forces, industrial and agricultural combine in india to create a huge underclass caught between traditional ways and the global economy, who don't have the skills they need to cope. The centre for culture and development works with disempowered peoples in southern india, both urban and rural, to help them acquire the skills and rebuild the social structure they need in order to prosper in a changing world.   yayasan tambuhak sinta is a development foundation based in the indonesian provinces of kalimantan. These provinces have a small population, but are rich in natural resources, and it is inevitable that large scale development will come. The foundation yts is working to create conditions that will enable this development to be balanced, sustainable, and equitable. To this end yts is collaborating with local communities and governments to strengthen their capacity to jointly manage the process of development.   anisha is a project begun in 1998 in the slums of bangalore city, india, by ms. Valli rajan and a small group of dedicated humanitarian volunteers. It is a public charitable trust registered with the government of india. The word anisha means moving from darkness to light, and its work has always embodied that spirit. The original mission of anisha was to operate a community based preschool in one of bangalore citys worst slum districts. It has now shifted its focus to working in rural areas in an effort to slow the flight of families from impoverished areas in the countryside into the hugely overcrowded urban areas. Agricultural practices in much of the countryside have become so dependent on the use of pesticides and artificial fertilizers that the soil is often too depleted to sustain local village life. People are unable to make a living and must abandon their rural way of life for the tragedy of urban slum living. Anishas current rural agricultural project is focused on working with small, marginal farmers and landless families in the martalli region of the southern indian state of karnataka. It is supported by a grant from the german federal ministry for economic cooperation and development as well as by grants from our susila dharma nationals sdusa, sd germany, and in recent years from sd norway, sd netherlands, and sd britain.   the human force volunteering for social change is a program that was founded and is directed by new york subud member alexandra woodward. In succesive years, starting in 2009, human force organized four camps to assist sd projects. In summer 2009, over 20 volunteers came together to rebuild part of a school for children from disadvantaged socioeconomic backgrounds at fundacin amanecer in colombia. In 2010, the human force worked at sd project usaha mulia abadi in san miguel atlautla, mexico, and in 2011, twelve volunteers assisted the cipanas yum village, a project in cipanas, indonesia. Most recently, in july, 2012, a camp of 12 volunteers from around the world was in residence at anisha, a program designed to assist local farmers in growing organic crops in karnataka state, india. Among their activities there, they interviewed community members about their farming practices and needs, and also taught english at a local high school.   womens world wide institute. This project, founded by new york city subud member, uraidah hassani, has as its goal to inspire and educate young women in low-income communities in nyc and in the developing world. They have initiated an after-school leadership, educational and personal development program called young women rock, for high school girls in local communities. They have also initiated the notebooks for peace program which donated inspirational notebooks to young people in conflict zones like the west bank and gaza. They have been active in supporting social action campaigns, like days of activism against gender-based violence, denim day solidarity with abuse victims, the aids walk, and the first ever international day of the girl. In 2013, twwi was granted 2,500 to help in funding the young women rock! Program. Twwi also receives financial oversight from the subud international cultural association  usaha mulia abadi a. C. Is a subud project located in the rural area of san miguel atlautla, edo. De mxico, mexico. Usaha mulia abadi has two purposes; first, to be a subud centre for all our brothers and sisters from around the world, and second to be a non profit organization that cares about the development of the community. San miguel atlautla is a marginalized area with a high index of poverty, 57% of the population is supported by agriculture and 12 per cent is illiterate. Usaha mulia abadi has worked in the community since 1997. This organization's main task is to work alongside the local community to build a center with an educational project for children and youth. Our mission is to support through this center, the development of skills, knowledge and comprehension to recognize and manifest the potential of the children and youth in an atmosphere of harmony and respect.   the purpose of the inner city schools project is to provides art supplies that are not normally available to children in low income schools. Books are also supplied. The project currently supports two schools every month. In addition the project provides clothing for homeless children when requested by social services in the area. The inner city schools project is just getting off the ground and has until now been supported only with small donations and grass roots fund raising. It is hoped that with support from sd usa the project can grow, and support more children.   tierra viva. In 2014, having formed a team of uruguayan collaborators, the new strategy is to develop a prevention project within and outside prisons. The composition of the new team means the project is able to expand its area of work which so far has been mainly focused on the caring relationships of women inmates with their children to now also cover the issue of hivaids prevention , prevention and treatment of addictions and some therapeutic guidelines with the inclusion in the team of psychologist sofia mutay.   subud indonesia. Install clean water towers in two villages. Towers are capable of producing 10,000 liters of fresh water per day by removing bacteria without the need for electricity except for the water pump. In addition, provide education concerning water health and hygiene.	
American Pain Foundation	http://www.painfoundation.org	(410) 783-7292	EIN 52-2002328	201 North Charles Street	Baltimore	MD	21201	USA	Health, Health (General & Financing), Health Care, Public Health	The american pain foundation is an independent nonprofit 501(c)3 organization serving people with pain through information, advocacy, and support. Our mission is to improve the quality of life of people with pain by raising public awareness, providing practical information, promoting research, and advocating to remove barriers and increase access to effective pain management.				Education & support: distributed 200,000 newsletters; distributed several thousand pain management books to va centers; presented at 12 conferences on the importance of improving pain management; published and distributed 12 e-newsletters; published and distributed 7,000 booklets on understanding and treating fibromyalgia; conducted 3-day training of pain advocates; supported advocates in conducting over 30 "pain awareness month" activities in local communities; responded to over 6,000 personal inquiries for information; conducted a program on acetaminophen safety; promoted and supported media activies conducted by volunteers supporting improved pain management; developed booklet on state pain policy; launched a major new project called painsafe which focuses on safe use of all treatment modalities and which provides information for providers and people with pain; managed new major professional education program called the national initiative on pain control.	
