Prickly Pear Land Trust	http://www.pricklypearlt.org	(406) 442-0490	EIN 81-0506868	Po Box 892	Helena	MT	59624	USA	Environment, Land Resources Conservation	To protect the natural diversity & rural characther of the prickly pear valley & adjoining lands through voluntary & cooperative means to perpetuate the recreational, wildlife, scenic, agricultural & historic values of the land.	Land preservation - planning & acquisition/donation of land for permanent protection. 2014 acquisitions included two additional land parcels located on mt ascension, valued at $352,500 (includes contributed value of $112,500 from the landowners). Pplt also acquired a parcel of land valued at $36,000 for centennial trail as part of the effort to connect spring meadow state park with the east helena bike path. A tract on rodney ridge was acquired with grant funds to extend the existing waterline trail. During 2014, pplt worked with the outdoor legacy foundation to acquire and transfer 300 acres in york gulch to the forest service, through a combination of landowner donation, grants and open space bond funds. In addition, pplt completed the aspen trails park project by transferring land to the state of montana for development of a fishing access site.   montana association of land trusts is a program sponsored by pplt in conjunction with other montana land trusts to support land conservation activity in montana and educate the public in these efforts. Malt activity included advocay for montana land trusts and educational conferences. Program service revenue includes fees of $7,669 received in support of this activity.   conservation program activities include various outreach and education activities within the pplt service area, initial work with landowners regarding future land and easement acquisitions and development and maintenance of the database regarding land conservation values within the pplt service area. This work includes outreach and planning efforts regarding conservation easements, and easement monitoring activity. Program service revenue consists of miscellaneous reimbursements received.   trails program - plan development, construction & maintenance, conducted with assistance of approximately 366 volunteer service days. Program revenue is derived from a contract with the city of helena for trail development & maintenance.					
Montana Environmental Information Center Inc	http://		EIN 23-7337100	PO Box 1184	Helena	MT	59624	USA	Environment	The Montana Environmental Information Center is a non-profit environmental advocate founded in 1973 by Montanans concerned with protecting and restoring Montana's natural environment.				Visit our accomplishments page at http://meic.org/about/accomplishments/		
Western Montana Equine Rescue & Rehabilitation Inc	http://		EIN 94-3466194	PO Box 1168	Corvallis	MT	59828	USA	Animal Protection & Welfare, Animals	To provide care for abandoned animals	To provide care and rehabilitaion for abandoned horses and other equine and to educate the public about these issuses					
Friends Of The Shelter Tobacco Valley Animal Shelter Inc	http://eurekafos.com	(406) 889-5457	EIN 81-0496968	Po Box 1815	Eureka	MT	59917	USA	Animal-Related, Animals	Shelter animals,spay/neuter,public education	To provide care for homeless animals and to attempt to find homes for as many animals as possible.					
Continental Public Land Trust	http://	(406) 782-0463	EIN 81-0465887	Po Box 3809	Butte	MT	59702	USA	Environment, Pollution Abatement & Control	The continental public land trust establishes a land trust to promote economic development to the community through enhanced quality of life in a depressed area.	Management services provided in establishing a land trust to promote economic development to the community through enhanced quality of life in a depressed area.					
Skyline Sportsman Association	http://		EIN 81-6012348	Po Box 173	Butte	MT	59703	USA								
Harvest Springs Community Church	http://		EIN 81-0301992	1001 36th Ave Ne	Great Falls	MT	59404	USA								
Bozeman Summit School Inc	http://		EIN 84-1413419	3001 W Villard St	Bozeman	MT	59718	USA	Education, Primary & Elementary Schools							
Rural Dynamics Inc	http://www.ruraldynamics.org	(406) 761-8721	EIN 81-0303443	2022 Central Ave Cccs Of Montana	Great Falls	MT	59401	USA	Financial Counseling, Human Services	We provide programs and develop partnerships to help youth, individuals, and families achieve economic independence.	Provided debt restructuring assistance through trust fund activity for 974 clients, provided financial education and counseling to 3,603 clients, and prepared 4,812 tax returns associated with the tax help montana program.					
Great Falls Public Library Foundation	http://www.gfplf.org	(406) 453-1100	EIN 23-7295568	Po Box 742	Great Falls	MT	59403	USA		The great falls public library foundation solicits, receives and provides stewardship of donations from the public to be used for the benefit, improvement and welfare of the great falls public library and its patrons, as a supplement to funds allocated from the budgets of the city of great falls and of cascade county, or otherwise received by the library.	The foundation has enabled the great falls public library to significantly expand materials and cultural events offered to the community. During the 2014-2015 fiscal year, the foundation bought 4,920 titles of which 1,953 were children/young adult materials. The foundation supported 117 adult programs with total attendance of 3,576. The foundation also provided funds to support downloadable e-books and audiobooks, a digital sign board, computer desk, and conference chairs.					
North Valley Food Bank Inc	http://		EIN 81-0456048	251 Flathead Ave	Whitefish	MT	59937	USA	Human Services							
The Ough Charitable Trust	http://	(406) 823-6411	EIN 81-6080844	504 S 13th St	Livingston	MT	59047	USA	Named Trusts, Philanthropy	The purpose of the trust is to establish a means for the trustors to make charitable contributions to livingston healthcare hospital, a 501(c)(3)organization, for the purpose of benefitting the community as a whole through its hospital, and thereby to support the hospital in its charitable purpose.	The purpose of the trust is to establish a means for the trustors to make charitable contributions to livingston healthcare hospital, a 501(c)(3)organization, for the purpose of benefitting the community as a whole through its hospital, and thereby to support the hospital in its charitable purpose.					
Institute Of Management Accountants Inc	http://		EIN 23-7353191	10600 Us Highway 10 E	Missoula	MT	59802	USA								
Thompson Falls Lions Manor Inc	http://	(619) 276-6271	EIN 81-0347759	Po Box 744	Thompson Fls	MT	59873	USA	Homeless & Housing, Low-Income & Subsidized Rental Housing	Provide affordable housing to low-income tenants	28 low income family housing units					
Montana Radio Reading Service	http://		EIN 81-0380195	PO Box 4126	Missoula	MT	59806	USA	Arts & Culture, Radio							
Elkhorn Mountain Health Services Inc	http://	(406) 225-4201	EIN 81-0426312	Po Box 28	Boulder	MT	59632	USA			Providing health care services to the rural community of boulder, montana and the surrounding area.					
Madison Valley Hospital Association	http://mvmedcenter.org	(406) 682-4274	EIN 81-0236460	305 N Main St	Ennis	MT	59729	USA	General Hospitals, Health	The mission of madison valley medical center is to provide healthcare and hospital services to the local community and surrounding area.	The madison valley medical center provides healthcare and hospital services to the local community and surrounding area.					
New Dawn Mt Farm Sanctuary	http://		EIN 80-0224697	689 Red Hawk Trl	Stevensville	MT	59870	USA	Animal Protection & Welfare, Animals							
Imagine Missoula	http://imaginemissoula.org	406-546-4697	EIN 27-2877617	1620 Howell St	Missoula	MT	59802	USA	Human Service Organizations	Imagine Missoula fosters community by helping people help each other.	We do the things that someone would ask a friend, family member or neighbor to help with, for folks without that connection to community or ability to pay for services. We are partnered with Missoula Aging Services, the YWCA, Open Aid Alliance, the Missoula County Public Schools, Hospice of Missoula and many more to meet these simple needs that mean so much.  We have been told by partnering agencies that we are "filling a significant hole in the safety net of services in Missoula."	Through our partner agencies, we work with the elderly, survivors of domestic violence, at risk youth, single mothers, veterans, folks living with mental and physical disabilities, working poor, homeless and many more.	Missoula County	The best way to describe this is through a letter from someone we have helped (all his punctuation): "AGAIN!!!!  THANK YOU for ALL YOU have done!!!!  I imagine that in some people's eyes, it's nasty couches, a coat of stain... or a nasty trailer house in the ghetto... but the reality, it's people's lives.... mountains we can't climb... and the total lack of ANYONE that cares enough about us in our little worlds to see how much a dirty carpet, an unstained deck... etc., is a reminder how alone we are in this world, and how LITTLE our lives mean to people we know... and a society that WE have taken our coat off in the winter and gave to someone else that was cold, or gave our last 5 bucks in this world ... so they could have gas to get home on....  So... the playing field changed... and these awesome people from Imagine Missoula showed up, and made MY world so much better, and again... I feel like a human... that somebody cares about.... and not for what they might be able to get from me.... It is MY PRAYER, that as you go... YOU WILL PROFOUNDLY EXPERIENCE first hand what TRUE GRATITUDE LOOKS LIKE...and HOW MUCH of what YOU DO.... changes the WORLD... one lonely old man at a time!!!! GOD BLESS Shawn"		
Rocky Mountain Elk Foundation Inc	http://www.rmef.org	(406) 523-4500	EIN 81-0421425	5705 Grant Creek Rd	Missoula	MT	59808	USA	Animals, Environment, Natural Resources Conservation & Protection, Wildlife Preservation & Protection	The mission of the rocky mountain elk foundation is to ensure the future of elk, other wildlife,their habitat and our hunting heritage. Our mission includes four core programs; land protection, habitat stewardship, elk restoration and hunting heritage.	Permanent land protection and access: represents land acquisitions, conservation easements, land exchanges, hunter and public access related projects, and real estate donations. Rmef identifies and prioritizes the most crucial elk range and habitat through gis mapping, a 100 point ranking system, partnerships, and field based professional knowledge. The highest priority interests in lands for habitat or access are protected through acquisition and then usually conveyed to a government management agency to increase public access. Conservation easements allow landowners to protect their land in perpetuity. Land and real estate donations allow rmef to protect habitat or raise funds for mission accomplishment. Rmef also participates in land exchanges with government agencies and private landowners. At the close of 2014, rmef had permanently protected 1,118,973 cumulative acres of elk habitat.   membership services: represents the costs of providing benefits to all rocky mountain elk foundation members, including certain costs related to bugle magazine. Rmef offers several levels of membership, with different benefits at each level. Rmef provides a variety of gifts to some of its members in appreciation of their support. Items vary with levels of membership, including an annual subscription to bugle magazine, decals, lapel pins, hats, personalized plaques and jackets. Members also receive educational membership materials and habitat protection and conservation brochures. Members are also invited to attend any number of rmef local or national events. At the close of 2014, rmef had 205,249 members.   conservation projects: represents projects to improve the essential forage, water, cover and acreage components of wildlife habitat. Types of projects include restoring aspen communities, fighting the spread of noxious weeds, boosting land productivity with prescribed burning, and thinning of forests. Rmef funds water development projects as well as fencing projects to provide better distribution of wildlife and livestock. Rmef also funds a variety of scientific research studies to better manage elk or their habitat. Research topics include elk calf mortality, nutrition, predation, livestock interaction, disease, migrations and genetics. At the close of 2014, rmef had enhanced 5,491,297 cumulative acres of elk habitat.					
Christs Church In Missoula	http://		EIN 81-0498840	1727 S 13th St W	Missoula	MT	59801	USA	Religion, Religion-Related							
Western Montana Area Vi Agency On Aging	http://www.westernmontanaagingservices.org	(406) 883-7284	EIN 81-0345779	110 Main St Ste 5	Polson	MT	59860	USA		The older american act intends that the area agency on aging shall be the leader relative to all aging issuers on behalf of all older persons in the planning and service area. This means that the area agency shall proactively carry out, under the leadership and direction of the state agency, a wide range of functions related to advocacy, planning, coordination, inter-agency linkages, information sharing, brokering, monitoring and evolution, designed to lead to the development or enhancement of comprehensive and coordinated community based systems in, or serving, each community in the planning and service area. These systems shall be designed to assist older person in leading independent, meaningful and dignified lives in their own homes and communities as long as possible.	Nutrition services - provides education, training, and resources allowing individuals and families to obtain and prepare quality, nutritional meals. Services include both congregate meal settings and home delivered meals.   information, referral, and assistance - provides a link between people in need with the appropriate services for their unique situations. State certified technicians maintain databases of service providers and local resource information including social and health services, medicare/medicaid assistance, legal services and utility, meals and other direct assistance.   foster grandparent program - a stipended volunteer program offering seniors on fixed incomes, 55 or older, opportunities to serve as mentors, tutors, and caregivers for children and youths to help young people become more full and productive members of society.   ombudsman program (expenses 175,769, no grants) in-home care & caregiver (expenses 143,346 including grants of 134,483) retired senior volumteer program (expenses 130,874, no grants) older american program (expenses 98,554, no grants)(revenue 32,738)					
Broadview	http://		EIN 81-0467591	Po Box 31	Broadview	MT	59015	USA								
Boy Scouts Of America	http://www.montanabsa.org	(406) 761-6000	EIN 81-0232188	820 17th Ave S	Great Falls	MT	59405	USA	Boy Scouts of America, Children & Youth	The executive board of the montana council of the boy scouts of america 315 has approved the creation and establishment of the boy scouts of america - montana council trust for the benefit of scouting in the territory covered by the local council charter, for the general purpose stated in the act of congress approved june 15, 1916, creating the boy scouts of america	Provided support to the programs of the montana coucil of the boy scouts of america 315, whose mission is to promote the ability of boys and young men and women to do things for themselves and others, training them in scoutcraft, and teaching them patriotism, courage, self-reliance, and kindred virtues, using methods which are now in common use by the boy scouts of america.					
Kitty Keepers	http://		EIN 81-0522064	600 23rd Ave W	Havre	MT	59501	USA	Animal Protection & Welfare, Animals							
Irwin and Florence Rosten Foundation	http://www.mapsmediainstitute.com	406 370-3745	EIN 20-1279915	PO Box 750 PO Box 750	Darby	MT	59829	USA	Arts & Culture, Media & Communications	The MAPS Media Institute is a nationally recognized, local education agency and after-school arts academy in western Montana.  We provide a rigorous, hands-on media arts experience for rural students, inspiring a passion for learning and equipping them with educational tools that they might otherwise find unattainable.   MAPS incorporates science, technology, engineering, the arts and math (STEAM) to help young people achieve tangible public success and impressive personal growth. MAPS students learn self-confidence, leadership and empathy for others, creating a strong foundation for the success of all their future endeavors.	Film, Design, Technology, Music and Entrepreneur	Underserved, economically disadvantaged and rural students grades 8 - 12. 50-50% Male and female.	Ravalli County, MT	1) MAPS student artists win two "Awards of Excellenceship (equivolent of EMMY awards) from NATAS, NW. (2015). 2) MAPS founder, Peter Rosten honored as "Bitterroot Business Person of the Year" by the Bitterroot Chamber of Commerce (2015).  3) Peter Rosten named a MONTANA AMBASSADOR by the Governor of Montana. (2015). 4)MAPS honored as one of the top 50 after-school programs in the country by the President's Committee on the Arts and Humanities. NAYHP  (2014).	500	
Bigfork Development Company	http://cfbbigfork.org	(406) 837-5461	EIN 23-7067099	Po Box 1439	Bigfork	MT	59911	USA		Promote and assist in community growth and development	Library:provide housing and pay all costs to maintain building for the local branch of the county library which is used by the general public.   community development:development and maintenance of community land including sidewalks, parks, nature trail, and highway beautification. Community members and general public benefit.					
Rocky Mountain Foundation Inc	http://		EIN 93-1099954	Po Box 8249	Missoula	MT	59807	USA								
Livingston Meals On Wheels	http://		EIN 81-0348455	Po Box 1603	Livingston	MT	59047	USA		MEALS ON WHEELS-PREPARATION AND DELIVERY OF MEALS TO PEOPLE UNABLE TO PREPARE TTHEIR OWN.						
Music In Montana Summer Festival	http://		EIN 81-0503520	PO Box 3616	Missoula	MT	59806	USA	Arts & Culture, Arts, Culture & Humanities							
Valley Community Emergency Food Bank Inc	http://		EIN 81-0466404	1010 4th Ave S	Glasgow	MT	59230	USA	Food, Food Programs							
Head Start Inc	http://billingsheadstart.org	(406) 869-1216	EIN 81-0398508	615 N 19th St	Billings	MT	59101	USA	Education, Food, Human Services, Preschools, Soup Kitchens	The mission of head start, inc. Is to prepare young children for success in school and life by providing high-quality, comprehensive educational services in collaboration with families and communities.	Federal head start program-provide comprehensive health educational and social services to economically disadvantaged children & their parents.   child and adult care food program - provide nutritional services to economical disadvantaged head start children					
Montana Project Healing Waters Fly Fishing Inc	http://		EIN 45-3506231	Po Box 1798	Helena	MT	59624	USA	Centers to Support the Independence of Specific Populations							
Spirit At Play Inc	http://www.spiritatplay.org	(406) 728-7001	EIN 81-0471947	621 Stephens Ave	Missoula	MT	59801	USA	Education, Elementary & Secondary Schools, Literacy	Early childhood education and care	Spirt at play celebrated 24 years of quality service to children and families in missoula and the surrounding area. During our fiscal year ended 8-31-15 we served 46 children. Other accomplishments/events during the year: *continuation of the "stars to quality" field test. The program has proven to be a good fit for spirit at play. The stars to quality program requires additional education of staff and documentation related to the program. We received a $6,500 grant from the program that was used for improvements to our school. For 2015, these grant funds were used to purchase large, outdoor climbing mats and monkey bars. We continue to work toward star level 3. *we again hosted our "know your farmer" fundraiser. We invited local farmers to educate participants on gardening and animal husbandry, met with animals owned by 4-h children, rode ponies, played farm-based activities and games. Attendees enjoyed music by local talent and ate local farm food provided for the event. The event is an attempt to raise awareness of our local farmers and educate children and families as to the source of their food. *our annual art show, know your farmer event, and spring plant fundraiser continue to provide us with additional support. *we continued participation in the montana state-funded best beginnings child care scholarship program. Scholarships are available to working families whose income is at or below 150 percent of the federal poverty guidelines as well as families who receive cash assistance through the temporary assistance for needy families program. *we have significantly reduced our carbon footprint and saved the school money with the use of our solar panels that were installed in a prior fiscal year. Spirit at play takes pride in hiring the best staff and volunteers to work with the children enrolled. We feel fortunate to have found the "cream of the crop" with our current staff.					
Missoula Pta Council	http://		EIN 81-0431135	PO Box 3415	Missoula	MT	59806	USA								
Phillips County Historical Society	http://	(406) 654-1089	EIN 81-0364319	Po Box 518	Malta	MT	59538	USA			Admission fees to the phillips county museum  sales of inventory  investment income and miscellaneous					
Friends Of The Missoula Public Library	http://	(406) 721-5700	EIN 81-0419412	200 W Broadway St	Missoula	MT	59802	USA	Education	Support education by supporting the missoula county public library	The friends of the missoula public library funds programs at the missoula public library for children, teens and adults. The friends of the library also purchases equipment and books for the library and help support and fund staff education that is not in the library's budget. Some of the activities funded in fy 2011 were the home bound program, teen and adult writing contest, the book chat program and the library incentive program. Funding for these activities is through book sales, book bags, note cards and copy machine revenue in addition to donations, memberships and memorials.					
REACH OUT & CARE WHEELS INC	http://www.rocwheels.org	(406)556-8065	EIN 20-0402658	301 Gallatin Park Drive	Bozeman	MT	59715	USA		To provide mobility products for people with disabilities in developing countries and to foster partnerships through ministry, youth empowerment, wheelchair distributions, manufacturing opportunities, and educational development.	YEWTHS ROC					
