name	url	telephone	tax_num	street	locality	region	postcode	country	Causes	Mission	Programs	Target demographics	Geographic areas served	Results	Direct beneficiaries per year	 
Montana Congress Of Parents Teachers Students	http://		EIN 84-1370806	PO Box C	White Sulphur Springs	MT	59645	USA								
Missoula Ski Education Foundation	http://www.msefskiteam.org	(406) 721-6481	EIN 51-0204168	Po Box 7046	Missoula	MT	59807	USA		Education	To provide ski racing instruction to youth ages 5-18 at levels of ability ranging from beginning to advanced. Approx 90 youth served.					
Church Of The Open Bible	http://		EIN 81-0416387	Po Box 309	Hardin	MT	59034	USA								
Ramsey Keller Memorial	http://www.kisses2heaven.com	(406) 655-1676	EIN 45-4856391	4382 Laredo Pl	Billings	MT	59106	USA	Health	Providing financial and emotional support and resources to parents who have lost a baby/child by contracting with funeral homes to pay for the expenses of children funerals.	Payment of funeral costs associated with the death of a child  supporting organizations that pursue research with a goal of preventing/eliminating infant and child loss to death					
Missions To America Incorporated	http://		EIN 82-0489226	591 Grantsdale Rd	Hamilton	MT	59840	USA	Religion, Religion-Related							
Praise Chapel Troy Montana	http://		EIN 26-3269956	314 Riverside	Troy	MT	59935	USA	Christianity, Religion							
Becky Eiker Foundation	http://		EIN 81-0510804	1220 Morning Glory St	Helena	MT	59601	USA	Arts & Culture, Arts, Culture & Humanities							
Lutheran Bible Camp Inc	http://www.christikon.org	(406) 656-1969	EIN 81-0367727	1108 24th St W	Billings	MT	59102	USA		Lutheran bible camp, inc. D. B. A. "christikon" mission is to offer an outdoor based church camping program of religious activities and education for youth, families and adults, developmentally disabled adults, and at-risk youth. It is the mission of christikon to awaken and nurture faith in christ-exploring god's creation and the adventure of life together.	During the summer of 2014, the church camping program offered by christikon served 578 registered guests:240 in youth programs (residential, backpacking, at-risk youth)-for a total of 1,314 camper days;180 in its family/adult programs-for a total of 415 camper days; and 52 in its program for developmentally disabled adults-for a total of 165 camper days. In addition, christikon facilities were used for retreats sponsored by ministries of member congregations, through the fall months of 2014. 69 people were sponsored for a total of 126 camper days.					
Tamarack Grief Resource Center Inc	http://www.tamarackgriefresourcecenter.org	(406) 541-8472	EIN 26-2278278	405 S 1st St W	Missoula	MT	59801	USA	Mental Health, Mental Health Treatment	Tamarack grief resource center strengthens and honors individuals,families and communities throughout their journey with grief.	In 2014 tamarack grief resource center (tgrc) served nearly 3300 participants in grief support and education programs--an increase of 46% from 2013. Tgrc offered over 10,630 hours of direct service extending support to more schools, organizations, and families throughout the region. 2014 programs included five annual camps and retreats, grief groups in partnership with schools and hospitals, community workshops, consultations and counseling, and training seminars. Programs were available to anyone likely to benefit regardless of ability to pay.					
Craighead Environmental Research Institute	http://www.craigheadresearch.org	406-585-8705	EIN 52-0810968	201 S Wallace Ave. Suite B2D	Bozeman	MT	59715	USA	Animals, Biological & Life Sciences, Environment, Land Resources Conservation, Wildlife Preservation & Protection	Our mission is to maintain healthy populations of native plants and wildlife,  along with vibrant, healthy human communities in sustainable, functioning ecosystems.	The craighead institure continued its work as a fiscal sponsor, working with organizations specializing in conservation, and natural resources.   ci continued its pika research throughout montana that includes three interrelated programs, including citizen science, pika population monitoring and pika connectivity. Specific accomplishments included a fourth year of gathering citizen science pika data from around the state of montana, continued monitoring of pika colonies in gallatin county and the completion of connectivity field work in the gallatin canyon.   ci continued development and implementation of wild planner tools. During 2014, this included projects in both madison county, montana, and canmore, british columbia. Madison county planners used the tools to assess subdivision regulations and the tools are also being used by other conservationists within the state. The wild planner tools have been instrumental in the madison redevelopment program that began in 2014. Ci is partnering with the sonoran institute and future west on this project. The british columbia project focused on determining animal connectivity in and around a planned resort and golf course near banff. The results from this project highlighted areas of connectivity for wildlife and the increase in urban sprawl, and the development has currently been tabled due to local opposition.   the organization continued various conservation research, education, and outreach projects, centered in bozeman, mt.		Western US and Canada, International			
Spirit Of The Valley Metropolitan Community Church	http://		EIN 84-1414547	1108 1st St W	Billings	MT	59101	USA	Religion, Religion-Related							
Kairos Youth Services	http://www.kairosyouthservices.org	(406) 727-0076	EIN 81-0383532	Po Box 3066	Great Falls	MT	59403	USA	Children & Youth, Children & Youth Services	Serving troubled youth and their families in community based group home settings to alleviate the emotional, mental health, legal and other familial difficulties that have resulted in an inability of one or both of these parties to function in a healthy and appropriate manner and to adequately adjust to societal norms and expectations.	Operate and maintain the missouri river youth and shelter home, which provided 2,259 days of shelter, care, supervision, personal guidance and treatment services to 39 abused, neglected, troubled, delinquent, and seriously emotionally disturbed male adolescents aged ten to eighteen. Sixty-seven percent of the residents were positively discharged from the home, and sixty-seven percent of those residents discharged were able to remain in a less restrictive living arrangement.   operate and maintain the evergreen youth and shelter home, which provided 2,017 days of shelter, care, supervision, personal guidance, and treatment services to 29 abused, neglected, troubled, delinquent, and seriously emotionally disturbed adolescents aged ten to eighteen. Sixty-seven percent of the residents were positively discharged from the home, and sixty-seven percent of those residents discharged were able to remain in a less restrictive living arrangement.   operate and maintain the portage place therapeutic youth home, which provided 1,801 days of shelter, care, supervision, personal guidance, and treatment services to 11 abused, neglected, troubled, delinquent, seriously emotionally disturbed adolescents aged ten to eighteen. Fifty-six percent of the residents were positively discharged from the home, and thirty-three percent of those residents discharged were able to remain in a less restrictive living arrangement.   provided 632 hours of individual service time to 48 youth aged sixteen and older enrolled in the chafee independent/transitional living program. Specific services included: post-secondary educational support, educational and financial assistance, housing/home management, academic support, career preparation, health education, transportation assistance, mentoring services, and vocational rehabilitation programming. Also provided 122. 75 hours of aftercare and mentoring services to seven adolescents and 107 hours of early intervention and mentoring services to four adolescents.					
Bitterroot Christian Ministries Inc	http://		EIN 81-0475716	Po Box 698	Corvallis	MT	59828	USA	Religion, Religion-Related							
American Prairie Reserve	http://www.americanprairie.org	(406) 922-0793	EIN 81-0541893	PO Box 908	Bozeman	MT	59771	USA	Environment	American Prairie Reserve's mission is to create and manage a prairie-based wildlife reserve that, when combined with public lands already devoted to wildlife, will protect a unique natural habitat, provide lasting economic benefits and improve public access to and enjoyment of the prairie landscape.	Reserve area management and economic/educational programs  land acquisition - includes a portion of salaries and payment of professional fees dedicated to land acquisition to fulfill the organization's mission  bison program			The goal of American Prairie Reserve (APR) is to create the largest wildlife reserve in the lower forty-eight states, consisting of approximately 3.5 million acres of both private and public lands. APR intends to acquire and manage approximately 500,000 private acres, which will serve to glue together roughly three million acres of existing public land. Multi-jurisdictional management of the eventual wildlife complex will be conducted by the various entities with land ownership and wildlife management authority including the U.S. Fish and Wildlife Service, U.S. Bureau of Land Management, Montana Department of State Lands, Montana Fish, Wildlife & Parks and American Prairie Reserve. Conservation biologists have determined that a mixed-grass prairie would need to be approximately 5,000 square miles (roughly 3.2 million acres) in size in order to be a fully functioning ecosystem that supports the full complement of native prairie biodiversity and provides room to endure episodic localized natural phenomena like fire, disease and winter ice events. The Reserve currently spans more than 305,000 acres of deeded private land and leased public land.  We believe that connecting people with the landscape in meaningful ways is central to our goal of instilling a deeper appreciation of the prairie and its wildlife in the general public. Visitors to the Reserve will discover a public campground and a variety of trails and interpretive experiences. In 2015, we opened the Enrico Education and Science Center to serve as a hub for students, scientists, and partners conducting fieldwork on the Reserve.  American Prairie Reserve aims to restore a complete and fully functioning prairie ecosystem, the largest of its kind in North America. This is critical to secure long term conservation of the grasslands. We also aim to restore the natural, historic abundance of species in the region. To do such, we rely on our values and innovative and sound science. Our approach is rigorous, collaborative and inspiring. American Prairie Reserves (APR) approach to biodiversity restoration is built around the Freese Scale for Grassland Restoration. Developed by conservation biologist Dr. Curt Freese with Dr. Kyran Kunkel and Dr. Sam Fuhlendorf, the scale identifies the ten major ecological drivers for restoring and conserving biodiversity on temperate grasslands. This scale can be used by land managers trying to achieve a balance between agricultural production and biodiversity as well as those, like APR, which are solely focused on maximizing native prairie biodiversity. Each year, our biologists, along with input from partners and experts, rate all APR properties on the Freese Scale. The total score for a particular area is recorded and retained, allowing for annual comparisons. Armed with this information, we decide what approaches in management could lead to an improved score for a particular area of the Reserve.		
Church Universal And Triumphant	http://		EIN 81-0473916	30 Sirius Dr	Emigrant	MT	59027	USA								
Blue Mountain Clinic Inc	http://www.bluemountainclinic.org	(406) 721-1646	EIN 81-0365291	610 N California St	Missoula	MT	59802	USA	Community Clinics, Health	The mission of blue mountain clinic is to provide access to safe, affordable reproductive and primary health care; to provide education on health,reproductive choices and sexuality; to advocate for policies that improve reproductive justice and correct health disparities; and to empower individuals to actively participate in their health care.	Blue mountain clinic (bmc) features quality clinicians and experienced staff who provide: family practice - general medical services, pediatrics, mens health, and on-site lab servicessexual and reproductive healthcare , including vasectomy and cervical cancer treatmentmental health counseling lgbt primary care and counseling first trimester abortion and counselingbmc has provided access to first trimester abortion care with an emphasis on options counseling and birth control selection for 38 years. In 2014, bmc was voted "best health clinic" and dr. Ravitz was voted "best doctor" for the 7th year in a row in the missoula independent's reader's poll "best of missoula" awards. Also during the year, the fundraiser entitled "off the rack" was again a great success. Over 900 supporters attended this fundraising fashion event designed to promote healthy sexuality that goes beyond barriers, gender and stigma. During 2014, bmc continued to expanded outreach efforts to activate support for and expand access to healthcare for all montana area residents. We joined with the montana family practice residency program to train resident doctors within our family practice setting. Many of these residents will eventually practice in rural montana areas. Continued steps were taken to create a network of advocates in rural health care delivery settings, to increase prevention awareness to underserved regions of montana and surrounding states, and to improve access to women seeking care by identifying resources to offset financial constraints. Finally, our outreach/education coordinator doubled the amount of student-led discussions about issues that are pertinent to them. Topics included bullying, birth control, healthy sexuality, bystander intervention, and substance abuse. Each year, bmc staff participates in 20-35 activities for education, advocacy and outreach. Ongoing initiatives include bmc's montana access project launched askmap, started in july 2010, an sms(text) and web-based hotline to provide information on sexual health, education and resources. Users can send or text a question confidentially and anonymously and get answers and resources from a clinical professional using a technological medium that helps reduce shame and embarrassment. Bmc sees about 9,000 patient visits every year. These visits breakdown as follows:family practice - 68%, gynecology, contraceptive and sexual health - 18%, mental health counseling - 6%, abortion care - 8%					
St Labre Indian School	http://www.stlabre.org		EIN 81-0244542	Po Box 216	Ashland	MT	59003	USA	Children & Youth, Children & Youth Services, Education, Primary & Elementary Schools, Secondary & High Schools	St. Labre Indian School, founded in 1884, was one of the first efforts to care for Native Americans who had been displaced as a result of homesteading. Today, St. Labre Indian School offers kindergarten through high school education for Crow and Northern Cheyenne children on three campuses. There is no tuition charged for any student to attend. The combined enrollment of all three campuses totals over 700 children.						
Paint Up Montana, Inc.	http://		EIN 81-0516312	3704 Colin Dr	Billings	MT	59102	USA	Philanthropy, Public Foundations							
International Church Of The Foursquare Gospel	http://		EIN 94-3232642	PO Box 599	Lewistown	MT	59457	USA								
The Biomimicry Institute	http://www.biomimicry.org	415-800-1401	EIN 86-1153859	PO Box  9216	Missoula	MT	59807	USA	Biological & Life Sciences, Education, Elementary & Secondary Schools, Environment, Higher Education, Literacy, Natural Resources Conservation & Protection	We are nurturing a global community of people who look to the natural world for ideas, designs, and strategies for sustainable design.  We want to bring biology to the design table. The mission of the Biomimicry Institute is to empower people to design nature-inspired solutions for a healthy planet.	AskNature.org, Student Design Challenge, Biomimicry Education	environment	International	We created a first-ever biomimetic chemistry lab lesson plan - showing high school students that we can make building materials - cement - without destructive mining or using excessive amounts of energy, and sequestering carbon!  We also 'crowd sourced' a university level Student Design Challenge and attracted 120 teams from around the world to compete.  See their amazing design entries here:  http://biomimicrydesignchallenge.com/p/2011-winners		
Anaconda Local Development Corp	http://www.anacondadevelopment.org	(406) 563-5538	EIN 81-0380448	118 E 7th Street	Anaconda	MT	59711	USA	Economic Development, Urban & Community Economic Development	Assist in the creation and retainage of jobs through economic expansion in the cit and county of anaconda-deer lodge	Economic development activities in anaconda deer lodge county					
Missoula Aging Services	https://missoulaagingservices.org/	(406) 728-7682	EIN 81-0379543	337 Stephens Ave	Missoula	MT	59801	USA	Human Services, Senior Centers, Seniors	Missoula Aging Services promotes the independence , dignity and health of older adults and those who care for them.	Meals on Wheels, Case Management, Resource Center, Senior Corps and Montana Senior Medical Patrol.	older adults and people with disabilities	Missoula County		thousands of individuals in Missoula County.	
Trinity Lutheran Church	http://		EIN 81-0298632	221 S Center Ave	Miles City	MT	59301	USA								
Community Youth Ministries	http://		EIN 91-1629634	P O Box 336	Frenchtown	MT	59834	USA	Children & Youth, Youth Development - Religious Leadership							
Montana Dance Arts Association	http://		EIN 23-7285427	718 Logan St	Helena	MT	59601	USA								
Animeals	http://www.animeals.com	406-721-4710	EIN 20-4694132	1700 Rankin St	Missoula	MT	59808	USA	Animal Protection & Welfare, Animals	The mission of AniMeals is to save the hungry, the helpless, the lost, the little ones just struggling to survive; to house and feed as many animals as possible; to ease the suffering of the weak and unloved; to build a no-kill community and to reach the achievement of a no-kill nation.	Providing food and supplies to the shelters and rescues, furry members of families-in-crisis and in-need, pets of the homebound and disabled, feral dog and cat colonies, and people who aid in re-homing animals who have been abandoned or surrendered because of circumstances.  By keeping these programs working in unison we are able to support the community, work towards a no-kill society, and continually educate the public in responsible pet care.  In addition to our Animal Food Bank, we operate a No-Kill Adoption Center in Missoula where we have saved the lives of over 1500 cats that had run out of options.	feed hungry animals, assists pets of elderly, home-bound or disabled individuals, pets of families in-crisis, and advocate for civilized treatment of animals through our no-kill shelter.	We mainly serve Western Montana, but our food bank reaches statewide and has sent food as far as Washington, Idaho, North Dakota, and Colorado. Our No-kill shelter is located in Missoula, Montana.	AniMeals is a 501(c) (3) and exists as a Food Bank for all animals great and small and a No-Kill Adoption Center for cats. In 2006, AniMeals started as a delivery service for pets of the elderly, homebound and disabled and quickly grew into a huge operation that covers more ground than any other animal food bank in the country. In the past seven years, AniMeals has delivered over 385 tons of food and supplies to the shelters, rescues, those who feed feral dog and cat colonies, furry members of families in-crisis, pets of low-income seniors, homebound or disabled individuals, and people who aid in re-homing animals who have been abandoned or surrendered because of circumstances.  Today our territory covers over 147,000 square miles of Montana and we work with rescues in Idaho and Washington.	1000's of starving and abandonded animals and 100's of low-income and under-served individuals within our state	
La Leche League International Inc	http://www.lalecheleague.org/		EIN 81-0381946	216 N Main St	St Ignatius	MT	59865	USA	Health, Health Care	To help mothers worldwide to breastfeed through mother-to-mother support, encouragement, information and education, and to promote a better understanding of breastfeeding as an important element in the healthy development of the baby and the mother.						
Rocky Mountain Bible Mission	http://		EIN 81-0303852	1515 Fairview Ave Ste 200	Missoula	MT	59801	USA								
Beartooth Mountain Pastoral Counseling	http://		EIN 20-3113003	50 Circle T Ln	Absarokee	MT	59001	USA	Counseling, Mental Health							
Rockmont Inc	http://		EIN 51-0168144	1700 Madeline Ave	Missoula	MT	59801	USA	Group Homes, Human Services							
Partnership For Animal Welfare Humane Society	http://		EIN 36-4098540	226 Vigilante Dr	Deer Lodge	MT	59722	USA	Animal Protection & Welfare, Animals							
THE EMERGENT INSTITUTE	http://www.theemergentvoices.com		EIN 74-3179187	296 Meadow Rd	Stevensville	MT	59870	USA	Arts & Culture, Arts Education		The Emergent Voices					
Heroes and Horses	http://www.heroesandhorses.org	(406) 284-2870	EIN 46-4639973	P.O.Box 35	Manhattan	MT	59741	USA	Human Services	Mission: To use the remote wilderness, and the horse / human connection to challenge, and inspire growth in veterans suffering from mental and physical scars.  We re-galvanize our nations veterans so they can rediscover who they are, and can be after 13 years of war. Heroes and Horses focus is not about what happened, but what can happen if you choose to drive on.  Challenge: Wilderness challenges that invoke change, and develop new ways to approach, and solve problems.  Experience: We provide extreme Expedition style horse pack trips that teach self-reliance, teamwork, and help veterans move past the struggles men and women face after years of war, internal and external.  Community: H&H aims to build a community of veterans, donors and volunteers who are involved and engaged.  Education: After completion of a first trip our program continues with career training for the guide, outfitter and ranching industries with continued education.	Leadership development in an aggressive therapy designed for lasting healing.  Professional development for the leaders of tomorrow.	Combat Veterans	United States	Ran by two Navy SEALs, our program is lead by those who know what our American Heroes really need.		
Gates Of The Mountain Foundation	http://		EIN 23-7332779	2234 Gold Rush Ave	Helena	MT	59601	USA								
Montana Indian Art And Culture Association, Inc.	http://		EIN 84-1079087	PO Box 6157	Bozeman	MT	59771	USA	Arts & Culture, Cultural & Ethnic Awareness							
Women's Aglow Fellowship	http://www.aglow.org/		EIN 81-0446481	Box 602	Chester	MT	59522	USA	Christianity, Religion	Aglow International is an intercultural transdenominational organization of Christian women with more than 3,500 fellowships in more than 151 nations. Our mission is to lead women to Jesus Christ and provide opportunity for Christian women to grow in their faith and minister to others. Aglow's vision to impact the lives of women worldwide is expressed in the strategic focuses of: Prayer, Evangelism, Relationship, and Reconciliation.						
Unity Church Of Truth	http://		EIN 81-6011472	1023 2nd Ave S	Great Falls	MT	59405	USA								
Missoula Community Chorus Inc	http://		EIN 81-2544533	1001 East Broadway Pmb 610	Missoula	MT	59802	USA	Arts & Culture, Performing Arts							
KOOTENAI VALLEY CHRISTIAN SCHOOL INC	http://www.kvcs.info	(406) 293-2303	EIN 81-0510370	1024 Montana Ave	Libby	MT	59923	USA	Education, Elementary & Secondary Schools, Literacy	Providing classroom based educational opportunities for grades pre-school to 8th grade servicing approximately 100 students.	Providing classroom based educational opportunities for grades pre-school to 8th grade servicing approximately 100 students.					
Sunburst Unlimited Inc	http://www.sunburstunlimited.org		EIN 81-0517112	1917 1st Ave. North	Great Falls	MT	59401	USA	Community & Neighborhood Development, Economic Development, Environment, Food, Natural Resources Conservation & Protection, Recycling		Gardens from Garbage is a city-wide initiative in Great Falls in collaboration with the City of Great Falls and the Great Falls Public School Electric City Agriculture Academy to develop community, school, and residential compost sites. This community campaign has two goals: one: annually producing hundreds of cubic yards of "good growing dirt" from thousands of tons of food waste whilestarving the local landfill while reducing greenhouse gas emissions; two: promoting the use of the "good dirt" to develop school and community gardens, thus providing locally grown nutritious food for children and families.Sunburst initiated this program in response the the need of Montana families to have local food sources. There are 47,000 Montana families without "food security", and a large percentage of food cost is the cost of transportation to our stores. Available nutrient-rich compost encourages families to grow their own food.					
Pondera Food Pantry Inc	http://		EIN 81-0415427	220 S Front St	Conrad	MT	59425	USA								
