Holy Rosary Healthcare	http://www.holyrosaryhealthcare.org	(406) 233-2600	EIN 81-0231792	2600 Wilson Street	Miles City	MT	59301	USA	Health, Hospitals	We reveal and foster god's healing love by improving the health ofthe people and communities we serve, especially those who are poorand vulnerable.	Founded in 1910, holy rosary healthcare is eastern montana's healthcare destination. Holy rosary operates a comprehensive acute-care hospital, physician clinics, a residential living community, and hospice and palliative care services - providing a complete continuum of care to a 10-county region of eastern montana. As part of sisters of charity of leavenworth health system, a faith-based, nonprofit health system, holy rosary has direct access to best practices, resources, technology, talent and strategic capital. Services include surgical, oncology, and maternity services, as well as 24-hour emergency room and diagnostic and therapeutic services. The extended care unit provides short-term transitional care after illness, injury, or surgery, as well as long-term care for those unable to live independently. In august 1910, the presentation sisters of aberdeen, south dakota, assumed management and operation of the county hospital in miles city at the request of the community, the milwaukee railroad and the doctors associated with the railroad. In 1915, the sisters purchased the hospital, committing to a relationship with the community that would extend for decades. In 1995, holy rosary healthcare opened a new cost effective facility on a 58-acre campus in miles city that allowed physicians and other care facilities to locate in the new hospital building. The building of the new facility and moving into the new facility was a community-wide effort, and was accomplished through the contributions of the staff, physicians, board members, community members and volunteers. In keeping with the new covenant process, sisters of charity of leavenworth health system, inc. (scl health) assumed sponsorship of holy rosary healthcare in 1997. Today, the 25-bed acute care hospital, residential living community and 16-physician clinic all in a single building, serves as a centralized setting for comprehensive health care for the people across eastern montana. Physician specialties include family medicine, internal/adult medicine, general surgery, vascular surgery, women's health, orthopedics, ophthalmology (eye), psychology, audiology, cardiology, neurology, neurosurgery, oral surgery, nephrology (kidney), dermatology, and sleep medicine/pulmonology. Today, holy rosary healthcare serves several eastern montana counties, which cover over 20,000 square miles or approximately 13% of montana. More than half of the people receiving healthcare in miles city, which has a population of 11,000, are from outside custer county. Therefore, holy rosary healthcare's impact on the healthcare delivery system reaches far beyond city and county lines. With a population density of 1. 4 persons per square mile across the seven-county region around holy rosary, clearly this degree of contemporary health care is extraordinary. During 2014, holy rosary healthcare had the following results:admissions - 1,294outpatient visits - 54,609births - 287surgeries - 1,494lab tests - 89,466as part of the montana region of scl health, holy rosary is affiliated with st. James healthcare in butte and st. Vincent healthcare in billings, giving it access to some of the state's most advanced medical technology. Holy rosary has a historic commitment to serving the poor and those with limited access to healthcare. The commitment is to the worth and dignity of the whole person - spiritual, psychological, and medical. Holy rosary is currently licensed by the state of montana and is accredited by the joint commission on accreditation of health care organizations. Holy rosary has 25 acute care and 86 extended care beds and 24 physician offices. Missionwe reveal and foster god's healing love by improving the health of the people and communities we serve, especially those who are poor and vulnerable. Visioninspired by our faith: we will be distinguished as the premier person-centered health system and trusted partner. We will share accountability with clinicians and other stakeholders to coordinate care across all settings and improve access, quality, health outcomes, and affordability. We will grow as community-based health networks to serve more people in partnerships with others who share our vision and values. Values caring spirit - we honor the sacred dignity of each person. Excellence - we set and surpass high standards. Good humor - we create joyful and welcoming environments. Integrity - we do the right thing with openness and pride. Safety - we deliver care that seeks to eliminate all harm for patients and associates. Stewardship - we are accountable for the resources entrusted to us. Holy rosary healthcare has a variety of programs and services to serve the community:cancer carefrom initial diagnosis to treatment and recovery, patients and their families can access an exceptional level of care close to home. Cardiac servicesfor optimal convenience, holy rosary offers a continuum of care - stress testing, pacemaker implantation, and cardiac rehabilitation. Children's carewe understand the special needs of children and offer experienced and skilled nurses, a family-friendly emergency department and board-certified pediatricians. Cliniclocated on the hospital campus, the holy rosary healthcare clinic was developed to provide outstanding primary and specialty care. Diabetes carethe holy rosary diabetes care team, certified by the american diabetes association, offers both inpatient and outpatient services to assist patients. Emergency and trauma servicesholy rosary's team of emergency providers and nurses adeptly assess conditions ranging from a child's rising fever to life-threatening heart attacks. Hospice and palliative careall palliative and hospice care team members are available to make home visits, nursing home visits, assisted living visits and to visit patients at holy rosary healthcare. Hospitalist programa hospitalist's primary professional focus is the total care of a patient from the time of admission until the patient leaves the hospital. Lab servicesthe labcheck program helps encourage people to seek preventive medicine, allowing patients to receive blood tests to detect illnesses and disorders at a reduced cost. Radiology and imaging servicesholy rosary healthcare offers inpatient and outpatient diagnostic and interventional (minimally invasive radiology) services. Residential livingresidential living offers nursing for short-term, post-acute hospital stays to long-term living. Sports medicinepractitioners work closely with athletes, parent, and coaches to educate and provide individual, as well as team consultations. Surgical servicessurgical teams bring a personal touch with the sophistication of advanced medicine. Therapy and rehabilitation servicesholy rosary healthcare offers a holistic approach to treatment, with special consideration for a patient's age, physical abilities, religious and ethnic beliefs. Walk in clinicholy rosary healthcare walk-in clinic serves all ages and is open every day of the week. Women's health servicescomprehensive women's health care team providing services to women in eastern montana.					
Conrad Christian Reformed Church	http://		EIN 51-0147804	120 N Virginia St	Conrad	MT	59425	USA								
Montana State University-Northern Foundation	http://www.msunfoundation.com	(406) 265-3711	EIN 81-0375335	Po Box 1691	Havre	MT	59501	USA		Msu northern foundation provides support for montana state university northern through fund raising	Scholarships - this activity provides scholarships for students at msu-northern university  athletics - provides support to msu-northern athletic programs in the form of scholarships and direct support  special projects - provides support for programs, campus improvements, faculty support					
Grace Gospel Church	http://		EIN 23-7346112	Po Box 325	Sunburst	MT	59482	USA	Child Abuse Prevention, Children & Youth, Children & Youth Services, Christianity, Crime & Law, Domestic Violence, Religion	Bridge Ministries (Ministerios Puente) is a Christian non-profit ministry dedicated to providing a safe, loving, and nurturing environment for children 0-15 years of age that are placed there from abusive homes affected by drug, alcohol, and/or domestic violence.  Children are encouraged to continue building a relationship with their natural parents until such a time that the original crisis is resolved and the child can be safely be returned to a healthy environment.						
Eagle Mount Bozeman	http://www.eaglemount.org	406-586-1781	EIN 84-1383214	6901 Goldenstein Lane	Bozeman	MT	59715	USA	Developmentally Disabled Centers, Disabilities, Health, Human Services, Medical Research, Recreation & Sports, Sports	Eagle Mount Bozeman is committed to provide quality therapeutic recreational opportunities for people with disabilities and young people with cancer, and to provide support for families of participants so that they shall mount up with wings as eagles. (Isaiah 40:31)	Since 1982, Eagle Mount has been transforming the lives of people with disabilities and children with cancer. With the help and support of a generous community, Eagle Mount opens up a world of adventuresskiing, horseback riding, swimming, camping, rock climbing, kayaking, cycling, fishing, and morethat foster freedom, joy, strength, focus, and confidence.  Set under the beauty of Montanas legendary big sky, Eagle Mount focuses on peoples abilities, while gently supporting their disabilities.					
Missoula Food Bank Inc	http://www.missoulafoodbank.org	(406) 549-0543	EIN 81-0414143	219 S 3rd St W	Missoula	MT	59801	USA	Food, Food Banks & Pantries, Food Programs	Missoula food bank distributes emergency food supplies to individuals and families and strives to reduce the incidence of hunger through a community of volunteers and resources.	During the fiscal year 2014-2015, expanded our programming to feed children in a significant way. During the summer months, we served 12,309 meals to hungry children in our community via our kids table program. In june 2015, we opened our first open feeding site at the missoula public library. In this same month, we were able to register our kids table program with the state of montana summer food service program (sfsp) and secure reimbursements for most of the meals we served. This fiscal year we also launched our empower pack program sending weekend meals home in children backpacks. We sent 9574 meals home to 297 children in otherwise food insecure homes. Missoula food bank also served over 77,563 individuals in our store, providing meals to 25,033 households in need. Each household was provided a 3 day supply of food. In addition, the food bank distributed 1803 turkeys for the thanksgiving holiday, delivered 4612 meals to homebound elderlythrough the roots program, and served an additional 1082 households in the lolo and potomac areas. Via our food circle program we recued 47,919 pounds of prepared food from local restaurants that would have went into the landfill. This fiscal year, 3427 volunteers worked more than 19,000 hours for missoula food bank.					
International Training In Communication	http://		EIN 81-6013594	113 Meadow Dr	Helena	MT	59601	USA								
Funshine Preschool	http://		EIN 81-0423779	Po Box 248	Chinook	MT	59523	USA								
Ronald Mcdonald House Charities Of Eastern Montana	http://www.rmhcmontana.org	(406) 541-7646	EIN 81-0400667	1144 N 30th St	Billings	MT	59101	USA	Cancer	Lodging for ill children and their families.	Lodging and support for children needing medical treatment and support for local children charities.					
Alberts Angel Fund	http://		EIN 83-0509591	699 Centennial Ave	Butte	MT	59701	USA	Animal Protection & Welfare, Animals							
Bitter Root Valley Historical Society	http://		EIN 81-0370013	205 Bedford St	Hamilton	MT	59840	USA		Acquire, preserve, protect and interpret the historical and cultural heritage of the bitter root valley and its people.	Brvhs operates and supports the ravalli county museum in the aj gibson courthouse built in 1900. The museum is fully staffed and open to the public year round with rotating exhibits and educational programming that focus on local history, art, and natural history. It maintains archives of documents, photographs, and newspapers dating back to the 1800s for public research. Our extensive collections include ernst peterson, bertie lord, and doug allard's photographic works, artifacts from the salish people and early settlers through the present day. We received grants from the dennis & phyllis washington foundation, and rapp family foundation, to provide two days of free admission and extended hours. The museum serves the entire region with over 10,000 visitors each year.   the museum is an educational venue that provides guided tours for over 600 school-age children each year and programming for visitors of all ages. Annual cultural heritage events attract thousands of regional visitors and celebrate the local mcintosh apple orchard boom of the early 1900s with our apple day and cider festivals, montana's state flower and salish homeland with bitter root day, and ranching lifestyles with cowboy music and poetry. The living cultures of nez perce are the focus of a multi-year exhibit project funded by usda forest service ccs and humanities montana grants.   preservation of our collections and archives is essential to our mission and educational programming. Generous grants from the jane s. Heman foundation and the institute of museum and library services provided the resources to advance our collections initiative to strengthen artifact conservation and recordkeeping. The annie maclay leffingwell foundation grant continues to fund our oral history project and prototype newspaper digitization. Through donations from local tradesman and individuals, we were able to relocate the historic grantsdale school bell and tower to the museum grounds for all to enjoy. By preserving the lifestyles of the past, we able to create exhibits that explore and illuminate the diversity of the bitter root valley.					
Culbertson Museum Inc	http://		EIN 81-0428447	Po Box 95	Culbertson	MT	59218	USA		Local historical museum and visitor information center	Local historical museum and visitor information center					
Billings Food Bank Inc	http://	(406) 259-2856	EIN 36-3519470	2112 4th Ave N	Billings	MT	59101	USA	Food, Food Banks & Pantries	To assume a leadership role in feeding the hungry by recovering, securing, purchasing, and delivering quality food and other products while playing a strong education and advocacy role in hunger-related issues; doing all within our power to address root causes of hunger and encourage economic growth.	Billings food bank was formed in 1982. Originally designed to serve agencies having food programs, and primarily in yellowstone county. It has now evolved into a truly independent food bank responding to requests from anywhere, throughout the state, the country and, in many cases beyond. If we have the ability to help, we do. In the past year are stats are as follows: 99,385 food boxes provided *note we also maintain a baby pantry and a pet food pantry. 64,896 food boxes provided through our senior nutrition program17,516 food boxes provided through our voucher system254,683 meals, sack lunches, back packs provided through fortin culinary center (in addition to boxes)15,855 holiday food services17,063 meals provided to boys & girl club locations. (note we are now doing 2,000 meals weekly)in the last five years we have also established the fortin culinary center where we teach culinary job training skills. We have so far had 98 graduates of this program with a 99% success rate of those truly wanting to work. The demand for people with culinary skills is tremendous. We have a very strict set of rules for our students as there is no charge for the course, but if you dont show up you are not allowed to continue. We have literally changed lives with this program. We are truly proud to have moved many of our students from a generational norm of living on the system, to now being productive members of the work force. Our fortin culinary center has also become a source of revenue and training for our students, and others. We have a large reception hall seating 300 which can be divided into two sections for meetings, weddings, receptions, company parties, memorial services, job training sessions, serv safe classes, etc. We serve many banquets on a regular basis, which of course, is tremendous training for our students. Last year we opened our fortin caf and gift shop in response to a neighborhood demand, which has now turned in to a popular breakfast and lunch venue. It is also a great training field for our students, many of whom we actually hire. We have two fulltime chefs, one teaches our classes and one runs the caf. We also encourage social enterprise by promoting and selling art and other items for area artists. And, we rent our beautiful commercial kitchen to entrepreneurs wishing to start or expand their food related business. We do this on an hourly basis so young businesses do not have to incure a heavy debt load as their business develops. We have been the catalyst for many businesses that have now grown and started their own places. We provide cooking and nutrition classes to not only our recipients, but to youth and others as our time and facility use allows. We serve as a training ground for many folks with special needs, and have actually hired several . In our spare time we also plant, harvest and maintain a 6. 5 acre garden located at oscars park.					
Toastmistress Clubs International Toastmistress Club Of Butte	http://		EIN 81-6014172	3201 Bayard	Butte	MT	59701	USA								
Montana Community Development Corporation	http://www.mtcdc.org	(406) 728-9234	EIN 81-0500256	229 E Main St	Missoula	MT	59802	USA	Community & Neighborhood Development, Economic Development	Mcdc partners with people and communities that want to prosper, providing innovative financing and business development products that create income opportunities for all members of our community. Our role is to foster a resilient economy that is built on the inherent strengths of the people and the place where we live. Since 1989, montana cdc has served hundreds of entrepreneurs with loans, consulting and training. The businesses our clients create help sustain their local communities and provide jobs in montana and idaho. In addition to our consulting and revolving loan fund services, montana cdc is a community development entity (cde) and eligible to make new market tax credit enhanced loans through limited liability companies in which montana cdc is the managing member. These entitys missions are to provide loans to qualified businesses in low-income communities. Our primary service areas are the states of montana and idaho. Montana cdc is an equal opportunity lender and employer.	Business loans: provides direct loan funds and related services to borrowers and loan applicants. These funds are used for loans to small and micro-businesses from proceeds of loans and grants from the montana department of commerce, the small business administration(sba), united states department of treasury, united states department of agriculture, united states department of commerce, local governments, and private organizations. Lending related technical assistance is funded by grants and loan earnings.   business consulting and special projects: state, federal, and private contract and grant programs provide technical assistance to small businesses. This program's goal is to build management capacity among entrepreneurs.					
Compassion Tanzania	http://		EIN 26-1635695	1802 University St	Helena	MT	59601	USA	AIDS, Health							
Montana Air National Guard Family Support Fund Fsp	http://		EIN 81-0470040	2800 Airport Avenue B	Great Falls	MT	59404	USA	Emergency Assistance, Human Services							
Big Sandy Medical Center Inc	http://bsmc.org	(406) 378-2188	EIN 81-0291695	Po Box 530	Big Sandy	MT	59520	USA	Health, Hospitals	To provide the best possible care for patients at the most reasonable cost in a competent, professional manner.	Big sandy medical center provides hospital and long-term medical care for the town of big sandy and northern chouteau county, montana.					
Sweet Medical Center Inc	http://www.sweetmedicalcenter.org	(406) 357-2294	EIN 81-0455292	Po Box 309	Chinook	MT	59523	USA			Providing medical services to the general public					
Billings Elks Memorial Fund	http://	(406) 252-8407	EIN 81-0376284	Po Box 20302	Billings	MT	59104	USA		Funding educational scholarships	Raise money to provide educational scholarships each year.					
Great Falls Rescue Mission	http://www.greatfallsrescuemission.org	(406) 761-2653	EIN 81-6014374	Po Box 129	Great Falls	MT	59403	USA	Congregate Meals, Food, Homeless & Housing, Homeless Shelters, Human Services, Mental Health, Neighborhood Centers, Substance Abuse Treatment	A christian organization committed to caring for the hungry, hurting, and homeless of north central montana.	Provide shelter to the homeless, including: food, medical services, counseling, lifestyle training, referrals to other agencies, clothing, and spiritual guidance.					
Silver Bow Montessori School Inc	http://www.silverbowmontessori.org	(406) 494-1033	EIN 36-4505424	1800 Sunset Rd	Butte	MT	59701	USA	Education, Elementary & Secondary Schools, Literacy	Provide educational services to children ages 3 to 12 using education principles and practices that will enable the children to gain a vast amount of knowledge, which will prove valuable in life.	Provide educational services to children ages 3 through 12 using educational principles and practices originally developed by maria montessori as continually updated to reflect best educational practices.					
Three Lakes Community Bib	http://		EIN 81-0367487	136 Ring Loop Rd	Troy	MT	59935	USA								
Council For The Arts Inc Lincoln Mt Eighth Ave	http://		EIN 81-0455724	Po Box 893	Lincoln	MT	59639	USA								
Fairview Alliance Church Inc Of The Christian And Missionary Alliance	http://		EIN 81-0371688	Po Box 325	Fairview	MT	59221	USA								
Wings Inc	http://www.wingsnwmontana.com	(406) 257-9464	EIN 84-1423019	Po Box 7852	Kalispell	MT	59904	USA	Health, Health Care	To offer financial assistance to individuals and their families to help defray out-of-pocket expenses associated with cancer treatment.	Giving grants for travel to people suffering from cancer					
National Society Of The Daughters Of The American Revolution	http://www.dar.org		EIN 81-6014316	Po Box 770	Malta	MT	59538	USA	Arts & Culture, Education, Historical Organizations, History Museums, Libraries	The objectives of the National Society Daughters of the American Revolution are historic preservation, promotion of education and patriotic endeavor.						
Chief Dull Knife College	http://www.cdkc.edu	(406) 477-6215	EIN 81-0351900	Po Box 98	Lame Deer	MT	59043	USA		Provide educational and cultural leadership to the residents of the northern cheyenne reservation and surrounding commmunities.	Tribally sponsored college providing two year programs to approximately 725 students, both indian and non-indian, in and near the northern cheyenne indian reservation in montana					
Hopa Mountain Foundation	http://www.hopamountain.org	406-586-2455	EIN 84-1635749	PO Box 10892	Bozeman	MT	59719	USA	Community & Neighborhood Development, Economic Development, Education, Educational Services, Environment	Hopa Mountain invests in rural and tribal citizen leaders, adults and youth, who are working to improve education, ecological health, and economic development.	Hopa Mountain's StoryMakers Program Youth Leadership Programs Native Science Field Centers Native Science Fellows Indigenous Scholars of Promise Citizen Leaders Workshops Strengthening the Circle Imagine Montana	Adult and youths in rural and tribal communities.	The Northern Rocky Mountain Region	We have solid evaluation efforts in place to analyze and document the impact of Hopa Mountain's programs in rural and tribal communities throughout the Northern Rocky Mountain region.	15,000	
Canyon Ferry Road Baptist Church	http://		EIN 81-0425172	3384 Canyon Ferry Rd	East Helena	MT	59635	USA								
Helena Community Gardens	http://		EIN 81-0510168	Po Box 1222	Helena	MT	59624	USA	Government & Public Administration							
Camp Patriot Corp	http://		EIN 58-2684780	417 Mineral Ave Ste 7C	Libby	MT	59923	USA	Centers to Support the Independence of Specific Populations							
Headwaters Resource Conservation And Development Area Inc	http://www.headwatersrcd.org	(406) 245-6443	EIN 23-7380551	65 E Broadway	Butte	MT	59701	USA	Environment, Natural Resources Conservation & Protection	To meet the needs of the people, achieve the objectives and goals of the area plan/comprehensive economic strategy; a community or group approach in solving cultural, social, and economic problems is encouraged.	The organization improves human and natural resources, and enhances the environment and standard of living in seven counties in southwest montana through conservation, economic development, and education. Headwaters offers the following services: grant administration, organizational development workshops, consensus building, small business technical assistance, small business development center, small business administration, loan packaging, finance programs, revolving loan funds, technical assistance for board and committee approved projects, homebuyer education class, entry level entrepreneur information and education and food and agricultural development center.					
