Yellowstone Art Museum	http://www.artmuseum.org	(406) 256-6804	EIN 81-6014902	401 N 27th St	Billings	MT	59101	USA	Art Museums, Arts & Culture	The yellowstone art museum exhibits, interprets, collects, and preserves art, with an emphasis on montana and surrounding regions, for the enrichment, education, inspiration, and enjoyment of all.	The curatorial function oversees the care and documentation of the permanent collection, researches and coordinates temporary and permanent exhibitions, researches and writes art-related publications, and coordinates an annual series of adult programs.   the education function prepares and presents curriculum-based and enrichment programs to children pre-k through high school, both onsite and through outreach programming.					
Miles City Foursquare Church	http://		EIN 81-0345239	708 Missouri Ave	Miles City	MT	59301	USA								
Keep Montana Green Association	http://		EIN 81-6014376	2705 Spurgin Rd	Missoula	MT	59804	USA	Environment, Forest Conservation							
Iqra Fund	http://iqrafund.org	(406) 581-7017	EIN 45-2751655	PO Box 416	Bozeman	MT	59771	USA	Civil Rights, Education, International, International Human Rights, Women, Womens Rights	Iqra Fund provides access to quality, sustainable education, especially for girls, in the remote tribal areas of Pakistan. Iqra Fund envisions a world where every child has access to quality, sustainable education that provides the skills to achieve success. Since its establishment in 2011, Iqra Fund has enrolled over 2,170 primary school children (1,218 girls), has hired over 50 local teachers, and has worked closely with village elders and parents to establish local Village Education Committees. Iqra Fund serves 5 valleys in 3 districts and derives its name from the Arabic word to "read."	Secondary school supportthe secondary school support program was launched in 2012 in the northern areas of pakistan. We provide transportation to/from the student's village to the location of their secondary school, along with room and board while they are away from home. Additionally, we provide support in the form of tuition, school supplies, uniforms and materials. And finally, we provide regular check-ins and access to mentors who meet with each student regularly to assess their progress, lend support, and provide access to whatever resources they may need in order to progress in their studies.   primary school supportwe provide support to overcome the barriers keeping primarily school-aged women and girls out of school. This support is achieved in various ways, invcluding the following: tuition assistance, books, materials, uniforms and fees, providing a girl-friendly school environment, and supporting teachers' salaries. Providing teacher training/development, not only for the teachers whose salaries are provided by iqra fund, but rather for all of the teachers in every school where we work. Establishment of education committees in each town where we work responsible for implementing measurement and evaluation strategies and criteria required by iqra fund before support is committed. These committees report on progress and results to iqra fund's staff. In 2014, we supported more than 2,170 students directly with our primary school support program, 46 teachers were hired and trained with professional development workshops, 100 mothers were supported with adult literacy programs, and 40 special needs children and adults were provided with services.		Gilgit-Baltistan province, Pakistan			
United in Light, Inc.	http://www.draftrescue.com	(406) 224-1882	EIN 20-0469874	Draft Horse Sanctuary  101 Billman Lane	Livingston	MT	59047	USA	Animal Protection & Welfare, Animals	To rescue mature Draft horse breeds from an untimely death, and to provide a place of retirement. United In Light, Inc. will rehabilitate the horses to optimal health and allow them to live out the rest of their lives free and in love, sharing the connection with humans and education on the Draft horse breeds.	Rescuing, boarding and providing a sanctuary for draft equine breeds. These horses were abused and/or in their later years of life. They can no longer perform the functions for which they were bred.   rescuing, boarding and providing a sanctuary for draft equine breeds. These horses were abused and/or in their later years of life. They can no longer perform the functions for which they were bred.					
Missoula Senior Citizens	http://www.missoulaseniorcenter.org	(406) 543-7154	EIN 81-0306648	705 S Higgins Ave	Missoula	MT	59801	USA	Human Services, Senior Centers, Seniors	To develop, implement and promote programs and services that support the physical, intellectual and emotional health and well-being of missoula's senior population.	Agency provides educational, social, and recreational activites for area senior citizens.					
Zonta International	http://		EIN 81-6016170	Po Box 1064	Billings	MT	59103	USA								
Parents Without Partners, Inc.	http://www.parentswithoutpartners.org/		EIN 84-1419970	PO Box 22706	Billings	MT	59104	USA	Family Services, Human Services, Single Parent Agencies	NOT A CURRENT CHAPTER WITHIN OUR ORGANIZATION						
MONTANA LEGAL SERVICES ASSOCIATION	http://mtlsa.org	406-442-9830	EIN 81-0298262	616 Helena Ave  Ste 100	Helena	MT	59601	USA	Crime & Law, Domestic Violence, Legal Services, Protection Against Abuse	MLSA is the only comprehensive legal services provider in the state.  MLSA's Board of Directors set priorities for direct client representation by MLSA attorneys.  Current priorities include: domestic violence advocacy; housing matters; public benefits; consumer issues; health issues; and utilities.	civil legal aid to help domestic violence survivors and their children live lives free of violence, to help Montanans living with a disability from unfairly losing benefits that pay for food, and to help veterans keep housing. Your generosity provides access to legal help for people to protect their livelihoods, their health, and their families. Your donation also makes it easier for all Montanans to access legal information, through easy-to-understand forms, on-line forms, and legal self-help.	all Montanans access justice, especially vulnerable Montanans,	all of Montana	MLSA has provided legal aid to people in every county of Montana over its nearly 50 years of continuous service.	6,000 Montanans access justice.	
Memorial Ambulance Of Fort Benton Montana	http://	(406) 622-5955	EIN 81-0305868	Po Box 653	Fort Benton	MT	59442	USA		To provide ambulance service to the community of fort benton, montana and the surrounding area	To provide ambulance service to the community of fort benton, montana					
Valley Veterans Service Center	http://ravallivvsc.org		EIN 41-2248466	217 N 3RD St, Suite L	Hamilton	MT	59840	USA	Military & Veterans Organizations, Veterans							
Christian Renewal Inc	http://		EIN 84-1215360	Po Box 11406	Bozeman	MT	59719	USA	Protestant, Religion	Christian renewal	To address and administer christian renewal					
Fellowship Of Christian Athletes	http://		EIN 81-0499476	PO Box 225	Roberts	MT	59070	USA								
Montana Environmental Education Association Inc	http://www.montanaeea.org		EIN 81-0468587	Po Box 1015	Missoula	MT	59806	USA	Environment, Environmental Education	MEEAs mission is to unite, support and inspire  individuals to be stewards of the natural world. MEEA provides professional development opportunities for educators,both formal and nonformal. MEEA facilitates communication,cooperation, collaboration, and coordination among the variedenvironmental education programs in the state. It is a neutral andobjective source of information related to environmental education inMontana, as well as a voice for EE''s important role in the balancebetween societal needs and environmental quality.	The annual conference is the most visible and important MEEA event,effectively promoting the mission by bringing together educators,agencies, tribes, businesses, and organizations. Each person leavesthe conference with renewed enthusiasm, new knowledge, relevant anduseful contacts and resources. Participants gain a greater awarenessof issues, discover fresh approaches to environmental education andbuild relationships with colleagues across the state.					
Stillwater Historical Society	http://www.museumofthebeartooths.com	(406) 322-4588	EIN 81-0417011	Po Box 1	Columbus	MT	59019	USA		To record and preserve the history and artifacts of stillwater county and the vicinity. To build, maintain and operate a local museum to house and display a collection of such artifacts and memorabilia deemed to be unique to our area and typical of the period of discovery, settlement and development of that area.	Hosted over 3,000 visitors.					
Five Valley Lutheran Retirement Center	http://		EIN 81-0393743	2429 Mission Way	Billings	MT	59102	USA								
Bozeman Shelter Care Facility	http://		EIN 81-0463248	P.O. Box 910	Bozeman	MT	59771	USA	Homeless & Housing, Homeless Shelters							
Rapelje Evangelical Church	http://		EIN 81-0475176	Po Box 56	Rapelje	MT	59067	USA								
Montana Large Animal Sanctuary & Rescue, Inc.	http://	(406) 741-3823	EIN 81-0510871	649 Far West Road Po Box 99	Hot Springs	MT	59845	USA	Animal Protection & Welfare, Animals	Montana Large Animal Sanctuary & Rescue, Inc., was founded in 1996 to address the needs of large domestic and exotic animals whose lives were no longer valued due to age, infirmity, or lack of humane care by previous owners. Our equine population is a significant indicator of the 'disposable' mind set overriding more admirable character traits in our yet uninformed fellow humans.  Fluctuating market values of exotic animals continues to create a rescue situation for breeds such as llamas, pot-bellied pigs, and emus. MLAS&R offers these animals an alternative to needless death and/or lives of misery and suffering.						
Bridger Ski Foundation	http://www.bridgerskifoundation.com	(406) 587-2445	EIN 81-0384359	851 Bridger Dr Ste 4	Bozeman	MT	59715	USA	Sports, Winter Sports	Bridger ski foundation is a nonprofit community organization based in bozeman, montana, that promotes personal and athletic excellence through educational and competitive programs in three olympic ski disciplines. Activities include programs for adults and youth per the mission statement; organize and operate the grooming of 50 miles of community nordic trails, for members and the general public; other activities are related fundraisers to support the programs of the mission.	Ski education and coaching programs, support for ski racing events, and grooming of nordic trails.					
Help For Homeless Pets Inc	http://		EIN 81-0523780	Po Box 1282	Billings	MT	59103	USA	Animal Protection & Welfare, Animals							
Gateway Community Services	http://www.gatewayrecovery.org	(406) 727-2512	EIN 81-0303335	26 4th St N	Great Falls	MT	59401	USA	Mental Health, Substance Abuse Treatment	Provide quality, comprehensive community based services addressing the prevention and treatment of alcohol and drug related problems, for all who seek services, regardless of their ability to pay.	Prevention and treatment program: gateway community services serves as a "critical care access center" for alcohol and drug abuse and provides several levels of care for patients over the age of 18. Treatment programs include the adolescent program for youths age 13-18; the m. I. P. Program for youths who have incurred an initial life consequence as a result of drug or alcohol use; the prime for life program for individuals who have been convicted of driving under the influence of drugs or alcohol or charged with misdemeanor dangerous drug; the family program which incorporates family into treatment; and the substance abuse group which is similar to 12-step group treatment. The prevention program served approximately 1,500 individuals during the fiscal year. The treatment programs serviced approximately 500 patients during the fiscal year. The prevention program is aimed at educating individuals and communities on alcohol, tobacco, and other drug abuse and providing activities and strategies to reduce the risk of such abuse.   blue thunder lodge: this is a recovery support home for individuals who are motivated towards recovery from methamphetamine or other drugs. It is an adult native american men's facility offering the unique opportunity for residents to live in an environment that is culturally integrated with best practice programs offered by gateway. Residents will be involved in community based intensiive outpatient treatments while working on living and job skills, as well as educational or training needs. The facility is staffed by case managers who facilitate job placement as well as education and training. The average length of stay for each resident is nine months. The facility houses up to eight individuals.					
Garfield County Health Center Inc	http://	(406) 557-2500	EIN 81-0422376	Po Box 389	Jordan	MT	59337	USA	General Hospitals, Health	Provide medical services to residents of garfield county and surrounding area.	Provide medical services to residents of garfield county and surrounding area.					
Meagher County Senior Citizens	http://	(406) 547-3651	EIN 88-0116830	Po Box 682	Wht Sphr Spgs	MT	59645	USA		Provide and maintain center for senior citizens.	To provide and maintain building for senior meals, activities, and other community functions such as public meetings and funeral gatherings. The center serves meals five days per week for 250 members and also provides several dinners during the year for the community. The center is open around 300 days per year in a city of approximately 1,000 residents and a county with a population of 1,900 people. The senior center is also instrumental in an ongoing housing project for seniors of the community.					
Flathead Spay & Neuter Task Force Inc	http://www.flatheadspayneuter.org		EIN 81-0539954	Po Box 2095	Whitefish	MT	59937	USA	Animal Protection & Welfare, Animals	Low cost spay and neuter clinic	The organization was formed in 2001 to assist low income pet owners and feral caretakers in getting their dogs and cats altered at a low cost. The task force is the only permanent spay/neuter clinic in montana serving a four county area. Four day clinics are held once a month and days are added as demand dictates. The organization is a high volume clinic, providing over 2500 surgeries per year, for a total of over 30,000 surgeries. The results have been a marked decrease in the intake numbers and euthanasia rates at the county animal shelter. Clinics are also made available to animal shelters and rescues in three neighboring counties. Long term goals are to continue to provide affordable altering of pets and feral cats, provide community outreach programs including free pet foods, emergency veterinary care and vaccine clinics.					
Mikal Kellner Foundation For Animals Trust Dba The Foundation For Animals	http://www.montanawildlife.org		EIN 81-6064330	PO Box 389	Helena	MT	59624	USA	Animal Protection & Welfare, Animals, Wildlife Preservation & Protection	The Mikal Kellner Foundation For Animals (MKFA) is a unique nonprofit foundation dedicated to addressing the critical needs of animals, both domestic and wild. The Foundation provides financial assistance to well-managed projects that promote animal welfare, prevent animal suffering and provide need improvement for animals. Established in 1989, the Foundation was named after Mikal Kellner, an advocate for both domestic and wild animals in Montana. That year Mikal was the recipient of the National American Veterinary Association Humane Award. The award recognizes a non-veterinarian who has demonstrated exceptional compassion for the welfare of animals. MKFA is proud to use her name as a symbol of the Foundation's ability to mobilize and employ resources on behalf of animals.						
Toastmasters International	http://www.toastmasters.org		EIN 94-2924208	PO Box 833	Hilger	MT	59451	USA	Community Service Clubs	The mission of a Toastmasters Club is to provide a mutually supportive and positive learning environment in which every member has the opportunity to develop communication and leadership skills, which in turn foster self-confidence and personal growth.						
Lords Church Ministries Inc	http://		EIN 68-0226236	807 13th Ave E	Polson	MT	59860	USA								
Eh Namani	http://		EIN 84-1362850	930 N 18th St	Billings	MT	59101	USA	Religion, Religion-Related							
Humane Society Of Western Montana	http://www.myhswm.org	(406) 549-3934	EIN 81-0290933	5930 Highway 93 South	Missoula	MT	59804	USA	Animal Protection & Welfare, Animals	Animal shelter - providing care, shelter and adoption for homeless and lost animals. Assisting pet owners in keeping pets by providing affordable training and care programs.	Care, shelter and adoption services for lost and homeless animals. Humane education serving missoula and western montana. Approximately 1,200 animals are handled annually.					
Child Life Safety Skills, Inc.	http://		EIN 84-1426331	PO Box 438	Great Falls	MT	59403	USA								
St Thomas Child And Family Center	http://www.stthomaskids.org	(406) 761-6538	EIN 81-0233495	1710 Benefis Ct	Great Falls	MT	59405	USA	Education, Elementary & Secondary Schools, Literacy	St. Thomas child and family center provides early childhood education, nurturing care and family support, which helps children thrive and build a quality future.	The goal of the organization is to provide quality childcare and learning opportunities to children age 6 weeks to 6 years, regardless of economic and cultural backgrounds. The childcare and educational needs of 131 children were met.					
All Mosta Ranch Montana	http://allmostaranch.org	(406) 270-7513	EIN 72-1543204	Po Box 937	Marion	MT	59925	USA	Animal Protection & Welfare, Animals, Food	Prevention cruelty children/animals, charitable & educational benefit to community	Animal rescue; adoption; rehabilitation; sanctuary; provide quality of life and fulfilling purpose; also provide emergency transportation, feed, hay, boarding to critters whose families are in need, numbers of resident critters vary and are dependent upon resources. Note expenses and grants accounted for does not include hay distributed for hay bank from inventory nor specific accounting for transportation provided on an as needed basis; hay 18,614. 00; feed 7,881. 91; vet/health 5,710. 80; 50% transportation 2,710. 38; 40% rent/utilities/maintenance 5630. 18; 75% independent contractor fees 8,797. 50; 50% printing/publication 386. 60; 50% website/advertising 269. 59; 1/3 goods 1,672. 65; 75% infrastructure 1,517. 47; 45% administration/office/visitors 411. 40; 85% equipment 18,093; does not include donations of food stuffs, clothing or hay that was distributed from inventory @ fmv of 1,600 plus . Total 71,695  community education and outreach: animal husbandry; inspire to learn; natural, healthy, recreational and social activities (through the critters); 'pet therapy'; crisis intervention & social interaction; place for individuals to accumulate volunteer hours toward academic, career or personal goals; public education in the prevention of abuse and cruelty; animal husbandry education. 50% printing/publication386. 60; 50% website/advertising 269. 59; 1/3 goods 1,672. 65; 25% infrastructure 505. 82; 10% rent/utilities/maintenance 1407. 55; 45% administration/office/visitors 411. 40; 25% transportation 1355. 19; 25% independent contractor fees 2,932. 50; 10% equipment 2,129 total 11,070  charitable benefit to individuals within community; provide bi-products to needy (food bank or directly); partnership assistance to other human resource or advocacy programs; at-cost housing for displaced families; recreational/educational programs for special needs individuals & groups/ and children 1 - 101 y/o; 50% rent/utilities/maintenance 7037. 74; benevolence grants (does not include donations of - and often comes in form of independent contractor fees above) 287. 11; 25% transportation 1355. 19; 1/3 goods 1672. 64; 10% administration/office/visitors 91. 42; 5% equipment 1064; donation of eggs, fresh vegetables, etc. Not included in value total 11,508					
National Indian School Board Association Inc	http://nisba.skc.edu/	(406) 883-3603	EIN 85-0308435	Po Box 1513	Polson	MT	59860	USA	Ethnic &  Immigrant Centers, Human Services, Immigration	To assist native american schools and school boards.	Empower school board members, parents, and other stakeholders in exercising effective stewardship of indian education in cooperation with tribal governments.					
Alternative Energy Resources Organization	http://www.aeromt.org	(406) 443-7272	EIN 81-0350698	Po Box 1558	Helena	MT	59624	USA	Energy Resources Conservation & Development, Environment	Aero is a grassroots nonprofit organization dedicated to solutions that promote resource conservation and local economic vitality. Aero nurtures individual and community self reliance through programs that support sustainable agriculture, renewable energy and environmental quality	Help citizens develop envirnomentally compatible technologies and practices that conserve energy, reduce fossil fuel dependency and foster community self-reliance.   provide a forum for the exchange of ideas and information through workshops, seminars and publications as well as online resources.   help promote sustainable agriculture in montana by supporting local producers and marketing local food to consumers.					
Gloria Dei Lutheran Church	http://		EIN 81-6018214	2300 Florence Ave	Butte	MT	59701	USA								
Montana Food Bank Network Inc.	http://www.montanafoodbanknetwork.org	(406) 721-3825	EIN 81-0421243	5625 Expressway	Missoula	MT	59808	USA	Food, Food Banks & Pantries, Food Programs	The Montana Food Bank Network is a non-profit organization that solicits, gleans, sorts, repackages, warehouses and transports donated food and distributes it to charitable programs throughout the state of Montana that directly serve needy families, children and seniors.  We also employ the only full time anti-hunger advocate in the state.	Support for our programs comes from a variety of sources. Gifts from individuals, grants from foundations, workplace giving campaigns, corporate sponsorship and cause-related marketing are all sources from which we receive generous financial support. These funds used to carry out our mission of feeding hungry people in Montana.					
Aglow International	http://		EIN 84-1389022	536-10th St	Havre	MT	59501	USA								
Montana Animal Care Association	http://		EIN 84-1409043	Po Box 153	Corvallis	MT	59828	USA	Animal Protection & Welfare, Animals							
Womens International Bowling Congress	http://		EIN 51-0222240	102 Oak St Hc	Glendive	MT	59330	USA								
Stillwater Youth Center Inc	http://www.stillwateryouthcenter.com	(406) 322-5440	EIN 81-0503004	Po Box 1148	Columbus	MT	59019	USA	Children & Youth, Youth Development	The stillwater youth ministry is to call kids to a life-long love relationship with christ; to reach and disciple youth; and to enhance relationships between adults and youth.	Weekly youth group - attended by local youths  youth summer camp  misc youth education  youth conferences & retreats - attended by local youths					
Animal Welfare League Of Montana	http://		EIN 81-0399059	910 6th Ave	Laurel	MT	59044	USA	Animal Protection & Welfare, Animals							
Bitterroot Valley Education Cooperative	http://		EIN 81-0405347	PO Box 187	Stevensville	MT	59870	USA								
River House Inc	http://		EIN 81-0399851	1315 Wyoming St	Missoula	MT	59801	USA								
HAMILTON PLAYERS INC	http://www.hamiltonplayers.com	406-375-9050	EIN 81-0500351	100 Ricketts Rd.	Hamilton	MT	59840	USA	Arts & Culture, Theater	Spotlighting education, inspiration, and community through the performing arts	K-12 and adult theater education; improv education; full stage musicals, dramas, and comedies; concerts and special performances; and reader's theaters	community members of all ages	The Bitterroot Valley, western Montana	Hamilton Players just celebrated its 20 year anniversary of the Hamilton Playhouse and will be celebrating its 40th anniversary as an organization in 2019. Hamilton Players have inspired community members to develop creative problem solving skills, to become compassionate and proactive global citizens, and to pursue their performance dreams.  Hamilton Playhouse is a place for the community to come together to share experiences, make memories, and celebrate the gifts and diversity in our community!	4500 participants, volunteers, and attendees.	
Big Horn County Historical Society	http://bighorncountymusuem.org	(406) 665-1671	EIN 81-6033295	1163 E 3rd St	Hardin	MT	59034	USA		The organization is dedicated to researching, collecting, restoring, protecting and exhibiting all historical items related to the culture and history of big horn county. The mission statement is preserving our past for the future	Operation of big horn county historical museum including collecting, perserving and exhibiting all items of significance to the areas history and culture. Volunteers and employees are working constantly to restore, repair or maintain items acquired by the organization. Community events are held to showcase the museums collections, including a kids history day for the area school children.					
