Point Community Development Corp.	http://thepoint.org	718 542 4139	EIN 13-3765140	940 Garrison Ave	The Bronx	NY	10474	USA	Arts & Culture, Children & Youth, Community & Neighborhood Development, Economic Development, Neighborhood Centers, Youth Development Programs	In the winter of 1993, four experienced community workers conceived THEPOINT to unearth the hidden strengths of both the Hunts Point community as awhole and of the young people who reside here. THE POINTs mission tostimulate culture and enterprise in the Hunts Point community and deeplyengage young people in all aspects of revitalizing their community. Today,the new South Bronx is a national model for urban rebirth. THE POINT isjust one example of the new thinking behind this boroughs rebirth. An artscenter and neighborhood marketplace, THE POINTs programs encourage and celebrate both artistry and entrepreneurship among the agencys 325 youth participants. THE POINT engages participants as active agents of change, rather than treating them merely as recipients of services. For THE POINT, at-risk young people are more than bundles of problems--they are in fact wellsprings of solutions.				Bronx				
Sunshine Horses, Inc.	http://www.sunshinehorses.org	(315) 456-9380	EIN 43-2046806	7105 Kingdom Road c/o Kate Starr	Memphis	NY	13112	USA	Animal Protection & Welfare, Animal-Related, Animals	Helping Horses, Helping People; by making a difference in the lives of horses in Central New York. Through rehabilitation, retraining and ultimately adoption, we make a profound difference in the lives of our own; as well as in those of community groups through education and care of the horses.  Sunshine Horses, Inc. is a non-profit adoption agency and rescue facility for horses located in Syracuse, NY. Founded by Kate Starr in 2003, Sunshine has found loving homes for more than 150 horses.  We specialize in retraining and rehoming retired Standardbred racehorses. However, Sunshine works with all horse breeds and prepares them for their forever homes.  Just as important to our mission of helping horses is our mission of helping people. Sunshine works with many different community organizations and agencies within the Syracuse area. Through youth and adult volunteer programs, we draw upon the strengths each participant brings to Sunshine and seek to provide personal growth and enrichment. Many program participants face unique challenges of their own, and can empathize and bond with our horses in a special way as they help prepare the horse for adoption. Sunshine has well over 150 committed volunteers that give love and care to over 25 horses. Many different breeds make up our Sunshine herd such as former Standardbred and Thoroughbred racehorses, Appaloosas, Warmbloods, Quarter Horses and Paints. Many of the retired Standardbreds come to us because they lacked the desire or skill to be successful on the track. Occasionally they have just become too old to race, or have an injury that prohibits further racing. Along with the off the track Standardbreds some of our horses have been surrendered, as their owners could no longer care for them, while others come from true rescue situations.  Once coming to Sunshine, all of the horses are rehabilitated and/or trained for different equestrian disciplines prior to their being adopted. Many of our horses are used to being driven, and adapt well to light carts and carriages. Others readily learn to accept a saddle and rider. We strive to give each horse the basics so that they may excel in any discipline or new career they might find. We work with them daily and try our best to match each ones unique qualities to the needs of a potential adopter.	Over 200 horses have found forever homes since our founding in 2003 We typically adopt out 20-30 horses each year Over 100 retired harness racehorses (Standardbreds) have been helped since our founding, including many rescued from slaughter At any given time, the total earnings of our horses waiting for forever homes typically exceeds $2 million.	Retired standardbred racehorses as well as other breeds find new careers and homes	Over 30 horses find their forever homes	Central New York	community outreach, open houses, attending equine events (shows, etc.), working with local groups (Youth, veteran, etc.)			
Southern Tier Animal Rescue Network	http://www.southerntieranimalrescue.org	607-862-6811	EIN 45-5598323	PO Box 433	Vestal	NY	13851	USA	Animal Protection & Welfare, Animals	Using Education, Income Assistance, Trap, Neuter, Return, and Adoption, STAR Network connects community resources to families and animals in New York's Southern Tier Region.   Our talented and dedicated group is 100% volunteer. We partner with local veterinary offices to provide assistance and work on eliminating overcrowding in shelters with a once a month TNR in multiple areas. We keep our overhead low by using foster homes rather than a shelter/adoption center model. We partner with PetSmart in Vestal NY to hold adoption hours in store on Friday evenings.	From Jan 1 - August 25, 2015 - 42 cats spayed/neutered in 2015  - Income assistance provided to 6 families for low cost spay/neuters - 9 cats removed from the streets to be adopted out during the TNR process.	stray/feral cat colonies, low income families, seniors, adoption, foster families		Broome County	animal fostering, assisting with Trap/Neuter Return, education, pet adoptions, community outreach, income assist Spay/Neuter.			
Alzheimer's Research Foundation, Fisher Center	http://www.ALZinfo.org	800-ALZ-INFO	EIN 13-3859563	199 Water Street, 23rd Floor West 46th St. & 12th Ave.	New York	NY	10038	USA	Alzheimers Disease, Brain Disorders Research, Health, Neurology & Neuroscience Research	The Fisher Center for Alzheimers Research Foundation is a leading source of funding for Alzheimers research. We serve Alzheimers patients and their families by seeking to understand the causes of, discover a cure for, and improve the lives of people with Alzheimers disease. Nobel laureate Dr. Paul Greengard directs the Foundations team of internationally renowned scientists, who have been at the forefront of research to understand and find a cure for Alzheimers disease. It also is a leader in public education through its website ALZinfo.org and Preserving Your Memory magazine. Only 8 cents on the dollar is used for overhead purposes. For more information visit www.ALZinfo.org					The Fisher Center is the largest and most modern facility in the world dedicated to solving the puzzle of Alzheimer's disease. Its coordinated approach combines basic scientific investigation in direct correlation with clinical studies, is designed to encourage crossfertilization of ideas and strategies.			
Oxalosis and Hyperoxaluria Foundation	http://www.ohf.org	800.OHF.8699	EIN 91-1457505	201 E. 19th Street, 12E	New York	NY	10003	USA	Health, Kidney Diseases	The Oxalosis and Hyperoxaluria Foundation (OHF) is a voluntary, not-for-profit health organization established in 1989 under IRS Code 501(c)3.  The OHF was founded in 1989 to seek the cause, improve the care and treatment and discover a cure for Oxalosis, PH and related stone disease.  Since then, the OHF has been and continues to be a global leader throughout the PH community.  The OHF helps educate and provides support to patients, professionals and the public to better understand Oxalosis, PH and related stone disease. All programs are supported by contributions from individuals, commerce and industry, unions and foundations, clubs and organizations, and bequests and memorials.  Contributions are tax-deductible within the limitations prescribed by the Internal Revenue Code.		all affected by Primary & Enteric Hyperoxaluria	hundreds of children and adults throughout the world.	all parts of the World	research grants, education, awareness and advocacy.			
Play4Autism Foundation	http://www.play4autism.org/	718-440-9863	EIN 80-0828486	88-11 Doran Avenue	Glendale	NY	11385	USA	Autism Research, Children & Youth, Health, Recreation & Sports, Sports, Youth Community Service Clubs	OUR MISSION is to increase the public's awareness and acceptance of Autism, while improving the quality of life and hope for children. We will achieve this goal by introducing children on the Autism Spectrum and their families to our Kidz into Action Program.     This will help to improve their self-esteem and social interaction, increase their communication and leadership skills plus teach them how to sustain regular lifelong physical activity as a foundation for a healthy, productive and fulfilling life.     Such can also help an individual improve their skills in areas such as sensory issues, behavior, cognition, perceptual/motor skills, and self-reliance or self-determination.   We also believe that by teaching children the basics of organized individual instruction & team play they will learn the values of teamwork & community in a fun and safe atmosphere		Children along the Autism Spectrum and their families.	Over 100 children and their families	The tri-state NY Area.	Sports, Martial Arts, Arts & Crafts and Music.			
Lucky Orphans Horse Rescue	http://www.luckyorphanshorserescue.org	(845) 416-8583	EIN 26-2729197	2699 ROUTE 22 PO BOX 334	Dover	NY	12522	USA	Animal Protection & Welfare, Animals	We strive to promote the humane treatment of horses and to strengthen the bond between horses and people through the education of people, especially children.  Our goal is to properly unite children and horses in a safe environment, using accepted methods to preserve the best equine care through informative and educational guidance, education and administration adhering to the understanding of the need for the preservation of rural equine communities.								
Renaissance Youth Center	http://www.RenaissanceYouth.org	(718) 450-3466	EIN 13-4122438	3485 3rd Avenue	Bronx	NY	10456	USA	Arts & Culture, Children & Youth, Performing Arts Centers, Physical Fitness & Community Recreational Facilities, Sports, Youth Centers & Clubs	To maximize the potential of at-risk, inner-city youth to become law-abiding citizens with something positive to offer society.	Renaissance serves over 1,200 youths every single week, offering programs in 12 public schools, 8 community-based organizations, three satellite after-school sites, and our 10,000 square feet center on Third Avenue. Our programs work with students holistically, teaching them skills in the arts or athletics, and delivering social development and academic enrichment through mentoring, tutoring, and SAT prep.   Since 2012, Renaissance and its programs have been honored by the Bronx Borough President, the New York Police Department, and the New York Yankees, and have appeared in the Huffington Post, Bronx 12 News, and a national commercial by Citgo.   Program participants that spend at least four years with Renaissance have a 100% high school graduation rate, and 97% of them go on to attend college.	At-risk, inner-city youth in the Bronx and surrounding boroughs, ages 2-19.	1500	New York City	Music On Wheels - this program provides music classes to over 20 public schools in NYC, instructing more than 1200 kids each school year. Music With A Message - our youth band that travels around New York City and beyond during the summer, playing live concerts and spreading positive messages. They've performed in several states, parks like Six Flags and Hershey Park, and in Yankee Stadium with Roger Waters. Basketball - our basketball program teaches discipline and work ethic to all ages. There are two travel teams for teens, and personal development is valued above pure athletic performance. Academic Tutoring - we provide SAT/ACT tutoring each school year, and have summer tutoring to keep students sharp while they're out of school. Teens Live to Tape - we're launching a TV show for teens, by teens. The show, currently in production, features an in-house band, interviews with experts from all walks of life, and other fun and educational segments.			
Everyone Reading	http://www.everyonereading.org	212 691 1930	EIN 13-2755541	71 W 23RD Ave Suite 1527	New York	NY	10010	USA	Education, Health, Literacy, Remedial Reading & Encouragement, Special Education, Specifically Named Diseases	Reading is a critical link to success. Everyone Reading advances the lives of children and adults with dyslexia and related learning disabilities by providing the resources they need to learn to become successful readers, writers and spellers.	In this year alone: 75 students received free tutoring this year Over 1000 educators benefited from our professional development  Over 2500 calls for information and referrals were answered			New York City and surrounding metro area	Full and Half Day Institutes and Workshops for educators Afterschool and summer tutoring in Wilson Reading System Information and referrals for families and professionals			
Chiari & Syringomyelia Foundation (CSF)	http://www.CSFinfo.org	(718) 966-2593	EIN 26-1316274	29 Crest Loop	Staten Island	NY	10312	USA	Health, Neurology & Neuroscience	The Chiari & Syringomyelia Foundation, Inc. (CSF) was established in October 2007 by a group of passionate and dedicated people who are committed to aggressively pursuing a cure for Chiari malformations (CM) and syringomyelia (SM). Our Medical Research Board consists of leaders in neurosurgery, neurology, neuroradiology, genetics, veterinary medicine, and engineering. Our Vision: Within a generation, we will be the preeminent world-wide resource for professional and laypeople seeking accurate and current information about treatments for and best practices surrounding the management of CM and SM. With our unique resources, both financial and intellectual, we will be the leader in driving ongoing programs and research focused on earlier diagnosis and better outcomes for people suffering with these disorders.	Here are just a few of the items we have accomplished and helped to fund since our inception in 2007: - research projects involving CM, SM and related disorders - educational lectures given by medical professionals - several fundraising efforts including (not limited to): the annual Bobby Jones Golf Classic in Atlanta, GA, about 50 annual national unite@night walks, as well as fundraising dinners, dances, etc... - annual Think Tank of thought leaders across nation - recurring International Hydrodynamics Symposium - a new campaign to educate medical professionals about CM, SM and related disorders: "Consider Chiari" - funding for a golf cart to help children with full or partial paralysis stay physically active (alongside Georgia Tech) - multiple annual research colloquia  And we have so many more ideas! If you would like to help, you can either donate directly or actively volunteer at events like those listed above by starting a CSF Chapter!	educate about and fund research on Chiari malformation, syringomyelia and related disorders.		United States	Do you want to volunteer? You can get started locally by setting up a CSF Chapter in your area! You will help to organize a unite@night walk, fundraise, organize educational lectures and programs, hold meetings and become an integral part of CSF's national/international team!  Email Cathy Poznik at cpoznik@csfinfo.org to get started!			
Global Youth Action Network / TakingITGlobal	http://www.youthlink.org	212-661-6111	EIN 20-0479950	540 President Street 3rd Floor	New York	NY	11215	USA	Children & Youth, Education, Educational Services, International, Promotion of International Understanding, Youth Development Programs	Our mission is to facilitate youth participation and intergenerational partnership in global decision-making; to support collaboration among diverse youth organizations; and to provide tools, resources, and recognition for positive youth action.					Educating and providing accessible information, capacity building and networking opportunities to young people and youth based projects: global youth action network strengthens the capacity of young social change makers through our e-courses, webinars and partnerships with international conferences focused on leadership development and leveraging the power of web tools for social change. Also, global youth action network distributes information about united nations activities to its members and network through blogs, newsletters, publications and printed materials.			
Academy of Medical & Public Health Services	http://www.amphsonline.org/	(212) 256-9036	EIN 27-2206293	5306 Third Avenue, Second Floor	Brooklyn	NY	11220	USA	Centers to Support the Independence of Specific Populations, Disaster Aid, Health, Human Service Organizations, Human Services, Public Health, Safety Education	AMPHS is a humanitarian 501(c)3 nonprofit organization operated solely by volunteers, dedicated to advancing the health care of underprivileged communities across the nation and around the world.  We accomplish our goals by providing accessible community activities that forge a firm foundation for the improvement of health and well-being.	We have held over 55 monthly free health screenings for underprivileged community members, partnering with local charities and organizations such as Interfaith Medical Center to provide HIV testing in addition to our standard risk factor screenings of BMI, blood pressure, visual acuity, and other vital signs.  We have incorporated free prescription assistance, health insurance assistance, and corrective lenses assistance services into our programs to assist uninsured families.  As an American Heart Association training site, we have trained over 300 people in emergency response skills, and are implementing a new Regional Community Training Program and Authorized Provider Program, which is anticipated to greatly increase the impact of our emergency preparedness courses.	Low-income community members who a) do not have healthcare access, b) do not have healthcare insurance, and c) have a language barrier that prevents them from understanding available resources.	a) Low-income community members located primarily in Sunset Park, Brooklyn who attend our health screenings and participate in our other programs;  b) Children who attend Teddy Bear Clinic sessions;  c)  Students who take our emergency preparedness courses;  d) Our volunteers who train with us and learn about public health and nonprofit management;  e) Our partner institutions, which are able to make a greater community impact	Sunset Park, Brooklyn	Community Health Project Community Health Screenings Prescription Assistance Program Health Access & Coverage Assistance Program Vision Assistance Program Community Research & Resource Center Training & Preparedness in CPR/AED and First Aid			
Autism Science Foundation	http://www.autismsciencefoundation.org	(914) 810-9100	EIN 26-4522309	106 West 32nd Suite 182	New York	NY	10001	USA	Autism, Disabilities, Health	The Autism Science Foundation supports autism research by providing funding and other assistance to scientists and organizations conducting, facilitating, publicizing and disseminating autism research.  The organization also provides information about autism to the general public and serves to increase awareness of autism spectrum disorders and the needs of individuals and families affected by autism.	ASF has awarded over one million dollars in funding to scientists doing autism research since our founding in 2009. We also provide travel awards for autism stakeholders to attend the International Meeting for Autism Research each year.  We launched an awareness campaign to encourage brain tissue donation so scientists can investigate the neural underpinnings of autism spectrum disorders.   ASF advocated successfully for a new medical classification code for autistic wandering, which became possible after the ASF-funded wandering study published in the journal Pediatrics.   ASF board members and staff are frequently sought after by major national media (CNN, Wall Street Journal, Washington Post, USA Today, etc) to comment on autism related issues.	The Autism Community	In 2012, ASF funded $330,000 in autism research fellowship grants. Since our founding in 2009, we've awarded over one million dollars in grants.	United States	We provide funding directly to scientists doing cutting-edge autism research to discover the causes of autism and develop better treatments.We also provide information to the general public and support the needs of individuals with autism and their families.			
