Open Door Pregnancy Center	http://www.theopendoor.com		EIN 22-2563190	533 Lakehurst Rd	Toms River	NJ	08755	USA	Counseling, Health, Mental Health, Reproductive Health Care, Reproductive Rights	The Open Door assists those facing unplanned pregnancies with counseling on all options, referrals for community assistance, material assistance and family support. We seek to share the love of Jesus Christ in both word and deed with those we serve.					
Values Into Action Nj Inc	http://	(610) 565-5177	EIN 20-8483298	14 Scenic Dr Ste 33	Dayton	NJ	08810	USA	Developmentally Disabled Centers, Disabilities	Provide support to people with disabilities			Provide support to people with disabilities		
The CJ Foundation for SIDS, Inc.	http://www.cjsids.org	1-888-CJ-SIDS	EIN 22-3280254	Hackensack University Medical Center 30 Prospect Ave	Hackensack	NJ	07601	USA	Health, Philanthropy, Private Independent Foundations				The Foundation offers a quarterly newsletter, which is currently distributed to about 30,000.  The organization's website -- www.cjsids.com -- is visited by about 20,000 families every month.  The site provides the latest information, research and developments in the SIDS community.		USA
Windmill Alliance Inc	http://	(201) 858-4460	EIN 52-1648111	141 Broadway	Bayonne	NJ	07002	USA	Developmentally Disabled Centers, Disabilities, Homeless & Housing, Housing & Shelter, Human Services, Job Training, Sheltered Employment	The organization is dedicated to serving those most in need			Windmill center - provides work related skills and habits to low income developmetally disabled individuals  supervised apartments - assists developmentally disabled low income individuals with daily living  highways - provides social and work skills to clients		
Alpine Learning Group Inc	http://www.alpinelearninggroup.org	201612-7800 X 18	EIN 22-2887044	777 Paramus Rd	Paramus	NJ	07652	USA	Education, Special Education	Alpine Learning Group's mission is to provide learners with autism and their families comprehensive, scientifically-validated educational and behavioral services designed to foster individual growth and personal achievement.  "At Alpine Learning Group, our son is treated with respect and his life has dignity and purpose. His future is full of possibilities and they never cease to amaze us! "	Founded in 1988, Alpine Learning Group is a renowned, ABA-based program. that has served as a model for other school programs in the country. At a time when most people thought that children with autism were hopeless, our founders believed that every individual deserves the opportunity to reach their full potential. From these humble beginnings, Alpine Learning Group has become a leader in the field of autism education and is internationally renowned for its methods, research and success. We are currently working diligently to raise the funds to create the ALG Adult Learning Center. This new facility will provide community-based supported employment and on-going education for our adult graduates.  Alpine's commitment to providing highly specialized and individual treatment to all of our learners is paramount.  With this new program, we will be able to have a "home" for our adult education program and ensure that all of our adult graduates will continue to succeed.  We will also be establishing a community resource center for the greater adult autism community.	Children and adults with autism.	Our programs include: - Day school - Peer modeling - inclusion and Transition - Supported structured learning experience/internship program - Parent training and Education - Early detection - Family consultation - Outreach program - Adult program - Research program - External evaluation - Mentorship and training - Social skills groups Visit our website for more information.		
Bais Tova Inc	http://	(732) 901-3913	EIN 22-3674957	555 Oak St	Lakewood	NJ	08701	USA	Education, Primary & Elementary Schools	Educational - operation of a parochial elementary and high school			Operation of a parochial elementary and high school		
Nyc Dance Alliance Foundation Inc	http://		EIN 27-2855982	101 Mcintosh Dr	Mahwah	NJ	07430	USA	Education, Scholarships, Scholarships & Student Financial Aid						
SONRISE DEVELOPMENT CORPORATION	http://www.sonrisehope.org	(201) 568-3410	EIN 22-3644135	351 Englewood Ave	Englewood	NJ	07631	USA	Adult Education, AIDS, Education, Health, Homeless & Housing, Homeless Centers, Human Services	SonRise Development Corporation is a community based 501(c)(3) organization that provides information and social services primarily to the residents of Englewood, Teaneck, and Hackensack, located in Bergen County, New Jersey.  It was organized in 1999 by the First Baptist Church of Englewood to go beyond the barriers of religious organizations in providing services to the neighboring communities.  The mission of SonRise Development Corporation is to empower and promote the wellbeing of members of our local communities by providing convenient and affordable access to resources and services not readily available to them.			SonRise runs two programs - His Invitation to Victory and SonRise Family Services.  Through His Invitation to Victory, SonRise offers HIV/AIDS education and spiritual support including workshops, free HIV testing, literature dissemination, information and support to churches starting HIV/AIDS ministries, and individual spiritual counseling and support upon client request.  SonRise Family Services is the newest department of SonRise and provides drug and alcohol education and prevention.  In 2007 we will offer computer classes and fatherhood classes.  We also have joined with Bergen Family Center to create the Family Success Center.  Finally, SonRise will soon begin renovations on SonRise House, a transition home for homeless women and their children.		
Organize Change	http://		EIN 47-1379934	Po Box 20315	Newark	NJ	07101	USA	Children & Youth, Youth Development Programs						
Troopers Assisting Troops Inc	http://	(732) 449-3650	EIN 80-0586838	16 Jason Dr	Spring Lake	NJ	07762	USA	Military & Veterans Organizations, Veterans	To provide support to returning			Entertain wounded warriors		
Catholic Kolping Society Of America	http://www.kolping.org	(513) 941-0247	EIN 36-3529717	1223 Van Houton Ave 2nd Floor	Clifton	NJ	07013	USA	Religion, Roman Catholic	The catholic kolping society of america's primary exempt purpose is to extend the vision of our founder, blessed adolph kolping by promoting the development of the individual and family; we foster a sense of belonging and friendship through our program of spiritual, educational, charitable and social activities.			The kolping banner is a christian newsletter  kolping convention		
B L E S S E D Ministries Inc	http://		EIN 06-1549887	303 Washington St Ste 330	Newark	NJ	07102	USA	Protestant, Religion						
Rileighs Rainbows	http://		EIN 47-2879668	1027 Bonnie Blue Cir	Williamstown	NJ	08094	USA	Education						
Allamuchy Township Education Foundation Inc	http://		EIN 26-2768502	Po Box 398	Allamuchy	NJ	07820	USA	Education, Educational Services						
Shri Yoga Vedanta Ashram Inc	http://	(732) 441-9822	EIN 22-3522556	45 Texas Rd	Matawan	NJ	07747	USA	Disaster Aid, Disaster Preparedness & Relief Services, Hinduism, International, International Relief, Religion	Health and human services and spiritual upliftment.			Providing health and human services and spiritual upliftment  assistance and spiritual to organizations in india		
Jonah Inc	http://		EIN 22-3674448	80 Grand St	Jersey City	NJ	07302	USA	Health, Reproductive Health Care, Reproductive Rights						
Mylestone Equine Rescue a New Jersey Non-Profit Corporation	http://www.mylestone.org	908-995-9300	EIN 22-3304384	227 Still Valley Rd	Phillipsburg	NJ	08865	USA	Animal Protection & Welfare, Animals	DEDICATED TO ABUSED AND NEGLECTED HORSES. WORKING TO EDUCATE THE GENERAL PUBLIC ABOUT THE SUFFERING OF UNWANTED HORSES.		abused and unwanted horses, many are cruelty cases	We provide sanctuary for these horses for the rest of their lives if adoptive homes are not found. Currently we care for 38 horses, none of which are ridable.  We work with two local schools where special needs students come and brush the horses. They also help with projects and barn chores. It is a wonderful way for our companion horses to be able to give back to the community. We have also helped other rescue groups with financial support, vet care, blood work, medication as well as supplies including blankets, supplements, de-wormer, vaccines etc... to help horses these groups have taken in need. We have helped horse owners directly by networking for homes, we have donated grain, medication, blankets etc.. We have also paid for humane euthanasia when the vet deemed necessary. At our last Open House event we collected soup for our local food bank, raising over 275lbs of soup.  You can visit our website for more details, www.mylestone.org		New Jersey
Biancas Kids	http://www.Biancaskids.org	856-341-6311	EIN 45-0669099		Williamstown	NJ	08094	USA		To provide hope to the hopeless by granting wishes to children and families in need. From celebrity meet & greets to bedroom makeovers and everything in between.   Children who are struggling emotionally, physically, mentally or financially -  every needy child is considered one of Bianca's Kids.  Unlike other nonprofits, $.95 of every dollar donated to Bianca's Kids gets to the intended target, our needy children. No one at Bianca's Kids receives a salary. From the President to its volunteers - everyone associated with this organization works on a volunteer basis. You can see/read about some of our granted wishes on our website www.Biancaskids.org and/or on our Facebook page at Bianca's Kids.	Bianca's Kids was named by the South Jersey Times as one of the "fastest growing nonprofits" in South Jersey.  In 31/2 short years and due to the passion of the Board of Directors and supporters of this organization - over 10,000 foster & needy children have received granted wishes, Christmas gifts and basic needs from Bianca's Kids.	Foster & Needy Children & Families	Bianca's Kids is a 501(c)3 organization that grants wishes, provides Christmas gifts and basic needs to needy children and families. By January, 2014 Bianca's Kids will have granted wishes and provided needs to nearly 12,000 needy children in NJ and around the US.  We are a volunteer based org. Accordingly no dollar donated goes to a salary for anyone associated with Bianca's Kids. This is a nonprofit you can trust.	Approximately 3500 children & families in need	NJ & around the US
The Tender Inc	http://help4caregivers.org		EIN 22-2224241	4501 Church Rd	Mount Laurel	NJ	08054	USA		To allow frail seniors and persons with Alzheimer's disease to remain at home, with family and as members of the community rather than being forced into nursing home placement.					
Musconetcong Watershed Association	http://www.musconetcong.org	(908) 537-7060	EIN 22-3199292	Po Box 113	Asbury	NJ	08802	USA	Environment, Water, Water Resources, Wetlands Conservation & Management	The musconetcong watershed association is an independent, non-profit organization dedicated to protecting and improving the quality of the musconetcong river watershed, including its natural and cultural resources, through:public education and awarenesswater monitoringsustainable land management community involvement			Dam removals and riparian restoration: the mwa provides project leadership for the removal of dams impeding the free flow of the musconetcong river, thus improving water quality, wildlife habitat, and recreational use. The mwa has managed the removal of four dams and is working with owners on the removal of a fifth. For these projects the mwa works with landowners to secure agreements, communicates with local municipalities and stakeholders, and is the applicant for all local and state permits. Mwa works with engineers, partners, and the state of new jersey during feasibility studies and uses information garnered during those studies to make decisions that result in successful dam removals. The mwa holds outreach and education forums for communities during these projects, and also works to restore and maintain riparian buffers along the river banks to prevent erosion and protect against pollution.   environmental education & outreach: the mwa watershed education program reaches hundreds of students each year, from fifth graders to college aged students, providing experiential environmental education and learning opportunities to all ages. Our "meet the river" program is designed to introduce very young children to the river by allowing them to get into the water, turn over rocks, and use nets and magnifying glasses. "camp musky," a summer day camp for children aged 5 to 12, offers an outdoor, hands-on, river-based program. In the spring and fall, we offer a program for elementary schools that meets the nj core curriculum content standards for science, and includes a classroom program as well as in-stream field experience. Our river watcher water monitoring program includes an intensive 6-hour training with both classroom and field sessions and is appropriate for those high school aged and older. We also offer a series of "river talks," which are educational seminars that address various aspects of river ecology and restoration, as well as current issues in the musconetcong watershed. In addition, the mwa offers many recreational and interpretive outdoor activities to suit all interests and skill levels.   river water quality monitoring and river cleanups: mwa works to maintain and improve water quality through several programs and events. The mwa river watcher program is a group of citizen scientists trained and led by the mwa water quality monitoring coordinator. River watchers conduct quarterly water testing at four locations on the musconetcong river and work on special tasks such as monitoring restoration projects and spills. Data provided by the program helps mwa maintain water quality and improve ecological conditions in the musconetcong watershed to ensure that it remains a great place to live as well as fish, swim, and boat. Annually, mwa volunteers collect hundreds of bags of garbage, recyclable materials, and truckloads of large miscellaneous debris from the river banks and streambed.   other miscellaneous programs.		
Woodlands Wildlife Refuge Inc	http://www.woodlandswildlife.org	9087308300	EIN 22-3053310	PO Box 5046	Clinton	NJ	08809	USA	Animal Protection & Welfare, Animals, Wildlife Sanctuaries	Our Mission is:"To receive, rehabilitate and release orphaned and injured native wildlife.To educate the public about wild animal habits and habitats". As our towns continue to grow and natural habitat changed so do encounters between humans and wildlife and thus the contining need for our services for both the people and the animals impacted.We provide the animals with a second chance and the people with a better knowledge and understanding of the animals.			Woodlands wildlife refuge received and cared for 868 orphaned or injured native wild animals of 43 species from 20 counties and accomplished a high release rate. In addition to our small staff, 24 volunteers and 14 unpaid interns provided care for the animals. Approximately 6,694 volunteer hours with a value of $150,950 and 3,320 intern hours with a value of $74,866 were worked during the year. The total approximate value of uncompensated volunteer and intern hours was $225,816.   woodlands wildlife refuge presented 35 educational programs to volunteers, schools,corporations and various other groups. We also responded to approximately 2,350 telephone calls relating to wildlife questions and concerns from residents of 20 counties.   woodlands wildlife refuge sold broke leg bear books, which is an educational children's book. It tells the true story of an injured bear cub that woodlands rehabilitated and successfully released back to the wild.		
Ronald McDonald House of Southern New Jersey Inc	http://www.ronaldhouse-snj.org	856-966-4663	EIN 22-2430393	550 Mickle Blvd	Camden	NJ	08103	USA	Health, Patient & Family Support	Ronald McDonald House of SNJ provides a home-away-from-home to families of seriously ill and traumatically injured children who are being treated at nearby hospitals and operates 11 Ronald McDonald Family Rooms within pediatric units of hospitals across the Southern New Jersey region.	We have helped over 20,000 families in 30 years.	Pediatric patients, 21 years old and under, and their families who have traveled from all over the state, country and world to seek specialized medical attention in the South Jersey area.	Ronald McDonald House and Ronald McDonald House Family Room Program		South Jersey, USA, Other Countries
Cerge-Ei Foundation	http://	(201) 692-9408	EIN 25-1725738	715 Queen Anne Rd	Teaneck	NJ	07666	USA	Economic Development, Economics, Education, Graduate & Professional Schools, International, International Economic Development, Microfinance	To promote economics education and research in the post-communist countries of central and eastern europe including the former soviet union.			The cerge-ei doctoral program in economics for promising students from the former soviet bloc and other developing nations is totally tuition free, building a base of knowledge and expertise in modern market economics in a region where it was previously unknown.   the undergraduate program in central european studies is an american junior-year study-abroad program designed to expand u. S. Students education in the study of central europe and to further expand knowledge of the cerge-ei program through american academia.   the cerge-ei teaching fellowships support graduate students and post-doctoral teachers in the effort to expand the teaching of modern market economics to undergraduates in a region where such education is in severe short supply.		
Delaware Valley Americans United for Separation of Church and State	http://dvau.org	856-881-1816	EIN 02-0712242	4 Roosevelt Blvd DVAU	Clayton	NJ	08312	USA	Civil Rights, Civil Rights, Social Action & Advocacy, Education	The Delaware Valley Chapter of Americans United for Separation of Church and State is a 501(c)(3) nonprofit, nonpartisan educational organization serving the Greater Philadelphia metropolitan region.  We work to preserve America's constitutional principle of separation of church and state.			Monthly meetings in Cherry Hill NJ, conferences and lectures in Philadelphia and South Jersey.  Tabling at community events.  Reporting church-state issues to Americans United. Taking action on church-state problems. In addition to hosting special speakers for lectures, we also provide speakers to schools, civic groups, and other nonprofits.		Philadelphia, Southeastern PA, Northern Delaware, South Jersey, Delaware Valley
International FPIES Association (I-FPIES)	http://www.fpies.org	(908) 910-4419	EIN 45-3930377	319 Richmond Avenue	Point Pleasant	NJ	07731	USA	Health	The International FPIES Association (I-FPIES) is a non-profit organization whose mission is to improve the quality of life for patients and families affected by Food Protein-Induced Enterocolitis Syndrome (FPIES) by means of education, research, advocacy and support.  The I-FPIES strives to be a worldwide leader in FPIES awareness and the issues surrounding this condition. We seek to increase awareness by providing educational resources, support services, advocacy, and the development of groundbreaking research through our partnership with the medical community.	-Creation of an official FPIES ICD-10 diagnostic code (K52.21), entirely foundation run and supported by the Centers for Disease Control (CDC) -Collaborative partnerships and recognized as the official FPIES organization with AAAAI, ACAAI, NORD, AAP -Continued funding of new research studies.  -Actively developing formal diagnostic and treatment guidelines of FPIES in collaboration with our Medical Advisory Board, AAAAI and an international panel of FPIES experts -Host of the first annual FPIES Education Conference in October, 2013 -Expansion of awareness and education programs. In 2013, I-FPIES educated over 67,000 medical providers, to decrease the amount of time patients are lost without a diagnosis and treatment - An extensive library of resources and educational videos hosted on the foundations interactive website and social media sites -One on one supportive services -Local and region support groups hosted by FPIES-knowledgeable experts and I-FPIES board members -Hosted the first national FPIES walk in Chicago, IL -Tools for the practical management of FPIES available in printable forms, at medical provider offices and on our website -Numerous fundraising programs with detailed reports on how funds are spent -All overhead expenses from 2010-2013 provided by the I-FPIES Executive Board to ensure all donated funds are used immediately and directly to the foundations mission and goals	patients and families affected by Food Protein-Induced Enterocolitis Syndrome (FPIES)	education, support, research and advocacy for individuals with Food Protein-Induced Enterocolitis Syndrome (FPIES) and their families.  I-FPIES partners with leaders in our medical community to develop evidence-based research with a focus on early detection and new treatment options. The foundations research efforts are coupled with our emphasis on education and advocacy to positively impact the lives of patients and families coping with FPIES. Ultimately, the I-FPIES represents families and medical professionals united by a common focus: finding a cause and a cure for FPIES.	over 100,000 families and supporters.	the U.S. and internationally
Home Front Hearts	http://www.homefronthearts.org	732-698-2389	EIN 26-1661564	7 Laurie Dr	E Brunswick	NJ	08816	USA	Military & Veterans Organizations, Veterans	The mission of Home Front Hearts is to serve the families that serve our country by: providing support and resources to the families of service members, increasing public awareness of the struggles and sacrifices of military families, and engaging both individuals and businesses in building communities that are responsive to the needs of these families.					nationwide
VETERANETWORK	http://www.veteranetwork.org	732-343-0100	EIN 46-1839593	PO Box 307	Spotswood	NJ	08884	USA	Arts & Culture, Arts Education, Job Training, Military & Veterans Organizations, Performing Arts Schools, Veterans	VeteraNetwork is a registered 501(C)(3) Non-profit training organization that focuses on developing technical skills of discharged veterans. Today's veterans have had extreme difficulty assimilating into US economic viability. Although many US companies have government mandates to hire veteran's, the unemployment rate for US veterans are at startling figures. Our plan is to arm veterans with niche IT infrastructure skills while also teaching soft skills to help them bridge the gap into the US corporate world.  With programmable networks and automated infrastructure already here, 95% of the current corporate infrastructure industry doesn't have the skills to operate new age infrastructure technology. After completing our programs we believe our graduates will successfully fill that void. Our training methodology is based on not only online classes but a series of level up testing and projects to make sure the repetitions are being done to learn. We additionally provide ongoing technical mentorship and career counseling creating trusted bonds with students to ensure their success.		Reducing the rate of unemployment of Post 9/11 Veterans by 5%	Specialized training programs for Veterans		USA
Lyme Disease Association Inc	http://www.LymeDiseaseAssociation.org		EIN 22-3123551	Po Box 1438	Jackson	NJ	08527	USA	Agricultural Programs, Food, Health, Specifically Named Diseases	LDA grew from a local to a state to a national all volunteer organization to fill a need to bring groups together nationwide to stop the spread of tick-borne diseases (TBD) through education and to fund resesearch which could lead to an effective test and a cure for chronic Lyme disease and other TBDs and to provide patient support.					
