Arc Mercer Inc	http://www.arcmercer.org	(609) 406-0181	EIN 21-0726335	180 Ewingville Road	Ewing	NJ	08638	USA	Developmentally Disabled Centers, Disabilities, Human Service Organizations, Human Services, Job Training	To serve individuals with intellectual and developmental disabilities throughout mercer county through vocational rehabilitation programs, housing programs, recreational programs and other support services.			Residential services - residential services provide housing opportunities to individuals with developmental disabilities in the community. Services range from group home settings to supported living.   arc enterprises - arc enterprises provides employment opportunities to individuals through programs such as the touch of taste catering & baskets and janitorial employment.   extended employment services - extended employment services include rehabilitation programs designed to provide long term employment to a worker.   employment services - employment services include occupational training center, which is designed to give training, therapy, counseling and placement for individuals. Vocational employment - vocational employment provides adult services that give individuals skill training at the adult resource center. Family support services - family support services provides respite care and recreational opportunities to individuals and their families. Program support services		
Landmark Property Management Inc	http://	(609) 458-5625	EIN 52-1819856	43 High St	Mount Holly	NJ	08060	USA	Unknown	Acquire,develop,construct, renovate, sell, lease, maintain, and manage real property and any interest therein in order to improve access to affordable housing to the special needs population in new jersey			Acquire,develop,construct, renovate, sell, lease, maintain, and manage real property and any interest therein in order to improve access to affordable housing to the special needs population in new jersey		
Autism Speaks Inc	http://www.autismspeaks.org	(212) 252-8584	EIN 20-2329938	1060 State Road 2nd Floor	Princeton	NJ	08540	USA	Health	At Autism Speaks, our goal is to change the future for all who struggle with autism spectrum disorders.  We are dedicated to funding global biomedical research into the causes, prevention, treatments, and cure for autism; to raising public awareness about autism and its effects on individuals, families, and society and to bringing hope to all who deal with the hardships of this disorder.			Research/science: the programmatic goals of the science/research program strive to improve the lives of people affected by autism today, as well as improve their future by advancing scientific research. The research focuses on diagnosis, treatment, service delivery and prevention. In 2014, autism speaks launched mssng (pronounced "missing"), its historic collaboration with google to create the world's largest genomic database on autism. The ambitious project will sequence the whole genomes of 10,000 families affected by the disorder. The result will be an autism research open source database containing extensive diagnostic information as it pertains to environmental, behavioral, and medical factors associated with autism. This could uncover various forms of autism and lead to individualized treatment for people living across the autism spectrum. A study co-funded by autism speaks found autism rates doubled among children whose mothers were exposed to high levels of particulate air pollution (smog) during pregnancy. The findings suggest an urgent need to revisit public health policies on pollution limits. In addition, autism speaks funded two major research projects to advance understanding of autism's gut-brain connection. The first explores the role of the microbiome (intestinal bacteria) in driving or relieving autism symptoms. The second focuses on chronic constipation, a serious problem for many people with autism. Research launched with an autism speaks trailblazer grant provided new support for the theory that autism symptoms can result from inflammation and cell distress. Based on those findings, the study's authors are developing and testing new autism medicines. Researchers, also funded by autism speaks, successfully field-tested a simple, practical method that non-specialists can use to screen for autism among schoolchildren in poor regions around the world. Such reliable yet easily administered tests are urgently needed in developing countries. A landmark study funded by autism speaks produced a comprehensive estimate of autism's costs to individuals, families and society. The lifetime cost of care averages $1. 4 million to $2. 4 million, depending on whether an intellectual disability is involved, and includes medical care, lost income, special education and residential supports. The yearly cost to society in the united states is $236 billion a year. This information is crucial for guiding public policy and planning services across the lifespan. In 2014, autism speaks spent $ 14,369,900 in grants and awards for new and continuing projects in the following categories: a. Special projects ($6,684,854) -- autism speaks-initiated projects aimed at addressing specific needs within the autism research community. Autism speaks staff work in conjunction with investigators to develop projects that may include improvements to research infrastructure, rapid responses to new and highly visible public health initiatives, or facilitating collaborations between investigators to address complex research issues from a multi-disciplinary perspective. In 2014, special projects included the autism and developmental disabilities monitoring network (addm), the preclinical autism consortium for therapeutics (animal model development), dsm-5 (diagnostic and statistical manual of mental disorders, fifth edition) comparisons, and projects around early intervention. B. Treatment, basic research and dissemination projects. These include the autism speaks autism treatment network ($2,138,915), basic & clinical studies ($3,199,364), gi and neurobehavior studies ($383,967), trailblazer award ($100,000), and treatment studies ($743,013). C. Training grants, including meixner translational postdoctoral fellowships ($594,477) and weatherstone predoctoral fellowships ($525,310).   awareness, family services, advocacy: awareness is a cornerstone of the autism speaks mission. In its fifth year, autism speaks' global light it up blue awareness campaign reached new heights. More than 10,000 iconic landmarks, businesses, communities and homes in 136 countries united on world autism awareness day, april 2, to shine a bright light on autism. At a special lighting ceremony at the empire state building, autism speaks and sesame workshop, the nonprofit behind sesame street, announced an initiative to help communities "see the amazing in all children" and reduce the stigma surrounding children with autism. Autism speaks hosted its seventh annual world focus on autism during the united nations general assembly. As heads of state gathered in new york city, first spouses from asia, africa, latin america, europe and the middle east gathered for a forum that united the global autism movement. Hosted by autism speaks co-founders suzanne and bob wright, dignitaries heard about global strategies from dr. Liri berisha, former first lady of albania and president of the albanian children's foundation, and mrs. Ban soon-taek, spouse of u. N. Secretary-general ban ki-moon. Family services is committed to connecting and empowering individuals with autism and their families with resources to improve their quality of life today and into the future. Autism speaks continued to focus on safety in the autism community. Nearly half of those with autism wander. In partnership with the national center for missing and exploited children (ncmec), autism speaks responded to 150 wandering incidents. In addition, autism speaks established the swimming and water safety scholarship fund, which enables service providers to offer scholarships to financially disadvantaged people with autism. Nearly 1,500 swimmers benefited from scholarships. Throughout the year, autism speaks focused on increasing the housing and community living options for adults with autism and adolescents entering adulthood. A national town hall series brought them together with families, adult-service providers and government officials to discuss challenges and opportunities. Autism speaks also launched an initiative to develop housing and community-living policies and programs. The goal is to ensure diverse options by collaborating with a wide range of stakeholders. The autism response team, a group of autism speaks staff members specially trained to connect individuals with autism and their families to tools and resources, responded to more than 47,500 calls and emails, including nearly 4,000 in spanish. This marked a 55 percent increase from the year before. In 2014, autism speaks' state advocacy initiatives for autism insurance reform were successful in several states: utah; nebraska; maryland; washington; and the u. S. Virgin islands. Autism speaks' federal advocacy efforts resulted in the passage of the autism cares act, which authorizes $1. 3 billion in federal funding for scientific research. That includes, for the first time, a focus on issues surrounding the transition to adulthood. In addition, after a nearly decade-long campaign by autism speaks and its partners, the achieving a better life experience act (able) was signed into law. It is widely considered the most significant disability-related legislation since the americans with disabilities act (ada) of 1990. Able allows states to create tax-preferred savings accounts -- much like 529 college-savings accounts -- for people with disabilities, generally without losing eligibility for medicaid, supplemental security income and other benefits.		
Steered Straight A New Jersey Non Profit Corporation	http://www.steeredstraight.org	(856) 691-6676	EIN 22-3781365	Po Box 579	Vineland	NJ	08362	USA	Crime & Law, Crime Prevention	Prevention of drug and alcohol use and abuse among our youth			Presentations to schools and other youth audiences		
Lunch Break	http://www.lunchbreak.org	(732) 747-8577	EIN 22-2440028	Po Box 2215	Red Bank	NJ	07701	USA	Food, Soup Kitchens	Lunch break freely provides life's basic necessities -- food,clothing and fellowship for our community members in need. Our mission is to alleviate hunger and lead those we serve to self-sufficiency and healthier lifestyles. We serve everyone, with compassion and dignity.			Organization provides prepared meals for the needy. 64,500 meals were served during the year. Additionally it provides a pantry, grocery and clothing distribution to the needy of the community.		
The Suppers Programs	http://www.thesuppersprograms.org		EIN 01-0882815		Princeton	NJ	08540	USA		The Suppers mission is to provide safe and friendly settings where anyone  and especially people with food-related health challenges  can develop and manage their personal transition to a healthier life.	We've experienced so many "Logical Miracles" over the years, it's hard to summarize.  We are impacting lives daily but supporting, sharing, listening, and helping people reduce or eliminate the need for surgery, medication, etc.	Anyone who wants to have a more vibrant life		We have over 700 people on our mailing list who can attend over 40 meetings per month in NJ	Mainly NJ but open to expansion ideas
Doodle Rescue Collective Inc	http://		EIN 27-1449091	2 Prospect Avenue	Montclair	NJ	07042	USA	Animal Protection & Welfare, Animals						
American Cancer Fund	http://www.AmericanCancerFund.org	908-431-9800	EIN 20-3232112-001	PO Box 7262	Hillsborough	NJ	08844-7262	USA		The American Cancer Fund (ACF) is an organization dedicated to the education, support and empowerment of those diagnosed with Cancer by organizing and clarifying information. We elevate the level of understanding of Cancer.  ACF provides free clear, independent information and research to enable patients and their families to make smarter choices for Cancer treatment with an emphasis on dignity, functionality and cure. We have been doing this for more than 30 years.  We Inform, You Decide!  Cancer education is among the most important facets of surviving cancer. An individual who has been given a diagnosis of cancer and provided with information such as stage and possible treatment options desperately needs additional facts in order to make an educated, empowered decision.  Among some of the questions that must be answers are:  What does it mean to be at stage.? Do I need a second opinion? Is there more than one treatment option? Though the patients physician may make every effort to offer answers to offer answers to these questions, more often than not the patient is not able to hear the physicians information. Shock, disbelief, grief, and anger among other emotions take the place of rational thought when confronted with this diagnosis. Further, individuals have different learning styles an needs. Some learn by listening, others by reading, while others learn by talking things out. Some individuals can handle medical terms and concepts, while others must be provided the information in very basic language.  Regardless of how an individual receives and processes the information provided, the critical aspect is that the information be easily accessible, be offered repeatedly, and at the level at which the patient can grasp it. Cancer, much like any other serious medical condition, does not afford the patient the luxury of misinformation. We seek to eliminate misinformation by doing the research for the patient; seeks to decrease the precious time wasted in research and data collection by providing a clear understandable source of information; seeks to offer comfort and support by ensuring that the information provided is useful and offered in a caring respectful manner.	In just the last 8 years we have helped more than 12 million people find all the resources they need to fight cancer.	empower cancer patients with knowledge.	Online resources to educate, empower and fight cancer. Offline cancer patient advocacy and outreach programs to people dealing with a cancer diagnosis.	more than 1.5 million people find the resources they needed to fight cancer.	the total world
Partners for Women and Justice Inc	http://www.pfwj.org	(973) 233-0111	EIN 22-3825867	60 So. Fullerton Ave. Suite 106	Montclair	NJ	07042	USA	Crime & Law, Legal Services, Public Interest Law, Victims Services	Partners is dedicated to effecting positive change in the lives of low income and abused women.  Partners' programs provide hope and enable victims and survivors of domestic violence to build safe and secure futures for themselves and their children.		low income domestic violence victims and their children			New Jersey
Children's Cardiomyopathy Foundation, Inc.	http://www.childrenscardiomyopathy.org	(866) 808-2837	EIN 75-2986661	P.O. Box 547	Tenafly	NJ	07670	USA	Health, Heart & Circulatory System Diseases & Disorders, Medical Disciplines Research, Pediatrics	The Children''s Cardiomyopathy Foundation (CCF) is a national, non-profit organization focused on pediatric cardiomyopathy, a chronic and potentially life-threatening heart disease that can affect children of all ages regardless of gender, ethnicity or socio-economic background. CCF is dedicated to finding causes and cures for pediatric cardiomyopathy through the support of research, education, awareness and advocacy.			As the first national group focused specifically on pediatric cardiomyopathy, CCF is involved in all aspects of the disease from research and education to patient support, awareness and advocacy.   CCF's work involves      * Catalyzing research and promoting education     * Advancing treatment models     * Providing leadership and advocacy in the pediatric community     * Offering child and family assistance   More than $1.5 million has been committed to research and treatment initiatives, and CCF has led the way in establishing a biologic specimen repository and planning the first international scientific conference. In the process, CCF has partnered with the National Heart, Lung and Blood Institute, American Heart Association, National Society of Genetic Counselors and the National Organization for Rare Diseases.  CCF continues to be an invaluable lifeline to affected families providing information, resources and guidance. CCFs educational materials are now distributed to more than 70 hospitals in North America.		
GIRL SCOUTS HEART OF NEW JERSEY INC	http://		EIN 22-1638950	120 Valley Rd	Montclair	NJ	07042	USA	Children & Youth, Girl Scouts of the U.S.A.	To build girls of courage, confidence and character, who make the world a better place.  GSHNJ serves girls in Hudson, Union, Somerset, Essex. Hunterdon, and parts of Middlesex and Warren Counties. 25,000 girls and 11,000 adult members enjoy programs in Central New Jersey that build the women leaders of tomorrow.					
United States Golf Association	http://www.usga.org	(908) 234-2300	EIN 13-1427105	Liberty Corner Road	Far Hills	NJ	07931	USA	Amateur Sports Competitions, Golf, Sports	The united states golf association promotes and conserves the true spirit of the game of golf as embodied in its ancient and honorable traditions. It acts in the best interests of the game for the continued enjoyment of those who love and play it. The usga serves the game most visibly through the conduct of its national championships and international competitions. Together with the r&a, the usga provides governance for the game worldwide, jointly administering the rules of golf, establishing equipment standards, and formulating the rules of amateur status. The usga also maintains the usga handicap and course rating systems, develops and promotes sustainable golf course management practices, celebrates the history of the game, and fosters access to the game for all who wish to play.			Usga championships, including broadcasts - each year, the usga conducts the united states open, united states women's open and united states senior open championships, which include amateur and professional golfers from around the world. The usga also conducts annually ten national amateur golf championships. In 2014, more than 40,000 people competed in these usga championships. Additionally, more than 500,000 people attended these usga championships as spectators. By exposing the public to these usga championships through various spectator packages, national and international television and radio broadcasts, and digital and social media platforms the usga promotes worldwide interest in the game of golf and inspires participation in the game. The usga also leverages these same platforms to disseminate educational materials and information regarding environmental and economic sustainability, stem education, diversity and inclusion, history, and other relevant topics. The usga also sponsors teams for several international amateur golf championships.   usga members program - each year, the usga provides educational materials and other support to people who have expressed an interest in the game of golf by electing to enroll in the usga members program. Such educational materials include information and education about the rules of golf, usga championships, environmental sustainability, stem education, diversity and inclusion, and history, as well as other relevant topics. The usga also provides a digital newsletter and access to the usga's websites that include information on a wide variety of golf topics. In 2014, more than 660,000 people opted to enroll in the usga members program.   ghin (golf handicap and information network) - ghin is a handicap computation service that allows golfers of differing abilities to compete against one another in a fair and equitable manner. This service began in 1981 with the metropolitan golf association (new york) as the first user; ghin currently provides services to 80 golf associations domestically and internationally, and provides billable handicaps to over 2. 3 million golfers.   each year the usga provides a variety of programs that benefit everyone who plays the game. The usga writes and interprets the rules of golf, and provides seminars and publications to educate golfers about the rules. The usga administers the rules of amateur status in the usa and mexico. The usga monitors equipment standards to ensure that skill rather than technology represents the essence of the game. The usga maintains national handicap and course rating systems to enable golfers of varying skill to compete fairly and equitably. Usga agronomists provide course consulting services to golf facilities throughout the united states and abroad for the purpose of advancing environmental and economic best management practices. The usga green section also provides speakers, on-line publications and on-line conferences to educate interested parties about environmental and agronomic issues affecting the game of golf, as well as the broader community. The usga provides grants to colleges and universities to finance turfgrass and environmental research to benefit golf courses and the environment. The usga supports grassroots golf programs for juniors, as well as accessible programs for physically challenged golfers. The usga provides education and information through public service announcements, championship webcasts, digital and social media platforms, publications, meetings and seminars. The usga supports local, state and regional golf associations in their local efforts and provides grants to these associations to fund internships to help administer their local programs. The usga maintains a museum dedicated to the game's history that serves as caretaker and steward of extensive historical collections.		
Mercy Center Corporation	http://	(732) 774-9397	EIN 22-2664472	1106 Main St	Asbury Park	NJ	07712	USA	Human Service Organizations, Human Services	Mercy center is a community			Outreach services to the mentally ill and support services for the working poor  education services for 50 elementary age students residing in an economincally disadvantaged environment and high school tuition aid to graduates of the elementary school.		
Echo Inc	http://		EIN 22-2042515	471 Parkway Ave	Trenton	NJ	08618	USA	Human Services, Senior Centers, Seniors	Activities for senior citizens			To provide activities for senior citizens non credit college courses exercise classes bible study crafts music classes social activities and trips		
Community Options, Inc.	http://www.comop.org	609-951-9900	EIN 22-2964056	16 Farber Rd	Princeton	NJ	08540	USA	Centers to Support the Independence of Specific Populations, Developmentally Disabled Centers, Disabilities	Community Options believes in the dignity of every person, and in the freedom of all people to experience the highest degree of self-determination. Embracing this philosophy, Community Options provides housing, support services and advocacy assistance to help empower people with disabilities.			Provides housing and other residential services to individuals with disabilities. The purpose is to empower persons with disabilities to live productive lives within the community.   provides employment counseling and support services to individuals with disabilities. The purpose is to increase the individual's self-esteem while enabling them to contribute to the community.		NJ, NY, PA, CT, SC, TN, KY, TX, NM
International Association Of Lions Clubs	http://		EIN 22-6080379	Po Box 72	Baptistown	NJ	08803	USA							
Wildlife Aid Inc.	http://	(609) 926-0182	EIN 22-2956892	155 Asbury Road	Egg Harbor Township	NJ	08234	USA					Organization supplies medical and other assistance toanimals in need		
YWCA of Trenton	http://www.ywcatrenton.org	609-396-8291	EIN 21-0635057	140 E Hanover St	Trenton	NJ	08608	USA	Human Services, Young Mens or Womens Associations	The mission of the YWCA is the elimination of racism and the empowerement of women.			The organization's programs are comprised of many activities, in efforts to draw together members who strive to create opportunities for women's growth, leadership and power in order to attain a common vision. The programs includes youth enrichment, summer camp, daycare and preschool, health and fitness, job placement, and latinas unidas.		
Smitten By Kittens	http://www.smittenbykittens.com	(888) 557-3106	EIN 16-1742160	Po Box 324	Morristown	NJ	07963	USA	Animal Protection & Welfare, Animals	Support and care of feral cat colonies in and arround morristown, nj.			Spaying & neutering programs: trap, neuter & release (79 cats)  animal protection & welfare programs: providing medical attention, shelter & food to feral cats (150 cats)  animal fostering: fostering program (6 cats)		
Bayonne Jewish Community Center	http://	(201) 436-6900	EIN 22-1500547	1050 Kennedy Blvd	Bayonne	NJ	07002	USA		Develop and conduct comprehensive programs for education and recreation,serve as a common meeting place,cooperate with other civic groups without regard to race,creed or color to further a democratic way of life for the community			Day care and nursery  youth and camping  adult services  health and physical education		
