Imamia Medics International Inc	http://www.imamiamed.org		EIN 22-3309208	Po Box 8209	Princeton	NJ	08543	USA	Philanthropy	Medical research & community awareness. Medical relief project in under-served regions. Physician education & training.			Imi administers, supports and oversees several medical clinics and projects throughout the global community by helping the existing and establishing new medical institutions and avenues of information and knowledge. Imi promotes global need for medical and humanatarian assistance in remote regions by hosting and attending international conferences and seminars.   imi administers and assists medical clinics globally and provides relief by providing needed medical support, medicine, equipment and by training physicians in the under-servied areas.		
Pet Adoption League Inc	http://		EIN 22-2467373	Po Box 206	Hackettstown	NJ	07840	USA	Animal Protection & Welfare, Animals						
Charity Kings	http://charitykingsinc.yolasite.com	8482050362	EIN 90-0582653	57 South Main St Ste 262	Neptune	NJ	07753	USA	Arts & Culture, Arts Education, Children & Youth, Education, Educational Services, Youth Community Service Clubs, Youth Development - Citizenship	Charity Kings Inc. Non- profit 501 (3) c organization was incorporated in the State of New Jersey on September 13, 2010 and founded by Darryl Hammary. Our main goal is to support academic excellence, stay in school initiatives, family values and to promote a positive community environment. Our focus has expanded from the children of Asbury Park, Long Branch, Neptune and Red Bank, to other areas of NJ.  Charity Kings is committed to promoting a better community by supporting and empowering families that may be in need, to achieve in life. We make it a priority to focus on our youth by offering academic support, enhancing family values by offering organized family-focused events, and promoting a positive community environment for them to thrive in.   Charity Kings is committed to the public school system, determining students needs and establishing relationships with local businesses, social service agencies, health care providers, parents and volunteer organizations to provide needed resources. We are hoping to eventually open our own youth recreational cultural center.	Community Involvement, Parent Participation, Youth	Children and families in need, education	Wish Upon A prom ,tutoring, mentoring, women empowerment, anti bullying,	1200 children and families	Monmouth county NJ
Make Some Noise: Cure Kids Cancer Foundation, Inc.	http://www.makenoise4kids.org	973-656-1111	EIN 27-0996732	PO Box 9210	Morristown	NJ	07932-9210	USA	Health, Pediatrics Research, Philanthropy	The Make Some Noise: Cure Kids Cancer Foundation was established by a child with cancer with one purpose in mind: to fund pediatric cancer research. To that end, the foundation serves as a vehicle to secure private funding to distribute to research facilities and promote awareness through its fund raising activities. The designation of funds to various research facilities is cancer specific and based on the foundation's annual evaluation of the latest research.	Through the generosity of donors like you, we have funded research at several of the 120 different research facilities for childhood cancer around the country, including: Baylor/Texas Childrens Cancer Canter, (Baylor/TCCC) Childrens Hospital of Philadelphia, (CHOP) Childrens Medical Center Dallas Colorado Children's Cornell-Weill Dana-Farber Cancer Institute Georgetown/Lombardi Seattle Childrens  Some Media Links: The Quilter Magazine, Feature Article, June/July 2013: http://www.thequiltermag.com/issues/2013/161/makesomenoise_article.pdf  Chicago  Aug 2014: ABC7: http://abc7chicago.com/society/national-angel-quilt-visits-chicago-area/228269/   Harrisburg July 2014: FOX 43: http://fox43.com/2014/07/10/national-angel-quilt-for-childhood-cancer/#axzz374UBaYKG   Denver - March 2012: ABC 7 Denver: http://www.thedenverchannel.com/news/30708778/detail.html NBC 9 Denver: http://www.9news.com/news/article/256496/222/Make-some-noise-and-cure-cancer   Seattle  April 2012: King 5 Seattle: New Day NW talk show in Seattle, April 2012:  http://www.king5.com/new-day-northwest/Make-Some-Noise-Cure-Kids-Cancer-147796085.html  NBC/King 5 Making a Difference interview: http://www.king5.com/video/featured-videos/Teenage-boy-travels-148188495.html    Rochester NY - Aug 2012:  YNN News: http://rochester.twcnews.com/content/search/594815/national-angel-quilt-begins-coast-to-coast-tour/  Troy Times, July 16, 2013: http://www.candgnews.com/news/quilt-honoring-kids-lost-cancer-stops-oakland-mall  Charlotte, NC: ABC WSOC, Aug 2013: http://m.wsoctv.com/news/news/local/national-angel-quilt-honors-charlotte-area-who-die/nZPBK/    Tulsa: NBC Channel 2 Live, July 2013 http://www.kjrh.com/dpp/news/local_news/15-year-old-begins-national-angel-quilt-raises-awareness-and-money-for-kids-cancer-research  Kansas City: NBC KSHB Channel 41: Action News with reporter, Fernando Ochoa July 2013 http://www.kshb.com/dpp/news/local_news/angel-quilt-makes-stop-at-union-station-raises-money-for-pediatric-cancer-research	fund vital cure research for childhood cancers.	The National Angel Quilt features images, names and ages of children who have lost their battles with cancer; These beautiful children may have lost the cancer battle, but all are the most inspiring heroes and have earned their angel wings. The National Angel Quilt honors these angles of pediatric cancer, and we are very excited to bring Pediatric Cancer Awareness to the country in such a beautiful and meaningful way; The National tour began during pediatric cancer awareness month in September 2011, and will continue to grow and tour until the cures are found and there are no more angels to add to the quilt.	Research Investigators in the field of Pediatric Oncology.	Nation wide
The Evergreens	http://www.evergreens.org	(856) 439-2030	EIN 21-0634485	309 Bridgeboro Rd	Moorestown	NJ	08057	USA	Human Services, Seniors, Supportive Housing for Older Adults	In the spirit of its episcopal tradition, it is the evergreens' mission to enhance the individual, social, emotional, spiritual and physical well-being of its diverse community.			Expenses incurred in providing a full continuum of services to elderly individuals including but not limited to residence, dietary, intellectual stimulation and activity, and health care. Organization's community benefit statement - in 1919, the evergreens was founded in bound brook, n. J. As a nonprofit retirement home through a generous gift to the episcopal diocese of new jersey by the henry lamonte family - a home on a five-acre site that accommodated 15 residents. When the evergreens moved to moorestown in 1949, the community expanded services to include long-term nursing care. The new facility consisted of 32 acres and a large home, now known as matthews hall, which remains at the center of the community's campus. This home was built in the 1920s for the johnson family, founders of the victor talking machine company, the predecessor of rca. The new facility provided rooms for 20 residents and an eight-bed infirmary. Through the years, buildings have been added, upgraded and expanded throughout campus to make the evergreens the community it is today. In 1990, the evergreens became an independent entity; however, it continued to maintain a chapel affiliated with the episcopal diocese of new jersey. In the same year, the community's tradition of delivering quality care progressed to yet another logical level of growth - offering active older adults an independent lifestyle through the construction of 200 independent living units (ilus) and officially becoming a continuing care retirement community (ccrc). The evergreens' campus continues to evolve and grow through the community's campus renewal project. Culminating years of strategic planning, this project calls for a multi-phase construction and renovation project - which began with the completion of the renovations to the community's kitchen/dining areas in 2010 and continued in 2012 with the grand opening of a new, state-of-the-art health care center. In 2014, the renovations commenced to update the community's ilu corridors - two floors have been finished, and the balance of work on the remaining hallways is due to be completed soon. Future plans, as outlined under the campus renewal project, include upgrades to the community's independent living common areas and recreational activities/services spaces. The evergreens strives to provide the highest quality service and care to residents, ensuring that residents can enjoy their individual lifestyles with dignity and respect in the most gracious of environments. With three lifestyle choices within one community - independent living, assisted living and skilled nursing care - residents at the evergreens are secure in the knowledge that they will receive quality health care, regardless of their changing needs. The evergreens works hard to provide the highest quality of care to its residents and has achieved this distinction consistently year after year. The community prides itself on being accredited by the commission on accreditation of rehabilitation facilities/ continuing care accreditation commission (carf-ccac), an honor held by a limited number of the nation's top ccrc's. In 2012, the evergreens was reaccredited for five years. Likewise, the community has been recognized numerous times by consumer reports in its nursing home monitor list. The community has also continued to maintain the highest possible rating - "five stars" - from the federal centers for medicare & medicaid services for the past six years, placing the community on the cms "honor roll" list. Among other awards and recognition, the evergreens has been named a best nursing home by u. S. News & world report and one of the best of burlington county by the burlington county times, both for multiple years. Additionally, the evergreens received a gold award from national mature media in 2014 for marketing direct mail design and was recognized as one of sj magazine's best of south jersey readers poll honorees in 2014.		
Autism New Jersey Inc	http://autismnj.org	(609) 588-8200	EIN 22-2129739	500 Horizon Dr Ste 530	Robbinsville	NJ	08691	USA	Autism, Disabilities, Health	Autism new jersey is a nonprofit agency committed to ensuring safe and fulfilling lives for individuals with autism, their families, and the professionals who support them. Through awareness, credible information, education, and public policy initiatives, autism new jersey leads the way to lifelong individualized services provided with skill and compassion. We recognize the autism community's many contributions to society and work to enhance their resilience, abilities and quality of life.			Autism new jersey provides information referral and advocacy, conferences, outreach, and clinical advocacy services for autistic children and adults throughout new jersey. In addition to state government grant revenues 463,502, program expenses are funded by a combination of donations from the public, autism new jersey membership fees and net revenues from fund raising events.		
Martin Luther King Youth Center Inc	http://	(908) 526-3688	EIN 22-2043677	1289 Prince Rodgers	Bridgewater	NJ	08807	USA	Children & Youth, Youth Centers & Clubs	The martin luther king youth center, inc. Is a not-for-profit organization that provides safe, affordable and educationally-oriented after-school and summer school child care services to children who live in bridgewater, new jersey and surrounding communities. The center serves students from all ethnic backgrounds from ages five through thirteen, and furnishes transportation, certified instruction and nutritious meals to its program participants.			The martin luther king youth center, inc. Is a not-for-profit organization that provides safe, affordable and educationally-oriented after-school and summer school child care services to children who live in bridgewater, new jersey and surrounding communities. The center serves students from all ethnic backgrounds from ages five through thirteen, and furnishes transportation, certified instruction and nutritious meals to its program participants.		
EL PRIMER PASO LTD	http://	(973) 361-0880	EIN 22-2124259	29 Segur St	Dover	NJ	07801	USA	Adult Education, Education	The mission of el primer paso ltd is to serve the community by providing high quality pre-school programs for dual language learners; provide affordable childcare for working dual language families; as well as provide adult english language education.			Provided high quality pre-school programs for dual language children  provided training, monitoring, and referral services for family day care providers.   provided adult esl education - english as a second language - speaking, writing and reading basic skills		
The Good People Fund	http://www.goodpeoplefund.org	973-761-0580	EIN 26-1887249	384 Wyoming Ave	Millburn	NJ	07041	USA	Human Services, International, International Development, Personal Social Services, Philanthropy	The Good People Fund searches for and supports people who work quietly and diligently, often below the radar screen and with shoe-string budgets, to better our world in untold numbers of ways. It is to these people, small entities or individuals whose efforts dont benefit from glossy brochures or promotions, or help from adequate staff or large organizational structures, that we direct our attention. Their success is our mission  by making them and their work visible and viable to others who will provide needed funding through tzedakah that is given in a cost-effective and meaningful way.			The good people fund was formed for charitable and educational purposes, providing both financial and operational support to small grass-roots programs in the united states and in israel. These programs are devoted to serving others in need. The good people fund assists programs to become sustainable and independent, and to advise individuals, students, teachers and donees ways to improve and maximize the use of financial and other resources and how to utilize other peoples talents on behalf of repairing the world.   provides charitable and educational assistance to those that better our world in numerous ways by providing both financial and operational support to small, low-overhead grass-roots programs and organizations that generally "fly below the radar screen" who are devoted to serving others in need in both the united states and israel. Common to all is the presence of an individual or small group who have recognized a problem and have dedicated themselves to resolving it.		US and Israel
Samaritan Healthcare & Hospice Inc	http://www.samaritanhealthcarenj.org	(856) 596-1600	EIN 22-2344036	5 Eves Dr Ste 300	Marlton	NJ	08053	USA	Counseling, Health, Health Care, Home Health Care, Mental Health	Samaritan is the preeminent provider of hospice and palliative (comfort) care, grief support, education, advocacy, and other life-enhancing services. We provide unparalleled services with respect, dignity and compassion for all people affected by serious, progressive illness or grief, contributing to the health and well-being of our patients, their families and our community. Guided by a deep sense of commitment and the ethic of human service, we provide care that is both life-giving and live-receiving through the incorporation of the philosophy, art and science of caring. Samaritan is an independent not-for-profit, non-sectarian organization serving people in atlantic, burlington, camden, gloucester and mercer counties who are coping with serious illness or grief.			Home/community care - people confronting a serious progressive illness are often plunged into unfamiliar, confusing and stressful situations. Spouses, adult children, and other caregivers are suddenly faced with medical decisions and financial and legal responsibilities for which they are often untrained and unprepared. These stresses can deprive them of the one thing they need most: time together. Samaritan home/community hospice care helps people find the time they need to focus on what's most important at this stage of life: the friends and family they want to be with, the feelings they want to share, and the words they need to say. The goal of samaritan's care is not to cure the disease, but to control its effects so that patients can spend their last days with dignity in the place where they live (home, assisted living or nursing home) and remain as comfortable, alert and pain-free as possible. Considered the compassionate model for people facing life-limiting illness or injury, the hospice philosophy offers a team-oriented approach to expert medical care, pain management, and emotional and spiritual support expressly tailored to each patient's and family's needs and family needs and wishes.   inpatient - the samaritan inpatient hospice center provides the comfort of short-term continuous samaritan care in a home-like setting for paitents whose pain, symptoms and special needs require a more acute level of hospice care than is recommended within the home. While in the inpatient center, you and your loved one will receive from samaritan staff the same services that you would in a home setting - plus the more acute 24-hour care your loved one now requires. The center's welcoming environment encourages families and friends to feel "at home" while spending quality time - whenever and for as long as they wish. Family members of all ages may visit 24 hours a day; family pets are welcome by appointment. A sleeper recliner in each bedroom allows a family member to spend the night at bedside comfortably.   as stated in samaritan's mission summary and our respective exempt purpose achievements, an important part of our comprehensive service to our community is the compassionate support for the grief that our patients and families experience. Samaritan provides such support on a regular basis through its center for grief support, where we provide bereavement, counseling, crisis intervention/debriefing, support groups and community outreach programs - all offering hope for tomorrow for those grieving today. Samaritan similarly serves the community through its transitions program, which serves community members who are coping with life-changes caused by their advanced illness but who are not yet ready for hospice care.		
Mary Queen of All Nations Missionary Alliance	http://www.maryqueenofallnations.org	973-361-5824  	EIN 22-2598337	8 Reservoir Ave	Dover	NJ	07801	USA	Disaster Aid, Education, Human Services, International, International Development, Public Safety, Disaster Preparedness & Relief	1. Support the poor and needy in the world thru established missionaries, e.g. Helping rebuild lives in disaster areas like the Philippine typhoon. Help them improve nutrition, sanitation, shelter, medications, etc. 2. Help the poor and needy stand on their feet thru self-sufficiency projects, e.g. Animal raising like pigs, goats, etc. Income producing such as sewing, carpentry, agriculture, etc. 3. Provide educational support to rise above poverty. 4. 100% of donations used for the poor. No salaries taken. Administration and operational expenses shouldered.	In 29 years, in several countries in Asia, South America, Africa, India, we have provided EDUCATION to thousands of seminarians and secular students who are now ordained priests serving the Church in various capacities and secular students who have graduated in their chosen careers, now have jobs that supports their families, and able to help siblings go to school and some were blessed to be able to go abroad. Hundreds of villages, communities, parishes, families and individuals are able to rise above poverty, now living a decent, better lives because of the self-sufficiency projects we provided to them, raising pigs, goats, buffaloes, lambs, cows, sheep, chickens, sewing machines, agricultural - electrical -  carpentry tools, etc.  Water tanks and land for agriculture helps the coffee plantation that supports the orphans. The Water Mineral Sheds provided the people with clean water. Water pumps provided water for drinking as well as for irrigation. Chapels, churches, grottos built provided house of worship for the people who otherwise have no place to worship. Toilet facilities provided to schools, parishes and families for sanitation and healthy living. Medical and emergency assistance provided to those victims of disasters such as floods, typhoons, earthquakes. School supplies, basic necessities such as nonperishable food, soaps, toothbrushes, etc. have been provided to hundreds of families. Rice Subsidy provided to hundreds of families. Prison Ministry to hundred of prisons, jails and rehabilitation centers. Help to orphanages and homes for the aged were also provided. Medical equipments, chairs, cabinets, medicines, provided to medical dispensaries in rural areas. Many other assistance provided as well, too numerous to mention here.   At the present, in the aftermath of typhoon Haiyan/Yolanda in the Philippines, we are assisting hundreds of families with food, water and basic necessities. We are also helping rebuild the houses, convents and schools that had been destroyed.	the poorest of the poor rise above poverty, have better housing, better education, better health and be able to stand on their own and support their own families	education to both religious and secular students, self-sufficiency projects such as rearing of animals like pigs, goats, rams, sheep, buffaloes, cows, chickens. etc. Transportation projects such as tricycle vans, motorcycles and boats. Self-sufficiency projects such as sewing machines, agricultural tools, knitting machines, carpentry tools. We provide them with housing, medical needs, sanitation by providing them with toilets, emergency funds, beds and bed sheets, tables and chairs, medical equipments to Medical Dispensaries, land and water tanks for irrigation for coffee plantations to support orphans, etc. We help built and/or repair houses, chapels, churches, water mineral sheds. We provide water by providing water pumps and water tanks. We have provided a generator that provided electricity for the whole village. We have sent packages containing basic necessities such as clothing, non-perishable food, soaps, toothpaste,etc, and many more projects too numerous to mention them all.		
Partners in Torah	http://www.partnersintorah.org	(973) 221-3650	EIN 27-0000414	228 Aycrigg Avenue	Passaic	NJ	07055	USA		Partners in Torahs signature phone-study program offers Jewish adults of all backgrounds across North America a cost-free learning opportunity to discover Judaismits culture, history, and traditionsat their pace and their schedule. Jewish men and women with an interest in acquiring specific skills (ex: Hebrew reading or Talmud) or in building their Jewish knowledge, are matched, one-to-one, with a carefully selected personal Torah trainer or mentor, for up to an hour-per-week of over-the-phone study and discussion. Participants can choose any topic, including Hebrew, Jewish philosophy, historyor a subject of their choosing. Several different programs include www.PartnersInTorah.org  | www.KoheletFellowships.com | www.MyKaddish.com  | www.Jewpiter.com					National
Spring Reins of Life Inc.	http://www.SpringReinsofLife.org	917-275-7765 (SR	EIN 45-2531926	PO Box 5311	Clinton	NJ	08809	USA		To provide a safe, healing and empowered path to peace, positive growth and self-guided recovery for those suffering trauma and loss with the assistance of horses as our guides.  Spring Reins of Life is dedicated to promoting psychological healing, emotional well-being and personal growth using the skills of mental health professionals and the assistance of horses.  For thousands of years there has been a unique bond between humans and horses, it is our mission to enhance and leverage this bond to reach those individuals who are suffering from the effects of trauma, loss, drug addiction and/or the combined stressors and obstacles set forth by either circumstance or societal confines.  Spring Reins of Life is an EAGALA Model certified program which provides EAP and EAL services to at risk / high risk youth, military veterans with PTS/TBI and their families, bereaved children and addiction recovery.  All of our services are provided for no cost or very low cost based on public and private tax deductible donations awarded to our programming.		At Risk / High Risk Teens, PSTD Veterans and Families and Children in Bereavment	EAP (equine assisted psychotherapy) under the international EAGALA Model. Spring Reins of Life is the first program in NJ to earn the "EAGALA Military Services Provider Certification" and also was just awarded a pilot contract from the state to work with the NJJJC. Ground based interactions with horses with the guidance of certified and licensed mental health professionals can provide an alternative and experiential (solution focused) way to resiliency in trauma without having to "talk about it".	180 PTSD hospitalized veterans with PTSD, 58 at risk teens from New Jersey, and 15 young children who are grieving a loss in their life. We have interest to do much more but seek the funding to continue and expand this work.	Central New Jersey
Loving Grace Ministries Inc	http://www.lovinggrace.org	(973) 729-6203	EIN 52-1160024	6 Marian Rd	Sparta	NJ	07871	USA	Protestant, Religion	Religious teachings & ministries			Religious teachings, tapes, literature, compact discs, religious seminars, retreats, pilgrimages and media ministries		
