Medshadow Foundation	http://medshadow.org	(212) 362-1257	EIN 46-1326364	178 Columbus Ave. #237182	New York	NY	10023	USA	Health, Public Health	Prescription drugs are a part of everyday life for millions of Americans who spent in excess of $329 billion on these medicines in 2013, an increase of 3.2% over the previous year. The pharmaceutical industry spent $3.8 billion in marketing these medications to doctors and consumers. Do they have short or long term side effects? Are there alternative solutions that may be just as effective with lower risk?  Guided by a passion to educate and encourage patients to pro-actively inquire about the short and long term side effects of prescription medications before accepting them, MedShadow Foundation seeks to prompt discussion between patient and health care provider. This includes asking deeper questions of the physician or pharmacist, looking at the pros and cons of prescription drugs, and if appropriate, exploring other options. We encourage our readers to avoid blind acceptance of prescription drugs and become an engaged advocate in their own health and wellbeing.  In 2014 MedShadow Foundation Inc. acquired DES Action USA, a nonprofit advocacy organization that provides information and educational resources to individuals exposed to the harmful drug diethylstilbestrol (DES). DES Action has been the leading advocacy, education and support organization for all who have been affected by DES exposure since 1979. To find our more information about DES, please visit DESAction.org  MedShadow Foundation uses its website and various social media platforms to gather and post timely articles and news about medical conditions, side effects and alternative therapies. While we recognize that medications save lives and that many are absolutely necessary in treating chronic illness and in managing life-and-death situations, we also know that some are over prescribed and that accurate and complete information on side effects is severely lacking. Long-term effects are not studied before FDA approval. We hope to help fill this information void and encourage patients to do a risk/benefit analysis of the medications they are prescribed.  The MedShadow Foundation team consists of concerned consumers and parents, not medical professionals. Please do not substitute what is said on the MedShadow website for what is advised by your doctor or health care provider, particularly when dealing with serious medical issues. Please share your stories and concerns, and let us know about your experiences and victories by posting comments on our stories or sending us notes via our contact page.  An independent 501c3 charitable organization, MedShadow does not accept advertising or contributions from pharmaceutical companies, health insurance companies, medical device manufacturers or political action organizations.		prompt discussion between patient and health care provider to pro-actively inquire about the short and long term side effects of prescription medications before accepting them	over 30,000 readers monthly	consumer education and advocacy	our website and various social media platforms to gather and post timely articles and news about medical conditions, side effects and alternative therapies.			
Palante Harlem Inc	http://www.palanteharlem.org	212 491 2541	EIN 80-0209989	470 West 126 Street	New York	NY	10027	USA	Homeless & Housing	To reduce poverty and advocate for safe housing by organizing, educating and empowering residents. We are committed to supporting each other and to preserving our quality of life, our health, and our personal safety by assisting tenants when their rights have been violated and by holding unresponsive landlords and building managers accountable.	Rent Refunds to Tenants: $2.9 Million Legal Assistance: 694 Families Pro-Bono Legal Representation: 252 Families Rents Frozen at Individual Apartments: 462 Apartments Secured Succession Rights in City-Owned Buildings: 1,525 Families	Housing	2000+	New York City	Tenant Organizing, Leadership Development, Mediation and Legal Services			
Natural Resources Defense Council Inc	http://www.nrdc.org	(212) 727-2700	EIN 13-2654926	40 West 20th Street	New York	NY	10011	USA	Environment, Natural Resources Conservation & Protection	The natural resources defense council, inc. (nrdc) is an international environmental organization dedicated to protecting the world's natural resources and ensuring a safe and healthy environment for all people. We work to restore the integrity of the elements that sustain life-air, land, and water-and to defend endangered species. We work to foster the fundamental right of all people to have a voice in decisions that affect their environment and seek to alleviate the disproportionate environmental burdens borne by people of color and others who face social or economic inequities. Ultimately, we strive to help create a way of life for humankind that can be sustained indefinitely without fouling or depleting the resources that support all life on earth.					See schedule o for a detailed description of all of nrdc's various environmental programs.			
Emma Alyson & Kate Hance Family Foundation Inc	http://www.hancefamilyfoundation.org	(516) 688-0055	EIN 27-0752188	PO Box 20795	Floral Park	NY	11002	USA	Philanthropy, Public Foundations	To help enhance and develop the confidence and self-esteem of all children, and providing innovative educational programs for children of all ages and abilities, and supports local schools and children's organizations, runs a large toy drive during the holidays, and delivers school supplies to families in need.		ensure healthy, happy, and safe children through innovative self-esteem educational programming and the support of children in need.	3,500 girls develop higher self-esteem and over 4,000 children through our other programs.	New York mainly, but have travled nationally and internationally	Beautiful Me... The Emma, Alyson, and Katie Hance Project, a self-esteem program designed to educate females by promoting appreciation for their genuine qualities, accurate self awareness, and the satisfaction of helping others.			
Dor Chadash USA, Inc.	http://www.DorChadashUSA.org	212-696-2151	EIN 20-3113544	165 East 56th St	New York	NY	10022	USA	International, Promotion of International Understanding	Dor Chadash is a national organization based in New York that inspires a new generation of Israeli and American Jews to make meaningful connections to Israel and with each other.  Through cutting-edge, Israel-centric programming in New York and Los Angeles, Dor Chadash is positively changing the way young Israelis and American Jews interact together.	Dor Chadash has built a network of 14,000 people living in the New York City area and produces 40 innovative, Israel-centric events a year. Dor Chadash is also proud to have recently opened its doors in Los Angeles where DC-LA now produces the highest quality Israel-programming in Southern California.				To connect the israeli and american jewish experiences through forging a community across continents. To bridge between israeli and american jews who share a mutual passion for israel.			
Lady's Legacy Equine Rescue	http://www.ladyslegacy.org		EIN 47-2241652	22 Utter Drive	Poughquag	NY	12570	USA	Animal Protection & Welfare, Animals	Our mission is to rescue, rehabilitate and rehome, abused, neglected and slaughter-bound horses. We also provide sanctuary to those horses that are deemed too old, too sick or unfit for adoption.	Since October 2014 we have rescued over a dozen horses and some have found their forever homes, some remain permanent residents and others await their forever family's arrival.	rescue abused, neglected and slaughter-bound horses.	Many horses who otherwise would have been shipped to slaughter	The Northeast	Rescue, rehabilitating and rehoming.			
Bunkers in Baghdad	http://bunkersinbaghdad.com		EIN 26-2583317	665 Main St Ste 400	Buffalo	NY	14203	USA	International, International, Foreign Affairs & National Security			troops and veterans	troops in over 1,000 units stationed around the world	Buffalo, NY and cities across the US	collecting and shipping donated golf balls and clubs to troops deployed around the world.  We also supply golf equipment to Wounded Warrior and VA programs in each of the 50 states.			
Nazareth Housing, Inc.	http://www.NazarethHousingNYC.org	212-777-1010	EIN 13-3176952	519 E 11th St	New York	NY	10009	USA	Homeless & Housing, Homeless Shelters, Housing Development, Construction & Management, Housing Expense Reduction Support	Nazareth Housing is committed to the promotion of housing stability and economic independence among low income families and individuals of New York City, through the provision of:	1. In June of 2008, Nazareth Housing was recognized by the NYC Department of Homeless Services as the best family shelter provider for a shelter under 100 beds and has been rated in the top 10 family shelter providers for NYC since 2006. Currently we provide 13 units of transitional and 40 of permanent housing, as well as extensive homelessness prevention programming and case work. Currently, Nazareth Housing is placing 220% of our goals of families from shelter into permanent housing. These families receive follow up services for 2 years. This intensive case management model has resulted in recidivism to homelessness of less than 5% since 2006.   The success of our work with homeless families has led the City Department of Homeless Services to ask us to increase our shelter provision and expand services in 2010. We anticipate adding 34 to 60 units of transitional shelter in 2010 to provide transitional housing for 170 adults and children.  2. Of the 1600 families that sought our assistance to retain and stabilize their housing, only one family needed to enter the shelter system. 65 families received direct financial assistance to retain housing and 40 received assistance to maintain their utilities. The remaining households received financial counseling, free tax filing, landlord  advocacy, case management and referrals for legal, medical and other services not directly provided by our agency.  160 households received free furniture and household items in the past 12 months  5. In 2009 we provided 732 Fillings  (32 over our goal of 700)                                                                                     Average return per filer  $1,844  Total Refunds: $751,251  Average EITC (Earned Income Tax Credit) per filer: $1,479                                                                                         174 customers received medium touch financial coaching (e.g. opening a interest bearing bond, savings account, etc) (104 over our goal of 70)	prevent and end homelessness for low income families, seniors, and individuals	6,723 individuals through intensive case management, urgent needs assistance, financial literacy, and educational workshops.	New York City	Nazareth housing promotes housing stability and economic independence among poor families and youth of new york city by providing, supportive and affordable housing, emergency family shelter and homelessness prevention services. Emergency shelter housing provides temporary shelter to homeless families with dependent children in units in the lower east side and harlem. It includes a broad array of supportive services for all family members including case management, financial strengthening and personal development programs. Homelessness prevention strives to keep households from losing housing, build economic resources and remain stably housed. Prevention includes arrears assistance, furniture, food and urgent needs assistance.			
PowerPlay NYC, Inc.	http://www.powerplaynyc.org	212-300-8061	EIN 13-4045021	42 Broadway, 20th Floor	New York	NY	10001	USA	Amateur Sports, Sports	Educating and empowering girls through sports, teaching life skills and fostering self-confidence and self-esteem for life!					STARS (Sports Training And Role models for Success) Programs  STARS Series  a physical activity and healthy living program providing elementary and middle school girls with (i) opportunities to learn sports skills and be physically active, (ii) encouragement and support from female coaches, (iii) multiple opportunities to learn teamwork, (iv) health and wellness learning activities, and (v) a safe space for discussion and expression.  Rising STARS Program  a six-week summer program providing middle school girls the opportunity to (i) to play sports and be physically active, (ii) learn important life skills, (iii) participate in healthy living activities, (iv) connect with female role models and mentors, and (v) develop their confidence and self-esteem.  SuperSTARS Leadership Academy  an intensive 8-week summer program providing high school girls with opportunities to (i) participate in a variety of sports, (ii) develop workplace and life skills for success; (iii) interact with women in a variety of careers; (iv) engage in health and wellness learning, (v) explore the college admissions process; and (vi) participate in STARWorks mini-internships.  SuperSTARS Symposium a one day event providing high school girls with the opportunity to participate in sport clinics and connect with successful women who share their life lessons.			
MATAN, Inc.	http://www.matankids.org	866-410-5600	EIN 13-4174834	333 Mamaroneck Avenue #342	White Plains	NY	10605	USA	Education, Ethnic &  Immigrant Centers, Immigration, Primary & Elementary Schools, Special Education	Matan supports Jewish communities, professionals, and institutions in educating children with special learning needs.  Matan is committed to exposing all children to the wonder of Jewish life and fostering literate and engaged Jews through creative and multi-sensory approaches.  By strengthening the capacity of Jewish institutions to support and sustain more educationally varied programs, Matan is expanding the Jewish communitys ability to fulfill the obligation to include all children  not just typical learners - in their Jewish educational birthright.				New York tri-state area	Provide support to teachers, families, and children that require special educational requirements, including severe developmental disabilities.			
The Terry Farrell Firefighters Scholarship Fund Inc	http://www.terryfund.org/	(516) 840-8839	EIN 56-2512213	1912 Wantagh Ave	Wantagh	NY	11793	USA	Disaster Aid, Education, Philanthropy, Scholarships, Scholarships & Student Financial Aid	we are the only fund avaialble to firefighters to assist the firefighter and family for reasons not covered during the course of employment or membership within a volunteer organization					Special grants were awarded to various fire departments throught the county. Equipment grants: requests for assistance with the purchase of fire service equipment, apparatus, protective clothing or tools may be made to the fund by fire departments on department letterhead and signed by the chief of the requesting department. The amount of each grant award is at the sole discretion of the board of directors and requires a majority of the vote eligible members. Emergency response team: the fund is staffed by firefighters and trained first responders who assist and respond to natural disasters such as floods, hurricanes and tornedos wherever they may occur. The fund has responded to hurricanes as far south as alabama and more recently had crews continually working for months during the recovery efforts of hurricane (superstorm) sandy.   special grants were made to firefighters and their families throught the country. Scholarships: are awarded to children of firefighters who attend vocational or parochial school. Upon submission of a written application detailing their parents duty status within the fire service, the age of the student, the grade entering in fall of coming school year and contact information, scholarships are awarded pursuant to a lottery drawing held at the office of the fund on the first sunday in august of each scholarship year. Scholarship amounts are made at the sole discretion of the board of directors. Medical emergency grants: in the event a firefighter or member of firefighter's family becomes ill, disabled or incapacitated, the fund, upon written request from the firefighter or firefighter's family member and supported by medical documentation, affect a financial grant to assist the requesting fire service member. Such grant amounts are the sole discretion of the board of directors and require a majority of voting members to approve.   training grants and recruitment grants: the fund assists fire departments and communities upon request with first responder and emergency training grants for those areas that do not have the financial resources to properly train their first responders. The fund also gives assistance to fire department to use for recruitment of membership within their community.			
Kathleen F Marks Memorial Foundation	http://www.KFMFoundation.Org		EIN 80-0767271	PO Box 802	Glenham	NY	12527	USA	Cancer, Philanthropy, Public Foundations	The Kathleen F. Marks Memorial Foundation Is a 501 c(3) Not for profit Public Charity. Our ultimate Goal is to help find a cure, and to help patients and their families in the process of reaching that goal Fundraise for cancer research, testing, trials, and vaccines.  Our Fundraising events will benefit facilities in active cancer research,In areas that are in NEED of the funding. We are not diagnosis specific, we hate all cancer equally!  Having fun and Making a difference all at the same time!  "Have a Hoot giving Cancer the Boot!"	We have spent a lot of time out at community events, getting to know the people in the community and recently Joined the local chamber , The hudson Valley Gateway Chamber Of commerce. Now that we are 501 c3 approved and registered in the NYS Charities database, Our first Annual Halloween Masquerade Ball and KFM Trick or Treat were able to raise $4000.00 which was donated to Pediatric AML research at Johns Hopkins Comprehensive Cancer Center.	Patients undergoing cancer treatment		Hudson Valley, NY	Fundraising events for research, Patient support fundraising, for patients in treatment.			
On Point For College Inc	http://onpointforcollege.org	(315) 362-5003	EIN 16-1569356	1654 W Onondaga St	Syracuse	NY	13204	USA	Education, Scholarships, Scholarships & Student Financial Aid	The purpose of on point for college, inc. Is to enroll low income, first generation youth in college through fostering their opportunity to attend college; facilitating their application process,sustaining their continued matriculation in college and helping them to transition to the work force after college graduation.					The purpose of on point for college, inc. Is to enroll low income, first generation youth in college through fostering their opportunity to attend college, facilitating their application process and sustaining their continued matriculation in college.			
St. George Theatre Restoration, Inc.	http://stgeorgetheatre.com	718-442-2900	EIN 20-0985637	35 Hyatt Street	Staten Island	NY	10301	USA	Arts & Culture, Arts Education, Dance, Performing Arts Centers	The St. George Theatre Restoration, Inc. (formerly the Richmond Dance Ensemble, Inc.) is absolutely committed to providing an authentic theatre experience for everyone. Originally formed to oversee the restoration of this historic theatre and to develop the theatre as a multi-purpose performance arts facility, the theatre also strives to promote programming that serves people of all ages, with & without disabilities; reflects the ethnic & cultural diversity of its audiences, and serves as an informational resource. It manages a performing arts series that features national tours and regional theatrical companies; arts education programs for students in grades Pre K - 12; hosts activities & events for other community-based nonprofit groups and connects local artists to audiences. The theatres summer arts & literacy program provides free dance training for children ages 9 - 18 from socially and/or economically challenged homes. Its popular ticket subsidy program operates in concert with social service agencies to offer under-served groups and individuals an opportunity to experience live theatre regardless of their ability to pay.	The popular appeal of its programs succeeds in getting people into the theatre, not just from Staten Island and the tri-state area but also from around the world.	The St. George Theatre Restoration, Inc. is committed to cultivating and nurturing the widest possible audience for the arts.	Approximately 83,000		Ticket Subsidy Program Summer Arts & Literacy Program			
Friends of Ninos de Guatemala	http://www.ninosdeguatemala.org	(917) 613-4819	EIN 45-5253062	16 West 77th Street No 11e	New York	NY	10024	USA	International, International Relief	NDG is a Dutch-Guatemalan nonprofit working to break the cycle of poverty in Guatemala by providing quality education to those who need it most.		Communities in poverty with little access to education	431 students	Antigua, Guatemala	Elementary and Middle school education, Nutrition and Health services, Psychological and Social work programs, Community services			
Orangutan Outreach Inc	http://www.redapes.org		EIN 26-0521285	419 Lafayette Street	New York	NY	10021	USA	Animal Protection & Welfare, Animals, Protection of Endangered Species, Wildlife Preservation & Protection, Wildlife Sanctuaries	To raise and promote public awareness of, and participate in, conservation strategies for orangutans through grassroots compaigns, community involvement and global communication.					To raise and promote public awareness of, and participation in, conservation strategies for orangutans through grassroots campaigns, community involvement and global communication.   to raise and promote public awareness of, and participation in, conservation strategies for orangutans through grassroots campaigns, community involvement and global communication.			
WhyHunger	http://www.whyhunger.org/	(212) 629-8850	EIN 13-2805575	505 Eighth Ave Suite 2100	New York	NY	10018	USA	Federated Giving Programs, Philanthropy, Unknown	WhyHunger is a leader in building the movement to end hunger and poverty by connecting people to nutritious, affordable food and by supporting grassroots solutions that inspire self-reliance and community empowerment.	Since it was founded in 1975 by the late Harry Chapin and current Executive Director Bill Ayres, WhyHunger has:  *Referred hundreds of thousands of people in need to emergency food assistance, government programs and local community-based organizations through the National Hunger Hotline.    *Recognized over 150 outstanding community-based organizations fighting hunger and poverty across the United States through the Harry Chapin Self-Reliance Awards.     *Organized numerous lectures, workshops and tours for farmers, activists and educators from across the world to share their experiences, techniques and successes with their US-based colleagues through the Global Movements program.  *Educated 1/2 million people per year on community food security issues, including community food assessment, community gardens, community supported agriculture, farm to cafeteria programs, food policy councils, land use planning, local & regional food systems, domestic hunger & federal food programs, migrant & seasonal farmworkers, nutrition and rural poverty.  *Raised over $10 million for grassroots organizations throughout the United States through Artists Against Hunger & Poverty.			USA & Beyond	The global movements program - works through international and u. S. Civil society networks to link whyhunger's domestic work on hunger and poverty to global movements for food sovereignty and the basic rights to food, land, water, and sustainable livelihoods for all people.   artists against hunger and poverty/hungerthon - the organization forges relationships between artists and grassroots organizations to raise funds, collect food, and generate awareness in support of the fight against hunger in america and around the globe. Participating artists during this review period included bruce springsteen, michael mcdonald, jackson browne, darryl 'dmc' mcdaniels, crosby stills & nash, and others. This initiative helped grassroots organizations in the united states and others around the world who are helping thousands of people receive food, shelter, government benefits, as well as access to job training, agricultural programs, and the education they so desperately need to rebuild their lives.   national hunger clearinghouse - collects, develops and distributes information and resources to help build the capacity of emergency food providers to address the immediate needs of struggling families and individuals while promoting self-reliance and access to healthy food. The clearinghouse includes the national hunger hotline, (1-866-3 hungry or 1-866-348-6479), which refers people in need anywhere in the u. S. To food pantries, soup kitchens, government programs, and model grassroots organizations.			
