Jewish Funds for Justice	http://www.jewishjustice.org	212-213-2113	EIN 52-1332694	330 Seventh Ave 19th Floor	New York	NY	10001	USA	Community Improvement & Capacity Building, Economic Development, Nonprofit Management, Philanthropy, Public Foundations	Jewish Funds for Justice (JFSJ) is a national public foundation guided by Jewish history and tradition. Since 1984, JFSJ has developed new ways to create social change and strengthen low-income communities. JFSJ creates economic opportunity and security by investing in low-income communities and grassroots organizations, and by engaging Jews as partners and allies in social change work. We believe Jews have a responsibility to stand with all communities seeking justice, across lines of race and faith. JFSJs strategies are rooted in Jewish values. They include grantmaking and community investing, leadership development and service learning, organizing and advocacy.				United States	To advocate and campaign for various social justice issues that are important to the jewish community.   to provide leadership training so that leaders can build more effective organizations which can become a powerful social justice movement.			
Chai-Life Line dba Chai Lifeline Inc	http://www.chailifeline.org	(212) 465-1300	EIN 11-2940331	151 W 30th St Third Fl	New York	NY	10001	USA	Cancer, Children & Youth, Children & Youth Services, Health, Judaism, Patient & Family Support, Religion		In 2010:  1. We built a new, state-of-the-art medical center at the Camp Simcha/Camp Simcha Special campus, the first step in doubling the capacity of the camps. 2. Hundreds of children received a "booster shot" of confidence, friendship, and support at Friends 'n Fun weekends across North America. 3. We opened after-school programs for children living with illness or loss in their homes in three additional cities. 4. Over 18,100 hospital visits helped children laugh through their pain and gave crucial emotional support to parents.	Children, teens, and young adults with cancer and other life-threatening illnesses, disabilities, and chronic disease.	4,300 children and their families	North America, Europe, Israel	Chai Lifeline understands that a childs illness creates a tear in the fabric that holds families together. Our network of 24 programs and services strengthen the family unit, giving children and parents the tools to remain cohesive and hopeful from the moment of diagnosis. Programs are divided into four major categories: camping concrete living services; counseling and support; recreation and the arts. All programs are free of charge.   Chai Lifelines flagship programs are its two camps for seriously ill children and teens, Camp Simcha and Camp Simcha Special. These camps are place where pain and illness vanish, and where children are reminded every day that anything is possible. The personalized attention and genuine regard of compassionate, trained staff are potent medicine for campers who are often socially isolated as a result of illness. Deep friendships and camaraderie developed through bunk living and everyday triumphs enhance resilience, raise confidence, and give 450 children and teens the will to keep fighting the devastating social and emotional impact of living with illness.    Concrete living services enable families to maintain important routines and provide unparalleled support during medical crises. Professional case managers/patient navigators provide immediate emotional support, medical referrals, information and advocacy. Hot meals and hospital visits from volunteers lift spirits as they nourish bodies. Insurance advocacy guides parents through the maze of regulations and reimbursements. Educational support, including tutoring, loans of laptop computers, and webcam connections between child and classroom, enables children who cant be in school to remain current in the classwork.   Chai Lifeline offers free counseling to ill children and their immediate families. Parents have found information and friendship through ChaiLine therapist-facilitated telephone support groups and interactive telephone sessions with medical and mental health experts. Every year, hundreds of families attend retreats for families coping with life-threatening illness, chronic disease and disability, or bereavement. Recreational activities during the year facilitate friendships and peer support. Regional outings give families a chance to reconnect, exchange information, and absorb new ideas for coping with the unique challenges of pediatric illness. Childrens activities enable ill children and their siblings to befriend the only people whom they feel truly understand them: others in their situation. Creative arts offer an avenue for expression and friendship.			
Nyc Siamese Rescue Inc	http://www.nycsiamese.org		EIN 20-0377494	Po Box 1602	New York	NY	10163	USA	Animal Protection & Welfare, Animal-Related, Animal Services, Animals	NYC SIAMESE RESCUE, INC. is an all volunteer-staffed, non-profit, no-kill animal rescue and referral organization funded entirely by private donations.  For our rescued animals, we provide spay/neuter services and other essential veterinary care needed to place them into loving, adoptive homes.   The Organization does not maintain an animal shelter.  Instead, our foster network provides safe haven for Siamese and other cats in a home setting.  Towards attaining those goals, NYC Siamese Rescue promotes responsible cat ownership by educating the public in the selection, care, and training of Siamese cats, as well as encouraging the recycling of abandoned animals to help reduce euthanasia rates in the area municipal pounds.								
Fractured Atlas	http://www.fracturedatlas.org	(888) 692-7878	EIN 11-3451703	248 W 35th St Floor 10	New York	NY	10001	USA	Alliances & Advocacy, Arts & Culture, Arts Services, Management & Technical Assistance, Theater	Fractured Atlas empowers artists, arts organizations, and other cultural sector stakeholders by eliminating practical barriers to artistic expression, so as to foster a more agile and resilient cultural ecosystem.		artists and arts organizations		United States	Insurance Fiscal Sponsorship Spaces Artful.ly Fractured U. O-1 VISA Letters of Consultation Artchipelago			
Malecare	http://www.malecare.org	212-673-4920	EIN 13-4057382	419 Lafayette Street	New York	NY	10003	USA	Civil Rights, Health, Lesbian & Gay Rights, LGBTQ, Public Health	Malecare, Inc. is a 501(c) (3) nonprofit organization, founded in 1997.; Malecare develops practical, life saving programs for cancer survivors. Malecare is largest mens cancer survivor support and advocacy national nonprofit organization.		Men diagnosed with cancer.		Global				
Bais Chana Women International Inc	http://www.baischana.org	718 604 0088	EIN 11-3310069	383 Kingston Ave Ste 248	Brooklyn	NY	11213	USA	Adult Education, Children & Youth, Education, Judaism, Religion, Unknown, Youth Development Programs	We provide a non-judgmental and supportive environment for Jewish girls and women to explore the Jewish teachings and traditions that are their rightful inheritance; we educate them in their search for a positive, compelling image of womanhood; and help them confront the spiritual and moral challenges in their lives. They do so, both personally and collectively, with the assistance of gifted educators and mentors, and a powerful network of their peers.				International				
Bay Street Theatre Festival Inc	http://www.baystreet.org	(631) 725-0818	EIN 13-3628854	Po Box 810	Sag Harbor	NY	11963	USA	Arts & Culture, Arts Education, Theater	Bay street theatre is a regional theater presenting new, classic and contemporary works, with a committment to challenging and entertaining our diverse community. This commitment extends to innovative educational programs that highlight the power of live theater. It is our mission to be an artistic haven for an extended family of artists and audience, while continuing to provide a gathering place to share in the unique collective theatrical experience.					Producing theatrical evennts including 3 plays during the summer, comedy nights and childrens productions, which include school curriculum based, literature live events.   educational programs for local schools, including residency programs and internships			
Aslans Cats Inc	http://aslanscats.org		EIN 27-1643835	p.o.box 12	Verbank	NY	12585	USA	Animal Protection & Welfare, Animals	to provide a lifelong sanctuary for cats that are leukemia positive.to give these cats the care that they deserve with ongoing medical care, top quality foods, vitamins, supplements,a  cage free environment  where they roam freely within the sanctuary ,and where they have access to an enclosed backyard at all times.		feline leukemia cats		animal rescue	Rescue leukemia positive cats from kill shelters and streets provide them a lifelong shelterproper food and vet assistance to ensure their health and well being			
Inky Blue Sea Companion Animal Rescue	http://www.inkyBlueSea.org	212.924.8561;  	EIN 27-4725295	200 West 20th Street suite 1106	New York	NY	10011	USA	Animal Protection & Welfare, Animals			Rescue and rehpmdogs and cats find permanent.homes	50 students and 150 dogs and cats.	New York City & Puerto Rico	Education, hands on animal rescue, and empowering youth with purpose, job readiness and confidence with internships in our adoption centers.  Youth served are highschool stufe students and foster youth.			
LitWorld	http://litworld.org	(646) 237-8959	EIN 13-4367685	222 Broadway, 19th Floor	New York	NY	10038	USA	Education, Elementary & Secondary Schools, International, International Development, Literacy	LitWorld's mission is to empower young people to author lives of independence, hope, and joy.					The organization works with locally based, grassroots organizations to run and expand literacy-based programs, building sustainable outcomes for young people and their communities around the world. The organization's programs are designed and written by staff members with support from consultants where needed. Local community leaders manage and lead the programs after receiving training and access to the organization's innovative curricula. The organization creates permanent positive change in the world by implementing these on-the-ground programs to address the hard-to-tackle challenge of illiteracy worldwide. The organization uniquely combines the power of children's own stores, access to diverse reading and writing experiences, peer-to-peer support networks and adult mentor relationships, which leads to productive and transformational literacy.			
Institute For Conscious Global Change	http://consciousglobalchange.org/		EIN 90-0476159	20 W 104th Street Suite 1 D,	New York	NY	10025	USA	Community & Neighborhood Development, Economic Development, International, International Economic Development, Microfinance, Science & Technology, Technology	The Institute for Conscious Global Change is dedicated to visually representing how with equal rights and opportunities for everyone, we can create a transformed world.					Virtually developing the Least Developed Countries.			
Sanlaap North America	http://www.sanlaapna.org	(973) 714-1316	EIN 27-4607614	240 East 27th Street Apartment 4f	New York	NY	10016	USA	Civil Rights, International, International Human Rights, International Relief, Women, Womens Rights	Sanlaap North America rescues, shelters and empowers victims of human trafficking	The construction of our shelter, school and vocational training center is almost complete! We currently support girls in a leased shelter.	Young girls (8-16) in India's red light districts		India, New York	Project Rehabilitation - shelter for trafficking survivors Empowerment Collection - economic rehabilitation for trafficking survivors Project MD - mobile medical care for the girls still living in India's brothels			
Central New York Cat Coalition Incorporated	http://www.cnycatcoalition.org		EIN 06-1688749	Po Box 6182	Syracuse	NY	13217	USA	Animal Protection & Welfare, Animals	Cat population care/control					In 2014, the cny cat coalition continued growing our mission to rescue, foster, spay/neuter, and adopt out homeless animals in our community. We also progressed our spay/neuter campaign for cats owned by low-income individuals. Through our two low-cost clinics and several participating veterinarians, we altered more than 1,900 cats in 2014, preventing the birth of potentially thousands of unwanted kittens. In addition, we adopted more than 450 homeless cats to loving forever homes through our adoption program affiliation with petfinder, petsmart charities, and through personal advocacy. Cnycc was very successful with grant writing in 2014, securing two grants from the aspca for a total of 35,000, a grant from the central new york community foundation, and a grant from the community foundation of herkimer and oneida counties. We held four public meetings to engage the community and spread educational information about cat health, rescue, behavior, and other topics. Cnycc participated in several community events, including the canine carnival, healthy pet clinics, and a number of fundraisers.			
John T Mather Memorial Hospital	http://www.matherhospital.org	631-473-1320	EIN 11-1639818	75 N Country Rd	Port Jefferson	NY	11777	USA	General Hospitals, Health	John T. Mather Memorial Hospital is an accredited 248-bed, non-profit community hospital dedicated to providing a wide spectrum of health care services of the highest quality, in a cost effective manner, to the residents of Suffolk County. As members of the Mather Hospital Family - Trustees, Medical Staff, Hospital Staff, Volunteers and Benefactors.	John T. Mather Memorial Hospital has earned the prestigious Magnet recognition from the American Nurses Credentialing Center (ANCC). The Magnet Recognition Program recognizes healthcare organizations for quality patient care, nursing excellence and innovations in professional nursing practice. Developed by ANCC, Magnet is the leading source of successful nursing practices and strategies worldwide. Consumers rely on Magnet designation as the ultimate credential for high quality nursing.   This recognition was the result of an enormous amount of work and collaboration by many people over five years, an effort that was led by CNO Vice President for Nursing Marie Mulligan, RN, the Nursing Department leadership and staff.  Mather is one of only 401 hospitals worldwide to have earned Magnet designation.				John t. Mather memorial hospital, a 248 bed community hospital, provides quality medical care regardless of race, creed, sex, national origin, handicap, age or ability to pay. Although reimbursement for services rendered is critical to the continued operation and stability of john t. Mather memorial hospital, it is recognized that not all individuals possess the ability to purchase essential medical services. Therefore, in keeping with the hospital's commitment to serve all members of the community, free and or subsidized care is provided to the indigent, care is provided to persons covered by government programs at below cost and numerous health related education and support services are offered to the community at large. Please read our comprehensive, 39 page, "report to the community for the year 2014" which is attached or at our website; matherhospital. Org.   the hospital's auxiliary volunteers generate funds through the hospital's thrift and gift shops as well as other activities. These funds are presented to the jtm health facilities foundation, inc. Annually.   to promote and encourage community service, john t. Mather memorial hospital inc. Provides scholarship grants to college bound junior volunteers.			
Urban Upbound	http://www.urbanupbound.org	7187840877	EIN 86-1096987	12-11 40th Ave	Long Island City	NY	11101	USA	Homeless & Housing	Urban Upbound, formerly known as the East River Development Alliance, Inc. (ERDA), is a community-based non-profit organization located in Long Island City, Queens. Urban Upbound's mission is to transform and improve New York City public housing by providing residents with the tools and opportunities necessary for self-sufficiency and economic mobility and to break cycles of poverty.  New York City has 344 conventional public housing developments with over 450,000 residents. The average household income is under $20,000 per year. Urban Upbound currently serves the residents of Queensbridge, Ravenswood, Astori,  Woodside Houses, and most recently, Far Rockaway.   Queensbridge Houses is the largest public housing development in the country, with 96 buildings spanning six square blocks with over 10,000 residents. Over 30,000 residents live in the five developments we serve, the majority of which are African American and Latino. Urban Upbound is working to build sustainable programs for public housing residents and other low-income New Yorkers that can be replicated in other developments throughout New York City and the nation.		break cycles of poverty in public housing neighborhoods	place 675 people in jobs with an average wage of $10.70; provided financial counseling to over 1,800 individuals; sent 20 kids to college; and banked 300 unbanked residents in the community	Queens	employment services, financial counseling, college access/youth development, community revitalization services, and banking services via the Urban Upbound Federal Credit Union.			
Helping Honduras Kids	http://www.helpinghonduraskids.org	619-752-8400	EIN 20-4295394	1525 Western Ave.  Maildrop #8	Albany	NY	12203	USA	Christianity, Education, Nonprofit Management, Primary & Elementary Schools, Religion	To improve the level of dignity, education, opportunity and health for orphaned, abandoned, abused, and/or neglected and special needs children, single mothers and families on the north coast of Honduras. We also strive to share the love of Jesus Christ everywhere we go through acts of kindness and love.		abondoned, abused, neglected children receive love, hope, opportunity and an education.	500+ children, single mothers and elderly	La Ceiba, Honduras	Hogar de Amor Children's Home and the Jungle School			
Guilderhaven, Inc.	http://www.guilderhaven.org	(518)861-6861	EIN 14-1836365	6655 Rte 158	Altamont	NY	12009	USA	Animal Protection & Welfare, Animals, Veterinary Services, Wildlife Preservation & Protection	Guilderhaven, inc. is a 501(c)(3) non-for-profit that provides low-cost spay/neuter, food,and medical intervention for the companion animals of New York residents and for wildlife. We also assist rescue organizations in this endeavor, with an emphasis on our local community	In 2015, we facilitated the spay/neuter of 561 cats and 165 dogs with the help of grants from the Wright Family Foundation, William Gundry Broughton Charitable Foundation, J. M. McDonald Foundation, the Community Foundation of New York, Affleck Family Fund, the Golub Foundation, and from generous donations from our individual supporters!  We continue our mission in helping New York companion animals and rehabilitating wildlife as well as educating the public. In addition, we continue to help place animals from private homes, rescue groups and animal shelters , speak to school groups, youth organizations, and church groups, and produce an educational coloring booklet.  This booklet emphasizes the importance of responsible pet guardianship and humane behavior toward animals.   This year we continue our spay/neuter efforts with a $15,000 grant from the Albert Schweitzer Animal Welfare Fund (ASAWF)!	companion animals of New York residents and wildlife	spay/neuter of 755 cats and 154 dogs with the help of grants from  the Golub Foundation, the Build-A-Bear Workshop Bear Hugs Foundation, and the generosity of our local supporters	New York state, with a focus on Albany, Schenectady, and Rensselaer counties	-Low cost spay neuter - in conjunction with the Cat Care      Coalition -Low-cost dog spay/neuter - Dog Care Coalition -Medical Intervention -Educational outreach -Wildlife rehabilitation -Wildlife education			
Alliance For International Women's Rights	http://www.aiwr.org		EIN 34-2047056	P.O. Box 165 c/o Lisa Herb	East Chatham	NY	12060	USA	Women, Womens Studies	AIWR's mission is to support women leaders and future women leaders in developing countries, with a current focus on Afghanistan.	AIWR currently provides its long-distance English Program to 65 Afghan women and girls, and provides its Mentor Program to five Afghan attorneys and one Afghan graduate student.	AIWR works to support women leaders and future women leaders in developing countries, with a current focus on Afghanistan.	Over 50 Afghan women and girls.	Afghanistan and Nepal	AIWR's English Program:  The purpose of the English Program is to increase the English capacity of Afghan women leaders and future women leaders by offering live, long-distance, one-on-one English classes.  By improving their English skills, Afghan women and girls can more easily reach out to the international community for information, advice and funding, as well as sharing their experiences with the world.    The English Program matches Afghan women and girls with experienced, volunteer English teachers from the U.S. and other Western, English-speaking countries.  Each student and teacher pair meet on-line twice a week, via Skype, for live English classes, using both voice and instant messaging features.  In addition to providing individualized English lessons to Afghan women and girls, the classes provide both the students and teachers with a unique opportunity to directly meet and learn about each others cultures.  This unique cultural exchange helps to build better understanding and stronger relationships between the Western world and Afghanistan, one person at a time.    AIWR's Mentor Program:  The Mentor Program helps build the capacity of Afghan women leaders by offering live, long-distance, one-on-one mentoring relationships with American women mentors.  The Mentor Program selects qualified American women professionals to provide long-distance mentoring to Afghan women and girls in the subject matter of the mentors expertise. The mentor and mentee meet weekly via Skypes free computer-to-computer phone and instant messaging service.   One example of our Mentor Program includes a team of Seattle women attorneys who have been mentoring Afghan women human rights attorneys twice a week via Skype.  The mentoring sessions focus on English legal and political terminology relevant to the Afghan attorneys work, including discussing the legal and political terminology in the Afghan Constitution and comparing it to other countries constitutions.    The Mentor Program also provides editing and writing support to its Afghan partner organizations.  For example, Mentor Program Volunteers assist Afghan partners with writing and editing documents that have been translated into English, such as grant proposals, website materials, brochures, articles, letters, and reports.  By having Alliance Volunteers assist with editing, research and writing, the partner organizations are able to improve their standing and communication with the international community and donors and more effectively reach out to the world.			
Felix Organization - Adoptees for Children Inc	http://www.thefelixorganization.org	646-761-7159	EIN 20-4413828	43 Oyster Bay Rd	Locust Valley	NY	11560	USA	Camps, Sports	THE FELIX ORGANIZATION/ Adoptees For Children provides inspiring opportunities and new experiences to enrich the lives of children who are growing up in the foster care system. As adoptees, we were "taken home." We want to give back to those children who didn't get "taken home."	The Felix Organization has sent over 1,000 youth in foster care to Camp Felix, an overnight camp in Putnam Valley NY and has sent hundreds more youth from Los Angeles to a state-of-the art overnight camp on the west coast. To date, 10 former campers have become CITs, Jr. Counselors and/or Counselors, expanding their leadership skills and gaining on-the-job competencies.	youth in foster care create a better future.	over 200 young people	New York and Los Angeles	Camp Felix overnight camp, Beyond Camp which allows youth in foster care to follow their dreams by paying for extracurricular activities, Thanksgiving Feast-ival, Winter Camp Reunions, Secret Santa holiday gifts and Felix Friendship Circle, which sends youth to Broadway shows and cultural events.			
