Second Harvest Food Bank Of Metrolina Inc	http://www.secondharvestmetrolina.org	(704) 376-1785	EIN 56-1352593	500 Spratt St Ste B	Charlotte	NC	28206	USA	Food, Food Banks & Pantries, Food Programs	To feed people by soliciting and distributing food and other products through partner agencies and educating the community about the nature of and solutions to problems of hunger.				Grocery product collection and distribution:overall product distribution: second harvest food bank of metrolina (shfbm)received 46,424,032 pounds of grocery and household products from almost 500 local donors, national sources coordinated by feeding america, usda commodities, and purchases in 2013-2014. We distributed 45,348,523 pounds of this product to almost 600 partner agencies throughout our 19 county service region of north and south carolina and to other food banks in the carolinas in 2013-2014. Government commodities and state nutrition assistance program (snap): while the majority of our food bank's products are donated by wholesalers, retailers, and the general public, 6,643,291 pounds came from government commodities and snap. Government commodities come from the department of agriculture in north carolina and from the department of social services in south carolina. These commodities are distributed to agencies based on the poverty levels in each county. Snap funds come from the north carolina legislature. These funds are given in equal amounts to each of the six north carolina food banks. With our share of snap ($500,001) we purchased highly nutritious food from north carolina businesses for distribution to emergency pantries in the 14 counties we serve in north carolina. Salvage: at the main warehouse of shfbm in charlotte, nonperishable foods and non-food items donated from food drives and salvage centers are inspected, sorted, and packaged for distribution to our partner agencies. This project is one of our most popular volunteer activities. A total of 5,350,723 pounds were processed during the fiscal year. Purchased: in addition to the snap purchases outlined above, in 2013-2014 shrbm received $1,676,762 in grants and donations restricted for food purchase. These gifts enabled the food bank to secure highly nutritious products that are rarely donated. Food drives: each year, hundreds of local businesses, churches, neighborhoods, and service groups hold food drives for shfbm. This past year over 4,997,871 pounds were collected in local food drives. Our partner agencies: in the past year, shfbm supported almost 600 partner agencies feeding the hungry in our 19 county service region of north and south carolina. These agencies include emergency pantries, soup kitchens, homeless shelters, low income daycares, and senior programs. Volunteerism:volunteers from all segments of our community (individuals, corporations, faith-based groups, schools, community service workers and others) make a huge contribution to shfbm. In 2013-2014, volunteers donated 133,180 hours to shfbm. Collectively the financial impact of these volunteer efforts was over two million dollars calculated at $22. 14 per hour. This hourly amount is set by independent sector, a leadership forum for charities around the world. Ending child and senior hunger:shfbm believes that no child or senior should ever go hungry. Two of our major goals are to implement programs that help us end child and senior hunger in our regions. These programs include:kids cafe: this program partners shfbm with partner agencies that serve at-risk children. Examples include: boys and girls clubs, communities in schools, and low-income daycares. The food bank makes it possible for these agencies to add a feeding component so that at-risk children can have access to nutritious meals and snacks. As of the end of 2013-2014, shfbm had 45 kids cafe sites in twelve different counties. Backpack program: this program provides backpacks full of nutritious ready to eat foods on weekends and holidays when school meals are not available. As of the end of 2013-2014, shfbm had 116 backpack sites in sixteen different counties. Second helping program: this program provides monthly food boxes to homebound seniors in eight counties in our region. Boxes are delivered by our agency partners on regular meals on wheels routes and are helping seniors remain in their homes longer.   distribution of nutritional foods:community food rescue (cfr): crf gathers and distributes perishable foods such as produce, dairy, restaurant, and bakery items that might otherwise be thrown away. The food is picked up daily and delivered at no cost on the same day to agencies that feed on-site. This program annually saves almost 6 million pounds of food. Almost 50 agencies in mecklenburg and iredell counties are served by cfr. Distribution of produce, meat, seafood and dairy: shfbm places a special emphasis on soliciting and distributing highly nutritious foods including produce, meats, dairy and seafood, needed for balanced and healthy diets. These are often the foods that people living in poverty can least afford. In 2013-2014, shfbm distributed 16,077,566 pounds in these categories.						
Horse Protection Society of North Carolina	http://www.horseprotection.org	704-855-2978	EIN 56-2122078	2135 Miller Road	China Grove	NC	28023	USA	Animal Protection & Welfare, Animals	It is the mission of the Horse Protection Society of North Carolina, Inc. to make the world a better place for horses through education, rescue, and rehabilitation.  HPS provides a sanctuary of last resort for unwanted, neglected, and abused equines.		rescue starved and/or abused horses.	Rowan, Iredell and surrounding counties		As of September 2014 we have taken in four new rescue horses and have placed four horses to wonderful homes! We are currently feeding  45 horses.					
"By My Spirit" Ministries	http://	704-922-7226	EIN 56-2119993	1200 E Academy Street	Cherryville	NC	28021	USA	Children & Youth, Children & Youth Services, Christianity, Emergency Assistance, Human Services, Religion, Religion-Related	TO FEED THE HUNGRY, CLOTHE THE NAKED, MEET THE NEEDS OF HOSPICE FAMILIES, DIALYSIS PATIENTS AND FAMILIES, AND SEVERLY MENTALLY AND PHYSICALLY CHALLENGED CHILDREN WHICH WE HAVE BEEN DOING FOR THE PAST 13 YEARS. WE ARE ALSO STARTING "OVER THE TOP" READING LAB FOR ANY CHILD 5-YEARS AND UP, ALSO FOR ADULTS WHO HAVE READING, SPELLING, OR CPMPREHENSION PROBLEMS. WE DO NOT CHARGE FOR ANY OF OUR PROGRAMS.	We have served Hospice and Dialysis Centers for the last 13 years, and never had to turn away a family in need because the Lord always has provided, now we have a building, with a Sanctuary  where we can keep the items we need for the families, and give them the spiritual and emotional help if desired.	ANY RACE, AGE, OR DENOMINATION. LOW INCOME CHILDREN, PARENTS WITH LIFE THREATENING SICKNESS, CHILDREN WITH SEVERE DISABILITIES IN THE GASTON,LINCOLN, CLEVELAND, AND IREDELL COUNTIES. WE HAVE ALSO TAKEN FOOD, BLANKETS, WARM CLOTHES TO THE FAMILIES OF WEST VIRGINIA WHEN WE WERE CALLED AND TOLD THERE WAS GREAT NEED DUE TO FLOODING OF THE MOUNTAIN AREAS.		Keepers of the Vineyard Feeding and Clothing Program Over the Top Reading Lab Gaston County Toy Run for toys for Christmas Kingdom Harvest Missions Kingdom Builders Praise and Worship Outreach Center for Spiritual and emotional comfort when desired as well as the area to keep items for our families to be distributed from.						
Campus Pride	http://www.campuspride.org	704-277-6710 	EIN 14-1969456	PO Box 240473	Charlotte	NC	28224	USA	Children & Youth, Civil Rights, Civil Rights, Social Action & Advocacy, Lesbian & Gay Rights, LGBTQ	Campus Pride serves LGBT and Ally student leaders and campus organizations in the areas of leadership development, support programs and services to create safer, more inclusive LGBT-friendly colleges and universities. It exists to develop, support and give "voice and action" in building future LGBT and ally student leaders.			United States	LGBT-Friendly Campus Climate Index, Stop the Hate, Camp Pride, LGBT-Friendy College Fairs, Voice & Action Award, Lambda 10 Project, Q Research Institute for Higher Education, LGBT Webinar Series						
Good Shepherd Ministries of Wilmington Inc	http://www.GoodShepherdWilmington.org	910-763-4424	EIN 56-1566178	811 Martin St	Wilmington	NC	28401	USA	Homeless & Housing, Homeless Shelters	The mission of Good Shepherd Center is to feed the hungry, shelter the homeless, and foster transition to housing.  a hot meal.  a warm bed.  a return path to housing.	We feed over 85,000 meals a year, shelter up to 118 individuals nightly, and help 150 individuals per year transition into permanent housing.	the hungry and the homeless	New Hanover, Brunswick and Pender counties	a Soup Kitchen serving 85,000 meals a year, a Day Shelter offering showers, clean clothing, plus an address and phone number, a Night Shelter capable of sheltering up to 118 men, women and children, plus a Medical Clinic.	150 individuals and families transition back into housing.					
Prodigals Community Inc	http://www.prodigals.org	(336) 785-0770	EIN 56-1759004	1024 Waughtown St	Winstonsalem	NC	27107	USA	Christianity, Crime & Law, Half-Way Houses for Offenders & Ex-Offenders, Mental Health, Religion, Religion-Related, Substance Abuse Dependency, Prevention & Treatment	We are an interdenominational christian ministry grounded in the 12-step model. We offer spiritually-based programs of recovery for chronic substance abusers, regardless of financial need, while providing opportunities for them to develop job readiness and life skills.				To provide residential programs to help addicts and alcoholics live responsible and drug-free lives. This also includes outreach ministries of education and support to families of addicts and alcoholics.   to provide vocational training necessary to assist residents in their transition into mainstream society						
Equus Survival Trust	http://www.Equus-Survival-Trust.org	336-352-5520	EIN 77-0637519	775 Flippin Rd	Lowgap	NC	27024	USA	Animal Protection & Welfare, Animals	The Equus Survival Trust is an educational non-profit organization dedicated to protecting the traditional traits and the genetic diversity of historical equine breeds (horses, ponies and donkeys) threatened with extinction. The Trust supports these breeds by engaging in collective conservation efforts, educational promotions, and by supporting the network of endangered breed equine associations, and enthusiasts around the globe, with special emphasis on North America and breeds unique to North America.		endangered historic horse breeds	Equine conservation	The Equus Survival Trust's main thrust is providing grassroots education as it relates to endangered breed conservation:  (1) by creating or compiling new and existing public resources, and by organizing and/or supporting exhibitions, clinics and lectures and competitions or inspections that enhance conservation and preservation  (2) by focusing on supporting or creating conservation markets that enhance the survival of endangered equines while retaining the historical inner and outer characteristics of these breeds  (3) by maintaining an aggressive presence in the public eye, particularly in publications and on the Internet.	over 35 different horse breeds and we have over 50 endangered breed organization affiliates.					
Foundation For Nursing Excellence	http://www.ffne.org	919-787-2016	EIN 30-0105241	3700 National Drive Suite 206	Raleigh	NC	27612	USA		To contribute to improving health outcomes for citizens of North Carolina through the support of leadership development, research and demonstration projects intended to enhance the practice of nursing.				Regionally Increasing Baccalaureate Nurses (RIBN) Project; Transition to Practice; Just Culture						
Artist And Angels Against Aids	http://		EIN 68-0656742	3630 Chepstow Ct	Charlotte	NC	28262	USA	AIDS, Arts & Culture, Education, Health											
Recovery Ventures Corporation	http://www.recoveryventurescorp.org	(828) 686-0807	EIN 71-0875890	PO Box 452	Black Mountain	NC	28711	USA	Group Homes, Job Training, Mental Health, Substance Abuse Dependency, Prevention & Treatment, Vocational Counseling	Recovery Ventures Corporation offers long term residential treatment and aftercare for those who suffer from drug and alcohol addictions and provides opportunities to restructure their lives, in a safe and healthy environment that promotes self-sufficiency, personal accountability, emotional growth, and a positive interdependent lifestyle.			National	Long-term residential substance abuse treatment for over 90 associates						
King David Dance Company	http://		EIN 56-1859303	2200b Coronation Blvd	Charlotte	NC	28227	USA	Religion, Religion-Related	To promote the gospel through dance ministry										
Sound Pet Animal Rescue and Referral	http://www.soundpet.org	(919)656-3407	EIN 42-1692016	Po Box 3204	Cary	NC	27519	USA	Animal Protection & Welfare, Animals											
Mozart Club	http://		EIN 20-5547552	PO Box 5041	Winston-Salem	NC	27113	USA	Arts & Culture, Music	The Mozart Club provides an opportunity for singers to sing with a large community chorus with no audition and provides the community an opportunity to hear a wonderful perfomance of Handel''s Messiah with no admission charged.										
Dennis Benton Ministries Inc	http://		EIN 26-2603876	Po Box 572	Denver	NC	28037	USA	Christianity, Religion											
Center for Smart Financial Choices	http://www.cfsfc.org	3367346919	EIN 45-3124703	1922 S MLK Drive Box P Box P	Winston Salem	NC	27107	USA	Mutual & Membership Benefit	"Cultivating Youth for a future of financial wellness"	CFSFC Workshops Jan-May 2016                                                                                                                     Total Sessions=    79		                           Grand Total Participants= 2219                                	                                                                              #AFAD Sessions= 52 	                      "Adult for A Day"     Participants=1357	              Other Sessions =  27				 	                        Number of Youth Participants		1957	 		                Number of Adult Participants                   370	youth achieve financial competency	Piedmont Region of North Carolina	Adult for A Day workshops that simulate real life experience with Students are able to: -	Explain what a budget is and create one that balances positively. -	Articulate how different education attainment levels will lead to different incomes.  -	Differentiate between needs and wants and prioritize accordingly. -	Articulate how credit can positively or negatively affect the areas of housing, transportation, utilities, credit card, and insurance.    -	Communicate the importance of saving money.	The demand for our Youth Workshops increased over 40% from 2014. We presented 84 workshops to more than 2,700 students in 17 different schools					
Trips For Kids - Triangle	http://www.tripsforkidstriangle.org	919-493-2453	EIN 26-1953448	P.O. Box 52234	Durham	NC	27717	USA	Physical Fitness & Community Recreational Facilities, Sports	Trips for Kids-Triangle provides mountain bike outings and environmental education to children who would not otherwise be exposed to such activities.  Our outings create a positive, fun outdoor experience for children, while teaching lessons in personal responsibility, achievement, and environmental awareness		Low-income children ages 10-15 in the Triangle Area of North Carolina. This includes Durham, Raleigh, and Chapel Hill	Raleigh, NC Durham, NC Chapel Hill, NC							
A Ban Against Neglect Inc.	http://www.aban.org	919-590-9557	EIN 27-2701612	118 E. Main St. #206	Carrboro	NC	27510	USA		A Ban Against Neglect ends the cycle of poverty among young mothers in Ghana and empowers them toward the restoration of self, their communities and the environment.		Young Mothers	Aburi, Ghana	ABAN Women's Empowerment, ABAN Preschool, ABAN Community Employment	40					
Pets For Vets Inc	http://www.pets-for-vets.com	(301) 956-3837	EIN 27-1250302	560 Iris Way	Hampstead	NC	28443	USA	Military & Veterans Organizations, Veterans	Pets for vets identifies veterans who could benefit from and care for a companion animal and then pairs them with shelter pets which have been rescued, rehabilitated and trained for that purpose.				The organization completed 60 veteran-pet matches at no cost to the veterans. Established 10 chapters, including 4 shelter chapters. Provided training to new chapters. Provided start-up funding and materials to the chapters. Featured in print and online articles including people magazine, merrill lynch, advisor magazine, the legal intelligencer and interviews on a variety of radio stations. Awarded grants from a wide variety of organizations including the healey foundation, the shipley foundation and the common bond foundation.						
CIrcles Winston Salem	http://www.theshalomprojectnc.org		EIN 20-2136431	The Shalom Project 639 South Green Street	Winston Salem	NC	27101	USA	Civil Rights, Civil Rights, Social Action & Advocacy, Community Improvement & Capacity Building, Human Services, Leadership Development	Provide food and health assistance to needy individuals in the local community				Circles - provides mentoring and counseling to address poverty within local community  peters creek community initiative - collaborative effort of churches and organizations to revitalize community through ecenomic and community development  medical clinic - provides medical services on a periodic basis to the poor and needy in the community						
Spirithouse Inc	http://		EIN 56-2159087	PO Box 61865	Durham	NC	27715	USA	Education, Educational Services											
Chapel Hill Carrboro Public School Foundation	http://		EIN 56-1421977	Po Box 877	Carrboro	NC	27510	USA	Education, Philanthropy, Public Foundations	The Chapel Hill-Carrboro Public School Foundation is a local education fund whose purpose is to support quality education by securing private funding for innovative projects that cannot be funded by local, state, or federal dollars.  We also coordinate efforts of the community to bring about positive change in the school system, help the schools develop more effective educational practices, and provide continuing educational opportunities for teachers and administrators.										
Inter-Faith Food Shuttle	http://www.FoodShuttle.org		EIN 56-1753180	1001 Blair Drive PO Box 14638	Raleigh	NC	27620	USA	Food, Food Programs, Human Service Organizations, Human Services, Job Training	Inter-Faith Food Shuttle pioneers innovative, transformative solutions designed to end hunger in our community.  We believe that hunger is unacceptable. We build people, jobs, and a hunger-free community. We feed, teach, and grow across many different programs, spanning food distribution, nutrition education, job training, and sustainable agriculture.	This past year we rescued over 7.1 million pounds of food from more than 365 donors and distributed to 223 programs and 187 agencies in 7 counties, serving an average of 64,900 adults and children per month with a focus on fresh produce and healthy proteins.		7 counties in North Carolina: Wake, Durham, Orange, Chatham, Johnston, Nash, and Edgecombe.	Food Recovery and Distribution, Field Gleaning, Children's Hunger Relief Programs (BackPack Buddies, Kids Cafes, Afterschool SNACKS, Summer Feeding, School Pantries), Mobile Farmers Markets, Grocery Bags for Seniors, Plant-A-Row for the Hungry, Young Farmer Training, Culinary Job Training Program, Catering with a Cause, Community Gardens, Urban Agriculture, Teaching Farm, Incubator Farm Program, Nutrition Education (Cooking Matters, Food Matters, Cooking Matters at the Store), and trainings and workshops on sustainable agriculture in our farms and gardens throughout the Triangle.						
Warren Community Health Clinic Inc	http://www.warrencountyfreeclinic.org	(252) 257-1904	EIN 20-4307481	546 W Ridgeway St	Warrenton	NC	27589	USA	Community Clinics, Community Health Systems, Health	To provide free primary medical health care and access services to the uninsured residents of warren and vance counties.				Provided free primary medical health care and access services to the uninsured residents of warren and vance counties.						
Charlotte Cocker Rescue Of Nc Inc	http://		EIN 26-3673391	Po Box 1050	Kannapolis	NC	28082	USA	Animal Protection & Welfare, Animals											
Elevation Church	http://		EIN 06-1741162	11416 E Independence Blvd Ste N	Matthews	NC	28105	USA	Protestant, Religion											
Horse Hugs	http://horsehugs.net	(919) 900-7378	EIN 20-0182355	3813 Sparrow Pond Ln	Raleigh/Durham/Chapel Hill	NC	27606	USA	Animal-Related, Animals, Human Service Organizations	Horse Hugs is a non-profit, all volunteer group located in North Carolina that uses miniature horses to visit patients in hospitals, nursing homes, hospices, assisted care centers, special needs children, at-risk teens, prisons and juvenile detention centers.		We have been concentrating on Nursing Homes and Assisted Living Centers as we have found that this is a greatly over-looked group that can be very lonely and in need of visitors.								
Lung Transplant Foundation	http://lungtransplantfoundation.org	(919) 865-7000	EIN 26-2484253	Po Box 12866	Raleigh	NC	27605	USA	Health, Lung Diseases	To assist transplant patients and caregivers, promote and educate the community on the benefits of organ donation, and to fund lung transplant research				The primary objective of the organization is funding for research to improve transplant outcomes. A total of $75,725 in grants was given in 2015 to help fund study of the mechanisms of bronchiolitis obliterans, the leading cause of death among the lung transplant population. As part of this objective, the lung transplant foundation participated in the duke lung transplant symposium in 2015.   the lung transplant foundation has designed and maintained a website. The website includes information on the history of lung transplants, news about current lung transplant research, information about the foundation, and information on donating and volunteering.						
Free the Kids Inc	http://www.freethekids.org	(844) 222-6300	EIN 22-3741436	2303 W Market St	Greensboro	NC	27403	USA	International, International Relief	TO PROVIDE BASIC SHELTER, FOOD, MEDICAL CARE, RELIGIOUS AND EDUCATIONAL INSTRUCTION TO THE UNDERPRIVILEGED				To provide basic shelter, food, medical care, religious & educational instruction to the underprivileged in haiti						
Little Pearls	http://littlepearls.org/	828-658-9097	EIN 52-2404740	PO Box 8641	Asheville	NC	28814	USA	Arts & Culture, Film & Video	The mission of Little Pearls and its tiny films is to transform the world we all share, awakening authentic connection and compassionate action on behalf of humanity and all living beings.		viewers worldwide via our "tiny films" that open hearts & minds	the Asheville, NC area							
Gastonia Potters House Inc	http://	(704) 824-3698	EIN 56-2114637	Po Box 322	Lowell	NC	28098	USA	Human Services	Substance abuse treatment.				Substance abuse treatments.						
WILMINGTON AREA REBUILDING MINISTRY INC	http://www.warmnc.org	(910) 399-7563	EIN 56-2076795	5058 Wrightsville Avenue	Wilmington	NC	28403	USA	Home Improvement & Repairs, Homeless & Housing	Reduce substandard housing.				Warm unites people of compassion to rebuild homes and restore hope for their low-income neighbors, many of whom are elderly and/or disabled, enabling them to live safely and independently in their own homes and communities. Warm serves brunswick, new hanover and pender counties of north carolina. In 2014, warm volunteers performed home repair projects for 105 households.						
Second Hope Shop	http://www.secondhopeshop.com	919-202-0445	EIN 20-1819368-001	5100 Us Highway 70 E	Princeton	NC	27569	USA	Health, Patient & Family Support	Second Hope Shop is a division of Me Fine Foundation, a registered, not for profit organization. 100% of revenue benefits Me Fine Foundation in its mission to provide necessary resources and financial assistance to parents and caregivers with children being treated at Duke and UNC Children's Hospitals regardless of race, diagnosis, economic status or religion in memory of Folden Lee, IV.										
Dogwood Alliance	http://www.dogwoodalliance.org	(828) 251-2525	EIN 56-2139120	PO Box 7645	Asheville	NC	28801	USA	Environment, Forest Conservation	Dogwood Alliance mobilizes the public and exposes the truth about forest destruction to inspire individuals, communities, corporations, and government to take action. At the same time, we work collaboratively with industry leaders to put innovative business solutions to work that result in more protected Southern forests.		protect Southern forests	the South	our Paper Campaign negotiating with paper producers and consumers to create sustainable practices, our Carbon Canopy Project to give incentive to landowners to keep their trees in the woods, and the "Our Forests Aren't Fuel" Campaign to stop the clearcutting of Southern US wetland forests to be burned for electricity in Europe.	increase protection for over 90 million acres of forests					
THE STALLION TRACK CLUB INC	http://		EIN 56-1444330	4148 Mark Trail Ct	Claremont	NC	28610	USA		We work with children 5-18 years, using track and field to exercise. We also teach the nutritional value of food in order to prevent obesity while keeping children focused and disciplined.										
Avery County N C Humane Society Inc	http://		EIN 56-1321762	279 New Vale Rd	Newland	NC	28657	USA	Animal Protection & Welfare, Animals											
