Henderson County Council On Aging Inc	http://coahc.org	(864) 692-4203	EIN 56-0936674	105 King Creek Blvd	Hendersonvlle	NC	28792	USA	Human Services, Senior Centers, Seniors	To provide & coordinate services to assist older adults with living independently. Programs include meals on wheels, congregate nutrition, caseworker services and information & assistance.				Meals on wheels - provides hot, nutritious meals monday through friday to homebound adults who are unable to prepare meals and who meet eligibility criteria. All meals are low fat/low salt and meet the one-third recommended dietary allowance for individuals 60 years of age and older. Meals are delivered by caring colunteers who enjoy a friendly visit with clients on a daily basis. Diabetic meals are also available. When necessary, the organization makes every effort to provide meals to eligible, at-risk adults who are disabled and homebound but may be under the age of 60.   the sammy williams center for active living (swc) acts as the congregate adults can participate in social, health and wellness, nutritional, recreational, educational and volunteer activities. Five days a week, a hot nutritious lunch is served to clients of the center. Transportation is provided through apple country transportation (part of western carolina community action), within specific geographic boundaries.   partnership for independent living - henderson county council on aging through a partnership with the local department of social services manages the services of trained caseworkers and a registered nurse to assist at- risk old adults with maintaining the ability to safely stay in their own homes. The caseworkers coordinate services within the community to help these senior citizens with their medical, housing, financial or nutritional needs.						
PEACEFUL BEGINNINGS SHELTER INC	http://		EIN 56-1891630	826 Shaw Mill Rd # 18	Fayetteville	NC	28311	USA	Homeless & Housing, Housing Support											
Hickory Community Theatre Inc	http://www.hct.org	828-327-3855	EIN 56-0819493	30 Third St NW	Hickory	NC	28601	USA	Arts & Culture, Theater	Hickory Community Theatre provides the venue for creative exploration in drama, music, dance and visual art to the citizens of Catawba County and the entire Unifour area.	We sell over 15,000 tickets every year to shows and special events put on by over 200 volunteer performers and staffed by over 400 community volunteers.	We serve people from all walks of life, at all income levels, regardless of race, color, social status or any other factors, throughout a five county region and beyond.	Catawba, Caldwell, Burke, Alexander. Iredell and Lincoln Counties	1. Mainstage theatre season: a season of five family-friendly plays and musicals chosen for broad audience appeal; produced with community volunteers. 2. Contemporary series: a season of three modern plays chosen to challenge audiences and actors by their content and subject matter; also produced with community volunteers. 3. Youth Theatre Academy: Experienced theatre professionals working with young people up to age 18 and teaching them the craft of theatre and performance.	15,000					
Southeast German Shepherd Rescue	http://southeastgsdrescue.org/Default.aspx	888-591-7477	EIN 27-2404358	P.O. Box 597	Clayton	NC	27528	USA		SGSR is a 501(c)(3) non-profit organization based in North Carolina and committed to assisting German Shepherd Dog (GSD) rescue efforts throughout the Southeast. Our mission is to RESCUE displaced, neglected, or unwanted GSDs; REHAB them with proper medical care, nourishment, and socialization; and REHOME them into caring and responsible forever homes where they are able to thrive as alert, loving, and loyal family members.	SGSR was incorporated in April 2010.  We began actively rescuing GSDs in May so that in 7 short months 46 dogs have been accepted into our program. In addition, through partnering with other GSD rescues, SGSR has ensured the safe rescue of several more GSDs that would have been euthanized otherwise.	German Shepherd lovers everywhere, butespecially the Southeastern United States.	Southeast United States	Rescue, Rehab, Rehome!  Our program is saving adoptable GSDs, providing them with much needed care and placing them in loving forever homes.						
RIGHT WAY RESCUE INCORPORATED	http://Www.rightwayrescue.com	2527226700	EIN 46-2058637	1099 Northside Rd	Elizabeth Cty	NC	27909	USA	Animal Protection & Welfare, Animals			Any Barn Yard animals in need	The entire Virginia and North Carolina atea	A rehabilitation & rehome program	198 animals that were in need					
Wow Women Of Wisdom	http://		EIN 41-2194060	6671 Whispering Dr	Rural Hall	NC	27045	USA	Centers to Support the Independence of Specific Populations											
Corolla Wild Horse Fund Inc	http://www.corollawildhorses.com	(252) 453-8002	EIN 31-1810713	Po Box 361	Corolla	NC	27927	USA	Animal Protection & Welfare, Animals, Wildlife Sanctuaries	To preserve and protect the herd of wild spanish mustangs on the currituck banks of north carolina.				Wild horse preservation and education: veterinary care for both the wild horses and horses available for adoption; maintenance of fences that border corolla and the north beach; general horse care supplies; educational materials and brochures regarding the wild horses; operation of museum shop.						
NC GreenPower	http://www.ncgreenpower.org	919-716-6398	EIN 22-3895009	909 Capability Drive Suite 2100	Raleigh	NC	27606	USA	Energy Resources Conservation & Development, Environment	NC GreenPower is an independent nonprofit organization established to improve North Carolina's environment by supporting renewable energy, carbon offset projects and providing grants for educational solar PV installations at K-12 schools.	Since 2003, NC GreenPower Donors Supported Nearly 722,436,874 kWh of renewable energy delivered onto the electric grid right here in North Carolina. That's the equivalent to 18,060,922 days of Traditional Energy Usage. (The average single family home in North Carolina uses approximately 40 kWh of electricity per day.) Which is Like Preventing the Consumption Of 585,173,868 lbs of coal, or Equivalent to Planting 115,589,900 trees, or Equivalent to Powering 50,169 homes.  Since the Launch of the Carbon Offset Product in 2008, Donors have Supported 30,993 Metric Tonnes of Greenhouse Gas Mitigation. That's the equivalent of Preventing 68,327,881 lbs of Methane Gas From Entering the Atmosphere. Equivalent to  86,642,570 miles Not Driven, or Like Planting 5,261,247 trees.	All North Carolina citizens who want to improve the quality of the environment	North Carolina	a statewide outreach and education program that connects consumers with renewable energy and carbon offset providers as well as grants for educational solar PV installations at K-12 schools.	the environment through donations that supported 614 renewable projects, avoiding 5,681 tons of coal, powering 974 homes, producing environmental benefits like planting 3.5 million trees. We also provided grant funding to 4 NC schools for the installation of a 5 kW solar PV demonstration system with monitoring equipment and curriculum.					
24 Hours Of Booty Inc	http://www.24hoursofbooty.org	(704) 365-4417	EIN 20-3768277	801 E Morehead St Ste 308	Charlotte	NC	28202	USA	Health	To organize 24-hour cycling events for the community to promote support for cancer research and survivorship.				See schedule o. 2014 was a strong year for the 24 hours of booty organization. More than $2 million was raised for cancer navigation and survivorship programs primarily through the peer-to-peer fundraising efforts of more than 2,000 cyclists across four 24 hour cycling events. The host cities for the 24 hours of booty are indianapolis, in, charlotte, nc, columbia, md and atlanta, ga. 2014 accomplishments of our organization included:a strong continuing relationship with livestrong, a national beneficiary of 24 hours of booty directed our granted funds to maintain the livestrong patient navigation programs supporting cancer survivorship. These navigation programs continue to address extraordinarily important needs of cancer survivors facing questions and concerns with topics such as insurance, employment, finances, emotions, medical options and fertility preservation. Ongoing funding and awareness for the levine cancer institute through 24 hours of booty's 3-year, $1mm commitment. Our contributions to the levine cancer institute provide important services to cancer survivors undergoing treatment that are not covered by traditional insurance plans. Such services include but are not limited to patient navigation, art therapy, support groups, yoga and tai chi, massage and more. The carolinas cancer wellness program powered by 24 hours of booty was funded for the seventh year. The cancer wellness program is an eight-week program designed to assist in managing the physical side effects of cancer treatment during treatment and recovery phases for survivors. The brain tumor fund carolinas also received vital funding from 24 hours of booty. The brain tumor fund is dedicated to increasing public awareness of the impact of brain tumors and to providing support for the development of treatment strategies and cooperative biomedical research related to brain tumors. 24 hours of booty helps to fund patient navigation programs in the carolinas. For the seventh year 24 hours of booty was proud to partner with the ulman cancer fund for young adults in columbia, maryland. The patient navigation program funded by 24 hours of booty has been able to employ cancer navigators in mid-atlantic hospitals to support young adults ages 18-40 battling cancer. As one of the premier pediatric cancer centers in the country, the aflac cancer center of children's healthcare of atlanta received a grant for the fifth year from 24 hours of booty. Through our most recent expansion city, indianapolis, in, 24 hours of booty continued local support of cancer navigation and survivorship programs through a growing relationship with the primary local beneficiary, the iu simon cancer institute. Wind river cancer wellness retreats & programs offers cancer survivors an opportunity to visit a pristine, natural environment in order to learn to better manage their energy and connect with others dealing with similar issues. Wind river's outreach programs include nutrition, physical, mental and emotional guidance from experts and peers for individuals surviving a cancer diagnosis. 24 hours of booty partners with wind river to fund a retreat each year at no cost to cancer survivors. With a strong year in the rearview mirror, 24 hours of booty is poised for a strong 2015 through strategic management of events, fundraising and grant giving.						
Daniel Center For Math And Science	http://www.danielcenter.org	(919) 255-8957	EIN 27-1597059	735 Rock Quarry Rd	Raleigh	NC	27610	USA	Children & Youth, Youth Development Programs	To provide improved math, science and technology education opportunities that narrow the education gap for at-risk and disadvantaged students; additionally, to prepare and motivate these young people to pursue a post-high school education through proven tutoring methods.				Provided education enhancement through teaching, training, and experiences (fieldtrips) that greatly benefited the academic and social well being of our students.						
Boone Appalachia Relief	http://www.shelterrock.org		EIN 56-2266292	141 Leigh Ln	Boone	NC	28607	USA	Education	Help the underserved population of appalachia and native american tribes of the west and educate american on need for relief in this country				Weekly distributions of food and supplies to area poor. Traveling to locations through virginia, north carolina and tennesse to distribute aid to the local improvished and their families.   a television broadcast to teach americans about the needs of our own people in america is seen on direct tv as well as other various stations. With this broadcast shelter rock gains support. At the end of each broadcast there is always an offer of a teaching series which is shipped out to the caller.   with our focus being on the children of appalachia and the native american tribes, shelter rock holds large outreach events to serve more effectively. These events normally serve between 500 to 5000 people in one afternoon. We use volunteers and have many donations to offer, including food, clothing, toiletries and gifts for children. This is a very effective way of locating families with children who will continue to receive aid from our mission.   32400 undersearved individuals were given food, clothing and other supplies as well as gifts for children and adults in appalachia. Many donors including patagonia, phillips van heusen, and operation blessing out of virgina beach, virginia make it possible for our staff and volunteers to carry out this mission. Also donated are various gifts from individuals for children.						
National Lung Cancer Partnership	http://www.lungcancerinitiativenc.org	(919) 784-0410	EIN 26-2300885	10504 Stonton Way	Raleigh	NC	27615	USA		Our mission is to decrease deaths and provide support to those affected by lung cancer through research, awareness, education and access programs across north carolina.				We contributed to free to breathe to fund research into lung cancer causes, treatments and preventions. We also educated physicians and the general public about lung cancer and provided gas cards for lung cancer patients to get to treatment.   we organized three 5k run/walks, two golf tournaments a yoga event, and a gala to raise awareness of and research dollars for lung cancer. In 2014 over 2,500 individuals registered for these events.						
Unifour One	http://		EIN 03-0437078	1400 Battleground Ave	Greensboro	NC	27408	USA	Civil Rights, Intergroup & Race Relations, Race											
Children of Fallen Heroes	http://www.childrenoffallenheroes.org	910-217-4755	EIN 81-0800340	805 S Main Street	Laurinburg	NC	28352	USA	Adult Education, Education, Elementary & Secondary Schools, Literacy, Mental Health, Sports, Sports Associations & Training Facilities, Substance Abuse Dependency, Prevention & Treatment	To provide retreat and education programs that enable healing, develop character and teamwork skills through a life changing adventure for spouses and dependent children of Fire, Police, First Responders and Military that may be seriously wounded, ill, injured, or have made the ultimate sacrifice.	MISSION STATEMENT   To provide retreat and education programs that enable healing, develop character and teamwork skills through a life changing adventure for spouses and dependent children of Fire, Police, First Responders and Military that may be seriously wounded, ill, injured, or have made the ultimate sacrifice.     History  The Children of Fallen Heroes was founded by Kenneth Wasley to honor the life of his father and the 13 men that lost their lives while serving the US Army Parachute Team, Golden Knights, in a tragic plane crash in Silkhope, North Carolina March 8th, 1973.            Giving Back  Kenneth volunteered his time with adaptive surfing and tandem skydiving programs for combat injured veterans. With a career in marketing and videography he began implementing  business and marketing strategies to help other military nonprofits. This resulted in raising over 7.4 million dollars in 2015 for military familes.                       Research Overview   Developing life long relationships with many of the adaptive veterans he was able to extensive research about their needs. The heart of a hero is alway about the well being of others before themselves. Research showed that the greatest concern was the well being of their spouses and children if something where to happen to them. Wheels where set in motion and Kenneth began to develop a nonprofit business and marketing plan to support our heroes concerns and needs.   After much reflection and soul searching Kenneth realized his life's purpose by giving back to the community and those that serve to protect our families and children.  Setting the plan in motion he established Children of Fallen Heroes an accredited IRS and GuideStar approved 501(c)(3) nonprofit in December of 2015.             The family support network of those serving the Fire, Police, First Responders and Military that are seriously wounded, ill, injured or paid the ultimate sacrafice can be over looked or forgotten. During these times can be stressful and fracture family unity.   Surviving Spouse Concerns Hitting a wall of worries, issues, depression and concerns.  How will I manage the household finances?  How do I help the children emotionally during these times?  I need an education for a better paying job to provide for my children.   Children Concerns Who will look after me?  Will I get sick?  Did I cause my parent to be ill, injured, wouded or death?  I don't feel like I fit in with my friends.   How do we address these concerns?  Children of Fallen Heroes Retreat & Education programs was created in 2015 for the spouses and children of ill, injured, wounded First Responders, Fire, Police and Military departments. The programs helps self-discovery, both in and out of the activities. This is created by the support from other nonprofits, small business, corporations including individuals fundraising efforts. 	We serve the children and spouses of our Nation's Fire, Police, EMT and Military Departments	Laurinburg, North Carolina	Scholarship, Education and Retreat Programs. Such as Equestrian,  Fishing, Grief Camp, Indoor Skydiving, Tandem Skydiving, Yoga and many more programs.						
Reynolda House Inc	http://reynoldahouse.org	888.663.1149	EIN 56-0810676	PO Box 7287 2250 Reynolda Road	Winston Salem	NC	27109	USA	Art Museums, Arts & Culture	Reynolda House preserves and interprets an American country home and a premier collection of American art.  Through innovative public programs and exhibitions, the Museum offers a deeper understanding of American culture to diverse audiences.  IMPACT STATEMENT Those who experience Reynolda House Museum of American Art are inspired to learn, imagine, and find meaning in the art collections and historic site.				Operation of a historic house and american art museum, including interpretation, preservation, and education. The museum offers changing exhibitions in its 2,789 square foot exhibition gallery. Education programs include lectures, tours, plays, courses, gallery talks, symposia, summer camps, etc. The museum hosted approximately 38,090 visitors during the year.						
United Animal Coalition Inc	http://www.adoptshelterpets.org	(336) 454-6598	EIN 56-2104458	4525 W Wendover Ave	Greensboro	NC	27409	USA	Animal Protection & Welfare, Animals	To maintain a professional, caring and team-oriented operation that is dedicated to providing quality customer service and preventing/eliminating the abuse and suffering of animals.				Providing shelter for stray animals - approximately 17,000 animals served.   promoting the adoption of animals - approximately 9,000 animals served.   providing treatment to homeless animals - approximately 3,080 animals served.						
Ralph J Wann Foundation	http://		EIN 84-6022561	1 W 4th St 4th Fl	Winston Salem	NC	27101	USA												
SPREADING SEEDS INC	http://Www.spreadseedswithus.com		EIN 46-4524355	3904 Airport Dr Nw Ste A	Wilson	NC	27896	USA	Children & Youth, Youth Development Programs											
Piedmont Wildlife Rehab, Inc.	http://piedmontwildliferehab.org/		EIN 56-1712003	2912 Liberty Rd	Greensboro	NC	27406	USA	Animal Protection & Welfare, Animal Services, Animals, Wildlife Preservation & Protection	Helping injured and orphaned wildlife and nurturing an appreciation for our  local wildlife and environment.										
Order Of The Red Grail Inc	http://		EIN 02-0739704	353 Jonestown Road 123	Winston-salem	NC	27104	USA	Christianity, Religion											
DAVIDSON COUNTY TRANSITIONAL SERVICES INC	http://www.dctsinc.org/	336-472-0625	EIN 61-1713957	Po Box 632	Thomasville	NC	27361	USA	Domestic Violence, Emergency Assistance, Family Violence Shelters, Homeless & Housing, Personal Social Services, Victims Services	To provide supportive services & referrals by connecting individuals & families to a collaborative network of support systems in their communities through education, support counseling, case management and life skills while empowering them with the necessary tools to transition in society. Therefore, allowing them to make healthier choices for themselves and their families.		Target the Bulls-eye of Everyday Problems	To eradicate destructive behaviors, provide resources and  referrals, networking, placement assistance, emeergency funding for utilities when available	A Walk In Their Shoes The Community Uniting  Empowerment  (CUE)Program  DC TS Outreach Programs	over 56 women  escape domestic abuse, 500 community members learn ways do overcome destructive behaviors					
Summit Charter School Foundation Inc	http://	(828) 743-9630	EIN 56-2039872	Po Box 2493	Cashiers	NC	28717	USA	Education	Support organization-school				Support for charter school. The organization raised money to purchase the building, furnishings and equipment						
Cabarrus Christian Fellowship Inc	http://		EIN 16-1742003	1101 Weststone Dr	Charlotte	NC	28208	USA												
Green River Preserve	http://www.greenriverpreserve.org	828-698-8828	EIN 56-1554526	301 Green River Road	Cedar Mountain	NC	28718	USA	Camps, Sports	The mission of Green River Preserve is to provide a stimulating and nurturing learning experience.  GRP strives to inspire a deep appreciation of interconnectedness, ecological respect, and the joy of living.		Summer camp targets children in rising second through twelfth grade.   School programs target middle school science classes.	The United States of America Majority of campers come from the Southeastern Region.	Summer camp at base camp for rising 2nd through 9th graders.  Expeditions for high school student on the NC outer banks and blue ridge mountains.						
MIRA Foundation USA	http://www.mirausa.org/	910-944-7757	EIN 26-3603779	77 Cherokee Road	Pinehurst	NC	28374	USA	Centers to Support the Independence of Specific Populations	To provide eligible blind children between the ages of 11 and 17 MIRA guide dogs and training free of charge.  We are the only organization in the United States that provides guide dogs to children under the age of 16.	Blind children across the United States have benefited from our program and with their MIRA guide dogs have gained  self-confidence and independence, developed responsibility in caring for their guide dogs and become more involved in the schools, communities and interact more successfully with their peers.  Having a guide dog is a life altering experience for our young children at an age when social interaction is vital to healthy development.  Go to our website www.mirausa.org and go to Success Stories to see what our young students say.	blind children	the United States	MIRA guide dogs and training to qualified blind children between the ages of 11 and 17 without charge.						
Alliance Of Aids Services-Carolina	http://www.aas-c.org	(919) 834-2437	EIN 56-2158082	1812 Tillery Pl Ste 105	Raleigh	NC	27604	USA	AIDS, Health, Health Support, Human Services	To assess, assure and evaluate comprehensive support for people living with hiv/aids associated conditions, their caregivers and communities at large. To promote compassionate, nonjudgemental care, prevention, education and advocacy.				The client services department is the point of entry for hiv positive individuals to receive all the care and services for which they qualify. Each person served is assigned a medical case manager who will be responsible for coordinating all of their non-primary care services. The case manager performs an assessment/intake of their care needs and that paperwork must be up to date before a person can receive assistance of any kind. These services include, but are not limited to mental health, housing, spiritual care, nutritional needs, transportation, non-primary medical needs, also medical appointment co-pays, medication co-pays, vision and dental care as it relates to their hiv need and a host of other referral sources.   the housing program protects and stabilizes not only individuals, but also their families and communities. Stable housing is necessary to reduce the correlation and persistence between homelessness, hiv infection and poor health outcomes among individuals living with hiv/aids. The housing opportunities for people living with aids (hopwa) program is the ony federal program dedicated to addressing the housing needs of persons living with hiv/aids. The alliance provides the following financial, transitional, and long term affordable solutions:short term rent mortgage and utilities (strmu) is time limited housing assistance designed to prevent homelessness and increase housing stability. Tenant based rental assistance (tbra) provides financial assistace to individual households that enable them to rent market-rate units. A six bedroom licensed full-care facility is staffed by skilled nurses.   the prevention education team currently offers targeted testing for those at risk for contracting hiv as well as those who are unaware of their status. We provide confidential testing at our office, in substance abuse treatment facilities, at community events, in nightclubs, in people's homes, on park benches, and wherever there is a need. The prevention education team also offers a cdc evidenced-based health promotion intervention called clear: choosing life: empowerment! Action! Results! . Clear is an intervention that provides individuals with the skills necessary to live the best life and to be able to make healthy choices. Clear is for individuals who are currently living with hiv, or who are at high risk of contracting hiv.						
