Merit Pit Bull Foundation	http://www.mpbf.org	 336-618-PITT	EIN 45-5448792	PO box 10744 .	Greensboro	NC	27404	USA	Animals	Improving the lives of bully-type dogs and the people who love them.  MPBF is a foundation, but above all, it is a group of animal advocates working as one. We are regular people who love animals, specifically pit bull type dogs.  We don't necessarily have more time, money, or resources than anyone else. Our daily lives include jobs, classes, partners, families, kids, and animals of our own. We are different amongst ourselves in many ways, yet are united by our passion for pit bulls. In that union, we can do great things.  We can make a difference... and we do.  Not because we have more, but because we want more. More for our community and more for our beloved breed.  We are people with a passion for pit bulls and there is always room for one more!		Improving the lives of bully-type dogs and the people who love them.	North Carolina	*Facilitates the rescue, and permanent placement of Pit Bull type dogs who were abandoned, neglected, abused, and/or surrendered within NC  *Promotes education about Pit Bull type dogs to the general public, media, and law makers  *Promotes and teaches responsible dog ownership  *Supports community needs relating to the benefit and welfare of Pit Bull type dogs.  *Brings communities together to strengthen the responsible dog owner's rights  *Opposes BSL (Breed Specific Legislation)in all forms, including actively opposing any legislation, either currently on the books or in the form of a bill, that we feel is unfair and/or impedes on the rights of responsible dog owners  *Supports and helps enact more legislative penalties against animal cruelty, neglect, abandonment, and irresponsible actions  *Works in conjunction with other rescue groups to promote the values of our organization  While we promote our vision for all breeds, we specifically support Pit Bull and other Bully type breeds.						
Hearts With Haiti Inc	http://		EIN 56-2267791	708 McCulloch St	Raleigh	NC	27603	USA	International, International Development											
Corral Riding Academy, Inc.	http://www.corralriding.org		EIN 26-3122904	3620 Kildaire Farm Rd	Cary	NC	27518	USA	Animal Protection & Welfare, Animals, Children & Youth, Education, Equestrian, Sports, Youth Development - Agricultural	CORRAL pairs at-risk girls with rescued horses to promote healing,transformational growth and ultimately, lasting life-change.				CORRAL changes lives by pairing girls with a rescued horses for ridinglessons and equine assisted learning that facilitates healing andgrowth. CORRALs adultmentors offer participants both academic support and positive friendship.CORRAL serves girls between ages of 11 and 18 years-old who areat-risk because of their socio-economic status, their homeenvironment, peer influences or other extenuating circumstances. Please visit http://corralriding.org/The-Vision.html to learn more about equine assisted learning and CORRAL's program structure.						
Holdeen Fund 50-10	http://		EIN 14-6018148	1 W 4th St 4th Fl	Winston Salem	NC	27101	USA	Philanthropy											
Ruffian Foundation	http://		EIN 75-3165155	Po Box 668	Castle Hayne	NC	28429	USA	Animal Protection & Welfare, Animals											
W A M Y Community Action Inc	http://www.wamycommunityaction.org	(828) 264-2421	EIN 56-0816296	225 Birch Stste 2	Boone	NC	28607	USA	Human Services	Improve economic and social conditions				21st century community learning center program provided a quality after school program in a safe, drug-free, nurturing environment. The program operated after school during the school year and on full-day schedule on teacher work days and during the summer months. The focus of the program is to raise student's end of grade scores and to broaden their horizons socially.   weatherization/harrp programs enable low-income families to permanently reduce their energy bills by making their homes more energy efficient.   csbg provides a variety of services designed to assist low-income families in attaining the skills, knowledge, and motivation necessary to achieve self-sufficiency.   other social programs that improve economic and social conditions.						
Curamericas Global	http://www.curamericas.org	919-510-8787	EIN 56-1400098	318 W. Millbrook Road Suite 105	Raleigh	NC	27609	USA	Health, International, International Development, Nonprofit Management, Public Health	Curamericas Global partners with underserved communities to make measurable and sustainable improvements in their health and well-being.	In Bolivia, the Curamericas project reduced child mortality rates by an average of 62% in six years.  After one year since construction was completed and the Maternity Center opened to serve families in Guatemala, 30% of all births in the community are taking place in its safe facilities.  Nurses and midwives are trained to aid in safe deliveries and to appropriately respond in emergency situations.  After only one year of work in Haiti, we have provided services to more than 10,000 women providing treatment and prevention services for HIV/AIDS.  Our Nehnwaa Child Survival Project in Liberia records zero maternal deaths since our project began in 2008.  In a country where the lifetime risk of death due to pregnancy is 400 times as high as the U.S., this is a terrific achievement by the local health teams.	Mothers and children under the age of five in countries with high maternal and child mortality rates; women of reproductive age in Haiti	Guatemala, Liberia, Haiti, Bolivia	Curamericas Global partners with underserved communities to make measurable and sustainable improvements in their health and wellbeing. For over thirty years, we have worked in Latin America, the Caribbean, and Africa to alleviate suffering from treatable and preventable causes. Our past and current projects in Guatemala, Haiti, and Liberia have served communities with some of the highest child and maternal mortality rates in the world, confronting conditions that include malnutrition, pneumonia, malaria, and complications from child birth. We believe passionately in the community and family foundations of health. Our projects build the capacity of communities and families to improve their own health.  Therefore, our projects always empower women and girls, recognizing that a mother is the childs first doctor, and the surest predictor of a childs health is the education level of his/her mother.  Curamericas Global utilizes community-based education and prevention interventions in order to address different health problems relating to maternal and child health in underserved communities in Latin America and West Africa, and delivers these strategies using Curamericas Community-Based, Impact-Oriented (CBIO) model in combination with the Care Group and Positive Deviance methodologies.   The CBIO approach involves: (a) Community mobilization to cement good relations and secure community buy-in and ownership; (b) Conducting a census and health assessment of each community; (c) drawing maps, enumerating households, and creating a Community Register of every beneficiary by household; (d) establishing Community Health Committees (CHCs) and helping the CHCs develop a Community Diagnosis describing the communitys health challenges and a Community Health Plan describing how the project and the community will work based on both epidemiologically-driven health objectives and community perceived health priorities; (e) using the Community Registers to monitor coverage of key services to ensure equitable services to all and that those most in need are served; (f) methodically locating and making targeted home visits through Routine Home Visitation (RHV) to those most in need; and (g) utilizing a continuous health surveillance system that allows staff to tailor service delivery and engage in continuous quality improvement. This involves the capturing of vital events  new pregnancies, births, and deaths - that give us the unique capacity to track and detect actual project impact and measure changes in maternal and child mortality rather than a sample.  The Care Group methodology involves recruiting and training mother peer educators called Care Group Volunteers. Each Care Group Volunteer is assigned eight to twelve neighboring households and brings to these households, via group meetings or home visitation, life-saving Behavior Change Communication (BCC) delivered in the local language and utilizing proven methods of adult education for non- or semi-literate audiences. Subjects covered include, but are not limited to the importance of antenatal and post-partum care and health facility deliveries; recognizing and responding to danger signs in pregnancy, delivery, and post-partum; prevention and care-seeking for malaria, diarrhea, and pneumonia; and proper nutrition for pregnant women and children, as well as immunization adherence. In this manner, health education penetrates to every household. In addition, the CGVs are the projects eyes and ears and report to project staff vital events so field staff can respond with timely services and to enable the unique surveillance capability described above.  The Positive Deviance model identifies healthy children (positive deviants). The mothers of these children are then interviewed in order to find out how better health was achieved, and thereby what locally available and affordable foods can be used.						
Cape Fear Raptor Center, Inc.	http://www.capefearraptorcenter.org	910-687-6888	EIN 46-5073990	9185 US Highway 117S	Rocky Point	NC	28457	USA	Animals, Bird Sanctuaries, Protection of Endangered Species	To provide compassionate and aggressive rehabilitation services to injured raptors with the goal of release back to their natural habitat, to protect and conserve the environment that these raptor's depend on, and to educate the citizen's of Eastern North Carolina, both young and old, the importance that raptor's serve in our ecosystem.	Hundreds of birds rehabilitated with a successful release rate, if they survive the first 24 hours. If the bird is not releasable, great care is given to find the bird a suitable educational placement with a permitted facility.	Injured and sick Raptors rehabilitate and be released	Southeastern North Carolina	Volunteer Program; Education Program	over 200 raptors and educated over 5,000 people					
The Livestock Conservancy	http://www.livestockconservancy.org	919-542-5704	EIN 03-0270281	PO Box 477 33 Hillsborough St	Pittsboro	NC	27312	USA	Animal Husbandry, Animal-Related, Animals, Food	The Livestock Conservancy was founded in 1977 to conserve rare breeds of cattle, horses, donkeys, sheep, goats, pigs, rabbits, chickens, ducks, geese, and turkeys. Today's rare breeds are quite different from the "improved" stocks, which are very productive but require intensive husbandry. The rare breeds retain survival qualities such as disease resistance, foraging efficiency, maternal abilities, and longevity, which make them a perfect fit for organic, grass-based, and humane sustainable agriculture. As well as being useful to farmers today, rare breeds represent the genetic diversity essential for domestic animals to adapt to changing environmental conditions in the future.	Effective conservation has allowed us to ensure survival for every breed on our Conservation Priority List, which now includes over 150 breeds.	save endangered breeds of livestock and poultry from extinction	North America	research on breed population size, distribution and genetic health; research on breed characteristics; gene banks to preserve genetic material from endangered breeds; rescues of threatened populations; education about genetic diversity and the role of livestock in sustainable agriculture; and technical support to a network of breeders, breed associations, and farmers.	thousands of small farmers and ranchers					
POWER OF THE DREAM INC/HANDmeUPs Thrift	http://www.thepowerofthedream.org	(919) 876-5750	EIN 26-2781679	8320 Litchford Rd.,  Suite 120	Raleigh	NC	27615	USA	Employment, Human Service Organizations, Human Services, Job Training	Advocacy and creating jobs for adults with autism and/or other Intellectual Developmental Disabilities (IDD) in the Raleigh Triangle area.	At the present time our non-profit thrift store, HANDmeUPs is providing paid  employment for 21 individuals with intellectual developmental disabilities, thereby making our vision a reality! We are providing space in the store for micro-enterprises run by individuals with developmental disabilities. We partner with a number of other non-profits in the Triangle area to make the best use of donations brought into our store. In addition, The Power of the Dream, Inc.  is working hard to educate the community and businesses about customized employment for adults with autism and other intellectual developmental disabilities.	with advocacy and creating jobs for adults with autism and/or other Intellectual Developmental Disabilities (IDD) in the Triangle	Raleigh, NC	- Operating a non-profit thrift store, HANDmeUPs Thrift,  which gives volunteer and paid employment opportunities to individuals with autism and other developmental disabilities. In addition, enabling micro-enterprises for individuals within the thrift store setting. - Initiating a Power UP Inclusive Employment Task Force with a goal towards creating a pilot program for customized employment (initially limited to workers with autism and/or intellectual developmental disabilities (IDD).	individuals with opportunities to work at our nonprofit thrift store and learn valuable job skills and other skills that will enable them to continue to work in the community.					
Purrfect Smiles	http://purrfectsmiles.org		EIN 81-1822608	302 Michelangelo Way	Cary	NC	27518	USA												
Freedom House	http://www.helpfreedomhouse.org		EIN 20-4427718	Po Box 38215	Greensboro	NC	27438	USA	Mental Health, Substance Abuse Dependency, Prevention & Treatment	Freedom house was founded in 2006 with the mission of providing a long-term, addiction recovery program that rescues, restores, and redeems the lives of women and their children in a christ-centered, family environment. (see schedule o)				Employment training services: many of the mothers that come to freedom house have never been employed and are in desperate need of job training to help them secure employment capable of providing for their families after leaving freedom house. In response to this need, freedom house opened its first thrift store in greensboro, north carolina on december 18, 2008. The freedom house employment training program helps prepare residents for locating and securing jobs of their own upon completion of the freedom house program. Among the many skills freedom house residents learn are customer service, organization, time management, and prioritizing tasks. The degree of the residents tasks increase as they progress through the employment training program. This year freedom house was able to grow its job training program through the opening of an additional thrift store in greensboro, north carolina.   residential services: this year freedom house was able to provide thousands of days of sobriety, shelter, and meals to the participants of its program. Participants of the program also received individual counseling, group therapy, employment training, and a variety of life skills classes, such as parenting, anger management, financial planning, and co-dependency. They were provided transportation within the county to medical, legal, and social service appointments. Freedom house helped residents work toward the following nine (9) goals: reunification; drug-free lifestyle; employment training and acquisition; education; social development and support; health care support and disease prevention; legal compliance; independence; and, faith. This year freedom house opened an additional residential facility that will allow freedom house to double the number of people it is able to serve through the residential program on an annual basis.						
Education For Successful Parenting	http://www.eduparents.org	949-646-6016	EIN 26-2098947	9016 Tenderfoot Trail	Raleigh	NC	27615	USA	Children & Youth, Children & Youth Services, Education, Health, Secondary & High Schools, Youth Development Programs	ESP is improving the health and well-being of children in our communities by educating adolescents about parenting before they conceive the next generation of children.  Our goal is to empower young adults with the information and life-planning skills they need to form a healthy family.  ESP is working to reduce rates of teen pregnancy, absent fathers, and child abuse.	Among teens who have attended ESP programs, over 90% report being more willing to wait until adulthood before parenting, and they report feeling more prepared to provide for, protect, and nurture a child.	improve children's well-being	pre-parenting education	"Healthy Foundations for Future Families" which educates teens about the effect of their choices today on the well-being of their future family.	over 1,000 teens.					
North Raleigh Athletic Association	http://www.popwarner.com		EIN 56-1745721	PO Box 98872	Raleigh	NC	27624	USA	Football, Sports	To operate a pop warner youth football league including a cheerleading squad				Children played a fall schedule for football and cheerleaders cheered during the games, cheerleading competitions were entered, referees were hired and paid for the games, uniforms were purchased for the players and cheerleaders, coaches uniforms were purchased and parental assistance was offered for parents who could not pay the full amount of registration.						
Soar Inc	http://		EIN 58-1505954	Po Box 388	Balsam	NC	28707	USA	Environment, Environmental Education											
Wake Interfaith Hospitality Network, Inc.	http://www.wihn.org	919-832-6024	EIN 56-1843022	903 Method Rd Suite	Raleigh	NC	27606	USA	Health, Homeless & Housing, Homeless Shelters, Specialty Hospitals	Wake Interfaith Hospitality Network (WIHN), is a non-profit corporation whose mission is to assist homeless families in achieving independence with dignity.  WIHN assists families in the transition from homelessness to self-sufficiency by providing an average of 39 days of service.  To both involve and educate the community, WIHN mobilizes more than 2000 volunteers from 50 congregations to provide families with shelter, meals and encouragement.  The professional staff provides resource oriented case management, individualized counseling and loving encouragement to each family.	In 2012, WIHN served 50 families (58 adults and 113 children) in our Emergency Shelter Program.  In transitional housing, we served 25 families, consisting of 99 individuals, with 32 adults and 67 children.  Of those 25 families, 14 have exited the program and 11 carried over into 2013.  For those who exited, 12 families (86%) moved into permanent housing.	homeless families with children	Wake County, NC	Emergency Shelter Transitional Housing Program Aftercare						
Alpha Pregnancy Support, Inc.	http://www.alphapregnancysupport.com	336 - 242 - 1218	EIN 58-1918989	23  West 3rd Street, Suite B PO Box 1385	Lexington	NC	27292	USA	Children & Youth, Civil Rights, Counseling, Family Services, Mental Health, Right to Life, Youth Development - Religious Leadership	We are a Christian organization offering Free Counseling Service, including Emotional, Spiritual and Practical support to women in a Crisis Pregnancy. We are supported by financial donations from, businesses, Churches, Community and individuals.  We counsel and minister to women, couples families and those who are hurting and abused. We teach parenting skills, abstinence, adoption education and alternatives to abortion. We offer confidential pregnancy  tests, on - going counseling, before and after the pregnancy. We also offer Bible Study, GED referrals, resume skills  and MOMS Support Classes. Clients earn Vouchers by attending classes and redeem coupons for baby clothing, diapers and new layette items.	The primary focus of the organization is to serve the Clients and meet their needs one on one. The Long - term goal is a new facility.	Young  girls and single mothers with babies and small children.	All the 14 Townships of Davidson County	MOMS Support, Resources, diapers, Parenting Classes, Character Education and Relationship skills	We serve an average of 300 to 375  returning, long - term clients in sessions per year.					
Literacy Volunteers of America-Pitt County	http://www.pittliteracy.org	252-353-6578	EIN 56-1630291	105 E Arlington Blvd Ste A Room/suite E	Greenville	NC	27858	USA	Adult Education, Education	The mission of Literacy Volunteers  Pitt County (LV-PC) is to promote literacy in Pitt County through trained volunteer tutors who provide one on one and small group tutoring to adults with limited reading, writing or English speaking/literacy skills.   Adult literacy is the ability to read, write and speak English proficiently, to compute and solve problems, and to use technology in order to become a life-long learner and be effective in the family, in the workplace and in the community.				One-on-one and small group instruction: Pre-GED Reading Writing Basic Math English Communication  Monthly classes available: Computer Basics Computer Applications I Computer Applications II						
Preservation Chapel Hill	http://www.preservationchapelhill.org	919-942-7818	EIN 23-7218278	610 East Rosemary Street	Chapel Hill	NC	27514	USA	Alliances & Advocacy, Arts & Culture, Historical Organizations, Management & Technical Assistance, Professional Societies & Associations	Preservation Chapel Hill is dedicated to protecting the character and heritage of the Town of Chapel Hill, and the surrounding community, through the preservation and conservation of its historic buildings and cultural landscapes.   To achieve our mission, our approach is three-fold:  PRESERVE  We preserve historic structures and places by offering Preservation Loans for rehabilitation and renovation projects, preparing Historic Structure Reports and conducting resource surveys at a reduced fee, and consulting with property owners during the design phase of projects in preparation for making applications to the Historic District District Commission, Planning Board, or Town Council.   ADVOCATE  We advocate for preservation initiatives by encouraging projects that balance the need for development and growth with the desire to retain our historic resources. We work with partners in economic development, heritage tourism, public education, and local government to ensure a voice for historic preservation is present in the decision-making process.   EDUCATE  We educate the public and our partners about what historic preservation is, why it matters, and how it can be a tool to achieve our community's goals. The field of historic preservation has developed and changed over the last fifty years, and we are a resource for understanding its role in today's society. 	Since 1972, PCH has purchased, rehabilitated, and sold numerous properties in Chapel Hill, protected twelve properties in perpetuity by administering preservation easements, advocated successfully for development projects that are sensitive to surrounding historic properties, and assisted countless property owners with researching, rehabilitation, and preserving their historic homes and businesses.	our community balance the need for growth with the protection of historic resources	Chapel Hill and Carrboro	technical services (research, National Register, tax credits, preservation easements) educational tours (downtown Chapel Hill, downtown Carrboro, women's history, Old Chapel Hill Cemetery) special events (Voices from the Grave, Holiday House Tour, Preservation Showcase Tours)	advocate for development projects sensitive to the historic districts, create an inventory of Chapel Hill's historic buildings, and add interpretive signage and information at the Old Chapel Hill Cemetery					
Comfort Socks	http://www.comfortsocks.org		EIN 80-0281035	PO Box 477	Supply	NC	28462	USA	Philanthropy, Public Foundations	Comfort Socks provides new socks to any agency that serves homeless people and families. Putting aside for a moment the hygiene benefit of socks for the homeless, for us, this mission is one of comfort. We provide the secure and comfortable feeling that putting on new pair of socks can give someone who feels lost or forgotten by this world. Every step taken by a homeless person is a painful step Comfort Socks eases that pain with the simple comfort of new socksComfort Socks also recognizes that sock drives encourages kindness and purpose for young and old alike. Part of our mission is to inspire others, so that ultimately, the comfort these socks bring can be enjoyed soulfully by the provider and recipient.										
